{"full-text-retrieval-response": {
    "scopus-eid": "2-s2.0-85200551348",
    "originalText": "serial JL 271506 291210 291817 291820 291862 291866 291870 291883 31 Expert Systems with Applications EXPERTSYSTEMSAPPLICATIONS 2024-07-31 2024-07-31 2024-08-05 2024-08-05 2024-08-30T10:59:38 1-s2.0-S0957417424018098 S0957-4174(24)01809-8 S0957417424018098 10.1016/j.eswa.2024.124942 S300 S300.1 FULL-TEXT 1-s2.0-S0957417424X00184 2024-08-30T10:29:01.145834Z 0 0 20241205 2024 2024-07-31T16:47:23.959013Z articleinfo articlenumber articletitlenorm authfirstsurnamenorm cid cids contenttype copyright crossmark dateloaded dateloadedtxt datesearch datesort dateupdated dco docsubtype doctype doi eid ewtransactionid hubeid indexeddate issn issnnorm itemstage itemtransactionid itemweight openaccess openarchive pg pgfirst pii piinorm pubdatestart pubdatetxt pubyr sortorder srctitle srctitlenorm srctype ssids alllist content subj subheadings suppl tomb volfirst volissue volumelist webpdf webpdfpagecount yearnav figure table body mmlmath affil articletitle auth authfirstini authfull authkeywords authlast orcid primabst ref 0957-4174 09574174 true 256 256 C Volume 256 45 124942 124942 124942 20241205 5 December 2024 2024-12-05 2024 article fla © 2024 Elsevier Ltd. All rights are reserved, including those for text and data mining, AI training, and similar technologies. SDYOLOAWDNETAHYBRIDAPPROACHFORSMARTOBJECTDETECTIONINCHALLENGINGWEATHERFORSELFDRIVINGCARS RASHMI 1 Introduction 2 Related work 3 Model introduction and improvement 3.1 YOLOv5 model introduction 3.2 Model structure improvement 3.2.1 Lightweighted model structure 3.2.2 GhostConv and C3Ghost 3.2.3 Depth-wise separable dilated convolutions and residual 3.2.4 CA＋C3Ghost module 3.3 SD-YOLO-AWDNet with focal-distribution loss 4 Results 4.1 Dataset and computational details 4.2 Evaluation metrics 4.3 Experimental graphs and detection results on BDD100k dataset 4.3.1 Proposed SD-YOLO-AWDNet detection results 4.3.2 Proposed SD-YOLO-AWDNet vs YOLOv5s 4.3.2.1 Ablation experiment 4.3.2.2 Class-wise comparative analysis 4.3.3 Proposed SD-YOLO-AWDNet vs SOTA (state of art models) 4.4 Performance validation on two other datasets 4.4.1 mAP comparision on CADC dataset 4.4.2 mAP comparison on KITTI dataset 4.4.3 SD-YOLO-AWDNet detections on out-of-distribution datasets 5 Conclusion CRediT authorship contribution statement References ADARSH 2020 687 694 P 20206THINTERNATIONALCONFERENCEADVANCEDCOMPUTINGCOMMUNICATIONSYSTEMS YOLOV3TINYOBJECTDETECTIONRECOGNITIONUSINGONESTAGEIMPROVEDMODEL BOCHKOVSKIY 2020 A YOLOV4OPTIMALSPEEDACCURACYOBJECTDETECTION CAI 2021 1 13 Y CHEN 2020 10600 10609 L CHENG 2023 53 65 P INTERNATIONALCONFERENCEIMAGEGRAPHICS TINYYOLOV7TINYOBJECTDETECTIONMODELFORDRONEIMAGERY GAO 2024 P YOLOTLAEFFICIENTLIGHTWEIGHTSMALLOBJECTDETECTIONMODELBASEDYOLOV5 GE 2021 Z YOLOXEXCEEDINGYOLOSERIESIN2021 GEIGER 2013 1231 1237 A GEIGER 2012 3354 3361 A 2012IEEECONFERENCECOMPUTERVISIONPATTERNRECOGNITION READYFORAUTONOMOUSDRIVINGKITTIVISIONBENCHMARKSUITE HAMZENEJADI 2023 120845 M HNEWA 2020 53 67 M HNEWA 2021 3323 3327 M 2021IEEEINTERNATIONALCONFERENCEIMAGEPROCESSING MULTISCALEDOMAINADAPTIVEYOLOFORCROSSDOMAINOBJECTDETECTION HOQUE 2023 119838 S JIANG 2023 119990 Y JOCHER 2022 G JOHARI 2020 1 6 A 2NDINTERNATIONALCONFERENCEDATAENGINEERINGAPPLICATIONS COMPARISONAUTONOMYSTUDYDEEPLEARNINGTOOLSFOROBJECTDETECTIONINAUTONOMOUSSELFDRIVINGVEHICLES LI 2022 C YOLOV6ASINGLESTAGEOBJECTDETECTIONFRAMEWORKFORINDUSTRIALAPPLICATIONS LI 2017 Z LIGHTHEADRCNNINDEFENSETWOSTAGEOBJECTDETECTOR LI 2024 023041 H LIAO 2023 7010 7016 W 2023IEEEINTERNATIONALCONFERENCEROBOTICSAUTOMATION GNNBASEDPOINTCLOUDMAPSFEATUREEXTRACTIONRESIDUALFEATUREFUSIONFOR3DOBJECTDETECTION LIU 2016 21 37 W COMPUTERVISIONECCV201614THEUROPEANCONFERENCEAMSTERDAMNETHERLANDSOCTOBER11142016PROCEEDINGSPARTI14 SSDSINGLESHOTMULTIBOXDETECTOR LIU 2021 6640 6653 Z LIU 2023 106217 G LIU 2022 1792 1800 W PROCEEDINGSAAAICONFERENCEARTIFICIALINTELLIGENCE IMAGEADAPTIVEYOLOFOROBJECTDETECTIONINADVERSEWEATHERCONDITIONS MAHAUR 2023 121036 B MICHAELIS 2019 C BENCHMARKINGROBUSTNESSINOBJECTDETECTIONAUTONOMOUSDRIVINGWINTERCOMING PAZ 2020 2059 2064 D 2020IEEERSJINTERNATIONALCONFERENCEINTELLIGENTROBOTSSYSTEMS PROBABILISTICSEMANTICMAPPINGFORURBANAUTONOMOUSDRIVINGAPPLICATIONS PITROPOV 2021 681 690 M RAMACHANDRAN 2017 P SEARCHINGFORACTIVATIONFUNCTIONS REZAEI 2023 120253 M SAKARIDIS 2018 973 992 C SIMHAMBHATLA 2019 23 R SINDAGI 2020 763 780 V COMPUTERVISIONECCV202016THEUROPEANCONFERENCEGLASGOWUKAUGUST23282020PROCEEDINGSPARTXIV16 PRIORBASEDDOMAINADAPTIVEOBJECTDETECTIONFORHAZYRAINYCONDITIONS SUN 2020 55 W TABATA 2023 120200 A TIAN 2019 4466 4475 Y TIAN 2024 121811 D WANG 2024 122507 Z WANG 2019 127 136 D WANG 2022 1 12 H WANG 2023 H WEI 2017 1795 1799 Y XUAN 2022 20910 20920 W YANG 2024 1 16 M YU 2015 F MULTISCALECONTEXTAGGREGATIONBYDILATEDCONVOLUTIONS ZHANG 2021 2246 2258 C ZHANG 2022 146 157 Y ZHANG 2021 Z CONSISTENTDEPTHPREDICTIONUNDERVARIOUSILLUMINATIONSUSINGDILATEDCROSSATTENTION ZHANG 2024 122669 Y RASHMIX2024X124942 2026-08-05T00:00:00.000Z 2026-08-05T00:00:00.000Z http://creativecommons.org/licenses/by-nc-nd/4.0/ © 2024 Elsevier Ltd. All rights are reserved, including those for text and data mining, AI training, and similar technologies. https://doi.org/10.15223/policy-017 https://doi.org/10.15223/policy-037 https://doi.org/10.15223/policy-012 https://doi.org/10.15223/policy-029 https://doi.org/10.15223/policy-004 item S0957-4174(24)01809-8 S0957417424018098 1-s2.0-S0957417424018098 10.1016/j.eswa.2024.124942 271506 2024-08-30T10:29:01.145834Z 2024-12-05 1-s2.0-S0957417424018098-main.pdf https://s3-eu-west-1.amazonaws.com/prod-ucs-content-store-eu-west/content/pii:S0957417424018098/MAIN/application/pdf/570088fd7ff4f37f4ccc9153ef352c9d/main.pdf main.pdf pdf true 10072167 MAIN 20 1-s2.0-S0957417424018098-main_1.png https://s3-eu-west-1.amazonaws.com/prod-ucs-content-store-eu-west/content/pii:S0957417424018098/PREVIEW/image/png/a0bc865f783bd0c94fab3d5fa9d551be/main_1.png main_1.png png 59286 849 656 IMAGE-WEB-PDF 1 1-s2.0-S0957417424018098-fx12.jpg https://s3-eu-west-1.amazonaws.com/prod-ucs-content-store-eu-west/content/pii:S0957417424018098/fx12/DOWNSAMPLED/image/jpeg/fc1b71861db74c772cc22e5db73e0b61/fx12.jpg fx12 fx12.jpg jpg 21355 107 213 IMAGE-DOWNSAMPLED 1-s2.0-S0957417424018098-fx56.jpg https://s3-eu-west-1.amazonaws.com/prod-ucs-content-store-eu-west/content/pii:S0957417424018098/fx56/DOWNSAMPLED/image/jpeg/e14290463edd08e0cba93c808bd10f34/fx56.jpg fx56 fx56.jpg jpg 27527 132 192 IMAGE-DOWNSAMPLED 1-s2.0-S0957417424018098-fx11.jpg https://s3-eu-west-1.amazonaws.com/prod-ucs-content-store-eu-west/content/pii:S0957417424018098/fx11/DOWNSAMPLED/image/jpeg/23ef7a6fde8f2a8c56815ea2e214eb89/fx11.jpg fx11 fx11.jpg jpg 19163 107 213 IMAGE-DOWNSAMPLED 1-s2.0-S0957417424018098-fx55.jpg https://s3-eu-west-1.amazonaws.com/prod-ucs-content-store-eu-west/content/pii:S0957417424018098/fx55/DOWNSAMPLED/image/jpeg/5576a597771a90f2a833d6e10185d287/fx55.jpg fx55 fx55.jpg jpg 25566 132 192 IMAGE-DOWNSAMPLED 1-s2.0-S0957417424018098-fx10.jpg https://s3-eu-west-1.amazonaws.com/prod-ucs-content-store-eu-west/content/pii:S0957417424018098/fx10/DOWNSAMPLED/image/jpeg/e5802c650a39bbbc00c47bf890b32d45/fx10.jpg fx10 fx10.jpg jpg 27329 124 213 IMAGE-DOWNSAMPLED 1-s2.0-S0957417424018098-fx54.jpg https://s3-eu-west-1.amazonaws.com/prod-ucs-content-store-eu-west/content/pii:S0957417424018098/fx54/DOWNSAMPLED/image/jpeg/1f45d4b49e8cee369c5d591192e76f9d/fx54.jpg fx54 fx54.jpg jpg 28734 132 192 IMAGE-DOWNSAMPLED 1-s2.0-S0957417424018098-fx53.jpg https://s3-eu-west-1.amazonaws.com/prod-ucs-content-store-eu-west/content/pii:S0957417424018098/fx53/DOWNSAMPLED/image/jpeg/99979980c82596253fd2d3b40a165ded/fx53.jpg fx53 fx53.jpg jpg 27527 132 192 IMAGE-DOWNSAMPLED 1-s2.0-S0957417424018098-fx16.jpg https://s3-eu-west-1.amazonaws.com/prod-ucs-content-store-eu-west/content/pii:S0957417424018098/fx16/DOWNSAMPLED/image/jpeg/6a95d04846395dcb309c7803228bb60e/fx16.jpg fx16 fx16.jpg jpg 25317 133 192 IMAGE-DOWNSAMPLED 1-s2.0-S0957417424018098-fx15.jpg https://s3-eu-west-1.amazonaws.com/prod-ucs-content-store-eu-west/content/pii:S0957417424018098/fx15/DOWNSAMPLED/image/jpeg/494a77343582b19fbbac08f9e18d1d9e/fx15.jpg fx15 fx15.jpg jpg 25655 133 192 IMAGE-DOWNSAMPLED 1-s2.0-S0957417424018098-fx59.jpg https://s3-eu-west-1.amazonaws.com/prod-ucs-content-store-eu-west/content/pii:S0957417424018098/fx59/DOWNSAMPLED/image/jpeg/9311229d326c1f718194655d35277b3e/fx59.jpg fx59 fx59.jpg jpg 27580 132 192 IMAGE-DOWNSAMPLED 1-s2.0-S0957417424018098-fx14.jpg https://s3-eu-west-1.amazonaws.com/prod-ucs-content-store-eu-west/content/pii:S0957417424018098/fx14/DOWNSAMPLED/image/jpeg/f6a0c2409ce0889c3e498be52361ac3d/fx14.jpg fx14 fx14.jpg jpg 15731 133 192 IMAGE-DOWNSAMPLED 1-s2.0-S0957417424018098-fx58.jpg https://s3-eu-west-1.amazonaws.com/prod-ucs-content-store-eu-west/content/pii:S0957417424018098/fx58/DOWNSAMPLED/image/jpeg/764719cdc496ec09528ba43f42b1944f/fx58.jpg fx58 fx58.jpg jpg 25935 132 192 IMAGE-DOWNSAMPLED 1-s2.0-S0957417424018098-fx13.jpg https://s3-eu-west-1.amazonaws.com/prod-ucs-content-store-eu-west/content/pii:S0957417424018098/fx13/DOWNSAMPLED/image/jpeg/2f67cc244107c7d890a77f78cc0663e1/fx13.jpg fx13 fx13.jpg jpg 25392 133 192 IMAGE-DOWNSAMPLED 1-s2.0-S0957417424018098-fx57.jpg https://s3-eu-west-1.amazonaws.com/prod-ucs-content-store-eu-west/content/pii:S0957417424018098/fx57/DOWNSAMPLED/image/jpeg/72fdf96c2f9f4070a8e79d8c09241856/fx57.jpg fx57 fx57.jpg jpg 28725 132 192 IMAGE-DOWNSAMPLED 1-s2.0-S0957417424018098-fx52.jpg https://s3-eu-west-1.amazonaws.com/prod-ucs-content-store-eu-west/content/pii:S0957417424018098/fx52/DOWNSAMPLED/image/jpeg/b057c4c114338fc0b3406675bf78a5f3/fx52.jpg fx52 fx52.jpg jpg 25566 132 192 IMAGE-DOWNSAMPLED 1-s2.0-S0957417424018098-fx51.jpg https://s3-eu-west-1.amazonaws.com/prod-ucs-content-store-eu-west/content/pii:S0957417424018098/fx51/DOWNSAMPLED/image/jpeg/9f59e6060f217823127435dc16d402dd/fx51.jpg fx51 fx51.jpg jpg 28650 132 192 IMAGE-DOWNSAMPLED 1-s2.0-S0957417424018098-fx50.jpg https://s3-eu-west-1.amazonaws.com/prod-ucs-content-store-eu-west/content/pii:S0957417424018098/fx50/DOWNSAMPLED/image/jpeg/66bd26f7a9da7a4094040bb2c626ab12/fx50.jpg fx50 fx50.jpg jpg 27588 132 192 IMAGE-DOWNSAMPLED 1-s2.0-S0957417424018098-fx19.jpg https://s3-eu-west-1.amazonaws.com/prod-ucs-content-store-eu-west/content/pii:S0957417424018098/fx19/DOWNSAMPLED/image/jpeg/a9796de1e609e1005585cb4cda5849ae/fx19.jpg fx19 fx19.jpg jpg 25385 133 192 IMAGE-DOWNSAMPLED 1-s2.0-S0957417424018098-fx18.jpg https://s3-eu-west-1.amazonaws.com/prod-ucs-content-store-eu-west/content/pii:S0957417424018098/fx18/DOWNSAMPLED/image/jpeg/8ee81d9f20fc4b4db21dbcd9ed52a40a/fx18.jpg fx18 fx18.jpg jpg 24668 133 192 IMAGE-DOWNSAMPLED 1-s2.0-S0957417424018098-fx17.jpg https://s3-eu-west-1.amazonaws.com/prod-ucs-content-store-eu-west/content/pii:S0957417424018098/fx17/DOWNSAMPLED/image/jpeg/dded72f18cf57018e399856da01a500a/fx17.jpg fx17 fx17.jpg jpg 15467 133 192 IMAGE-DOWNSAMPLED 1-s2.0-S0957417424018098-fx45.jpg https://s3-eu-west-1.amazonaws.com/prod-ucs-content-store-eu-west/content/pii:S0957417424018098/fx45/DOWNSAMPLED/image/jpeg/1b0a11b3df95b18ce91c4fe12acf1d7d/fx45.jpg fx45 fx45.jpg jpg 27011 133 192 IMAGE-DOWNSAMPLED 1-s2.0-S0957417424018098-fx44.jpg https://s3-eu-west-1.amazonaws.com/prod-ucs-content-store-eu-west/content/pii:S0957417424018098/fx44/DOWNSAMPLED/image/jpeg/5bc924fb9854a9ec186ff1f754609774/fx44.jpg fx44 fx44.jpg jpg 27068 133 192 IMAGE-DOWNSAMPLED 1-s2.0-S0957417424018098-fx43.jpg https://s3-eu-west-1.amazonaws.com/prod-ucs-content-store-eu-west/content/pii:S0957417424018098/fx43/DOWNSAMPLED/image/jpeg/a0efbb62e98a0724c483719a2f545d50/fx43.jpg fx43 fx43.jpg jpg 24930 133 192 IMAGE-DOWNSAMPLED 1-s2.0-S0957417424018098-fx42.jpg https://s3-eu-west-1.amazonaws.com/prod-ucs-content-store-eu-west/content/pii:S0957417424018098/fx42/DOWNSAMPLED/image/jpeg/3d5face050ea7a6839d54b5670ce993d/fx42.jpg fx42 fx42.jpg jpg 26996 133 192 IMAGE-DOWNSAMPLED 1-s2.0-S0957417424018098-gr16.jpg https://s3-eu-west-1.amazonaws.com/prod-ucs-content-store-eu-west/content/pii:S0957417424018098/gr16/DOWNSAMPLED/image/jpeg/f1283b753aba61f0bedcbf8092196a8f/gr16.jpg gr16 gr16.jpg jpg 105740 351 725 IMAGE-DOWNSAMPLED 1-s2.0-S0957417424018098-fx49.jpg https://s3-eu-west-1.amazonaws.com/prod-ucs-content-store-eu-west/content/pii:S0957417424018098/fx49/DOWNSAMPLED/image/jpeg/fddad1bc072741a6ef0a13c4a7e968b5/fx49.jpg fx49 fx49.jpg jpg 25927 132 192 IMAGE-DOWNSAMPLED 1-s2.0-S0957417424018098-gr17.jpg https://s3-eu-west-1.amazonaws.com/prod-ucs-content-store-eu-west/content/pii:S0957417424018098/gr17/DOWNSAMPLED/image/jpeg/5befefc9aeaaa2c8982a573dfee79024/gr17.jpg gr17 gr17.jpg jpg 293234 571 731 IMAGE-DOWNSAMPLED 1-s2.0-S0957417424018098-fx48.jpg https://s3-eu-west-1.amazonaws.com/prod-ucs-content-store-eu-west/content/pii:S0957417424018098/fx48/DOWNSAMPLED/image/jpeg/7e3561c1e76d1919f9234ff7e15fdf41/fx48.jpg fx48 fx48.jpg jpg 27004 133 192 IMAGE-DOWNSAMPLED 1-s2.0-S0957417424018098-fx47.jpg https://s3-eu-west-1.amazonaws.com/prod-ucs-content-store-eu-west/content/pii:S0957417424018098/fx47/DOWNSAMPLED/image/jpeg/e2d47f80abb287ca969871d486e8a4d0/fx47.jpg fx47 fx47.jpg jpg 26971 133 192 IMAGE-DOWNSAMPLED 1-s2.0-S0957417424018098-fx46.jpg https://s3-eu-west-1.amazonaws.com/prod-ucs-content-store-eu-west/content/pii:S0957417424018098/fx46/DOWNSAMPLED/image/jpeg/736a52ab00a593bbc186d8198a21186d/fx46.jpg fx46 fx46.jpg jpg 24895 133 192 IMAGE-DOWNSAMPLED 1-s2.0-S0957417424018098-gr7.jpg https://s3-eu-west-1.amazonaws.com/prod-ucs-content-store-eu-west/content/pii:S0957417424018098/gr7/DOWNSAMPLED/image/jpeg/d56e559527bad83d7defb7e3e04dc4e5/gr7.jpg gr7 gr7.jpg jpg 110436 327 609 IMAGE-DOWNSAMPLED 1-s2.0-S0957417424018098-gr12.jpg https://s3-eu-west-1.amazonaws.com/prod-ucs-content-store-eu-west/content/pii:S0957417424018098/gr12/DOWNSAMPLED/image/jpeg/4581fec5cf992b92cf55ab4f88b3b382/gr12.jpg gr12 gr12.jpg jpg 95687 286 385 IMAGE-DOWNSAMPLED 1-s2.0-S0957417424018098-gr8.jpg https://s3-eu-west-1.amazonaws.com/prod-ucs-content-store-eu-west/content/pii:S0957417424018098/gr8/DOWNSAMPLED/image/jpeg/fb02db131bb3647c565826f2ee73102d/gr8.jpg gr8 gr8.jpg jpg 86233 158 654 IMAGE-DOWNSAMPLED 1-s2.0-S0957417424018098-gr13.jpg https://s3-eu-west-1.amazonaws.com/prod-ucs-content-store-eu-west/content/pii:S0957417424018098/gr13/DOWNSAMPLED/image/jpeg/ce71e727a3be5c1163a98eec61480e31/gr13.jpg gr13 gr13.jpg jpg 96051 290 383 IMAGE-DOWNSAMPLED 1-s2.0-S0957417424018098-gr9.jpg https://s3-eu-west-1.amazonaws.com/prod-ucs-content-store-eu-west/content/pii:S0957417424018098/gr9/DOWNSAMPLED/image/jpeg/22597abaaefcd3b65b469601ff2d8b84/gr9.jpg gr9 gr9.jpg jpg 81865 98 668 IMAGE-DOWNSAMPLED 1-s2.0-S0957417424018098-gr14.jpg https://s3-eu-west-1.amazonaws.com/prod-ucs-content-store-eu-west/content/pii:S0957417424018098/gr14/DOWNSAMPLED/image/jpeg/d3ccca03ef7f63e59e5f9c8089adf32a/gr14.jpg gr14 gr14.jpg jpg 99563 251 384 IMAGE-DOWNSAMPLED 1-s2.0-S0957417424018098-gr15.jpg https://s3-eu-west-1.amazonaws.com/prod-ucs-content-store-eu-west/content/pii:S0957417424018098/gr15/DOWNSAMPLED/image/jpeg/3b4b0ae927e3954fba21216153b01213/gr15.jpg gr15 gr15.jpg jpg 100042 250 384 IMAGE-DOWNSAMPLED 1-s2.0-S0957417424018098-gr3.jpg https://s3-eu-west-1.amazonaws.com/prod-ucs-content-store-eu-west/content/pii:S0957417424018098/gr3/DOWNSAMPLED/image/jpeg/14cb98fad1d0e2eaa234a428ab349fdb/gr3.jpg gr3 gr3.jpg jpg 113797 323 294 IMAGE-DOWNSAMPLED 1-s2.0-S0957417424018098-fx41.jpg https://s3-eu-west-1.amazonaws.com/prod-ucs-content-store-eu-west/content/pii:S0957417424018098/fx41/DOWNSAMPLED/image/jpeg/2a80f40256d3c85de59b82adc143c0a9/fx41.jpg fx41 fx41.jpg jpg 26828 133 192 IMAGE-DOWNSAMPLED 1-s2.0-S0957417424018098-gr4.jpg https://s3-eu-west-1.amazonaws.com/prod-ucs-content-store-eu-west/content/pii:S0957417424018098/gr4/DOWNSAMPLED/image/jpeg/4b2db345ce7f578c09dd0cacbf92c902/gr4.jpg gr4 gr4.jpg jpg 203543 737 735 IMAGE-DOWNSAMPLED 1-s2.0-S0957417424018098-fx40.jpg https://s3-eu-west-1.amazonaws.com/prod-ucs-content-store-eu-west/content/pii:S0957417424018098/fx40/DOWNSAMPLED/image/jpeg/c57d824ac11736e89fd99abde08a539c/fx40.jpg fx40 fx40.jpg jpg 24642 133 192 IMAGE-DOWNSAMPLED 1-s2.0-S0957417424018098-gr5.jpg https://s3-eu-west-1.amazonaws.com/prod-ucs-content-store-eu-west/content/pii:S0957417424018098/gr5/DOWNSAMPLED/image/jpeg/70bf1eb53db89ba696a254026ccaf119/gr5.jpg gr5 gr5.jpg jpg 102184 357 527 IMAGE-DOWNSAMPLED 1-s2.0-S0957417424018098-gr10.jpg https://s3-eu-west-1.amazonaws.com/prod-ucs-content-store-eu-west/content/pii:S0957417424018098/gr10/DOWNSAMPLED/image/jpeg/9e784c8faa63d881a3ac2de47ce407b8/gr10.jpg gr10 gr10.jpg jpg 99425 241 386 IMAGE-DOWNSAMPLED 1-s2.0-S0957417424018098-gr6.jpg https://s3-eu-west-1.amazonaws.com/prod-ucs-content-store-eu-west/content/pii:S0957417424018098/gr6/DOWNSAMPLED/image/jpeg/97504efc4e4e9940fb676208c8fe9e55/gr6.jpg gr6 gr6.jpg jpg 99227 326 373 IMAGE-DOWNSAMPLED 1-s2.0-S0957417424018098-gr11.jpg https://s3-eu-west-1.amazonaws.com/prod-ucs-content-store-eu-west/content/pii:S0957417424018098/gr11/DOWNSAMPLED/image/jpeg/840e4f76605210b7714ae5f57f828ef1/gr11.jpg gr11 gr11.jpg jpg 190201 465 731 IMAGE-DOWNSAMPLED 1-s2.0-S0957417424018098-fx6.jpg https://s3-eu-west-1.amazonaws.com/prod-ucs-content-store-eu-west/content/pii:S0957417424018098/fx6/DOWNSAMPLED/image/jpeg/416bd0422adc73c343bc1308ed396245/fx6.jpg fx6 fx6.jpg jpg 21770 107 213 IMAGE-DOWNSAMPLED 1-s2.0-S0957417424018098-fx7.jpg https://s3-eu-west-1.amazonaws.com/prod-ucs-content-store-eu-west/content/pii:S0957417424018098/fx7/DOWNSAMPLED/image/jpeg/cbfb2fa82ff2bdd37b417742614cef73/fx7.jpg fx7 fx7.jpg jpg 22016 107 213 IMAGE-DOWNSAMPLED 1-s2.0-S0957417424018098-gr1.jpg https://s3-eu-west-1.amazonaws.com/prod-ucs-content-store-eu-west/content/pii:S0957417424018098/gr1/DOWNSAMPLED/image/jpeg/83a5cec6835d168fff549bba62ab71b9/gr1.jpg gr1 gr1.jpg jpg 77399 101 386 IMAGE-DOWNSAMPLED 1-s2.0-S0957417424018098-fx8.jpg https://s3-eu-west-1.amazonaws.com/prod-ucs-content-store-eu-west/content/pii:S0957417424018098/fx8/DOWNSAMPLED/image/jpeg/5d8de041dc327cf222b9908483b5dedd/fx8.jpg fx8 fx8.jpg jpg 23615 107 213 IMAGE-DOWNSAMPLED 1-s2.0-S0957417424018098-gr2.jpg https://s3-eu-west-1.amazonaws.com/prod-ucs-content-store-eu-west/content/pii:S0957417424018098/gr2/DOWNSAMPLED/image/jpeg/aad2e04c437cf1c90e16c7c59f3359bf/gr2.jpg gr2 gr2.jpg jpg 143895 218 713 IMAGE-DOWNSAMPLED 1-s2.0-S0957417424018098-fx9.jpg https://s3-eu-west-1.amazonaws.com/prod-ucs-content-store-eu-west/content/pii:S0957417424018098/fx9/DOWNSAMPLED/image/jpeg/a4ecd2ed54212eb98982b0a7eceeb39f/fx9.jpg fx9 fx9.jpg jpg 25377 124 213 IMAGE-DOWNSAMPLED 1-s2.0-S0957417424018098-fx2.jpg https://s3-eu-west-1.amazonaws.com/prod-ucs-content-store-eu-west/content/pii:S0957417424018098/fx2/DOWNSAMPLED/image/jpeg/e899d43b19da04f7e3d282c95181ca27/fx2.jpg fx2 fx2.jpg jpg 26087 107 213 IMAGE-DOWNSAMPLED 1-s2.0-S0957417424018098-fx3.jpg https://s3-eu-west-1.amazonaws.com/prod-ucs-content-store-eu-west/content/pii:S0957417424018098/fx3/DOWNSAMPLED/image/jpeg/7aece7a9ab0dc28026ede99d1629b368/fx3.jpg fx3 fx3.jpg jpg 18394 107 213 IMAGE-DOWNSAMPLED 1-s2.0-S0957417424018098-fx4.jpg https://s3-eu-west-1.amazonaws.com/prod-ucs-content-store-eu-west/content/pii:S0957417424018098/fx4/DOWNSAMPLED/image/jpeg/d6f199c564131df7d5de393858aa90c7/fx4.jpg fx4 fx4.jpg jpg 19850 107 213 IMAGE-DOWNSAMPLED 1-s2.0-S0957417424018098-fx5.jpg https://s3-eu-west-1.amazonaws.com/prod-ucs-content-store-eu-west/content/pii:S0957417424018098/fx5/DOWNSAMPLED/image/jpeg/91aa276e553cd23d5c054ae438470e09/fx5.jpg fx5 fx5.jpg jpg 20335 107 213 IMAGE-DOWNSAMPLED 1-s2.0-S0957417424018098-fx1.jpg https://s3-eu-west-1.amazonaws.com/prod-ucs-content-store-eu-west/content/pii:S0957417424018098/fx1/DOWNSAMPLED/image/jpeg/00df5d107fc0e89405f52406fd5555c7/fx1.jpg fx1 fx1.jpg jpg 25180 107 213 IMAGE-DOWNSAMPLED 1-s2.0-S0957417424018098-fx34.jpg https://s3-eu-west-1.amazonaws.com/prod-ucs-content-store-eu-west/content/pii:S0957417424018098/fx34/DOWNSAMPLED/image/jpeg/4249bbfd53cb2a683665d619d08a4715/fx34.jpg fx34 fx34.jpg jpg 25798 132 192 IMAGE-DOWNSAMPLED 1-s2.0-S0957417424018098-fx33.jpg https://s3-eu-west-1.amazonaws.com/prod-ucs-content-store-eu-west/content/pii:S0957417424018098/fx33/DOWNSAMPLED/image/jpeg/8d752cf6090e075795cb502e911c70d1/fx33.jpg fx33 fx33.jpg jpg 25489 132 192 IMAGE-DOWNSAMPLED 1-s2.0-S0957417424018098-fx32.jpg https://s3-eu-west-1.amazonaws.com/prod-ucs-content-store-eu-west/content/pii:S0957417424018098/fx32/DOWNSAMPLED/image/jpeg/e436c04e49f656213240ee81c5b20d2a/fx32.jpg fx32 fx32.jpg jpg 17413 132 192 IMAGE-DOWNSAMPLED 1-s2.0-S0957417424018098-fx31.jpg https://s3-eu-west-1.amazonaws.com/prod-ucs-content-store-eu-west/content/pii:S0957417424018098/fx31/DOWNSAMPLED/image/jpeg/5d1504d40a8f56ce20453fa73133d84a/fx31.jpg fx31 fx31.jpg jpg 25927 132 192 IMAGE-DOWNSAMPLED 1-s2.0-S0957417424018098-fx38.jpg https://s3-eu-west-1.amazonaws.com/prod-ucs-content-store-eu-west/content/pii:S0957417424018098/fx38/DOWNSAMPLED/image/jpeg/c1359941e5925b708c157663997ce781/fx38.jpg fx38 fx38.jpg jpg 17957 132 192 IMAGE-DOWNSAMPLED 1-s2.0-S0957417424018098-fx37.jpg https://s3-eu-west-1.amazonaws.com/prod-ucs-content-store-eu-west/content/pii:S0957417424018098/fx37/DOWNSAMPLED/image/jpeg/2791abedb3d54241e8e03c74112f2caa/fx37.jpg fx37 fx37.jpg jpg 25850 132 192 IMAGE-DOWNSAMPLED 1-s2.0-S0957417424018098-fx36.jpg https://s3-eu-west-1.amazonaws.com/prod-ucs-content-store-eu-west/content/pii:S0957417424018098/fx36/DOWNSAMPLED/image/jpeg/ae994110abb7257c3714daad75077667/fx36.jpg fx36 fx36.jpg jpg 25460 132 192 IMAGE-DOWNSAMPLED 1-s2.0-S0957417424018098-fx35.jpg https://s3-eu-west-1.amazonaws.com/prod-ucs-content-store-eu-west/content/pii:S0957417424018098/fx35/DOWNSAMPLED/image/jpeg/85eb0dbe0b1a2094f1bf5521cd4a1ee4/fx35.jpg fx35 fx35.jpg jpg 17443 132 192 IMAGE-DOWNSAMPLED 1-s2.0-S0957417424018098-fx30.jpg https://s3-eu-west-1.amazonaws.com/prod-ucs-content-store-eu-west/content/pii:S0957417424018098/fx30/DOWNSAMPLED/image/jpeg/9b01b5236950f94a23eeec215c43a2d0/fx30.jpg fx30 fx30.jpg jpg 25480 132 192 IMAGE-DOWNSAMPLED 1-s2.0-S0957417424018098-fx39.jpg https://s3-eu-west-1.amazonaws.com/prod-ucs-content-store-eu-west/content/pii:S0957417424018098/fx39/DOWNSAMPLED/image/jpeg/84e4b3346140ad4c81fb30038abe196c/fx39.jpg fx39 fx39.jpg jpg 25748 132 192 IMAGE-DOWNSAMPLED 1-s2.0-S0957417424018098-fx23.jpg https://s3-eu-west-1.amazonaws.com/prod-ucs-content-store-eu-west/content/pii:S0957417424018098/fx23/DOWNSAMPLED/image/jpeg/43e5b6d873380b8ffaffe8d5e8f5727b/fx23.jpg fx23 fx23.jpg jpg 17457 132 192 IMAGE-DOWNSAMPLED 1-s2.0-S0957417424018098-fx22.jpg https://s3-eu-west-1.amazonaws.com/prod-ucs-content-store-eu-west/content/pii:S0957417424018098/fx22/DOWNSAMPLED/image/jpeg/681ecac74708ec923802bb728e29f125/fx22.jpg fx22 fx22.jpg jpg 25551 132 192 IMAGE-DOWNSAMPLED 1-s2.0-S0957417424018098-fx66.jpg https://s3-eu-west-1.amazonaws.com/prod-ucs-content-store-eu-west/content/pii:S0957417424018098/fx66/DOWNSAMPLED/image/jpeg/b677013b0247e7ea09a34b43ec92bf07/fx66.jpg fx66 fx66.jpg jpg 28650 132 192 IMAGE-DOWNSAMPLED 1-s2.0-S0957417424018098-fx21.jpg https://s3-eu-west-1.amazonaws.com/prod-ucs-content-store-eu-west/content/pii:S0957417424018098/fx21/DOWNSAMPLED/image/jpeg/e947fb2fa71a42846572ef3574825fe0/fx21.jpg fx21 fx21.jpg jpg 24833 133 192 IMAGE-DOWNSAMPLED 1-s2.0-S0957417424018098-fx65.jpg https://s3-eu-west-1.amazonaws.com/prod-ucs-content-store-eu-west/content/pii:S0957417424018098/fx65/DOWNSAMPLED/image/jpeg/e01dd1097cde87863a411f11a626908c/fx65.jpg fx65 fx65.jpg jpg 27588 132 192 IMAGE-DOWNSAMPLED 1-s2.0-S0957417424018098-fx20.jpg https://s3-eu-west-1.amazonaws.com/prod-ucs-content-store-eu-west/content/pii:S0957417424018098/fx20/DOWNSAMPLED/image/jpeg/27a290bc7e2533a7c54bfe1e13f7bc4b/fx20.jpg fx20 fx20.jpg jpg 15285 133 192 IMAGE-DOWNSAMPLED 1-s2.0-S0957417424018098-fx64.jpg https://s3-eu-west-1.amazonaws.com/prod-ucs-content-store-eu-west/content/pii:S0957417424018098/fx64/DOWNSAMPLED/image/jpeg/bae885cee4d9ce56903f3c7d053ed102/fx64.jpg fx64 fx64.jpg jpg 25935 132 192 IMAGE-DOWNSAMPLED 1-s2.0-S0957417424018098-fx27.jpg https://s3-eu-west-1.amazonaws.com/prod-ucs-content-store-eu-west/content/pii:S0957417424018098/fx27/DOWNSAMPLED/image/jpeg/98ec9947c6914b915a5e33f56a9b2f3b/fx27.jpg fx27 fx27.jpg jpg 25496 132 192 IMAGE-DOWNSAMPLED 1-s2.0-S0957417424018098-fx26.jpg https://s3-eu-west-1.amazonaws.com/prod-ucs-content-store-eu-west/content/pii:S0957417424018098/fx26/DOWNSAMPLED/image/jpeg/77cf6c3fb72519975c048a28fc40f710/fx26.jpg fx26 fx26.jpg jpg 17290 132 192 IMAGE-DOWNSAMPLED 1-s2.0-S0957417424018098-fx25.jpg https://s3-eu-west-1.amazonaws.com/prod-ucs-content-store-eu-west/content/pii:S0957417424018098/fx25/DOWNSAMPLED/image/jpeg/d5fb6486f18a3d78eea7ef895aa350b7/fx25.jpg fx25 fx25.jpg jpg 25823 132 192 IMAGE-DOWNSAMPLED 1-s2.0-S0957417424018098-fx24.jpg https://s3-eu-west-1.amazonaws.com/prod-ucs-content-store-eu-west/content/pii:S0957417424018098/fx24/DOWNSAMPLED/image/jpeg/f4743c057f58ad26593859b1b3326354/fx24.jpg fx24 fx24.jpg jpg 25748 132 192 IMAGE-DOWNSAMPLED 1-s2.0-S0957417424018098-fx63.jpg https://s3-eu-west-1.amazonaws.com/prod-ucs-content-store-eu-west/content/pii:S0957417424018098/fx63/DOWNSAMPLED/image/jpeg/971943ddf3b9ac20a8a5cc86b771048a/fx63.jpg fx63 fx63.jpg jpg 28701 132 192 IMAGE-DOWNSAMPLED 1-s2.0-S0957417424018098-fx62.jpg https://s3-eu-west-1.amazonaws.com/prod-ucs-content-store-eu-west/content/pii:S0957417424018098/fx62/DOWNSAMPLED/image/jpeg/dd4dbaa49a5ee77190aaed281968e77b/fx62.jpg fx62 fx62.jpg jpg 27588 132 192 IMAGE-DOWNSAMPLED 1-s2.0-S0957417424018098-fx61.jpg https://s3-eu-west-1.amazonaws.com/prod-ucs-content-store-eu-west/content/pii:S0957417424018098/fx61/DOWNSAMPLED/image/jpeg/b94fcaf9e9b821cd2fc92ff18d83d08c/fx61.jpg fx61 fx61.jpg jpg 25927 132 192 IMAGE-DOWNSAMPLED 1-s2.0-S0957417424018098-fx60.jpg https://s3-eu-west-1.amazonaws.com/prod-ucs-content-store-eu-west/content/pii:S0957417424018098/fx60/DOWNSAMPLED/image/jpeg/3b55b68d0710a690d338c84ecff589cc/fx60.jpg fx60 fx60.jpg jpg 28731 132 192 IMAGE-DOWNSAMPLED 1-s2.0-S0957417424018098-fx29.jpg https://s3-eu-west-1.amazonaws.com/prod-ucs-content-store-eu-west/content/pii:S0957417424018098/fx29/DOWNSAMPLED/image/jpeg/6e95765a1203e6a70d092d3adad6822b/fx29.jpg fx29 fx29.jpg jpg 17322 132 192 IMAGE-DOWNSAMPLED 1-s2.0-S0957417424018098-fx28.jpg https://s3-eu-west-1.amazonaws.com/prod-ucs-content-store-eu-west/content/pii:S0957417424018098/fx28/DOWNSAMPLED/image/jpeg/4ad68901c4248a46343988db87685567/fx28.jpg fx28 fx28.jpg jpg 25826 132 192 IMAGE-DOWNSAMPLED 1-s2.0-S0957417424018098-fx12.sml https://s3-eu-west-1.amazonaws.com/prod-ucs-content-store-eu-west/content/pii:S0957417424018098/fx12/THUMBNAIL/image/gif/ac26f84f98b34b7c45a0c325d268ee11/fx12.sml fx12 fx12.sml sml 27530 110 219 IMAGE-THUMBNAIL 1-s2.0-S0957417424018098-fx56.sml https://s3-eu-west-1.amazonaws.com/prod-ucs-content-store-eu-west/content/pii:S0957417424018098/fx56/THUMBNAIL/image/gif/bfd4ab2d174c8cfa5b9c710c31e7ef8b/fx56.sml fx56 fx56.sml sml 39097 151 219 IMAGE-THUMBNAIL 1-s2.0-S0957417424018098-fx11.sml https://s3-eu-west-1.amazonaws.com/prod-ucs-content-store-eu-west/content/pii:S0957417424018098/fx11/THUMBNAIL/image/gif/1f8cd50163bf8b2f62b68cd707a5cac4/fx11.sml fx11 fx11.sml sml 27420 110 219 IMAGE-THUMBNAIL 1-s2.0-S0957417424018098-fx55.sml https://s3-eu-west-1.amazonaws.com/prod-ucs-content-store-eu-west/content/pii:S0957417424018098/fx55/THUMBNAIL/image/gif/78a9556f75c5acde22481dd8d8fac422/fx55.sml fx55 fx55.sml sml 35496 151 219 IMAGE-THUMBNAIL 1-s2.0-S0957417424018098-fx10.sml https://s3-eu-west-1.amazonaws.com/prod-ucs-content-store-eu-west/content/pii:S0957417424018098/fx10/THUMBNAIL/image/gif/9b10b722e1397fa143d8ee6fc9c705d5/fx10.sml fx10 fx10.sml sml 33104 128 219 IMAGE-THUMBNAIL 1-s2.0-S0957417424018098-fx54.sml https://s3-eu-west-1.amazonaws.com/prod-ucs-content-store-eu-west/content/pii:S0957417424018098/fx54/THUMBNAIL/image/gif/407ab7aeae706e255bce9ac01ae87142/fx54.sml fx54 fx54.sml sml 37780 151 219 IMAGE-THUMBNAIL 1-s2.0-S0957417424018098-fx53.sml https://s3-eu-west-1.amazonaws.com/prod-ucs-content-store-eu-west/content/pii:S0957417424018098/fx53/THUMBNAIL/image/gif/16bb6bb7dfdaa0f508e31ca37fdc9387/fx53.sml fx53 fx53.sml sml 39097 151 219 IMAGE-THUMBNAIL 1-s2.0-S0957417424018098-fx16.sml https://s3-eu-west-1.amazonaws.com/prod-ucs-content-store-eu-west/content/pii:S0957417424018098/fx16/THUMBNAIL/image/gif/10c60b680a239cf50c588a46a23ac2b1/fx16.sml fx16 fx16.sml sml 32270 152 219 IMAGE-THUMBNAIL 1-s2.0-S0957417424018098-fx15.sml https://s3-eu-west-1.amazonaws.com/prod-ucs-content-store-eu-west/content/pii:S0957417424018098/fx15/THUMBNAIL/image/gif/9a42fa43aac0ddae3c4cd0ad8a4f8f12/fx15.sml fx15 fx15.sml sml 35824 152 219 IMAGE-THUMBNAIL 1-s2.0-S0957417424018098-fx59.sml https://s3-eu-west-1.amazonaws.com/prod-ucs-content-store-eu-west/content/pii:S0957417424018098/fx59/THUMBNAIL/image/gif/4b1eaa3be982270542c5b0e928387ae7/fx59.sml fx59 fx59.sml sml 39103 151 219 IMAGE-THUMBNAIL 1-s2.0-S0957417424018098-fx14.sml https://s3-eu-west-1.amazonaws.com/prod-ucs-content-store-eu-west/content/pii:S0957417424018098/fx14/THUMBNAIL/image/gif/f3942365bfebf63573440149d5b0b86e/fx14.sml fx14 fx14.sml sml 28162 152 219 IMAGE-THUMBNAIL 1-s2.0-S0957417424018098-fx58.sml https://s3-eu-west-1.amazonaws.com/prod-ucs-content-store-eu-west/content/pii:S0957417424018098/fx58/THUMBNAIL/image/gif/ea231d69bf2503360162b938519bca2c/fx58.sml fx58 fx58.sml sml 35589 151 219 IMAGE-THUMBNAIL 1-s2.0-S0957417424018098-fx13.sml https://s3-eu-west-1.amazonaws.com/prod-ucs-content-store-eu-west/content/pii:S0957417424018098/fx13/THUMBNAIL/image/gif/3035d51a38efb51bdb993e763e40b623/fx13.sml fx13 fx13.sml sml 32375 152 219 IMAGE-THUMBNAIL 1-s2.0-S0957417424018098-fx57.sml https://s3-eu-west-1.amazonaws.com/prod-ucs-content-store-eu-west/content/pii:S0957417424018098/fx57/THUMBNAIL/image/gif/1ee7e72c6a271e7efb2c9d705cd7e324/fx57.sml fx57 fx57.sml sml 37921 151 219 IMAGE-THUMBNAIL 1-s2.0-S0957417424018098-fx52.sml https://s3-eu-west-1.amazonaws.com/prod-ucs-content-store-eu-west/content/pii:S0957417424018098/fx52/THUMBNAIL/image/gif/e2c1321d306a5b692a25b20d6a75cd61/fx52.sml fx52 fx52.sml sml 35496 151 219 IMAGE-THUMBNAIL 1-s2.0-S0957417424018098-fx51.sml https://s3-eu-west-1.amazonaws.com/prod-ucs-content-store-eu-west/content/pii:S0957417424018098/fx51/THUMBNAIL/image/gif/2f99f7dccc0fadca45a5ee27e29d152b/fx51.sml fx51 fx51.sml sml 37595 151 219 IMAGE-THUMBNAIL 1-s2.0-S0957417424018098-fx50.sml https://s3-eu-west-1.amazonaws.com/prod-ucs-content-store-eu-west/content/pii:S0957417424018098/fx50/THUMBNAIL/image/gif/e745fd3c105a7151c0eed956f5f292dd/fx50.sml fx50 fx50.sml sml 39119 151 219 IMAGE-THUMBNAIL 1-s2.0-S0957417424018098-fx19.sml https://s3-eu-west-1.amazonaws.com/prod-ucs-content-store-eu-west/content/pii:S0957417424018098/fx19/THUMBNAIL/image/gif/1992a3565867c7a65424bdae1fa82f5f/fx19.sml fx19 fx19.sml sml 32395 152 219 IMAGE-THUMBNAIL 1-s2.0-S0957417424018098-fx18.sml https://s3-eu-west-1.amazonaws.com/prod-ucs-content-store-eu-west/content/pii:S0957417424018098/fx18/THUMBNAIL/image/gif/234b7e4480c7d40a901bae4883c73fbf/fx18.sml fx18 fx18.sml sml 35572 152 219 IMAGE-THUMBNAIL 1-s2.0-S0957417424018098-fx17.sml https://s3-eu-west-1.amazonaws.com/prod-ucs-content-store-eu-west/content/pii:S0957417424018098/fx17/THUMBNAIL/image/gif/bad16d25fa88512284c2fe010e697104/fx17.sml fx17 fx17.sml sml 27978 152 219 IMAGE-THUMBNAIL 1-s2.0-S0957417424018098-fx45.sml https://s3-eu-west-1.amazonaws.com/prod-ucs-content-store-eu-west/content/pii:S0957417424018098/fx45/THUMBNAIL/image/gif/ecb810387dc619b4ec73d3df1e10132f/fx45.sml fx45 fx45.sml sml 38369 152 219 IMAGE-THUMBNAIL 1-s2.0-S0957417424018098-fx44.sml https://s3-eu-west-1.amazonaws.com/prod-ucs-content-store-eu-west/content/pii:S0957417424018098/fx44/THUMBNAIL/image/gif/f3d1270626638c7540a9a1fce5ee0774/fx44.sml fx44 fx44.sml sml 39600 152 219 IMAGE-THUMBNAIL 1-s2.0-S0957417424018098-fx43.sml https://s3-eu-west-1.amazonaws.com/prod-ucs-content-store-eu-west/content/pii:S0957417424018098/fx43/THUMBNAIL/image/gif/5ea1c61e76c06394962bcf91175aa183/fx43.sml fx43 fx43.sml sml 35777 152 219 IMAGE-THUMBNAIL 1-s2.0-S0957417424018098-fx42.sml https://s3-eu-west-1.amazonaws.com/prod-ucs-content-store-eu-west/content/pii:S0957417424018098/fx42/THUMBNAIL/image/gif/cf883be50f239b08d4735d0bed7bf03b/fx42.sml fx42 fx42.sml sml 38246 151 219 IMAGE-THUMBNAIL 1-s2.0-S0957417424018098-gr16.sml https://s3-eu-west-1.amazonaws.com/prod-ucs-content-store-eu-west/content/pii:S0957417424018098/gr16/THUMBNAIL/image/gif/6a378a3032f052bc685456e222c3c1f8/gr16.sml gr16 gr16.sml sml 73533 106 219 IMAGE-THUMBNAIL 1-s2.0-S0957417424018098-fx49.sml https://s3-eu-west-1.amazonaws.com/prod-ucs-content-store-eu-west/content/pii:S0957417424018098/fx49/THUMBNAIL/image/gif/8266b94d0425d1522c1e2dfbdd7faa39/fx49.sml fx49 fx49.sml sml 35573 151 219 IMAGE-THUMBNAIL 1-s2.0-S0957417424018098-gr17.sml https://s3-eu-west-1.amazonaws.com/prod-ucs-content-store-eu-west/content/pii:S0957417424018098/gr17/THUMBNAIL/image/gif/f0b2e874be02793f78a33a97598ed979/gr17.sml gr17 gr17.sml sml 103642 164 210 IMAGE-THUMBNAIL 1-s2.0-S0957417424018098-fx48.sml https://s3-eu-west-1.amazonaws.com/prod-ucs-content-store-eu-west/content/pii:S0957417424018098/fx48/THUMBNAIL/image/gif/10c7d4de2d00afaf32772d7dc62f6912/fx48.sml fx48 fx48.sml sml 38262 151 219 IMAGE-THUMBNAIL 1-s2.0-S0957417424018098-fx47.sml https://s3-eu-west-1.amazonaws.com/prod-ucs-content-store-eu-west/content/pii:S0957417424018098/fx47/THUMBNAIL/image/gif/87db524c1d4221c6638ac59aa34d1929/fx47.sml fx47 fx47.sml sml 39486 152 219 IMAGE-THUMBNAIL 1-s2.0-S0957417424018098-fx46.sml https://s3-eu-west-1.amazonaws.com/prod-ucs-content-store-eu-west/content/pii:S0957417424018098/fx46/THUMBNAIL/image/gif/d2ed97b8f363ad3c9884bfc15e79e4bf/fx46.sml fx46 fx46.sml sml 35840 152 219 IMAGE-THUMBNAIL 1-s2.0-S0957417424018098-gr7.sml https://s3-eu-west-1.amazonaws.com/prod-ucs-content-store-eu-west/content/pii:S0957417424018098/gr7/THUMBNAIL/image/gif/c2bd477f9fcf30305b33493c5c4f0b39/gr7.sml gr7 gr7.sml sml 73848 118 219 IMAGE-THUMBNAIL 1-s2.0-S0957417424018098-gr12.sml https://s3-eu-west-1.amazonaws.com/prod-ucs-content-store-eu-west/content/pii:S0957417424018098/gr12/THUMBNAIL/image/gif/8a4ee90c5e0fd35f8afff71f5385d7f4/gr12.sml gr12 gr12.sml sml 73272 163 219 IMAGE-THUMBNAIL 1-s2.0-S0957417424018098-gr8.sml https://s3-eu-west-1.amazonaws.com/prod-ucs-content-store-eu-west/content/pii:S0957417424018098/gr8/THUMBNAIL/image/gif/364dfac1272d89b2eff6858672125a01/gr8.sml gr8 gr8.sml sml 68373 53 219 IMAGE-THUMBNAIL 1-s2.0-S0957417424018098-gr13.sml https://s3-eu-west-1.amazonaws.com/prod-ucs-content-store-eu-west/content/pii:S0957417424018098/gr13/THUMBNAIL/image/gif/4f4054eaa831805055bb1817f709501a/gr13.sml gr13 gr13.sml sml 73705 164 217 IMAGE-THUMBNAIL 1-s2.0-S0957417424018098-gr9.sml https://s3-eu-west-1.amazonaws.com/prod-ucs-content-store-eu-west/content/pii:S0957417424018098/gr9/THUMBNAIL/image/gif/808a401495a823925403114408b96b37/gr9.sml gr9 gr9.sml sml 67653 32 219 IMAGE-THUMBNAIL 1-s2.0-S0957417424018098-gr14.sml https://s3-eu-west-1.amazonaws.com/prod-ucs-content-store-eu-west/content/pii:S0957417424018098/gr14/THUMBNAIL/image/gif/d8aabebab812ce0e17d51726e93e9c10/gr14.sml gr14 gr14.sml sml 75822 143 219 IMAGE-THUMBNAIL 1-s2.0-S0957417424018098-gr15.sml https://s3-eu-west-1.amazonaws.com/prod-ucs-content-store-eu-west/content/pii:S0957417424018098/gr15/THUMBNAIL/image/gif/429dc414428ee3623ebff03227338370/gr15.sml gr15 gr15.sml sml 75951 143 219 IMAGE-THUMBNAIL 1-s2.0-S0957417424018098-gr3.sml https://s3-eu-west-1.amazonaws.com/prod-ucs-content-store-eu-west/content/pii:S0957417424018098/gr3/THUMBNAIL/image/gif/64dbc51b2c490e055c97c0293b6b4633/gr3.sml gr3 gr3.sml sml 84324 164 149 IMAGE-THUMBNAIL 1-s2.0-S0957417424018098-fx41.sml https://s3-eu-west-1.amazonaws.com/prod-ucs-content-store-eu-west/content/pii:S0957417424018098/fx41/THUMBNAIL/image/gif/209aef6407bf156c925d360e606ecfc9/fx41.sml fx41 fx41.sml sml 39746 152 219 IMAGE-THUMBNAIL 1-s2.0-S0957417424018098-gr4.sml https://s3-eu-west-1.amazonaws.com/prod-ucs-content-store-eu-west/content/pii:S0957417424018098/gr4/THUMBNAIL/image/gif/8e2d112fdd7903e0ab937cffceaf68fb/gr4.sml gr4 gr4.sml sml 80365 163 163 IMAGE-THUMBNAIL 1-s2.0-S0957417424018098-fx40.sml https://s3-eu-west-1.amazonaws.com/prod-ucs-content-store-eu-west/content/pii:S0957417424018098/fx40/THUMBNAIL/image/gif/7073a5bba7ff4b259cf35f35493de2cd/fx40.sml fx40 fx40.sml sml 35986 152 219 IMAGE-THUMBNAIL 1-s2.0-S0957417424018098-gr5.sml https://s3-eu-west-1.amazonaws.com/prod-ucs-content-store-eu-west/content/pii:S0957417424018098/gr5/THUMBNAIL/image/gif/eb3b31a45e0c47042012f8f990c68643/gr5.sml gr5 gr5.sml sml 73193 148 219 IMAGE-THUMBNAIL 1-s2.0-S0957417424018098-gr10.sml https://s3-eu-west-1.amazonaws.com/prod-ucs-content-store-eu-west/content/pii:S0957417424018098/gr10/THUMBNAIL/image/gif/ea75e8139e9ab2d45946efc742fbff7a/gr10.sml gr10 gr10.sml sml 75073 137 219 IMAGE-THUMBNAIL 1-s2.0-S0957417424018098-gr6.sml https://s3-eu-west-1.amazonaws.com/prod-ucs-content-store-eu-west/content/pii:S0957417424018098/gr6/THUMBNAIL/image/gif/3ab9f0964a7f6fefc7121c0ddc571a38/gr6.sml gr6 gr6.sml sml 76293 163 187 IMAGE-THUMBNAIL 1-s2.0-S0957417424018098-gr11.sml https://s3-eu-west-1.amazonaws.com/prod-ucs-content-store-eu-west/content/pii:S0957417424018098/gr11/THUMBNAIL/image/gif/24c7466c8dd583c5aaa4f9d2f721104c/gr11.sml gr11 gr11.sml sml 86742 139 219 IMAGE-THUMBNAIL 1-s2.0-S0957417424018098-fx6.sml https://s3-eu-west-1.amazonaws.com/prod-ucs-content-store-eu-west/content/pii:S0957417424018098/fx6/THUMBNAIL/image/gif/d5997293521da6b31f00756ec9569d26/fx6.sml fx6 fx6.sml sml 26148 110 219 IMAGE-THUMBNAIL 1-s2.0-S0957417424018098-fx7.sml https://s3-eu-west-1.amazonaws.com/prod-ucs-content-store-eu-west/content/pii:S0957417424018098/fx7/THUMBNAIL/image/gif/411169c42654ad880e2d427f9c124bf8/fx7.sml fx7 fx7.sml sml 27970 110 219 IMAGE-THUMBNAIL 1-s2.0-S0957417424018098-gr1.sml https://s3-eu-west-1.amazonaws.com/prod-ucs-content-store-eu-west/content/pii:S0957417424018098/gr1/THUMBNAIL/image/gif/18c698a0efffc7a076694e549a2ed1db/gr1.sml gr1 gr1.sml sml 68890 57 219 IMAGE-THUMBNAIL 1-s2.0-S0957417424018098-fx8.sml https://s3-eu-west-1.amazonaws.com/prod-ucs-content-store-eu-west/content/pii:S0957417424018098/fx8/THUMBNAIL/image/gif/f17a66bbc8c98e9ec39bcfb3cd919a43/fx8.sml fx8 fx8.sml sml 27995 110 219 IMAGE-THUMBNAIL 1-s2.0-S0957417424018098-gr2.sml https://s3-eu-west-1.amazonaws.com/prod-ucs-content-store-eu-west/content/pii:S0957417424018098/gr2/THUMBNAIL/image/gif/69460c77d9adc20810a47f4ae05ca4ec/gr2.sml gr2 gr2.sml sml 80840 67 219 IMAGE-THUMBNAIL 1-s2.0-S0957417424018098-fx9.sml https://s3-eu-west-1.amazonaws.com/prod-ucs-content-store-eu-west/content/pii:S0957417424018098/fx9/THUMBNAIL/image/gif/3a9fa7b6deca32ec641d7294beee41ac/fx9.sml fx9 fx9.sml sml 33338 128 219 IMAGE-THUMBNAIL 1-s2.0-S0957417424018098-fx2.sml https://s3-eu-west-1.amazonaws.com/prod-ucs-content-store-eu-west/content/pii:S0957417424018098/fx2/THUMBNAIL/image/gif/308158767e11db9902a6eda723ad2e06/fx2.sml fx2 fx2.sml sml 30367 110 219 IMAGE-THUMBNAIL 1-s2.0-S0957417424018098-fx3.sml https://s3-eu-west-1.amazonaws.com/prod-ucs-content-store-eu-west/content/pii:S0957417424018098/fx3/THUMBNAIL/image/gif/0a58f6e65443100d6f2da154790d46b2/fx3.sml fx3 fx3.sml sml 27184 110 219 IMAGE-THUMBNAIL 1-s2.0-S0957417424018098-fx4.sml https://s3-eu-west-1.amazonaws.com/prod-ucs-content-store-eu-west/content/pii:S0957417424018098/fx4/THUMBNAIL/image/gif/ed09ddf8e6e2dbc694ae9e5101a66c53/fx4.sml fx4 fx4.sml sml 27159 110 219 IMAGE-THUMBNAIL 1-s2.0-S0957417424018098-fx5.sml https://s3-eu-west-1.amazonaws.com/prod-ucs-content-store-eu-west/content/pii:S0957417424018098/fx5/THUMBNAIL/image/gif/d9862d84fdb09e48b1dbda16e734af0b/fx5.sml fx5 fx5.sml sml 25959 110 219 IMAGE-THUMBNAIL 1-s2.0-S0957417424018098-fx1.sml https://s3-eu-west-1.amazonaws.com/prod-ucs-content-store-eu-west/content/pii:S0957417424018098/fx1/THUMBNAIL/image/gif/2f0126cdf4a784e8306386160a98b5c4/fx1.sml fx1 fx1.sml sml 30423 110 219 IMAGE-THUMBNAIL 1-s2.0-S0957417424018098-fx34.sml https://s3-eu-west-1.amazonaws.com/prod-ucs-content-store-eu-west/content/pii:S0957417424018098/fx34/THUMBNAIL/image/gif/771e0dfaccec7f8cf6b67b032b86d52e/fx34.sml fx34 fx34.sml sml 32626 151 219 IMAGE-THUMBNAIL 1-s2.0-S0957417424018098-fx33.sml https://s3-eu-west-1.amazonaws.com/prod-ucs-content-store-eu-west/content/pii:S0957417424018098/fx33/THUMBNAIL/image/gif/55fe78c7dfeb6a48bae6076380d6cdba/fx33.sml fx33 fx33.sml sml 35224 151 219 IMAGE-THUMBNAIL 1-s2.0-S0957417424018098-fx32.sml https://s3-eu-west-1.amazonaws.com/prod-ucs-content-store-eu-west/content/pii:S0957417424018098/fx32/THUMBNAIL/image/gif/1e71850e142f29da6318d2126539034d/fx32.sml fx32 fx32.sml sml 28666 151 219 IMAGE-THUMBNAIL 1-s2.0-S0957417424018098-fx31.sml https://s3-eu-west-1.amazonaws.com/prod-ucs-content-store-eu-west/content/pii:S0957417424018098/fx31/THUMBNAIL/image/gif/a97f4534cd4948d02b2a9e147bc43c44/fx31.sml fx31 fx31.sml sml 35573 151 219 IMAGE-THUMBNAIL 1-s2.0-S0957417424018098-fx38.sml https://s3-eu-west-1.amazonaws.com/prod-ucs-content-store-eu-west/content/pii:S0957417424018098/fx38/THUMBNAIL/image/gif/6bd9e23853b20d09925ba4fe7d104da8/fx38.sml fx38 fx38.sml sml 28899 151 219 IMAGE-THUMBNAIL 1-s2.0-S0957417424018098-fx37.sml https://s3-eu-west-1.amazonaws.com/prod-ucs-content-store-eu-west/content/pii:S0957417424018098/fx37/THUMBNAIL/image/gif/fd5574e7097cf919f9ee66b42b2fb757/fx37.sml fx37 fx37.sml sml 32258 151 219 IMAGE-THUMBNAIL 1-s2.0-S0957417424018098-fx36.sml https://s3-eu-west-1.amazonaws.com/prod-ucs-content-store-eu-west/content/pii:S0957417424018098/fx36/THUMBNAIL/image/gif/8561ab7d410984024028e2c38c8eeff9/fx36.sml fx36 fx36.sml sml 35361 151 219 IMAGE-THUMBNAIL 1-s2.0-S0957417424018098-fx35.sml https://s3-eu-west-1.amazonaws.com/prod-ucs-content-store-eu-west/content/pii:S0957417424018098/fx35/THUMBNAIL/image/gif/bb71d4871e7548c7447a67068c167429/fx35.sml fx35 fx35.sml sml 28735 151 219 IMAGE-THUMBNAIL 1-s2.0-S0957417424018098-fx30.sml https://s3-eu-west-1.amazonaws.com/prod-ucs-content-store-eu-west/content/pii:S0957417424018098/fx30/THUMBNAIL/image/gif/ddadf8fb7a64922736691a474bfbe9fc/fx30.sml fx30 fx30.sml sml 35379 151 219 IMAGE-THUMBNAIL 1-s2.0-S0957417424018098-fx39.sml https://s3-eu-west-1.amazonaws.com/prod-ucs-content-store-eu-west/content/pii:S0957417424018098/fx39/THUMBNAIL/image/gif/5bf130dac2b76adfe19642a1bb90b8c1/fx39.sml fx39 fx39.sml sml 35395 151 219 IMAGE-THUMBNAIL 1-s2.0-S0957417424018098-fx23.sml https://s3-eu-west-1.amazonaws.com/prod-ucs-content-store-eu-west/content/pii:S0957417424018098/fx23/THUMBNAIL/image/gif/378fed01c5d3c90807be58421f4fa866/fx23.sml fx23 fx23.sml sml 28440 151 219 IMAGE-THUMBNAIL 1-s2.0-S0957417424018098-fx22.sml https://s3-eu-west-1.amazonaws.com/prod-ucs-content-store-eu-west/content/pii:S0957417424018098/fx22/THUMBNAIL/image/gif/e8f7230db3bcf4aeb2204bc8f2041e42/fx22.sml fx22 fx22.sml sml 32039 151 219 IMAGE-THUMBNAIL 1-s2.0-S0957417424018098-fx66.sml https://s3-eu-west-1.amazonaws.com/prod-ucs-content-store-eu-west/content/pii:S0957417424018098/fx66/THUMBNAIL/image/gif/1c771199db2f41ca950e4f7f6dcad070/fx66.sml fx66 fx66.sml sml 37595 151 219 IMAGE-THUMBNAIL 1-s2.0-S0957417424018098-fx21.sml https://s3-eu-west-1.amazonaws.com/prod-ucs-content-store-eu-west/content/pii:S0957417424018098/fx21/THUMBNAIL/image/gif/b2e6a5a8ca7fe9d8ffc83ecdb3329911/fx21.sml fx21 fx21.sml sml 35620 152 219 IMAGE-THUMBNAIL 1-s2.0-S0957417424018098-fx65.sml https://s3-eu-west-1.amazonaws.com/prod-ucs-content-store-eu-west/content/pii:S0957417424018098/fx65/THUMBNAIL/image/gif/90ac51c0f88ef2973cfd895f1b8eec74/fx65.sml fx65 fx65.sml sml 39119 151 219 IMAGE-THUMBNAIL 1-s2.0-S0957417424018098-fx20.sml https://s3-eu-west-1.amazonaws.com/prod-ucs-content-store-eu-west/content/pii:S0957417424018098/fx20/THUMBNAIL/image/gif/e17754d642fa6115840c99019d28a606/fx20.sml fx20 fx20.sml sml 27841 152 219 IMAGE-THUMBNAIL 1-s2.0-S0957417424018098-fx64.sml https://s3-eu-west-1.amazonaws.com/prod-ucs-content-store-eu-west/content/pii:S0957417424018098/fx64/THUMBNAIL/image/gif/49edfff85bb3461d4f1f0d0c134c787d/fx64.sml fx64 fx64.sml sml 35589 151 219 IMAGE-THUMBNAIL 1-s2.0-S0957417424018098-fx27.sml https://s3-eu-west-1.amazonaws.com/prod-ucs-content-store-eu-west/content/pii:S0957417424018098/fx27/THUMBNAIL/image/gif/bd6e64a8dccc70a6a59b22a2a3fedf09/fx27.sml fx27 fx27.sml sml 35422 151 219 IMAGE-THUMBNAIL 1-s2.0-S0957417424018098-fx26.sml https://s3-eu-west-1.amazonaws.com/prod-ucs-content-store-eu-west/content/pii:S0957417424018098/fx26/THUMBNAIL/image/gif/5ab7bd08d4f2eda562aff5ee95a02b1d/fx26.sml fx26 fx26.sml sml 28643 151 219 IMAGE-THUMBNAIL 1-s2.0-S0957417424018098-fx25.sml https://s3-eu-west-1.amazonaws.com/prod-ucs-content-store-eu-west/content/pii:S0957417424018098/fx25/THUMBNAIL/image/gif/827b2a71947167bd90157dbc972a951b/fx25.sml fx25 fx25.sml sml 32574 151 219 IMAGE-THUMBNAIL 1-s2.0-S0957417424018098-fx24.sml https://s3-eu-west-1.amazonaws.com/prod-ucs-content-store-eu-west/content/pii:S0957417424018098/fx24/THUMBNAIL/image/gif/8e6362fce836492024b9378dc09f931a/fx24.sml fx24 fx24.sml sml 35395 151 219 IMAGE-THUMBNAIL 1-s2.0-S0957417424018098-fx63.sml https://s3-eu-west-1.amazonaws.com/prod-ucs-content-store-eu-west/content/pii:S0957417424018098/fx63/THUMBNAIL/image/gif/0042455eed5e44e18679058274c76720/fx63.sml fx63 fx63.sml sml 37949 151 219 IMAGE-THUMBNAIL 1-s2.0-S0957417424018098-fx62.sml https://s3-eu-west-1.amazonaws.com/prod-ucs-content-store-eu-west/content/pii:S0957417424018098/fx62/THUMBNAIL/image/gif/f4df9b4692386cd03dce9949e0ee96cd/fx62.sml fx62 fx62.sml sml 39119 151 219 IMAGE-THUMBNAIL 1-s2.0-S0957417424018098-fx61.sml https://s3-eu-west-1.amazonaws.com/prod-ucs-content-store-eu-west/content/pii:S0957417424018098/fx61/THUMBNAIL/image/gif/1ba809b12bb87a74303a2b69042e99cb/fx61.sml fx61 fx61.sml sml 35573 151 219 IMAGE-THUMBNAIL 1-s2.0-S0957417424018098-fx60.sml https://s3-eu-west-1.amazonaws.com/prod-ucs-content-store-eu-west/content/pii:S0957417424018098/fx60/THUMBNAIL/image/gif/5c8573729b577c14c1e64593db66ba49/fx60.sml fx60 fx60.sml sml 37862 151 219 IMAGE-THUMBNAIL 1-s2.0-S0957417424018098-fx29.sml https://s3-eu-west-1.amazonaws.com/prod-ucs-content-store-eu-west/content/pii:S0957417424018098/fx29/THUMBNAIL/image/gif/bea4a8cfeb2f436f850899f0167e1b89/fx29.sml fx29 fx29.sml sml 28563 151 219 IMAGE-THUMBNAIL 1-s2.0-S0957417424018098-fx28.sml https://s3-eu-west-1.amazonaws.com/prod-ucs-content-store-eu-west/content/pii:S0957417424018098/fx28/THUMBNAIL/image/gif/c62e70e5358e6c9151d953a02d09d43f/fx28.sml fx28 fx28.sml sml 32663 151 219 IMAGE-THUMBNAIL 1-s2.0-S0957417424018098-fx12_lrg.jpg https://s3-eu-west-1.amazonaws.com/prod-ucs-content-store-eu-west/content/pii:S0957417424018098/HIGHRES/image/jpeg/deb568cc573a70a39caed118038c3425/fx12_lrg.jpg fx12 fx12_lrg.jpg jpg 117653 473 945 IMAGE-HIGH-RES 1-s2.0-S0957417424018098-fx56_lrg.jpg https://s3-eu-west-1.amazonaws.com/prod-ucs-content-store-eu-west/content/pii:S0957417424018098/HIGHRES/image/jpeg/d7774002f9cc0f4623a8187f78466682/fx56_lrg.jpg fx56 fx56_lrg.jpg jpg 137968 587 851 IMAGE-HIGH-RES 1-s2.0-S0957417424018098-fx11_lrg.jpg https://s3-eu-west-1.amazonaws.com/prod-ucs-content-store-eu-west/content/pii:S0957417424018098/HIGHRES/image/jpeg/15434446b080655286c5cfbcea32d0d7/fx11_lrg.jpg fx11 fx11_lrg.jpg jpg 106284 473 945 IMAGE-HIGH-RES 1-s2.0-S0957417424018098-fx55_lrg.jpg https://s3-eu-west-1.amazonaws.com/prod-ucs-content-store-eu-west/content/pii:S0957417424018098/HIGHRES/image/jpeg/cf73ae91a7ff89c9288c838a5a546e58/fx55_lrg.jpg fx55 fx55_lrg.jpg jpg 143626 587 851 IMAGE-HIGH-RES 1-s2.0-S0957417424018098-fx10_lrg.jpg https://s3-eu-west-1.amazonaws.com/prod-ucs-content-store-eu-west/content/pii:S0957417424018098/HIGHRES/image/jpeg/bacd1ccbb6422b6767a7b1e87997a4c2/fx10_lrg.jpg fx10 fx10_lrg.jpg jpg 147485 552 945 IMAGE-HIGH-RES 1-s2.0-S0957417424018098-fx54_lrg.jpg https://s3-eu-west-1.amazonaws.com/prod-ucs-content-store-eu-west/content/pii:S0957417424018098/HIGHRES/image/jpeg/af4a213ccf47aa0e53a7cff15ebff29f/fx54_lrg.jpg fx54 fx54_lrg.jpg jpg 157839 586 851 IMAGE-HIGH-RES 1-s2.0-S0957417424018098-fx53_lrg.jpg https://s3-eu-west-1.amazonaws.com/prod-ucs-content-store-eu-west/content/pii:S0957417424018098/HIGHRES/image/jpeg/fd2aa8089e4e01ae12a20d7d0de76f8f/fx53_lrg.jpg fx53 fx53_lrg.jpg jpg 137968 587 851 IMAGE-HIGH-RES 1-s2.0-S0957417424018098-fx16_lrg.jpg https://s3-eu-west-1.amazonaws.com/prod-ucs-content-store-eu-west/content/pii:S0957417424018098/HIGHRES/image/jpeg/c97c3d11cb0d7d733a27b9f6a422aab5/fx16_lrg.jpg fx16 fx16_lrg.jpg jpg 121260 589 851 IMAGE-HIGH-RES 1-s2.0-S0957417424018098-fx15_lrg.jpg https://s3-eu-west-1.amazonaws.com/prod-ucs-content-store-eu-west/content/pii:S0957417424018098/HIGHRES/image/jpeg/4bc8116515eac60d240d6d9c8f07946f/fx15_lrg.jpg fx15 fx15_lrg.jpg jpg 117469 591 851 IMAGE-HIGH-RES 1-s2.0-S0957417424018098-fx59_lrg.jpg https://s3-eu-west-1.amazonaws.com/prod-ucs-content-store-eu-west/content/pii:S0957417424018098/HIGHRES/image/jpeg/11e37c498b82489828df7d39dd50d920/fx59_lrg.jpg fx59 fx59_lrg.jpg jpg 139480 587 851 IMAGE-HIGH-RES 1-s2.0-S0957417424018098-fx14_lrg.jpg https://s3-eu-west-1.amazonaws.com/prod-ucs-content-store-eu-west/content/pii:S0957417424018098/HIGHRES/image/jpeg/38d7307eede2c852b719ac60ae34d635/fx14_lrg.jpg fx14 fx14_lrg.jpg jpg 65143 589 851 IMAGE-HIGH-RES 1-s2.0-S0957417424018098-fx58_lrg.jpg https://s3-eu-west-1.amazonaws.com/prod-ucs-content-store-eu-west/content/pii:S0957417424018098/HIGHRES/image/jpeg/f507b05d08c95858c066dd4c87b085cb/fx58_lrg.jpg fx58 fx58_lrg.jpg jpg 145012 587 851 IMAGE-HIGH-RES 1-s2.0-S0957417424018098-fx13_lrg.jpg https://s3-eu-west-1.amazonaws.com/prod-ucs-content-store-eu-west/content/pii:S0957417424018098/HIGHRES/image/jpeg/ce2a23fd96743ed02888e64f65a2641b/fx13_lrg.jpg fx13 fx13_lrg.jpg jpg 121380 589 851 IMAGE-HIGH-RES 1-s2.0-S0957417424018098-fx57_lrg.jpg https://s3-eu-west-1.amazonaws.com/prod-ucs-content-store-eu-west/content/pii:S0957417424018098/HIGHRES/image/jpeg/05a744e7ddb944ca1be570876e5ef3fb/fx57_lrg.jpg fx57 fx57_lrg.jpg jpg 157838 586 851 IMAGE-HIGH-RES 1-s2.0-S0957417424018098-fx52_lrg.jpg https://s3-eu-west-1.amazonaws.com/prod-ucs-content-store-eu-west/content/pii:S0957417424018098/HIGHRES/image/jpeg/9cc7d9a2aac824e7cbf5599e19d6a719/fx52_lrg.jpg fx52 fx52_lrg.jpg jpg 143626 587 851 IMAGE-HIGH-RES 1-s2.0-S0957417424018098-fx51_lrg.jpg https://s3-eu-west-1.amazonaws.com/prod-ucs-content-store-eu-west/content/pii:S0957417424018098/HIGHRES/image/jpeg/7e5db181e2ee57accffc01af782e6732/fx51_lrg.jpg fx51 fx51_lrg.jpg jpg 159542 587 851 IMAGE-HIGH-RES 1-s2.0-S0957417424018098-fx50_lrg.jpg https://s3-eu-west-1.amazonaws.com/prod-ucs-content-store-eu-west/content/pii:S0957417424018098/HIGHRES/image/jpeg/715dcb15b5956576b40f6c43ae8b7f72/fx50_lrg.jpg fx50 fx50_lrg.jpg jpg 139488 587 851 IMAGE-HIGH-RES 1-s2.0-S0957417424018098-fx19_lrg.jpg https://s3-eu-west-1.amazonaws.com/prod-ucs-content-store-eu-west/content/pii:S0957417424018098/HIGHRES/image/jpeg/d43a7b2210d895e63b385935ac74bf92/fx19_lrg.jpg fx19 fx19_lrg.jpg jpg 121988 589 851 IMAGE-HIGH-RES 1-s2.0-S0957417424018098-fx18_lrg.jpg https://s3-eu-west-1.amazonaws.com/prod-ucs-content-store-eu-west/content/pii:S0957417424018098/HIGHRES/image/jpeg/58db08b67ae27e168f56de526fe1df31/fx18_lrg.jpg fx18 fx18_lrg.jpg jpg 111967 589 851 IMAGE-HIGH-RES 1-s2.0-S0957417424018098-fx17_lrg.jpg https://s3-eu-west-1.amazonaws.com/prod-ucs-content-store-eu-west/content/pii:S0957417424018098/HIGHRES/image/jpeg/95f54461101a412b41964e1f3df32492/fx17_lrg.jpg fx17 fx17_lrg.jpg jpg 64014 589 851 IMAGE-HIGH-RES 1-s2.0-S0957417424018098-fx45_lrg.jpg https://s3-eu-west-1.amazonaws.com/prod-ucs-content-store-eu-west/content/pii:S0957417424018098/HIGHRES/image/jpeg/22a4da2cdd6df7693801fc783396b758/fx45_lrg.jpg fx45 fx45_lrg.jpg jpg 133616 589 851 IMAGE-HIGH-RES 1-s2.0-S0957417424018098-fx44_lrg.jpg https://s3-eu-west-1.amazonaws.com/prod-ucs-content-store-eu-west/content/pii:S0957417424018098/HIGHRES/image/jpeg/d7f344878eb5cbf8a7ef9debc35f0507/fx44_lrg.jpg fx44 fx44_lrg.jpg jpg 125920 589 851 IMAGE-HIGH-RES 1-s2.0-S0957417424018098-fx43_lrg.jpg https://s3-eu-west-1.amazonaws.com/prod-ucs-content-store-eu-west/content/pii:S0957417424018098/HIGHRES/image/jpeg/bd659975593480ed82f6572a9e2af484/fx43_lrg.jpg fx43 fx43_lrg.jpg jpg 129984 589 851 IMAGE-HIGH-RES 1-s2.0-S0957417424018098-fx42_lrg.jpg https://s3-eu-west-1.amazonaws.com/prod-ucs-content-store-eu-west/content/pii:S0957417424018098/HIGHRES/image/jpeg/b805df8bac7c8798f0b246fa9a673e34/fx42_lrg.jpg fx42 fx42_lrg.jpg jpg 131297 588 851 IMAGE-HIGH-RES 1-s2.0-S0957417424018098-gr16_lrg.jpg https://s3-eu-west-1.amazonaws.com/prod-ucs-content-store-eu-west/content/pii:S0957417424018098/HIGHRES/image/jpeg/bd61fe55a447df9e905fd416149baf29/gr16_lrg.jpg gr16 gr16_lrg.jpg jpg 286341 1552 3208 IMAGE-HIGH-RES 1-s2.0-S0957417424018098-fx49_lrg.jpg https://s3-eu-west-1.amazonaws.com/prod-ucs-content-store-eu-west/content/pii:S0957417424018098/HIGHRES/image/jpeg/378c5d5c7e1297ee00f4cac2ad603cb8/fx49_lrg.jpg fx49 fx49_lrg.jpg jpg 145004 587 851 IMAGE-HIGH-RES 1-s2.0-S0957417424018098-gr17_lrg.jpg https://s3-eu-west-1.amazonaws.com/prod-ucs-content-store-eu-west/content/pii:S0957417424018098/HIGHRES/image/jpeg/d1a445ae05227b9c449b1a8822af1ddb/gr17_lrg.jpg gr17 gr17_lrg.jpg jpg 2431335 2531 3238 IMAGE-HIGH-RES 1-s2.0-S0957417424018098-fx48_lrg.jpg https://s3-eu-west-1.amazonaws.com/prod-ucs-content-store-eu-west/content/pii:S0957417424018098/HIGHRES/image/jpeg/2e57e8204503976ba2c9ef7837087f1d/fx48_lrg.jpg fx48 fx48_lrg.jpg jpg 131305 588 851 IMAGE-HIGH-RES 1-s2.0-S0957417424018098-fx47_lrg.jpg https://s3-eu-west-1.amazonaws.com/prod-ucs-content-store-eu-west/content/pii:S0957417424018098/HIGHRES/image/jpeg/09b2e1b9b3786fb3179984ee09a6ac81/fx47_lrg.jpg fx47 fx47_lrg.jpg jpg 126702 589 851 IMAGE-HIGH-RES 1-s2.0-S0957417424018098-fx46_lrg.jpg https://s3-eu-west-1.amazonaws.com/prod-ucs-content-store-eu-west/content/pii:S0957417424018098/HIGHRES/image/jpeg/27ea85c89b6afcbe6838b8e20f8ab869/fx46_lrg.jpg fx46 fx46_lrg.jpg jpg 129795 589 851 IMAGE-HIGH-RES 1-s2.0-S0957417424018098-gr7_lrg.jpg https://s3-eu-west-1.amazonaws.com/prod-ucs-content-store-eu-west/content/pii:S0957417424018098/HIGHRES/image/jpeg/679f30b5c38afd37bcc81f6e84735aeb/gr7_lrg.jpg gr7 gr7_lrg.jpg jpg 352596 1449 2697 IMAGE-HIGH-RES 1-s2.0-S0957417424018098-gr12_lrg.jpg https://s3-eu-west-1.amazonaws.com/prod-ucs-content-store-eu-west/content/pii:S0957417424018098/HIGHRES/image/jpeg/25606859d2fa02d3d0862fc206ee8ab8/gr12_lrg.jpg gr12 gr12_lrg.jpg jpg 250808 1267 1704 IMAGE-HIGH-RES 1-s2.0-S0957417424018098-gr8_lrg.jpg https://s3-eu-west-1.amazonaws.com/prod-ucs-content-store-eu-west/content/pii:S0957417424018098/HIGHRES/image/jpeg/f5a071c25072f5e3e326775152a0153e/gr8_lrg.jpg gr8 gr8_lrg.jpg jpg 202327 699 2898 IMAGE-HIGH-RES 1-s2.0-S0957417424018098-gr13_lrg.jpg https://s3-eu-west-1.amazonaws.com/prod-ucs-content-store-eu-west/content/pii:S0957417424018098/HIGHRES/image/jpeg/27a8f69042d152a12279b9fe8dde9d4c/gr13_lrg.jpg gr13 gr13_lrg.jpg jpg 257299 1282 1695 IMAGE-HIGH-RES 1-s2.0-S0957417424018098-gr9_lrg.jpg https://s3-eu-west-1.amazonaws.com/prod-ucs-content-store-eu-west/content/pii:S0957417424018098/HIGHRES/image/jpeg/b51b94d8c93d09d175ff2ab1fd1c6f7d/gr9_lrg.jpg gr9 gr9_lrg.jpg jpg 162753 433 2956 IMAGE-HIGH-RES 1-s2.0-S0957417424018098-gr14_lrg.jpg https://s3-eu-west-1.amazonaws.com/prod-ucs-content-store-eu-west/content/pii:S0957417424018098/HIGHRES/image/jpeg/9a0fe924ae5167d2febeb51071fda965/gr14_lrg.jpg gr14 gr14_lrg.jpg jpg 276985 1112 1703 IMAGE-HIGH-RES 1-s2.0-S0957417424018098-gr15_lrg.jpg https://s3-eu-west-1.amazonaws.com/prod-ucs-content-store-eu-west/content/pii:S0957417424018098/HIGHRES/image/jpeg/5b65afab9c543a84caa7bc6b59c2a158/gr15_lrg.jpg gr15 gr15_lrg.jpg jpg 283952 1109 1703 IMAGE-HIGH-RES 1-s2.0-S0957417424018098-gr3_lrg.jpg https://s3-eu-west-1.amazonaws.com/prod-ucs-content-store-eu-west/content/pii:S0957417424018098/HIGHRES/image/jpeg/7258e850522d98172464307a99eea470/gr3_lrg.jpg gr3 gr3_lrg.jpg jpg 426673 1434 1305 IMAGE-HIGH-RES 1-s2.0-S0957417424018098-fx41_lrg.jpg https://s3-eu-west-1.amazonaws.com/prod-ucs-content-store-eu-west/content/pii:S0957417424018098/HIGHRES/image/jpeg/e2cc6f51dfaca67239a86f883cf80c7b/fx41_lrg.jpg fx41 fx41_lrg.jpg jpg 125426 589 851 IMAGE-HIGH-RES 1-s2.0-S0957417424018098-gr4_lrg.jpg https://s3-eu-west-1.amazonaws.com/prod-ucs-content-store-eu-west/content/pii:S0957417424018098/HIGHRES/image/jpeg/bd52ca1998f4b3385dc6991134b7f7aa/gr4_lrg.jpg gr4 gr4_lrg.jpg jpg 965120 3260 3253 IMAGE-HIGH-RES 1-s2.0-S0957417424018098-fx40_lrg.jpg https://s3-eu-west-1.amazonaws.com/prod-ucs-content-store-eu-west/content/pii:S0957417424018098/HIGHRES/image/jpeg/954a505f390ac9632bcd69c924eede94/fx40_lrg.jpg fx40 fx40_lrg.jpg jpg 129548 589 851 IMAGE-HIGH-RES 1-s2.0-S0957417424018098-gr5_lrg.jpg https://s3-eu-west-1.amazonaws.com/prod-ucs-content-store-eu-west/content/pii:S0957417424018098/HIGHRES/image/jpeg/eb3d5aede0ad6a9faba83bcef3d1ad85/gr5_lrg.jpg gr5 gr5_lrg.jpg jpg 297813 1583 2335 IMAGE-HIGH-RES 1-s2.0-S0957417424018098-gr10_lrg.jpg https://s3-eu-west-1.amazonaws.com/prod-ucs-content-store-eu-west/content/pii:S0957417424018098/HIGHRES/image/jpeg/672f319f691cae0853ae1679954d7407/gr10_lrg.jpg gr10 gr10_lrg.jpg jpg 248725 1066 1708 IMAGE-HIGH-RES 1-s2.0-S0957417424018098-gr6_lrg.jpg https://s3-eu-west-1.amazonaws.com/prod-ucs-content-store-eu-west/content/pii:S0957417424018098/HIGHRES/image/jpeg/70b8d33ecbdf73fff79ce86a8877a1e7/gr6_lrg.jpg gr6 gr6_lrg.jpg jpg 279615 1444 1652 IMAGE-HIGH-RES 1-s2.0-S0957417424018098-gr11_lrg.jpg https://s3-eu-west-1.amazonaws.com/prod-ucs-content-store-eu-west/content/pii:S0957417424018098/HIGHRES/image/jpeg/d306f59353b256baf94acecc38054017/gr11_lrg.jpg gr11 gr11_lrg.jpg jpg 1214178 2060 3238 IMAGE-HIGH-RES 1-s2.0-S0957417424018098-fx6_lrg.jpg https://s3-eu-west-1.amazonaws.com/prod-ucs-content-store-eu-west/content/pii:S0957417424018098/HIGHRES/image/jpeg/c4bb978edd93b03acbe55e2f3792d275/fx6_lrg.jpg fx6 fx6_lrg.jpg jpg 106384 473 945 IMAGE-HIGH-RES 1-s2.0-S0957417424018098-fx7_lrg.jpg https://s3-eu-west-1.amazonaws.com/prod-ucs-content-store-eu-west/content/pii:S0957417424018098/HIGHRES/image/jpeg/4aec53ee225f3a10594b6c81a88ac890/fx7_lrg.jpg fx7 fx7_lrg.jpg jpg 107125 473 945 IMAGE-HIGH-RES 1-s2.0-S0957417424018098-gr1_lrg.jpg https://s3-eu-west-1.amazonaws.com/prod-ucs-content-store-eu-west/content/pii:S0957417424018098/HIGHRES/image/jpeg/35020754416de3c70a162c282985e5bb/gr1_lrg.jpg gr1 gr1_lrg.jpg jpg 151300 447 1712 IMAGE-HIGH-RES 1-s2.0-S0957417424018098-fx8_lrg.jpg https://s3-eu-west-1.amazonaws.com/prod-ucs-content-store-eu-west/content/pii:S0957417424018098/HIGHRES/image/jpeg/e1feb1a0e03802d824e67d0d89ce4f76/fx8_lrg.jpg fx8 fx8_lrg.jpg jpg 119564 473 945 IMAGE-HIGH-RES 1-s2.0-S0957417424018098-gr2_lrg.jpg https://s3-eu-west-1.amazonaws.com/prod-ucs-content-store-eu-west/content/pii:S0957417424018098/HIGHRES/image/jpeg/dce129b8b6f0204ba44e2dd4e1e48d09/gr2_lrg.jpg gr2 gr2_lrg.jpg jpg 830181 965 3157 IMAGE-HIGH-RES 1-s2.0-S0957417424018098-fx9_lrg.jpg https://s3-eu-west-1.amazonaws.com/prod-ucs-content-store-eu-west/content/pii:S0957417424018098/HIGHRES/image/jpeg/ec242d39a660b72a917b766084fe039e/fx9_lrg.jpg fx9 fx9_lrg.jpg jpg 134610 552 945 IMAGE-HIGH-RES 1-s2.0-S0957417424018098-fx2_lrg.jpg https://s3-eu-west-1.amazonaws.com/prod-ucs-content-store-eu-west/content/pii:S0957417424018098/HIGHRES/image/jpeg/61047df7d9166e7717927c648ce33119/fx2_lrg.jpg fx2 fx2_lrg.jpg jpg 135279 473 945 IMAGE-HIGH-RES 1-s2.0-S0957417424018098-fx3_lrg.jpg https://s3-eu-west-1.amazonaws.com/prod-ucs-content-store-eu-west/content/pii:S0957417424018098/HIGHRES/image/jpeg/2cc06722ccfb67f7d748bb2c479e0d5b/fx3_lrg.jpg fx3 fx3_lrg.jpg jpg 110098 473 945 IMAGE-HIGH-RES 1-s2.0-S0957417424018098-fx4_lrg.jpg https://s3-eu-west-1.amazonaws.com/prod-ucs-content-store-eu-west/content/pii:S0957417424018098/HIGHRES/image/jpeg/b73b2739642cf3f0366c3e03780f9b4f/fx4_lrg.jpg fx4 fx4_lrg.jpg jpg 119407 473 945 IMAGE-HIGH-RES 1-s2.0-S0957417424018098-fx5_lrg.jpg https://s3-eu-west-1.amazonaws.com/prod-ucs-content-store-eu-west/content/pii:S0957417424018098/HIGHRES/image/jpeg/9115e8a0feba20ffd1b022301e6f5f69/fx5_lrg.jpg fx5 fx5_lrg.jpg jpg 96507 473 945 IMAGE-HIGH-RES 1-s2.0-S0957417424018098-fx1_lrg.jpg https://s3-eu-west-1.amazonaws.com/prod-ucs-content-store-eu-west/content/pii:S0957417424018098/HIGHRES/image/jpeg/85fe7d10db798acd4e7052b9e2db7aee/fx1_lrg.jpg fx1 fx1_lrg.jpg jpg 129192 473 945 IMAGE-HIGH-RES 1-s2.0-S0957417424018098-fx34_lrg.jpg https://s3-eu-west-1.amazonaws.com/prod-ucs-content-store-eu-west/content/pii:S0957417424018098/HIGHRES/image/jpeg/033980164f98bbdb727f6fecfdeaa01b/fx34_lrg.jpg fx34 fx34_lrg.jpg jpg 136591 587 851 IMAGE-HIGH-RES 1-s2.0-S0957417424018098-fx33_lrg.jpg https://s3-eu-west-1.amazonaws.com/prod-ucs-content-store-eu-west/content/pii:S0957417424018098/HIGHRES/image/jpeg/3a68f2448f907b4303fa0402ce593011/fx33_lrg.jpg fx33 fx33_lrg.jpg jpg 128855 586 851 IMAGE-HIGH-RES 1-s2.0-S0957417424018098-fx32_lrg.jpg https://s3-eu-west-1.amazonaws.com/prod-ucs-content-store-eu-west/content/pii:S0957417424018098/HIGHRES/image/jpeg/17577ca28f6746fa8069b5d0350d9d95/fx32_lrg.jpg fx32 fx32_lrg.jpg jpg 80687 587 851 IMAGE-HIGH-RES 1-s2.0-S0957417424018098-fx31_lrg.jpg https://s3-eu-west-1.amazonaws.com/prod-ucs-content-store-eu-west/content/pii:S0957417424018098/HIGHRES/image/jpeg/f7a508cb1d6af2fca2a83d9df2a152da/fx31_lrg.jpg fx31 fx31_lrg.jpg jpg 145004 587 851 IMAGE-HIGH-RES 1-s2.0-S0957417424018098-fx38_lrg.jpg https://s3-eu-west-1.amazonaws.com/prod-ucs-content-store-eu-west/content/pii:S0957417424018098/HIGHRES/image/jpeg/8443105eafa778c91e01b8c4b6ec37a9/fx38_lrg.jpg fx38 fx38_lrg.jpg jpg 83589 587 851 IMAGE-HIGH-RES 1-s2.0-S0957417424018098-fx37_lrg.jpg https://s3-eu-west-1.amazonaws.com/prod-ucs-content-store-eu-west/content/pii:S0957417424018098/HIGHRES/image/jpeg/29b0cb261fe679b1a2b555ab804b1fb2/fx37_lrg.jpg fx37 fx37_lrg.jpg jpg 135732 587 851 IMAGE-HIGH-RES 1-s2.0-S0957417424018098-fx36_lrg.jpg https://s3-eu-west-1.amazonaws.com/prod-ucs-content-store-eu-west/content/pii:S0957417424018098/HIGHRES/image/jpeg/20adb76e64f3642cddb67cfc70ca3ca7/fx36_lrg.jpg fx36 fx36_lrg.jpg jpg 130295 586 851 IMAGE-HIGH-RES 1-s2.0-S0957417424018098-fx35_lrg.jpg https://s3-eu-west-1.amazonaws.com/prod-ucs-content-store-eu-west/content/pii:S0957417424018098/HIGHRES/image/jpeg/484a6f5c1eb1696b8d5cbd06d7b1395a/fx35_lrg.jpg fx35 fx35_lrg.jpg jpg 80708 587 851 IMAGE-HIGH-RES 1-s2.0-S0957417424018098-fx30_lrg.jpg https://s3-eu-west-1.amazonaws.com/prod-ucs-content-store-eu-west/content/pii:S0957417424018098/HIGHRES/image/jpeg/065397afcdf47bb138f991a1b9594bac/fx30_lrg.jpg fx30 fx30_lrg.jpg jpg 128832 586 851 IMAGE-HIGH-RES 1-s2.0-S0957417424018098-fx39_lrg.jpg https://s3-eu-west-1.amazonaws.com/prod-ucs-content-store-eu-west/content/pii:S0957417424018098/HIGHRES/image/jpeg/2d813f3691c6c2d6ca13312e1b96f18c/fx39_lrg.jpg fx39 fx39_lrg.jpg jpg 129581 587 851 IMAGE-HIGH-RES 1-s2.0-S0957417424018098-fx23_lrg.jpg https://s3-eu-west-1.amazonaws.com/prod-ucs-content-store-eu-west/content/pii:S0957417424018098/HIGHRES/image/jpeg/390f4be761bc539c795367b0dc71f3e7/fx23_lrg.jpg fx23 fx23_lrg.jpg jpg 80309 587 851 IMAGE-HIGH-RES 1-s2.0-S0957417424018098-fx22_lrg.jpg https://s3-eu-west-1.amazonaws.com/prod-ucs-content-store-eu-west/content/pii:S0957417424018098/HIGHRES/image/jpeg/1ec58ea832e335ed3fe6dc535588a8eb/fx22_lrg.jpg fx22 fx22_lrg.jpg jpg 128420 586 851 IMAGE-HIGH-RES 1-s2.0-S0957417424018098-fx66_lrg.jpg https://s3-eu-west-1.amazonaws.com/prod-ucs-content-store-eu-west/content/pii:S0957417424018098/HIGHRES/image/jpeg/f56811498db15d4281aaf3256623e936/fx66_lrg.jpg fx66 fx66_lrg.jpg jpg 159542 587 851 IMAGE-HIGH-RES 1-s2.0-S0957417424018098-fx21_lrg.jpg https://s3-eu-west-1.amazonaws.com/prod-ucs-content-store-eu-west/content/pii:S0957417424018098/HIGHRES/image/jpeg/e9dbeb90b34ab353311d1b5a9c260171/fx21_lrg.jpg fx21 fx21_lrg.jpg jpg 112798 589 851 IMAGE-HIGH-RES 1-s2.0-S0957417424018098-fx65_lrg.jpg https://s3-eu-west-1.amazonaws.com/prod-ucs-content-store-eu-west/content/pii:S0957417424018098/HIGHRES/image/jpeg/3e4b92a273eccaafa279fdcc87a2d8c0/fx65_lrg.jpg fx65 fx65_lrg.jpg jpg 139488 587 851 IMAGE-HIGH-RES 1-s2.0-S0957417424018098-fx20_lrg.jpg https://s3-eu-west-1.amazonaws.com/prod-ucs-content-store-eu-west/content/pii:S0957417424018098/HIGHRES/image/jpeg/026b391d96794e5054a2e916ba76340c/fx20_lrg.jpg fx20 fx20_lrg.jpg jpg 63407 590 851 IMAGE-HIGH-RES 1-s2.0-S0957417424018098-fx64_lrg.jpg https://s3-eu-west-1.amazonaws.com/prod-ucs-content-store-eu-west/content/pii:S0957417424018098/HIGHRES/image/jpeg/75f972744f832cd30736b76803de3c60/fx64_lrg.jpg fx64 fx64_lrg.jpg jpg 145012 587 851 IMAGE-HIGH-RES 1-s2.0-S0957417424018098-fx27_lrg.jpg https://s3-eu-west-1.amazonaws.com/prod-ucs-content-store-eu-west/content/pii:S0957417424018098/HIGHRES/image/jpeg/2a594767882f8fd762e570c2ce91f91c/fx27_lrg.jpg fx27 fx27_lrg.jpg jpg 130292 586 851 IMAGE-HIGH-RES 1-s2.0-S0957417424018098-fx26_lrg.jpg https://s3-eu-west-1.amazonaws.com/prod-ucs-content-store-eu-west/content/pii:S0957417424018098/HIGHRES/image/jpeg/5e30f2d187eff9d6cabdb91fc8edfd74/fx26_lrg.jpg fx26 fx26_lrg.jpg jpg 81134 587 851 IMAGE-HIGH-RES 1-s2.0-S0957417424018098-fx25_lrg.jpg https://s3-eu-west-1.amazonaws.com/prod-ucs-content-store-eu-west/content/pii:S0957417424018098/HIGHRES/image/jpeg/1b1a7a9e62435790e09641aec425c751/fx25_lrg.jpg fx25 fx25_lrg.jpg jpg 137172 587 851 IMAGE-HIGH-RES 1-s2.0-S0957417424018098-fx24_lrg.jpg https://s3-eu-west-1.amazonaws.com/prod-ucs-content-store-eu-west/content/pii:S0957417424018098/HIGHRES/image/jpeg/a5b5c815deffc2950feee04dcac1a760/fx24_lrg.jpg fx24 fx24_lrg.jpg jpg 129581 587 851 IMAGE-HIGH-RES 1-s2.0-S0957417424018098-fx63_lrg.jpg https://s3-eu-west-1.amazonaws.com/prod-ucs-content-store-eu-west/content/pii:S0957417424018098/HIGHRES/image/jpeg/98aede2975f0685ad8014136782faa97/fx63_lrg.jpg fx63 fx63_lrg.jpg jpg 157937 586 851 IMAGE-HIGH-RES 1-s2.0-S0957417424018098-fx62_lrg.jpg https://s3-eu-west-1.amazonaws.com/prod-ucs-content-store-eu-west/content/pii:S0957417424018098/HIGHRES/image/jpeg/9223d6b17e1d55985b810bbae851cf8e/fx62_lrg.jpg fx62 fx62_lrg.jpg jpg 139488 587 851 IMAGE-HIGH-RES 1-s2.0-S0957417424018098-fx61_lrg.jpg https://s3-eu-west-1.amazonaws.com/prod-ucs-content-store-eu-west/content/pii:S0957417424018098/HIGHRES/image/jpeg/c852f3d919024de20a2a900d6afee472/fx61_lrg.jpg fx61 fx61_lrg.jpg jpg 145004 587 851 IMAGE-HIGH-RES 1-s2.0-S0957417424018098-fx60_lrg.jpg https://s3-eu-west-1.amazonaws.com/prod-ucs-content-store-eu-west/content/pii:S0957417424018098/HIGHRES/image/jpeg/3918ae430e77e8f4e0d6c550e00895b1/fx60_lrg.jpg fx60 fx60_lrg.jpg jpg 157768 586 851 IMAGE-HIGH-RES 1-s2.0-S0957417424018098-fx29_lrg.jpg https://s3-eu-west-1.amazonaws.com/prod-ucs-content-store-eu-west/content/pii:S0957417424018098/HIGHRES/image/jpeg/63823385c5bf7f3c08f47c70f4b77b97/fx29_lrg.jpg fx29 fx29_lrg.jpg jpg 79930 587 851 IMAGE-HIGH-RES 1-s2.0-S0957417424018098-fx28_lrg.jpg https://s3-eu-west-1.amazonaws.com/prod-ucs-content-store-eu-west/content/pii:S0957417424018372/HIGHRES/image/jpeg/02fc6c7849e8490e1c380ced71388c0c/fx28_lrg.jpg fx28 fx28_lrg.jpg jpg 137300 587 851 IMAGE-HIGH-RES 1-s2.0-S0957417424018098-si1.svg https://s3-eu-west-1.amazonaws.com/prod-ucs-content-store-eu-west/content/pii:S0957417424018098/image/svg+xml/29220700d0fe3c2dc5cf5f2f1ff3fab5/si1.svg si1 si1.svg svg 2845 ALTIMG 1-s2.0-S0957417424018098-si10.svg https://s3-eu-west-1.amazonaws.com/prod-ucs-content-store-eu-west/content/pii:S0957417424018098/image/svg+xml/927c019eb55e80cbf50905f5386c57fb/si10.svg si10 si10.svg svg 8970 ALTIMG 1-s2.0-S0957417424018098-si11.svg https://s3-eu-west-1.amazonaws.com/prod-ucs-content-store-eu-west/content/pii:S0957417424018098/image/svg+xml/c1aedaed2ad9313a78f5e6f24d95fdb1/si11.svg si11 si11.svg svg 1446 ALTIMG 1-s2.0-S0957417424018098-si12.svg https://s3-eu-west-1.amazonaws.com/prod-ucs-content-store-eu-west/content/pii:S0957417424018098/image/svg+xml/3c3de4dc9ecab6423366fa1a6e60ecc1/si12.svg si12 si12.svg svg 2665 ALTIMG 1-s2.0-S0957417424018098-si13.svg https://s3-eu-west-1.amazonaws.com/prod-ucs-content-store-eu-west/content/pii:S0957417424018098/image/svg+xml/53eaf2a883f7a19ece3b6f0b40d220c6/si13.svg si13 si13.svg svg 14871 ALTIMG 1-s2.0-S0957417424018098-si14.svg https://s3-eu-west-1.amazonaws.com/prod-ucs-content-store-eu-west/content/pii:S0957417424018098/image/svg+xml/a16bda773a122c170d54b6d35d678e82/si14.svg si14 si14.svg svg 19104 ALTIMG 1-s2.0-S0957417424018098-si15.svg https://s3-eu-west-1.amazonaws.com/prod-ucs-content-store-eu-west/content/pii:S0957417424018098/image/svg+xml/9b61be2d51be54aa7a42bd0172693d04/si15.svg si15 si15.svg svg 1099 ALTIMG 1-s2.0-S0957417424018098-si16.svg https://s3-eu-west-1.amazonaws.com/prod-ucs-content-store-eu-west/content/pii:S0957417424018098/image/svg+xml/edf8d5cb5248dfa24beed5fbe56e0d98/si16.svg si16 si16.svg svg 24531 ALTIMG 1-s2.0-S0957417424018098-si17.svg https://s3-eu-west-1.amazonaws.com/prod-ucs-content-store-eu-west/content/pii:S0957417424018098/image/svg+xml/08931898cf4494b200674ae1c776098e/si17.svg si17 si17.svg svg 13037 ALTIMG 1-s2.0-S0957417424018098-si19.svg https://s3-eu-west-1.amazonaws.com/prod-ucs-content-store-eu-west/content/pii:S0957417424018098/image/svg+xml/f4774f992310fb4dfc29a7d63ec52be0/si19.svg si19 si19.svg svg 37336 ALTIMG 1-s2.0-S0957417424018098-si21.svg https://s3-eu-west-1.amazonaws.com/prod-ucs-content-store-eu-west/content/pii:S0957417424018098/image/svg+xml/6bb6326e4de0a17627d27782f461128b/si21.svg si21 si21.svg svg 10907 ALTIMG 1-s2.0-S0957417424018098-si22.svg https://s3-eu-west-1.amazonaws.com/prod-ucs-content-store-eu-west/content/pii:S0957417424018098/image/svg+xml/11af05443d072d0f43192bfff6d8b519/si22.svg si22 si22.svg svg 12981 ALTIMG 1-s2.0-S0957417424018098-si23.svg https://s3-eu-west-1.amazonaws.com/prod-ucs-content-store-eu-west/content/pii:S0957417424018098/image/svg+xml/f0f0dba21d107465d83c1520284c17ab/si23.svg si23 si23.svg svg 12660 ALTIMG 1-s2.0-S0957417424018098-si24.svg https://s3-eu-west-1.amazonaws.com/prod-ucs-content-store-eu-west/content/pii:S0957417424018098/image/svg+xml/b5d3195a176f6a45f87be8ac55e1f25b/si24.svg si24 si24.svg svg 9095 ALTIMG 1-s2.0-S0957417424018098-si25.svg https://s3-eu-west-1.amazonaws.com/prod-ucs-content-store-eu-west/content/pii:S0957417424018098/image/svg+xml/b6588dce08c8bb0460479d41096c5e9d/si25.svg si25 si25.svg svg 2855 ALTIMG 1-s2.0-S0957417424018098-si26.svg https://s3-eu-west-1.amazonaws.com/prod-ucs-content-store-eu-west/content/pii:S0957417424018098/image/svg+xml/2da7727b307f44c383b53a036b836f50/si26.svg si26 si26.svg svg 1136 ALTIMG 1-s2.0-S0957417424018098-si28.svg https://s3-eu-west-1.amazonaws.com/prod-ucs-content-store-eu-west/content/pii:S0957417424018098/image/svg+xml/602e0b3d8ea6c347e1b169028f8e452c/si28.svg si28 si28.svg svg 1389 ALTIMG 1-s2.0-S0957417424018098-si29.svg https://s3-eu-west-1.amazonaws.com/prod-ucs-content-store-eu-west/content/pii:S0957417424018098/image/svg+xml/f3c8f310361f84f2a44200d3ff60ed08/si29.svg si29 si29.svg svg 1671 ALTIMG 1-s2.0-S0957417424018098-si3.svg https://s3-eu-west-1.amazonaws.com/prod-ucs-content-store-eu-west/content/pii:S0957417424018098/image/svg+xml/8a01966690996ab34815ba863ff498b3/si3.svg si3 si3.svg svg 15222 ALTIMG 1-s2.0-S0957417424018098-si30.svg https://s3-eu-west-1.amazonaws.com/prod-ucs-content-store-eu-west/content/pii:S0957417424018098/image/svg+xml/2729b1e11b9a53dc0f1a16fa9ce5fb91/si30.svg si30 si30.svg svg 1142 ALTIMG 1-s2.0-S0957417424018098-si31.svg https://s3-eu-west-1.amazonaws.com/prod-ucs-content-store-eu-west/content/pii:S0957417424018098/image/svg+xml/d9d2925021d3204c8c1cb75b0ef7a2fb/si31.svg si31 si31.svg svg 2611 ALTIMG 1-s2.0-S0957417424018098-si32.svg https://s3-eu-west-1.amazonaws.com/prod-ucs-content-store-eu-west/content/pii:S0957417424018098/image/svg+xml/5034d77d7b1560b7933860e3d225ace2/si32.svg si32 si32.svg svg 2413 ALTIMG 1-s2.0-S0957417424018098-si34.svg https://s3-eu-west-1.amazonaws.com/prod-ucs-content-store-eu-west/content/pii:S0957417424018098/image/svg+xml/db31bc9d7e39e05cf2db206328500e21/si34.svg si34 si34.svg svg 702 ALTIMG 1-s2.0-S0957417424018098-si39.svg https://s3-eu-west-1.amazonaws.com/prod-ucs-content-store-eu-west/content/pii:S0957417424018098/image/svg+xml/b939d9398db5c0537ec2cef7cc0168cc/si39.svg si39 si39.svg svg 1627 ALTIMG 1-s2.0-S0957417424018098-si4.svg https://s3-eu-west-1.amazonaws.com/prod-ucs-content-store-eu-west/content/pii:S0957417424018098/image/svg+xml/f650dee45d39d91e54cd9eb970dbd4ed/si4.svg si4 si4.svg svg 752 ALTIMG 1-s2.0-S0957417424018098-si40.svg https://s3-eu-west-1.amazonaws.com/prod-ucs-content-store-eu-west/content/pii:S0957417424018098/image/svg+xml/9256a5cfb6cf3ee670a8ed7493a6d8ce/si40.svg si40 si40.svg svg 1330 ALTIMG 1-s2.0-S0957417424018098-si41.svg https://s3-eu-west-1.amazonaws.com/prod-ucs-content-store-eu-west/content/pii:S0957417424018098/image/svg+xml/5ab7db1a6ddc7c0c451845ec81eae8f5/si41.svg si41 si41.svg svg 11778 ALTIMG 1-s2.0-S0957417424018098-si42.svg https://s3-eu-west-1.amazonaws.com/prod-ucs-content-store-eu-west/content/pii:S0957417424018098/image/svg+xml/00fb8f535f95248acbf6be1f6b28ce29/si42.svg si42 si42.svg svg 13791 ALTIMG 1-s2.0-S0957417424018098-si43.svg https://s3-eu-west-1.amazonaws.com/prod-ucs-content-store-eu-west/content/pii:S0957417424018098/image/svg+xml/1eab91714346d59d738743938990bcfd/si43.svg si43 si43.svg svg 8507 ALTIMG 1-s2.0-S0957417424018098-si44.svg https://s3-eu-west-1.amazonaws.com/prod-ucs-content-store-eu-west/content/pii:S0957417424018098/image/svg+xml/844d743f7c4e464a57bfd6e9204d22c1/si44.svg si44 si44.svg svg 8210 ALTIMG 1-s2.0-S0957417424018098-si45.svg https://s3-eu-west-1.amazonaws.com/prod-ucs-content-store-eu-west/content/pii:S0957417424018098/image/svg+xml/2954120c411d94313a9f270ce0b91712/si45.svg si45 si45.svg svg 8404 ALTIMG 1-s2.0-S0957417424018098-si46.svg https://s3-eu-west-1.amazonaws.com/prod-ucs-content-store-eu-west/content/pii:S0957417424018098/image/svg+xml/91993f35b79f3f119ec8d0626fe55663/si46.svg si46 si46.svg svg 3788 ALTIMG 1-s2.0-S0957417424018098-si48.svg https://s3-eu-west-1.amazonaws.com/prod-ucs-content-store-eu-west/content/pii:S0957417424018098/image/svg+xml/e8eadb7b34c05fce638a063a9667d455/si48.svg si48 si48.svg svg 12995 ALTIMG 1-s2.0-S0957417424018098-si49.svg https://s3-eu-west-1.amazonaws.com/prod-ucs-content-store-eu-west/content/pii:S0957417424018098/image/svg+xml/6f162516f5ebc5a52eabc96dfc96e832/si49.svg si49 si49.svg svg 1351 ALTIMG 1-s2.0-S0957417424018098-si5.svg https://s3-eu-west-1.amazonaws.com/prod-ucs-content-store-eu-west/content/pii:S0957417424018098/image/svg+xml/3e1bf7d92511bd883344eae20a12eb1d/si5.svg si5 si5.svg svg 18229 ALTIMG 1-s2.0-S0957417424018098-si50.svg https://s3-eu-west-1.amazonaws.com/prod-ucs-content-store-eu-west/content/pii:S0957417424018098/image/svg+xml/1c8231f1de501ae1136e7b3116ca039b/si50.svg si50 si50.svg svg 3361 ALTIMG 1-s2.0-S0957417424018098-si51.svg https://s3-eu-west-1.amazonaws.com/prod-ucs-content-store-eu-west/content/pii:S0957417424018098/image/svg+xml/71ff7cd6979e279e9449ec051f1e3084/si51.svg si51 si51.svg svg 22575 ALTIMG 1-s2.0-S0957417424018098-si52.svg https://s3-eu-west-1.amazonaws.com/prod-ucs-content-store-eu-west/content/pii:S0957417424018098/image/svg+xml/7070e5159a502e94dd6bf2e0ccc00813/si52.svg si52 si52.svg svg 2639 ALTIMG 1-s2.0-S0957417424018098-si53.svg https://s3-eu-west-1.amazonaws.com/prod-ucs-content-store-eu-west/content/pii:S0957417424018098/image/svg+xml/fe0193ca6e158de323bfac0cdc9d9556/si53.svg si53 si53.svg svg 3485 ALTIMG 1-s2.0-S0957417424018098-si54.svg https://s3-eu-west-1.amazonaws.com/prod-ucs-content-store-eu-west/content/pii:S0957417424018098/image/svg+xml/d9e94d23a63d36bcde67fdf7a558feb0/si54.svg si54 si54.svg svg 1352 ALTIMG 1-s2.0-S0957417424018098-si55.svg https://s3-eu-west-1.amazonaws.com/prod-ucs-content-store-eu-west/content/pii:S0957417424018098/image/svg+xml/cc8fe7a07ea81afcf34af498fa1fc02b/si55.svg si55 si55.svg svg 8673 ALTIMG 1-s2.0-S0957417424018098-si6.svg https://s3-eu-west-1.amazonaws.com/prod-ucs-content-store-eu-west/content/pii:S0957417424018098/image/svg+xml/2f542b204531a65a8f534dc9cb5642f1/si6.svg si6 si6.svg svg 20085 ALTIMG 1-s2.0-S0957417424018098-si7.svg https://s3-eu-west-1.amazonaws.com/prod-ucs-content-store-eu-west/content/pii:S0957417424018098/image/svg+xml/391119bb994bd02d58f0ed0724f91f14/si7.svg si7 si7.svg svg 19651 ALTIMG 1-s2.0-S0957417424018098-si8.svg https://s3-eu-west-1.amazonaws.com/prod-ucs-content-store-eu-west/content/pii:S0957417424018098/image/svg+xml/4657b70899a496db2abf7f44c2e074dd/si8.svg si8 si8.svg svg 2237 ALTIMG 1-s2.0-S0957417424018098-si9.svg https://s3-eu-west-1.amazonaws.com/prod-ucs-content-store-eu-west/content/pii:S0957417424018098/image/svg+xml/0f9e03b36a179710668ab65c48aeedf8/si9.svg si9 si9.svg svg 19537 ALTIMG ESWA 124942 124942 S0957-4174(24)01809-8 10.1016/j.eswa.2024.124942 Elsevier Ltd Fig. 1 General taxonomy of perception and planning in Autonomous driving (Johari & Swami, 2020). Fig. 2 Object Detection on a scene of traffic. Fig. 3 General Scenarios of Adverse Weather conditions in Autonomous Driving. Fig. 4 Proposed SD-YOLO-AWDNet model Architecture. Fig. 5 Architectural breakdown of GhostConv and GhostBottleneck modules. Fig. 6 Structure of Depthwise Separable Dilated Convolutions module. Fig. 7 An illustration of coordinated attention module. Fig. 8 Visual depiction of C3 Ghost module architecture with pointwise convolutions, depthwise convolutions, and linear bottleneck. Fig. 9 Visualizing the CA＋C3Ghost Module. Fig. 10 Sensitivity analysis for key hyperparameters for the proposed model. Fig. 11 Overview of the object detection process and results. Fig. 12 Loss comparison of YOLOv5s and SD-YOLO-AWDNet. Fig. 13 Precision comparison of YOLOv5s and SD-YOLO-AWDNet. Fig. 14 PR curve showing mAP values of YOLOv5s on BDD100k for all classes. Fig. 15 PR curve showing mAP values of SD-YOLO-AWDNet on BDD100k for all classes. Fig. 16 mAP values comparison of SD-YOLO-AWDNet with State-Of-Art-Models. Fig. 17 Proposed model\u2019s detection results for real world scenarios on different Indian locations. Table 1 Number of objects in train and test dataset in BDD100k. Traffic sign Traffic light Car Rider Motor Drivable area Lane Person Bus Truck Bike Train Training data 2,339,686 1,86,117 4,517 3,002 1,25,723 5,28,643 91,349 11,672 29,971 7,210 136 122 Validation data 34,908 26,885 1,02,506 649 452 17,981 75,730 13,272 1,597 4,245 1,007 15 Table 2 Number of images per weather. Clear Rainy Snowy Overcast Partly cloudy Foggy Unknown Training data 37,344 5,070 5,549 8,770 4,881 130 8,119 Validation data 5,346 738 769 1,239 738 13 1,157 Table 3 Number of images per scene. City street Highway Residential Parking lot Tunnel Gas stations Unknown Training data 43,516 17,379 8,074 377 129 27 361 Validation data 6,112 2,499 1,253 49 27 7 53 Table 4 Number of images per time of day. Daytime Dawn/Dusk Night Unknown Training data 36,728 5,027 27,971 137 Validation data 5,258 778 3,929 35 Table 5 System configuration. Total memory GPU CPU Cache size CUDA Version CudNN 32 GB Nvidia Tesla T4 (16 GB) Intel(R) Xeon(R) @ 2.30 GHz * 4 core 46080 KB 11.2 8.1.0.77-1 Table 6 Detection results of proposed SD-YOLO-AWDNet on different weather scenarios. Weather scenarios Original image SD-YOLO-AWDNet Detection Clear sky Foggy Night Partly cloudy Rainy Snowy Table 7 Results from ablation experiments with BDD100k dataset. Model mAP (%) Precision (%) Recall (%) Parameters FLOPs (G) YOLOv5s (Jocher et al., 2022) 57.8 82.12 77.0 7046599 16.0 YOLOv5-GN 57.3 82.14 69.51 3708815 8.3 YOLOv5-FDL 59.2 90.34 78.0 7046599 16.0 SD-YOLO-AWDNet 59.1 1.0 0.78 3708815 8.3 Table 8 mAP (%) comparison of YOLOv5s and SD-YOLO-AWDNet on different weather scenarios of BDD100k. Model Clear sky Foggy Night Partly cloudy Rainy Snowy YOLOv4 (Bochkovskiy, Wang, & Liao, 2020) 54.23 47.17 48.19 48.01 46.23 47.58 YOLOv5s (Jocher et al., 2022) 54.31 51.65 54.01 52.34 51.12 52.28 SD-YOLO\u2013AWDNet 62.80 56.97 58.23 59.81 54.32 53.89 Table 9 mAP comparison of YOLOv5s and SD-YOLO-AWDNet on different classes of BDD100k. Class YOLOv5s (Jocher et al., 2022) SD-YOLO-AWDNet Bike 0.550 0.550 Bus 0.635 0.642 Car 0.832 0.845 Motor 0.482 0.493 Person 0.687 0.671 Rider 0.478 0.479 Traffic light 0.708 0.768 Traffic sign 0.751 0.782 Train 0.000 0.021 Truck 0.660 0.662 mAP 0.578 0.591 Table 10 Comparative performance metrics analysis: mAP, FPS, GFLOPs, and parameters across state-of-the-art models on the BDD100k dataset. Model mAP@0.50 (%) mAp@0.75 (%) FPS FLOPs (G) Parameters FasterRCNN (Girshick, 2015) 29.32 14.81 27.06 231.43 42.4 million SSD Resnet (Liu et al., 2016) 34.31 18.23 54.93 95.86 25.6 million CenterNet (Duan et al., 2019) 41.92 28.45 42.15 63.08 21.3 million Yolov4 (Bochkovskiy et al., 2020) 50.23 31.46 40.46 128.73 64.4 million Yolov5s (Jocher et al., 2022) 57.80 37.53 56.95 16.0 7.5 million Yolov6 (Li, Li, et al., 2022) 55.89 42.23 142 27.7 19.6 million Yolov7 (Wang, Bochkovskiy & Liao, 2023) 56.8 29.0 161 104.3 37 million Yolov7s-tiny (Cheng et al., 2023) 51.1 41.7 278 5.8 6.2 million Yolov8s (Vats & Anastasiu, 2023) 58.1 45.9 87.1 28.6 11.2 million SD-YOLO-AWDNet 59.13 44.19 80.21 8.3 3.7 million Table 11 Comparison of performance metrics of Proposed model with State-of-art models on the CADC Dataset. Model mAP@ 0.50 (%) mAp@ 0.75 (%) FPS FLOPs (G) Parameters Faster RCNN (Girshick, 2015) 22.60 11.60 27.06 231.43 42.4 million SSD Resnet (Liu et al., 2016) 1.20 0.30 54.93 95.86 25.6 million CenterNet (Duan et al., 2019) 23.80 14.60 42.15 63.08 21.3 million Yolov5s (Jocher et al., 2022) 25.60 13.46 40.46 128.73 64.4 million Yolov6 (Li, Li, et al., 2022) 25.90 15.41 142 27.7 19.6 million Yolov7 (Wang, Bochkovskiy & Liao, 2023) 27.61 15.30 161 104.3 37 million Yolov7s-tiny (Cheng et al., 2023) 27.22 14.90 278 5.8 6.2 million Yolov8s (Vats & Anastasiu, 2023) 28.20 15.68 87.1 28.6 11.2 million SD-YOLO-AWDNet 28.80 15.60 80.21 8.3 3.7 million Table 12 Performance metrics comparison: Proposed model versus state-of-the-art models on KITTI dataset. Model mAP@ 0.50 (%) mAp@ 0.75 (%) FPS FLOPs (G) Parameters Faster RCNN (Girshick, 2015) 54.5 28.4 27.06 231.43 42.4 million SSD Resnet (Liu et al., 2016) 44.0 10.1 54.93 95.86 25.6 million CenterNet (Duan et al., 2019) 29.2 12.7 42.15 63.08 21.3 million Yolov5s (Jocher et al., 2022) 83.3 54.0 40.46 128.73 64.4 million Yolov6 (Li, Li, et al., 2022) 83.39 54.43 142 27.7 19.6 million Yolov7 (Wang, Bochkovskiy & Liao, 2023) 84.91 53.5 161 104.3 37 million Yolov7s-tiny (Cheng et al., 2023) 84.12 52.88 278 5.8 6.2 million Yolov8s (Vats & Anastasiu, 2023) 84.99 55.0 87.1 28.6 11.2 million SD-YOLO-AWDNet 86.0 55.1 80.21 8.3 3.7 million Table 13 Detection results comparison of different models in different weather scenarios with proposed SD-YOLO-AWDNet . Models Clear Sky Foggy Night CenterNet (Duan et al., 2019) Faster RCNN (Girshick, 2015) SSD Resnet (Liu et al., 2016) YOLOv5s (Jocher et al., 2022) YOLOv6 (Li, Li, et al., 2022) YOLOv7 (Wang, Bochkovskiy & Liao, 2023) YOLOv7-tiny (Cheng et al., 2023) YOLOv8s (Vats & Anastasiu, 2023) SD-YOLO-AWDNet Models Partly cloudy Rainy Snowy CenterNet (Duan et al., 2019) Faster RCNN (Girshick, 2015) SSD Resnet (Liu et al., 2016) YOLOv5s (Wang et al., 2022) YOLOv6 (Li, Li, et al., 2022) YOLOv7 (Wang, Bochkovskiy & Liao, 2023) YOLOv7-tiny (Cheng et al., 2023) YOLOv8s (Vats & Anastasiu, 2023) SD-YOLO-AWDNet SD-YOLO-AWDNet: A hybrid approach for smart object detection in challenging weather for self-driving cars Rashmi Software Formal analysis Resources Data curation Writing \u2013 original draft Visualization Investigation Software Validation Writing \u2013 review & editing Rashmi Chaudhry Conceptualization Methodology Supervision Project administration Funding acquisition Writing \u2013 review & editing \u204e Netaji Subhas University of Technology, New Delhi, India Netaji Subhas University of Technology New Delhi India organization=Netaji Subhas University of Technology, city=New Delhi, country=India \u204e Corresponding author. Several deep learning algorithms are currently focused on object detection in adverse weather scenarios for autonomous driving systems. However, these algorithms face challenges in real-time scenarios, leading to a reduction in detection accuracy. To tackle these issues, this paper introduces a lightweight object detection model named Self Driving Cars You Only Look Once Adverse Weather Detection Network (SD-YOLO-AWDNet), derived from enhancements to the YOLOv5 algorithm. The model incorporates four progressive improvement levels within the YOLOv5 framework. This includes integrating C3Ghost and GhostConv modules in the backbone to enhance detection speed by reducing computational overhead during feature extraction. To address potential accuracy issues arising from these modules, Depthwise-Separable Dilated Convolutions (DSDC) are introduced, striking a balance between accuracy and parameter reduction. The model further incorporates a Coordinate Attention (CA) module in the GhostBottleneck to enhance feature extraction and eliminate unnecessary features, improving precision in object detection. Additionally, a novel \u201cFocal Distribution Loss\u201d replaces CIoU Loss, accelerating bounding box regression and loss reduction. Test dataset experiments demonstrate that SD-YOLO-AWDNet outperforms YOLOv5 with a 54% decrease in FLOPs, a 52.53% decrease in model parameters, a 2.24% increase in mAP, and a threefold improvement in detection speed. Keywords Object detection Self driving cars Deep neural network YOLO 1 Introduction As per a technical report by the National Highway Traffic Safety Administration (NHTSA), nearly 94% of accidents on the road are attributed to human mistakes (Simhambhatla, Okiah, Kuchkula, & Slater, 2019). In addressing this issue, Self-Driving Systems (SDS) have been created to prevent accidents, alleviate driving-related stress, lower emissions, and offer accessible transportation for individuals with mobility impairments (Geiger, Lenz, & Urtasun, 2012). These systems are sophisticated and intelligent, handling a variety of responsibilities across different phases from perception to planning (Geiger et al., 2012; Wang, Wen, Wang, Huang, & Pei, 2019). Fig. 1 depicts the comprehensive classification of stages in self-driving cars. The perception phase involves identifying objects and motion in the environment, encompassing static object detection like roads, lane markings, construction signs, and obstructions, as well as dynamic object detection including vehicles and pedestrians. Furthermore, ego localization entails estimating our position, velocity, acceleration, orientation, and angular motion at any given time. The planning phase includes decisions related to the driver\u2019s tasks which can be classified as reactive rule-based planning and predictive planning. Reactive planning includes rules that take into account the current state of the ego vehicle and other objects to make decisions. Predictive planning is about other vehicles and how they are moving (Wang et al., 2019). This paper addresses a specific challenge within the domain of the Perception Phase of self-driving or autonomous vehicles, concentrating on the objective of detecting objects in challenging weather conditions. The Perception Phase involves various challenges, such as robust detection and segmentation, sensor uncertainty leading to potentially corrupted GPS measurements, noise in LiDAR/RADAR readings, occlusion, reflection, illumination, lens flare, and precipitation (Johari & Swami, 2020). The impact of weather conditions on detection accuracy is contingent upon the quality of input data from sensors. Input data plays a pivotal role in ensuring higher security levels for Self-Driving Systems and Self-driving vehicles (Hnewa & Radha, 2020). Consequently, contemporary self-driving vehicles leverage cameras, sensors, and deep learning approaches for object classification and detection (Hnewa & Radha, 2020). Fig. 2 illustrates the object detection scene of BDD100k datasets (Yu et al., 2020) for self-driving cars. Fig. 3 shows various adverse weather conditions and highlights the challenges. Weather conditions like heavy rain, snow or fog can reduce visibility, which makes it hard to detect objects\u2019 sizes and positions. This may lead to inaccuracy of the object detection system. Such weather conditions can also cause partial or complete object occlusion. Traditional object-detecting algorithms may struggle with these visibility and occlusion issues. Deep learning-based algorithms have been dominating the landscape, showcasing advancements in getting better at limitations with obscured objects and improving overall understanding of the scene. With the continuous evolution of Convolutions Neural Network (CNN) models, it has gotten more popular, as evidenced by recent developments (Hnewa & Radha, 2020). Object detection algorithms are generally classified into 2 categories one-stage or two-stage detectors. Over the past few decades, researchers have made significant improvements in both categories. One-stage detectors are very well suited for real-time applications because of their speed and streamlined architecture. These models can directly predict object locations and classes without the need for an explicit region proposal step (Tian, Shen, Chen & He, 2019). Alternatively, two-stage detectors prioritize precision, employing a sequential two-phase approach (Redmon, Divvala, Girshick, & Farhadi, 2016; Wang, Bochkovskiy & Liao, 2023). This involves initially generating region proposals, followed by meticulous refinement of object localization and classification (Li et al., 2017). Deciding between these two detection approaches relies on the specific needs of the application in question, necessitating a thoughtful evaluation to find an equilibrium between computational speed and detection accuracy. Adverse weather conditions, including fog, rain, haze, snow, mist, and thunderstorms, can notably reduce the quality of visual data collected by sensors, cameras, and LiDAR systems. This often leads to decreased visibility and image fidelity, consequently degrading the performance of object detection. In particular, the vehicle may encounter difficulties in identifying crucial objects within its surroundings. The different scenarios of adverse weather conditions are shown in Fig. 3. These can be classified into two categories namely dynamic (rain and snow) or steady (mist, fog, and haze) weather conditions. Dynamic weather conditions are more complex than visual effects. Various studies are focusing on various types of dynamic weather conditions independently. In addressing the challenges posed by both dynamic and steady weather conditions, the various studies are focusing on distinct types independently. Recognizing the complexities of adverse weather conditions, this paper proposes a novel model, SD-YOLO-AWDNet, which integrates ghost convolutions and an enhanced loss function into YOLOv5. This innovative approach aims to significantly improve detection performance, providing a robust solution for adverse weather scenarios. Key contributions of the paper are given as follows: 1. Novel SD-YOLO-AWDNet model is proposed based on YOLOv5 for adverse weather scenarios in self-driving cars. This model incorporates a novel loss function known as the \u201cFocal-Distribution Loss\u201d, which is designed to expedite the convergence rate of the model. 2. Moreover, Within the YOLOv5 backbone, traditional convolutional layers were replaced by lightweight C3Ghost and GhostConv modules, achieving model compression via cost-effective linear operations while maintaining detection speed and accuracy. 3. New Depthwise separable Dilated Convolutions (DSDC) with residual structures are introduced to improve feature extraction capabilities while maintaining computational costs. 4. The Coordinated Attention (CA) module was included to improve the extraction of relevant features while suppressing irrelevant ones. This augmentation aims to boost the accuracy of the algorithm\u2019s detection capabilities. 5. The performance is compared with various Tensorflow Object Detection (TFOD) models, including two-stage detectors (Faster RCNN, ResNet 101 Girshick, 2015), and one-stage detectors (SSD ResNet v1 FPN Liu et al., 2016, CenterNet (Duan et al., 2019), YOLOv5 (Jocher et al., 2022)), YOLOv6 (Li, Li, et al., 2022), YOLOv7 (Wang, Bochkovskiy & Liao, 2023), YOLOv7-tiny (Cheng et al., 2023), and YOLOv8 (Vats & Anastasiu, 2023). These models are trained on the BDD100k dataset (Yu et al., 2020), intentionally curated to encompass a wide array of corner cases, thereby comprehensively addressing adverse scenarios such as fog, snow, rain, sunshine, and low-light conditions. Additionally, selected images of above mentioned adverse scenarios from the BDD100k dataset (Yu et al., 2020) are examined independently. While primary analysis focuses on BDD100k dataset due to its extensive nature, additional validation is conducted on the CADC (Pitropov et al., 2021) and KITTI (Geiger, Lenz, Stiller, & Urtasun, 2013) datasets to ensure performance consistency across varied datasets. 2 Related work Over the past few years, there is been a noticeable increase in attention directed towards object detection tasks, especially within the domain of autonomous vehicles, which plays an increasingly prominent role in advancing autonomous driving technology (Paz, Zhang, Li, Xiang, & Christensen, 2020). Consequently, object detection techniques under severe weather conditions have arisen as a pivotal and substantial area of exploration in research (Cai et al., 2021). Deep learning uses deep neural networks for object detection. However, the input of these networks may be affected by different adverse weather conditions including too sunny, snow, heavy rain, and haze, etc which leads to wrong predictions or classification of objects on the road (Ouyang et al., 2015). However, various studies have worked on this problem to provide proper assessment. Some study focuses on the usage of both camera and radar information fusion sensing methods instead of using a single radar sensor in adverse weather conditions (Liu et al., 2021). Some are working on CARLA simulator for depth estimation along with 2d object detection (Tabata, Zimmer, dos Santos Coelho, & Mariani, 2023). Some researchers concentrate their efforts solely on data sets affected by snowfall, employing 2D object detection methods and addressing issues related to missing data points caused by snow (Michaelis et al., 2019). Others adopt an Image adaptation approach, which adaptively enhances images to improve detection capabilities, as demonstrated in Liu et al. (2022). Most studies in this domain tend to isolate specific adverse weather parameters such as snow or fog and often employ specialized datasets like VOC foggy (Sakaridis, Dai, & Van Gool, 2018) and RTTS (Wang et al., 2022). While some concentrate on de-raining images for rainy weather conditions (Jiang, Zhu, Zhao, & Deng, 2023). One conventional approach involves pre-processing the images using classical Dehazing or image enhancement techniques, as discussed in Liu, Ma, Shi, and Chen (2019). These methods were initially developed to alleviate foggy conditions and enhance overall image quality. Nevertheless, it is important to note that improving image quality may not always guarantee a corresponding enhancement in detection performance. Alternatively, some researchers are exploring innovative approaches, such as Sigma: Semantic-complete graph matching, to address challenges in object detection domain adaptation, as outlined in Li, Liu, and Yuan (2022). Researchers also covered 3D object detection (Rezaei, Azarmi, & Mir, 2023) but are focusing on traffic monitoring rather than adverse weather scenarios. Some Case studies also work with 6d pose estimation but are yet to be implemented in adverse weather scenarios (Hoque, Xu, Maiti, Wei, & Arafat, 2023). While the majority of the research has concentrated on general object detection (Wang, Xu, et al., 2023), there has been relatively limited exploration into object detection under adverse weather conditions. One prevalent and uncomplicated strategy involves domain-adaptive object detection designed specifically for autonomous vehicles in misty conditions environments, with a significant focus on improving detection capabilities in foggy settings, as outlined in Li et al. (2023). Numerous prior methodologies (Zhang et al., 2021) have utilized combined image amplification and detection techniques to alleviate the influence of adverse weather information, specifically. In another study, an unsupervised domain adversarial object detection framework based on prior knowledge for object detection in rainy and hazy conditions was introduced by Sindagi, Oza, Yasarla, and Patel (2020). Another set of methods, as demonstrated in Hnewa and Radha (2021), tackle this issue through domain adaptation, Assuming a domain shift between images taken under regular and adverse weather conditions. They developed a multi-scale domain adaptive YOLO model that facilitates the adaptation of domains at various layers during the process of extracting features. Certain approaches in the field of computer vision for autonomous driving concentrate on specialized object detection tasks, exemplified by Tian, Gelernter, Wang, Li and Yu (2019), such as precise identification of traffic lights and signs. Some approaches emphasize object feedback and feature retention to enhance small object detection efficacy (Tian, Han, & Wang, 2024). In another study, the focus is on detecting small objects, particularly addressing multiscale defects, within complex background interference scenarios, aiming to improve object detection precision in challenging environments (Zhang, Zhang, Huang, Han, & Zhao, 2024). Domains like traffic monitoring and smart parking pose challenges for real-time vehicle detection and classification, including the identification of small-sized objects and variations in UAV altitude and angles. Hamzenejadi and Mohseni (2023) specifically addresses vehicle detection, emphasizing small-sized objects in these scenarios. Another study explores strategies to reduce computational burden while maintaining accuracy, though it does not cater specifically to self-driving car scenarios (Wang, Li, Liu, & Meng, 2024). Notably, none of these studies have focused on adverse weather conditions affecting self-driving cars. While many studies tend to narrow their focus on specific weather parameters like snow or fog, often utilizing datasets such as VOC foggy (Sakaridis et al., 2018) and RTTS (Sindagi et al., 2020), this paper adopts a broader perspective. Lightweight networks primarily adopt two key strategies. The first involves pruning the target model network structure, for instance, YOLOv3-tiny (Adarsh, Rathi, & Kumar, 2020) and YOLOv4-tiny (Wang, Bochkovskiy, & Liao, 2021) tailored for YOLOv3 and YOLOv4, respectively. The second method involves adapting network architecture by adjusting depth or width scaling factors, as seen in EfficientDet by Tan, Pang, and Le (2020) and Ge, Liu, Wang, Li, and Sun (2021), offering variants like YOLOX-nano and YOLOX-tiny. Mahaur, Mishra, and Kumar (2023) introduced a model improving the detection performance of small-scale objects through network pruning, reducing computational costs. Another study focused on small object detection by adding a detection layer for finer feature maps in the neck network pyramid and integrating the C3CrossConv module into the backbone network (Gao, Ji, Yu, & Yuan, 2024). A lightweight object detection model, YOLOv8-Lite, based on the YOLOv8 framework and enhanced with the FastDet structure, TFPN pyramid, and CBAM attention mechanism, was proposed (Yang & Fan, 2024). Enhancements in YOLOv5 include the convolutional block attention mechanism for channel and spatial feature attention, the slimming pruning algorithm for improved efficiency, and knowledge distillation for accuracy compensation during fine-tuning (Li, Zhuang, Bao, Chen, & Yang, 2024). For instance, Point-GNN is designed to predict the category and shape of the object each vertex belongs to, with an auto-registration mechanism to reduce translation variance and a box merging and scoring operation for accurate detections (Shi & Rajkumar, 2020). A GNN-based feature extraction of point cloud maps was constructed to increase the receptive fields of learning map features, based on PVRCNN (Liao, Wang, & Lin, 2023). However, these studies focus on normal scenarios, not adverse weather conditions. While these models are integrated into autonomous driving systems, their improved performance on less powerful hardware often compromises detection accuracy (Chen, Ding, Zou, Chen, & Li, 2020). Conversely, larger models offer better accuracy but require extensive computation. Recent studies employ dilated and depth-wise separable convolutions to mitigate accuracy loss in lightweight models (Sun, Zhang, & He, 2020). Additionally, coordinate attention mechanisms have been investigated for detecting small objects (Xuan et al., 2022). However, challenges remain in adapting these techniques for practical development, such as in autonomous driving systems. This paper addresses such challenges by proposing a lighter model structure with fewer parameters, ensuring better precision efficiency. Here, the research centers around various TensorFlow-based object detection models, comparing their performance across a cross-weather hybrid dataset of BDD100k (Yu et al., 2020) to handle diverse weather scenarios. It covers a range of adverse weather conditions, including cloudiness, rainfall, snowfall, bright sunshine, sandy environments, and sunrise conditions. Validation testing is done on popular datasets of CADC (Pitropov et al., 2021) and KITTI (Geiger et al., 2013) as well. 3 Model introduction and improvement In this section, multiple enhancements are suggested for the traditional YOLOv5 model, i.e, Light-weighted model structure substituting the Conv ＋ BatchNorm ＋ SiLU (CBS) and Cross Stage partial (CSP) modules with GhostConv and C3Ghost modules, incorporating the Coordinate Attention (CA) mechanism (Hou, Zhou, & Feng, 2021), adding Depthwise Separable Dilated Convolutions (DSDCs), and swapping out the Complete Intersection over Union (CIoU) loss with \u201cFocal-Distribution Loss\u201d in the loss function. The resulting model, depicted in Fig. 4, is denoted as SD-YOLO-AWDNet. The subsequent sections elaborate on each component of the network and their contribution towards the performance achieved. 3.1 YOLOv5 model introduction The YOLOv5 variants, labelled n, s, m, l, and x, exhibit distinct network depth and width attributes, functioning as a one-stage target detection algorithm. The YOLOv5 model comprises four essential components: input, backbone network, neck, and the detection head. YOLOv5n boasts the least number of parameters and the quickest detection speed among these models. Nevertheless, its detection accuracy is comparatively lower when performance features are considered. While, YOLOv5x employs the largest parameter count and scans at a slower pace, despite achieving the highest detection accuracy. While the architecture remains consistent across all these models, variations in network depths and feature map widths enable scalable adjustments to the network model. YOLOv5s are more suited for object detection in autonomous vehicles based on the distinctive attributes of these versions. This research paper proposes an object detection technique for self-driving cars that balances network speed with detection precision by improving YOLOv5s. The CBS module, Concentrated-Comprehensive Convolut (C3) module, and Spatial Pyramid Pooling F (SPPF) module make up the backbone network for YOLOv5s. CBS module combines three tasks: batch normalization, activation, and convolution (Conv2d), while the auto pad technique is utilized to create the full effect. Leaky ReLU is replaced with Swish (or SiLU) (Ramachandran, Zoph, & Le, 2017) as the activation function. By adapting CSPNet\u2019s (Han et al., 2020) concepts to the DarkNet53 backbone network, YOLOv5 extends and incorporates these principles. The YOLOv5s Neck incorporates concepts from the Path Aggregation Network (PANet) and Feature Pyramid Network (FPN) (Liu, Qi, Qin, Shi, & Jia, 2018). The positional information from shallow layers is incapable of influencing features at deeper levels. As a solution, PANet introduces a bottom-up channel a top FPN to transmit semantic information from deep to shallow layers. In this manner, the deep layer can also receive position data from the bottom layer, improving multi-scale localization capacity. These two structures, together, improve the neck network\u2019s ability to fuse features. In YOLOv5s, the Head multiplies the number of channels by a 1 × 1 convolution for each of the various scales of feature maps obtained in the Neck. Additionally, the number of anchors on each detection layer is determined by (number of categories ＋ 5), where 5 represents the width, height, and confidence of the centroid of the prediction frame, with confidence indicating the frame\u2019s confidence. Each feature map incorporates three pre-defined anchors with distinct aspect ratios for prediction. YOLOv5 partitions the grid based on the pixel sizes of the three different feature map scales. As a result, the channel dimension encapsulates all location and classification data associated with the anchor from the preceding frame within the feature map\u2019s channel dimension. In YOLOv5\u2019s backbone, the CBS and CSP modules efficiently extract image features but contribute to a high number of model parameters, resulting in increased computational demands. To address this, the enhanced backbone incorporates GhostConv and C3Ghost modules, effectively reducing model parameters and computational complexity. 3.2 Model structure improvement 3.2.1 Lightweighted model structure To minimize model parameters, reduce model costs, and enhance overall accuracy, the design of SD-YOLO-AWDNet is introduced. The subsequent section outlines four components of architectural enhancements in SD-YOLO-AWDNet. SD-YOLO-AWDNet demonstrates promising strategies for reducing model size while potentially maintaining or improving accuracy. Fig. 4 visually represents the improved SD-YOLO-AWDNet architecture. The diagram showcases the integration of GhostConv, C3Ghost, and CA modules, emphasizing the structural changes made to the backbone. The visual representation aids in understanding the architectural modifications made for a more efficient and accurate YOLOv5s model. In YOLOv5\u2019s backbone, the CBS and CSP modules efficiently extract image features but contribute to a high number of model parameters, resulting in increased computational demands. Addressing this, the upgraded backbone replaces CBS and CSP with GhostConv and C3Ghost modules, effectively decreasing model parameters and lowering computational complexity. Prioritizing the CA module over the C3Ghost module enhances accuracy by suppressing unnecessary data and emphasizing crucial information, minimizing model accuracy loss. In the neck network\u2019s feature fusion process, fewer model parameters impact the speed at which features combine. To address this, the Depthwise Separable Dilated Convolutions (DSDCs) in the neck network combine dilated and depthwise convolutions for a larger receptive field without sacrificing accuracy. Dilated convolutions expand the receptive field without additional parameters, and DSDC further reduces parameters by factorizing the convolution operation. While dilated convolutions can be computationally expensive and DWConv less accurate, the DSDC module combines their advantages, mitigating their drawbacks. The DSDC module (Zhang & Xian, 2021), a technique replacing the CBS module, considers feature fusion characteristics. Unlike conventional convolution, each DSDC module convolution core handles a single channel and acts simultaneously on every channel in a two-dimensional plane, reducing the computational burden. This design, featuring as many convolution cores as channels in the preceding layer (Liu, Hu, Chen, Guo, & Ni, 2023), retrieves local detailed features with fewer parameters. To strike a balance between multi-scale target detection and accuracy loss, the paper proposes a redesigned structure that combines dilated convolution and DWConv in the shallow feature extractor of the Backbone. This structure overcomes the computational cost increase of dilated convolutions without suffering from the grid effect. It extracts more target features, compensating for the accuracy loss incurred during the process of shrinking and enlarging feature maps. After each DSDC convolution, the CA＋C3Ghost module minimizes parameters and boosts model accuracy. In the context of adverse weather scenarios for self-driving cars, the YOLOv5 model incorporating GhostConv and DSDC demonstrates proficiency. The SD-YOLO-AWDNet model presents benefits in self-driving cars under adverse weather conditions, encompassing reduced parameters, increased efficiency, enhanced accuracy in challenging situations, and the capability to identify objects of varying scales. The subsequent subsections illustrate all four levels of enhancements, encompassing GhostConv and C3Ghost, Depth-wise Separable Dilated Convolutions and Residual, CA＋C3Ghost, and the Focal-Distribution Loss function. 3.2.2 GhostConv and C3Ghost The GhostConv module and the C3Ghost module, as introduced by Ghost-net (Han et al., 2020), were suggested to significantly decrease the parameter count in YOLOv5s. The GhostConv module employs distributed feature map extraction to eliminate redundancy. It employs cheaper linear operations to produce a subset of feature maps and the rest are produced by using Conv modules. The Ghost-Conv module comprises three distinct stages, namely Convolution, ghost creation, and feature map stitching. In the initial stage, output feature maps are produced by employing a reduced number of convolution kernels. Specifically, the parameter \u201cp\u201d is replaced with a reduced value denoted as \u201cq.\u201d Subsequently, the second phase involves the application of a computationally cheap operation to each feature map generated in the initial step. This results in the creation of a total of q × r new feature maps, with \u201cr\u201d serving as a factor to ensure that q × r equals the original parameter \u201cp.\u201d This verification ensures the congruence of the feature shapes output by the Ghost module and regular convolution. The final stage encompasses the combining of these newly generated feature maps, culminating in the completion of the three-stage process of the Ghost-Conv module. Notably, the values of \u201cp,\u201d \u201cq,\u201d and \u201cr\u201d are integral to the methodology, with \u201cp\u201d representing the original parameter, \u201cq\u201d denoting the reduced value, and \u201cr\u201d ensuring the appropriate relationship between the two for consistency in feature shapes. Figs. 5(a) and 5(b) depicts the GhostConv module\u2019s operating principle. GhostConv eliminates duplicity through distributed feature map extraction. If each original feature corresponds to \u201cRF\u201d redundant features, GhostConv only needs to generate N/RF base features. It employs linear transforms to expand the original features and create similar ones. GhostConv\u2019s objective is to minimize redundancy in feature maps within conventional convolutions. This involves generating a smaller set of intrinsic features and strategically expanding them, resulting in parameter reduction. The approach includes generating fewer initial feature maps and using cost-effective expansion operations. The Eqs. (1)\u2013(6) describe the number of FLOPs for both Conventional Convolution and Ghost Convolution, along with FLOPs reduction (Rate_S) and the Parameter compression (Rate_C) of the GhostConv modules. (1) C _ C o n v _ F l o p s = N × H × W × C × K × K where, C_Conv_Flops represents flops for conventional convolution, N represents the number of feature maps produced by the convolution layer, H represents the height of the Output layer, W represents the width of the Output layer, C represents the number of Input channels, and K × K represents the size of the convolution kernel and the Flops measure the cost of the convolution layer. (2) G h o s t C o n v _ F l o p s = F l o p s _ i n t r i n s i c + F l o p s _ g h o s t where, (3) F l o p s _ i n t r i n s i c = N R F ∗ H × W × C × k × k where, RF represents the Redundancy factor represents the number of redundant factors. (4) F l o p s _ g h o s t = N R F × H × W × C × d × d × ( R F − 1 ) where, d × d represents the size of the kernel used for the cheap operations (usually 1 × 1). FLOPs reduction (Rate_S) measures how much GhostConv reduces computational cost compared to conventional convolution. As shown in Eq. (5) GhostConv achieves an RF times reduction in FLOPs, making it computationally more efficient. (5) R a t e _ S = G h o s t C o n v _ F l o p s F l o p s _ g h o s t = R F Parameter compression (Rate_C) measures how much GhostConv compresses model parameters compared to conventional convolution. As shown in Eq. (6) GhostConv also reduces the number of parameters by a factor of RF, leading to a smaller memory footprint. (6) R a t e _ C = R a t e _ S = R F The reduction in Flops and parameter compression in GhostConv is directly proportional to the redundancy factor (RF). Hence, the choice of RF is pivotal in achieving a balance between efficiency and accuracy, as RF controls the compression degree. The FLOPs reduction (Rate_S) and the parameter compression rate (Rate_C) are associated with RF, necessitating a trade-off between efficiency and accuracy. GhostConv is particularly beneficial for memory-constrained devices or tasks prioritizing model size. 3.2.3 Depth-wise separable dilated convolutions and residual The integration of depth-wise separable convolutions (Chollet, 2017), dilated convolutions (Yu & Koltun, 2015), and residual connections (Wei, Yuan, Shen, & Zhang, 2017) enhances computational efficiency, improves the capacity to capture large-scale spatial relationships, and facilitates smoother information flow, addressing challenges such as vanishing gradients in deeper learning. Depth-wise separable dilated convolutions (DSDCs) capitalize on the advantages of depth-wise separable convolutions, dilated convolutions, and residual connections, resulting in the creation of an efficient network. In YOLOv5\u2019s approach to object detection, a trade-off is employed, necessitating down-sampling through convolution operations to compress the feature map and enhance the receptive field. This is followed by up-sampling to restore the image size for recognizing targets of diverse scales. However, this can lead to information loss, potentially hindering the detection of certain targets. So, DSDCs offer a potential solution by combining point-wise convolution, dilation, and depth-wise convolution: \u2022 Depth-wise convolution: Separate filters process individual input channels independently, reducing computations. \u2022 Dilation: Gaps in the filters expand the receptive field, capturing long-range dependencies without losing spatial resolution. \u2022 Point-wise convolution: 1 × 1 filters merge features and manage output channels, maintaining sensitivity to targets of different sizes. This approach balances efficiency, receptive field size, and multi-scale feature detection for object detection tasks. The comprehensive architecture of depth-wise separable convolutions is illustrated in Fig. 6. The input goes through a series of depth-wise separable convolutional layers. Each layer includes two stages: \u2022 Depth-wise convolution: This stage uses multiple filters, each with the same size as a single channel in the input. These filters convolve with each input channel independently, extracting spatial features specific to each channel. This reduces the number of computations compared to standard convolution. \u2022 Point-wise convolution ( 1 × 1 × N ): This stage uses a single 1 × 1 filter for each output channel. This filter combines the extracted features from the depth-wise convolution stage and controls the number of output channels. Depth-wise separable convolution layers use dilation. This means that the filters \u201chop\u201d over pixels instead of sliding smoothly across them. This increases the receptive field (area covered) of the filters without making them larger, enabling the network to grasp long-range dependencies in the input. Residual Connections (Wei et al., 2017) are the skip connections that are added between some of the layers in the network. These connections bypass some layers and directly add their output to the output of later layers. This helps alleviate the vanishing gradient problem and improves information flow for multi-scale target detection, allowing the network to learn deeper representations. 3.2.4 CA＋C3Ghost module The Coordinated Attention (CA) module (Hou et al., 2021) enhances attention focus by incorporating positional information. By utilizing two pooling layers, it aggregates information in two distinct spatial orientations and segregates them into one-dimensional features. Recording location data in one spatial direction and monitoring remote dependencies in the opposite direction, the module encodes direction-aware and location-aware attention maps. Utilizing the resultant feature maps for the input amplifies the extraction of meaningful features. As depicted in Fig. 7, the CA module dynamically adjusts attention across spatial dimensions, enabling the model to efficiently concentrate on pertinent regions and enhance feature representation. The C3Ghost module, aimed at replacing CBS and CSP in YOLOv5, efficiently extracts features while reducing model parameters for enhanced computational efficiency. Illustrated in Fig. 8, the module incorporates GhostConv layers, collaboratively capturing and processing crucial features from input data. Highlighting the module\u2019s design and internal connections, the C3Ghost module efficiently uses parameters. It ensures effective feature extraction while minimizing parameters to optimize resource usage and enhance task performance. To further improve attention focus on positional information, the CA＋C3Ghost module reduces the number of parameters while preserving accuracy. This design aims to emphasize task-relevant features, suppress unnecessary ones, and enhance the efficiency and accuracy of processing image feature information. Fig. 9 demonstrates the seamless integration of the CA module into the existing C3Ghost structure, showcasing the collaborative functionality of both components. The CA block captures low-level features from the input image through stacked convolutional layers. The C3Ghost block combines regular convolution for primary feature extraction, \u201cGhost channels\u201d to cut down computation while preserving accuracy, and extra convolutions for fine-tuning. Finally, it outputs concatenated features from both blocks for a more comprehensive representation. Overall, CA＋C3Ghost efficiently extracts multi-level features from inputs. The C3Ghost module emphasizes parameter efficiency, and the CA＋C3Ghost module extends this efficiency by integrating spatial attention mechanisms through the CA module. 3.3 SD-YOLO-AWDNet with focal-distribution loss Within the object detection domain, bounding box regression serves as a pivotal component in determining the accuracy of object localization. YOLOv5 object detection model employs Complete Intersection over Union (CIoU) Loss as the designated function for regression of bounding boxes. CIoU, which is an extension of Distance-intersection over Union (DIoU), induces an increase in loss in proportion to the dimensions of the predicted box. Precisely, it intensifies the penalty linked to the length-width ratio value between the predicted and the ground-truth box as shown in Eq. (7), and Eq. (8): (7) 1 − I o U + ρ 2 ( b , b g t ) c 2 + V ( 1 − I o U ) + V V (8) V = 4 π 2 a r c t a n g e n t w g t h g t − a r c t a n g e n t w h 2 \u2018b\u2019 and \u2018bgt\u2019 signify the centre for the predicated and the actual box, respectively. Meanwhile, \u2018 ρ \u2019 refers to the Euclidean distance b/w the centre for the ground truth and the predicted box. \u2018c\u2019 represents the diagonal length of the minimum bounding rectangle that encloses both the predicted and ground truth bounding boxes. The height and width for the ground truth bounding box are represented by variables \u2018hgt\u2019 and \u2018wgt\u2019, while \u2018h\u2019 and \u2018w\u2019 represent the height and width for the predicted bounding box predicted. \u2018Arctangent\u2019 is an Inverse tangent function, returning the angle whose tangent is a given value. Applying the arctangent function to the calculated aspect ratio results in an angle between −90 and 90 degrees, representing the \u201cskewness\u201d of the box. The CIoU evaluates the similarity between predicted and ground-truth bounding boxes, considering their aspect ratios. It mandates independent adjustments to the height and width of the predicted box to preserve a balance between challenging and straightforward samples. However, the CIoU lacks consideration for maintaining a balance between difficult and easy samples when resizing the boxes. Efficient-Intersection over Union (EIoU), a metric proposed in Zhang et al. (2022), extends upon the CIoU metric by incorporating a separate measure of the length-to-width ratio. EIoU considers three specified geometric factors (overlapping area, centre point, and side lengths) when assessing the similarity between ground truth and predicted bounding boxes. This enables a more comprehensive and accurate measurement of the disparity between the ground truth and predicted boxes. There can be issues while using imbalanced training data, like when dealing with samples that are inherently more difficult to classify than others. The Focal Loss function was proposed as a solution for addressing this issue. By modifying the standard cross-entropy loss function, Focal Loss assigns a higher weight to misclassified samples that are more difficult to classify, thus giving more attention to those samples during training. This approach has demonstrated enhanced performance in models addressing imbalanced classification tasks. Eqs. (9) and (10) provide the calculation method for the above technique: (9) L E I o U = 1 − I o U + ρ 2 ( b , b g t ) c 2 + ρ 2 ( w , w g t ) c w 2 + ρ 2 ( h , h g t ) c h 2 (10) L F o c a l E I o U = I o U γ L E I o U The proposed focal-distribution loss function inherits the advantages of FocalEIoU loss while intensifying loss for high Intersection over Union (IoU) targets, ensuring more precise localization. Additionally, it improves gradient-adaptive weighted regression for bounding boxes, leading to more accurate object detection. This addresses accuracy degradation caused by occlusion and perspective distortion issues, even in diverse weather conditions. The calculation method for it is given in Eq. (11): (11) L F o c a l − D i s t r i b u t i o n L o s s = I o U γ ( α ( 1 − I o U ) β ( 1 − I o U ) δ ) + max ( 0 , R ( b ) + R ( w ) + R ( h ) ) (12) R ( b ) = ρ 2 α ( b , b g t ) c 2 (13) R ( w ) = ρ 2 β ( w , w g t ) c w 2 (14) R ( h ) = ρ 2 β ( h , h g t ) c h 2 The Focal-Distribution Loss function is structured to address challenges such as imbalanced class distributions by introducing a focal term and a regularization term. The term ( α ( 1 − I o U ) β ( 1 − I o U ) δ ) introduces a focal term that dynamically adjusts the loss based on the IoU. The regularization term max(0, R(b) ＋ R(w) ＋ R(h)) penalizes bounding box regression errors, where, R(b), R(w), and R(h) are regularization terms. The Bounding Box Regularization R(b), Width Regularization R(w) and Height Regularization R(h) are shown in Eqs. (12), (13), and (14). Other terms are described as: I o U represents the actual IoU score between the predicted and actual bounding boxes. γ represents a hyperparameter regulating the significance of the IoU term. ρ represents a function computing the Euclidean distance between two points. α , β represent hyperparameters that control the importance of width, height, and the centre point terms. c , c w , c h represent hyperparameters that govern the impact of the centre point, width, and height terms. This paper conducted multiple experiments on the BDD100K dataset to fine-tune our model and subsequently opted for the following hyperparameter values: α = 2.0, β = 0.25 and γ = 2.0. 4 Results In this section, the dataset, training environment, and performance metrics are described. Following that, multiple experiments are conducted to demonstrate the superior performance of the proposed SD-YOLO-AWDNet model. 4.1 Dataset and computational details This paper utilizes the BDD100K dataset (Yu et al., 2020), which encompasses diverse scenarios such as highways, residential areas, and city streets. The dataset consists of videos recorded at different periods during the day and under varying weather conditions, distributed across training (70K), validation (10K), and testing (20K) sets. Notably, the dataset features scenes from around the world, with a balanced representation of day and night footage. This diversity facilitates domain transfer, enabling successful generalization of object detection models to new test sets. The dataset includes detailed distributions of images categorized by scene, time of day, and weather, as depicted in the Tables 1\u20134. To focus more on out-of-distribution scenarios, the BDD100k dataset has been divided into 6 different categories that handle the corner cases covering adverse scenarios of clear, overcast, foggy, partly cloudy, rainy, and snowy. BDD100k includes bounding box annotations for 10 detection categories in the reference frames. For validation purposes, the proposed model is also evaluated on datasets of CADC (Pitropov et al., 2021) and KITTI (Geiger et al., 2013). The sample images from Indian road traffic are also used for performance validation, collected across different places and weather scenarios. Table 5 presents the system configuration of the computing setup, showcasing key components. The system comprises 32 GB of total memory, an Nvidia Tesla T4 GPU with 16 GB memory, and an Intel(R) Xeon(R) CPU operating with 4 cores at 2.30 GHz. Additionally, the details on the cache size (46080 KB), CUDA (11.2), and CudNN (8.1.0.77-1) versions are also provided in the table offering a comprehensive overview of the hardware and software specifications. Default hyper-parameters values for YOLOv5 model is slower to converge. So, this paper performs a sensitive analysis for the additional hyper-parameters (Ghost module ratio, kernel sizes, and attention mechanism parameters, added by the Ghost Network in the proposed model. Fig. 10 represents the output of sensitivity analysis. The x -axis represents impact values corresponding to each hyper-parameter and the y -axis measures the performance of the model using the mean Average Precision (mAP) metric. Based on the sensitivity analysis, the impact values for hyperparameters are deduced. 4.2 Evaluation metrics The model\u2019s performance is assessed using various technical metrics, including Precision, Recall, mean Average Precision (mAP), Frames Per Second (FPS), the number of parameters, Floating Point Operations per Second (FLOPs), and loss function curves. All these metrics are utilized for quantitatively assessing the efficacy and efficiency of the examined model. All the metrics are outlined in the following sections. The Precision (P) metric in classification estimates the accuracy of positive predictions, representing the proportion of correctly predicted positive instances among all instances predicted as positive. It is computed as the ratio of true positives to the sum of true positives and false positives, as illustrated in the Eq. (15): (15) P = T P v a l u e s T P v a l u e s + F P v a l u e s Recall (R) quantifies the ratio of correctly anticipated positive cases among all positive instances, as given in Eq. (16): (16) R = T P v a l u e s T P v a l u e s + F N v a l u e s In Eqs. (15) and (16), F P v a l u e s indicate the number of detections found solely in the results, not in the ground truth. T P v a l u e s denote the number of detections present in both the ground truth and the results. F N v a l u e s represent the number of detections existing in the ground truth only, absent in the results. Recall and Precision are two commonly used performance metrics in machine learning that are often in conflict with each other. To address this, the m A P is introduced, which combines both Precision and Recall to provide an overall score across all classes that reflects the algorithm performance. It calculates the average precision across various recall levels, providing a comprehensive evaluation of a model\u2019s ability to precisely identify objects within a given context. The algorithm\u2019s performance improves with a higher m A P score. It is calculated as shown in Eq. (17): (17) mAP = 1 N ∑ i = 1 N AP i Here: N represents the total count of classes or categories and A P i represents the Average Precision for the class. For a specific class, the Average Precision is given in Eq. (18) and calculated as: (18) AP i = 1 R i ∑ k = 1 R i P ( k ) ⋅ precAtK ( k ) where: R i is the overall count of relevant instances in class. P ( k ) is the precision for k th retrieved instance. p r e c A t K ( k ) is an indicator function that equals 1 if the k th retrieved instance is relevant, and 0 otherwise. Frames Per Second is a measure of a system\u2019s or model\u2019s processing speed. It represents the number of image frames processed or generated per second, reflecting the system\u2019s real-time processing capability. The number of Parameters refers to the biases and weights in the model. It reflects the model complexity and its ability to learn from the training data, with a higher number of parameters often indicating increased model complexity. Floating-point operations per second (FLOPs) is a metric that quantifies the computational complexity of a model, representing performed floating-point operations per second. It is a crucial measure for understanding the computational efficiency and performance of a model, especially in resource-constrained environments. 4.3 Experimental graphs and detection results on BDD100k dataset In this section, the detection results are listed for the proposed SD-YOLO-AWDNet. Later, the performance of the proposed SD-YOLO-AWDNet is presented in contrast to YOLOv5s using various performance metrics. Finally, the performance of SD-YOLO-AWDNet is compared with other state-of-the-art models. 4.3.1 Proposed SD-YOLO-AWDNet detection results In this section, results for intermediate steps and the model\u2019s output are analysed. Fig. 11 provides an overview of the object detection process and results. Fig. 11(a) illustrates an intermediate training state of the input image using the SD-YOLO-AWDNet model, converting the original image into pixels. Through graph networks, feature detection utilizes filters to activate multiple neurons, highlighting pattern recognition within the input image, which is further refined for object identification and classification. Explainable AI techniques are employed to enhance interoperability across different model components and detection layers. Fig. 11(b) depicts heat maps generated by the proposed model post-integration with the CA mechanism, aimed at clarifying the architecture\u2019s operational coherence. The detection outcomes of SD-YOLO-AWDNet are presented in the subsequent Table 6 concerning six different scenarios i.e. clear sky, foggy, night, partly cloudy, rainy and snowy. Detection output showcases bounding boxes for various classes with confidence scores attached to them. 4.3.2 Proposed SD-YOLO-AWDNet vs YOLOv5s A comparison of the performance of the proposed algorithm with the base model YOLOv5s is discussed in this subsection. 4.3.2.1 Ablation experiment In this section, the ablation experiment results are explained for the proposed SD-YOLO-AWDNet with YOLOv5, YOLOv5-GN and YOLOv5-FDL. For YOLOv5-GN, ghost conv, c3 ghost modules and DSDCs are added in the backbone to make the model lightweight and enhance feature extraction by incorporating the DSDC and CA module in the GhostBottleneck. For YOLOv5-FDL, a novel loss function named Focal Distribution Loss is employed. Subsequent subsections will include mAP, loss and precision comparison curves for comparative analysis with the proposed model. \u2022 mAP Comparison The ablation experiments were performed on four different models, including YOLOv5, YOLOv5-GN, YOLOv5-FDL and SD-YOLO-AWDNet, to confirm the efficiency of the proposed model. As shown in Table 7, the number of parameters and FPS are reduced to half in comparison to YOLOv5. A slight decrease in mAP is observed from 57.8 in YOLOv5 to 57.3 in YOLOv5-GN. For YOLOv5-FDL, an increase in the mAP value from 57.8 (in YOLOv5) to 59.2 is observed with the same parameters and FPS. Both YOLOv5-GN and YOLOv5-FDL are combined in SD-YOLO-AWDNet to provide a light-weight model with fewer parameters (half of YOLOv5) and better mAP values (59.1) providing an enhancement of 2.24% as per the ablation experiments. \u2022 Loss Comparison Curve Loss function curves illustrate the variation of the model\u2019s loss over training epochs. The loss function measures the disparity between the predicted and actual values, and the curve offers insights into the model\u2019s learning process. Monitoring loss function curves helps in assessing convergence, identifying over-fitting or under-fitting, and optimizing model performance. Fig. 12 represents the bounding box loss of two models named YOLOv5s and the proposed SD-YOLO-AWDNet over training data in 300 epochs during training. A faster decline for SD-YOLO-AWDNet represents more efficient learning than YOLOv5s. Major improvements over the YOLOv5 model are also described as YOLOv5 - GN (Ghost Network) and YOLOv5 - FDL (Focal Distribution Loss), showcasing how these intermediate improvements impact change in loss for training on the BDD100k dataset. \u2022 Precision Comparison Curve The precision curve comparison between YOLOv5 and the proposed SD-YOLO-AWDNet reveals intriguing insights into their respective performances. Precision, a critical metric in object detection, measures the accuracy of identified objects. On analysis of precision curves for both models, it can be justified that the proposed model consistently performs better. Fig. 13 shows the precision comparison of YOLOv5s and SD-YOLO-AWDNet over 300 epochs of training data. It is evident that the SD-YOLO-AWDNet results in fewer misclassifications and has better precision in object detection within the scene. Similar to the previous section, intermediate improvements of YOLOv5 - GN (Ghost Network) and YOLOv5 - FDL (Focal Distribution Loss) are also added here to showcase how these improvements impact change in precision curve over training on the BDD100k dataset. SD-YOLO-AWDNet shows more sensitivity in detecting smaller objects, which is generally a common challenge in object detection tasks. The model performs well for a diverse scale of objects. The prevision curve for SD-YOLO-AWDNet also has a smoother ascent, indicating a more stable and reliable performance. As compared to YOLOv5\u2019s inconsistent behaviour for some classes, SD-YOLO-AWDNet shows high precision values across diverse adverse scenarios with consistency across all classes. In short, the precision curve comparison between SD-YOLO-AWDNet and YOLOv5 showcases the superior performance of SD-YOLO-AWDNet with fewer false positives, consistency across all classes and handling diverse scales of objects. SD-YOLO-AWDNet outperforms YOLOv5 in terms of model accuracy and reliability. 4.3.2.2 Class-wise comparative analysis In this section, a comparative analysis is done between SD-YOLO-AWDNet with YOLOv5 based on different categories of the BDD100k dataset. The following sections will include class-wise comparison based on mAP values for BDD100k object classes, comparison based on performance on individual adverse weather conditions and PR curve comparison based on BDD100k object classes. \u2022 Class-wise mAP Comparasion Table 8 presents the mAP values for YOLOv5 and SD-YOLO-AWDNet across various weather scenarios. Furthermore, YOLOv4 is incorporated in the table due to its comparable performance with the YOLOv5s model, and in certain classes (for example, clear sky), it even outperforms YOLOv5s. The result showcases better mAP values in all scenarios for the proposed model of SD-YOLO-AWDNet. \u2022 Adverse Weather Based mAP Comparasion In Table 9, classwise mAP comparisons are also listed for better clarity of results. It represents mAP comparisons of YOLOv5s and SD-YOLO-AWDNet on all eight classes of the BDD100k dataset,i.e, it is evident that SD-YOLO-AWDNet performs better than YOLOv5 in most of the classes and achieves the highest overall class based mAP scores. \u2022 The Precision-Recall (PR) Curve The precision\u2013recall (PR) curve presents the relationship between the metrics of precision and recall across various thresholds, providing a clear assessment of the model\u2019s performance at different levels of precision and recall. The precision\u2013recall (PR) curve is graphically depicted, with the x -axis denoting the recall metric and the y -axis denoting the precision metric. Originating from a point based on the initial threshold, the curve illustrates how precision and recall change as the detection threshold is adjusted. Typically, raising the threshold results in an increase in precision but a decrease in recall. This is because, at higher thresholds, the model becomes more selective and makes detections only when it is more certain, leading to fewer false positives but potentially overlooking some true positives. The precision\u2013recall curve and mAP values of all classes in the BDD100k dataset for YOLOv5 and SD-YOLO-AWDNet are shown in Figs. 14 and 15. By analysing the PR curves, it can be confirmed that the proposed model exhibits a higher area under the curve, suggesting superior overall performance. 4.3.3 Proposed SD-YOLO-AWDNet vs SOTA (state of art models) Result comparison of the proposed algorithm with State Of Art Models is discussed in this subsection. \u2022 mAP Value Based Comparison The comparison Table 10 shows the mAP@0.50, mAP@0.75, FPS, Giga Floating Point Operations Per Second (GFLOPs) and number of parameters values of different object detection algorithms for the BDD100k dataset. It is evident that the proposed model, SD-YOLO-AWDNet, demonstrates superior performance compared to all other models across various performance metrics, as indicated by higher mAP values. The improvement is notable considering the model has nearly half the parameters compared to YOLOv5s. In addition to the improved accuracy, there is a noticeable boost in FPS, signifying a faster processing speed. The model also demonstrates a decrease in GFLOPs, highlighting its efficiency in computational operations. Together, these aspects highlight the lightweight design and heightened performance efficiency of the proposed model SD-YOLO-AWDNet. SD-YOLO-AWDNet is the most accurate object detection model of all shown in the table, having the highest mAP score of 59.1. Faster RCNN is the least accurate object detection model of all shown in the table with the lowest mAP score of 29.3. SSD Resnet and CenterNet also performed on the lower scale with mAP values of 34.31 and 41.92, respectively. YOLOv5s, YOLOv6, YOLOv7 and YOLOv7-tiny performed slightly weaker based on mAP values of 57.80, 55.89, 56.8, and 51.1, respectively. The total number of parameters utilized is significantly high as well in these models. YOLOv8s performance is similar but again the parameters used are much higher as well. SD-YOLO-AWDNet has used almost one-third of the total number of parameters utilized by YOLOv8s. The bar chart as shown in Fig. 16, conveys the comparison of mAP scores including mAP@50 and mAP@75 values for all models vs SD-YOLO-AWDNet. SD-YOLO-AWDNet is the most accurate object detection model of the ten shown having the highest mAP@50 score i.e. 59.1. Faster RCNN is the least accurate object detection model of the ten shown because it has the lowest mAP@50 score, 29.3. While YOLOv8s outperforms all others in mAP@75, SD-YOLO-AWDNet is comparatively lighter in weight than YOLOv8s. \u2022 Detection Results After training models, objects are detected in different weather scenarios with ten state-of-the-art models (CenterNet, Faster RCNN, SSD Resnet, YOLOv5s, SD-YOLO-AWDNet model, YOLOv6, YOLOv7, YOLOv7-tiny, and YOLOV8) Table 13 illustrates the detection results of SD-YOLO-AWDNet in adverse weather conditions across six distinct scenarios of clear sky, foggy, night, partly cloudy, rainy, and snowy, from the BDD100K dataset. The comparative analysis with other models offers insights into the proposed model\u2019s robustness and performance variations under challenging weather conditions. It is evident from the output of the models that the miss ratio is comparatively lesser in the proposed model of SD-YOLO-AWDNet. Reviewing the results aids in comparing SD-YOLO-AWDNet with other models, demonstrating its capability to precisely detect and locate objects in various scenarios. The visual representation of the detection results helps us grasp SD-YOLO-AWDNet\u2019s capability to recognize and accurately detect objects in various environmental challenges. By presenting results across multiple weather scenarios, the figures provide a comprehensive evaluation of SD-YOLO-AWDNet\u2019s adaptability and efficacy in real-world conditions for autonomous vehicles. 4.4 Performance validation on two other datasets The paper involves a major analysis of the BDD100k dataset as shown in previous sections. To validate the robustness of the model across diverse datasets, analysis is also done on other popular datasets including Canadian Adverse Driving Condition (CADC) (Pitropov et al., 2021) and Karlsruhe Institute of Technology and Toyota Technological Institute (KITTI) (Geiger et al., 2013). The following sections showcase comparison analysis with KITTI and CADC respectively. 4.4.1 mAP comparision on CADC dataset The comparison Table 11 shows the mAP@0.50, mAP@0.75, FPS, Giga Floating Point Operations Per Second (GFLOPs) and several parameters values of different object detection algorithms for the CADC dataset (Pitropov et al., 2021). SSD Resnet performed least with mAP of 0.12 with FasterRCNN and CenterNet also performing weaker with mAP values of 22.60 and 23.80. Variants of YOLOv5s, YOLOv6, YOLOv7 and YOLOv7-tiny performed slightly better with mAP values of 25.60, 25.90, 27.60 and 27.20, but still lagged behind the proposed model. YOLOv8s performed similarly to the proposed model with a mAP of 28.20, but the total parameters are significantly lesser in the proposed model. Together, these aspects highlight the lightweight design and increased performance efficiency of the proposed model SD-YOLO-AWDNet. 4.4.2 mAP comparison on KITTI dataset The comparison Table 12 shows the mAP@0.50, mAP@0.75, FPS, Giga Floating Point Operations Per Second (GFLOPs) and several parameters values of different object detection algorithms for the KITTI dataset (Geiger et al., 2013). CenterNet performed the least with a mAP of 29.2. Faster-RCNN improves the detection performance with a higher mAP value of 54.5 as compared to SSDResNet and CenterNet which performed relatively poorly with mAP values of 44.0 and 29.2. YOLOv5 improves detections with mAP of 83.3 but it is still lower than YOLOv7 and YOLOv8s with mAP of 84.91 and 84.99. The proposed model SD-YOLO-AWDNet with mAP of 86.0 outperforms the baseline model significantly with overall benchmarking across all key indicators, with the least number of training parameters. An improved lightweight object detection model is developed for adverse weather conditions in self-driving cars, delivering improved FPS on existing hardware. Its adaptability to weaker hardware offers superior performance and efficiency compared to other models. These findings provide insights for updates to driving systems, facilitating multi-scale target detection in adverse weather and accelerating model deployment for low-end vehicles, thereby enhancing the feasibility of autonomous vehicles (ADS) for wider public distribution. 4.4.3 SD-YOLO-AWDNet detections on out-of-distribution datasets For training and validation purposes BDD100k, CADC and KITTI datasets are used. However visual analysis is done on real-world images from Indian road traffic. The collected images span across different places and weather scenarios i.e rainy, snowy, daytime, night-time, sunny, sparse traffic, dense traffic, valley and hill areas. This is done to validate the effectiveness of the proposed model on out-of-context datasets. It is evident from Fig. 17 that objects are detected more precisely by the proposed model on images of real world scenarios. In future, detailed analysis will be done for different traffic, various terrains and adverse weather conditions. 5 Conclusion This paper presents SD-YOLO-AWDNet, improved lightweight YOLOv5s for enhanced detection in adverse weather conditions while reducing model size without sacrificing efficiency. It utilizes ghost convolutions with DSDC and CA modules, with a novel loss function for improved performance. Comparative analysis reveals SD-YOLO-AWDNet\u2019s performance gains for mAP 50 is [92%, 72.3%, 41.05%, 2.24%, 5.7%, 4.04%, 15.7%, and 1.77%] for BDD100k dataset, [57.7%, 97.4%, 78%, 3.24%, 3.12%, 1.28%, 2.22%, and 1.18%] for KITTI dataset, and [27.4%, 40%, 21%, 12.5%, 11.16%, 4.31%, 5.8%, and 2.12%] for CADC dataset in comparison to [Faster RCNN, SSD-ResNet, CenterNet, YOLOv5, YOLOv6, YOLOv7, YOLOv7-tiny, and YOLOv8] models. The performance shows that the proposed model successfully reduces [91.27%, 85.5%, 82.6%, 94.2%, 50.6%, 81.1%, 90%, 40.3% and 66.9%] number of parameters in comparison to [FasterRCNN, SSD ResNet, CenterNet, YOLOv4, YOLOv5, YOLOv6, YOLOv7, YOLOv7-tiny and YOLOv8s], respectively. The future goal is to utilize this method with different object detection techniques to enhance model detection performance, alongside conducting deeper analyses on the CADC and KITTI datasets using the proposed model. A custom dataset will also be generated in future for further evaluating the model\u2019s efficiency. CRediT authorship contribution statement Rashmi: Software, Formal analysis, Resources, Data curation, Writing \u2013 original draft, Visualization, Investigation, Software, Validation, Writing \u2013 review & editing. Rashmi Chaudhry: Conceptualization, Methodology, Supervision, Project administration, Funding acquisition, Writing \u2013 review & editing, Result analysis. Declaration of competing interest The authors declare that they have no known competing financial interests or personal relationships that could have appeared to influence the work reported in this paper. References Adarsh et al., 2020 Adarsh P. Rathi P. Kumar M. YOLO v3-tiny: Object detection and recognition using one stage improved model 2020 6th international conference on advanced computing and communication systems 2020 IEEE 687 694 Adarsh, P., Rathi, P., & Kumar, M. (2020). Yolo v3-tiny: Object detection and recognition using one stage improved model. In 2020 6th international conference on advanced computing and communication systems (ICACCS) (pp. 687\u2013694). IEEE. Bochkovskiy et al., 2020 Bochkovskiy A. Wang C.-Y. Liao H.-Y.M. YOLOv4: Optimal speed and accuracy of object detection 2020 arXiv preprint arXiv:2004.10934 Bochkovskiy, A., Wang, C.-Y., & Liao, H.-Y. M. (2020). Yolov4: Optimal speed and accuracy of object detection. arXiv preprint arXiv:2004.10934, . Cai et al., 2021 Cai Y. Luan T. Gao H. Wang H. Chen L. Li Y. YOLOv4-5D: An effective and efficient object detector for autonomous driving IEEE Transactions on Instrumentation and Measurement 70 2021 1 13 Cai, Y., Luan, T., Gao, H., Wang, H., Chen, L., Li, Y., Sotelo, M. A., & Li, Z. (2021). Yolov4-5d: An effective and efficient object detector for autonomous driving. IEEE Transactions on Instrumentation and Measurement, 70, 1\u201313. Chen et al., 2020 Chen L. Ding Q. Zou Q. Chen Z. Li L. DenseLightNet: A light-weight vehicle detection network for autonomous driving IEEE Transactions on Industrial Electronics 67 2020 10600 10609 Chen, L., Ding, Q., Zou, Q., Chen, Z., & Li, L. (2020). Denselightnet: A light-weight vehicle detection network for autonomous driving. IEEE Transactions on Industrial Electronics, 67, 10600\u201310609. Cheng et al., 2023 Cheng P. Tang X. Liang W. Li Y. Cong W. Zang C. Tiny-YOLOv7: Tiny object detection model for drone imagery International conference on image and graphics 2023 Springer 53 65 Cheng, P., Tang, X., Liang, W., Li, Y., Cong, W., & Zang, C. (2023). Tiny-yolov7: Tiny object detection model for drone imagery. In International Conference on Image and Graphics (pp. 53\u201365). Springer. Chollet, 2017 Chollet, F. (2017). Xception: Deep learning with depthwise separable convolutions. In Proceedings of the IEEE conference on computer vision and pattern recognition (pp. 1251\u20131258). Duan et al., 2019 Duan, K., Bai, S., Xie, L., Qi, H., Huang, Q., & Tian, Q. (2019). Centernet: Keypoint triplets for object detection. In Proceedings of the IEEE/CVF international conference on computer vision (pp. 6569\u20136578). Gao et al., 2024 Gao P. Ji C.-L. Yu T. Yuan R.-Y. YOLO-TLA: An efficient and lightweight small object detection model based on YOLOv5 2024 arXiv preprint arXiv:2402.14309 Gao, P., Ji, C.-L., Yu, T., & Yuan, R.-Y. (2024). Yolo-tla: An efficient and lightweight small object detection model based on yolov5. arXiv preprint arXiv:2402.14309, . Ge et al., 2021 Ge Z. Liu S. Wang F. Li Z. Sun J. Yolox: Exceeding yolo series in 2021 2021 arXiv preprint arXiv:2107.08430 Ge, Z., Liu, S., Wang, F., Li, Z., & Sun, J. (2021). Yolox: Exceeding yolo series in 2021. arXiv preprint arXiv:2107.08430, . Geiger et al., 2013 Geiger A. Lenz P. Stiller C. Urtasun R. Vision meets robotics: The kitti dataset The International Journal of Robotics Research 32 2013 1231 1237 Geiger, A., Lenz, P., Stiller, C., & Urtasun, R. (2013). Vision meets robotics: The kitti dataset. The International Journal of Robotics Research, 32, 1231\u20131237. Geiger et al., 2012 Geiger A. Lenz P. Urtasun R. Are we ready for autonomous driving? The kitti vision benchmark suite 2012 IEEE conference on computer vision and pattern recognition 2012 IEEE 3354 3361 Geiger, A., Lenz, P., & Urtasun, R. (2012). Are we ready for autonomous driving? the kitti vision benchmark suite. In 2012 IEEE conference on computer vision and pattern recognition (pp. 3354\u20133361). IEEE. Girshick, 2015 Girshick, R. (2015). Fast R-CNN. In Proceedings of the IEEE international conference on computer vision (pp. 1440\u20131448). Hamzenejadi and Mohseni, 2023 Hamzenejadi M.H. Mohseni H. Fine-tuned YOLOv5 for real-time vehicle detection in UAV imagery: Architectural improvements and performance boost Expert Systems with Applications 2023 120845 Hamzenejadi, M. H., & Mohseni, H. (2023). Fine-tuned yolov5 for real-time vehicle detection in uav imagery: Architectural improvements and performance boost. Expert Systems with Applications, (p. 120845). Han et al., 2020 Han, K., Wang, Y., Tian, Q., Guo, J., Xu, C., & Xu, C. (2020). GhostNet: More features from cheap operations. In Proceedings of the IEEE/CVF conference on computer vision and pattern recognition (pp. 1580\u20131589). Hnewa and Radha, 2020 Hnewa M. Radha H. Object detection under rainy conditions for autonomous vehicles: A review of state-of-the-art and emerging techniques IEEE Signal Processing Magazine 38 2020 53 67 Hnewa, M., & Radha, H. (2020). Object detection under rainy conditions for autonomous vehicles: A review of state-of-the-art and emerging techniques. IEEE Signal Processing Magazine, 38, 53\u201367. Hnewa and Radha, 2021 Hnewa M. Radha H. Multiscale domain adaptive yolo for cross-domain object detection 2021 IEEE international conference on image processing 2021 IEEE 3323 3327 Hnewa, M., & Radha, H. (2021). Multiscale domain adaptive yolo for cross-domain object detection. In 2021 IEEE International Conference on Image Processing (ICIP) (pp. 3323\u20133327). IEEE. Hoque et al., 2023 Hoque S. Xu S. Maiti A. Wei Y. Arafat M.Y. Deep learning for 6D pose estimation of objects \u2014 A case study for autonomous driving Expert Systems with Applications 223 2023 119838 Hoque, S., Xu, S., Maiti, A., Wei, Y., & Arafat, M. Y. (2023). Deep learning for 6d pose estimation of objects\u2014a case study for autonomous driving. Expert Systems with Applications, 223, 119838. Hou et al., 2021 Hou, Q., Zhou, D., & Feng, J. (2021). Coordinate attention for efficient mobile network design. In Proceedings of the IEEE/CVF conference on computer vision and pattern recognition (pp. 13713\u201313722). Jiang et al., 2023 Jiang Y. Zhu B. Zhao X. Deng W. Pixel-wise content attention learning for single-image deraining of autonomous vehicles Expert Systems with Applications 224 2023 119990 Jiang, Y., Zhu, B., Zhao, X., & Deng, W. (2023). Pixel-wise content attention learning for single-image deraining of autonomous vehicles. Expert Systems with Applications, 224, 119990. Jocher et al., 2022 Jocher G. Chaurasia A. Stoken A. Borovec J. Kwon Y. Fang J. ultralytics/YOLOv5: V6. 1-TensorRT, TensorFlow edge TPU and OpenVINO export and inference Zenodo 2022 Jocher, G., Chaurasia, A., Stoken, A., Borovec, J., Kwon, Y., Fang, J., Michael, K., Montes, D., Nadar, J., Skalski, P. et al. (2022). ultralytics/yolov5: v6. 1-tensorrt, tensorflow edge tpu and openvino export and inference. Zenodo, . Johari and Swami, 2020 Johari A. Swami P.D. Comparison of autonomy and study of deep learning tools for object detection in autonomous self driving vehicles 2nd international conference on data, engineering and applications 2020 IEEE 1 6 Johari, A., & Swami, P. D. (2020). Comparison of autonomy and study of deep learning tools for object detection in autonomous self driving vehicles. In 2nd International Conference on Data, Engineering and Applications (IDEA) (pp. 1\u20136). IEEE. Li, Li, et al., 2022 Li C. Li L. Jiang H. Weng K. Geng Y. Li L. YOLOv6: A single-stage object detection framework for industrial applications 2022 arXiv preprint arXiv:2209.02976 Li, C., Li, L., Jiang, H., Weng, K., Geng, Y., Li, L., Ke, Z., Li, Q., Cheng, M., Nie, W. et al. (2022a). Yolov6: A single-stage object detection framework for industrial applications. arXiv preprint arXiv:2209.02976, . Li, Liu, and Yuan, 2022 Li, W., Liu, X., & Yuan, Y. (2022). Sigma: Semantic-complete graph matching for domain adaptive object detection. In Proceedings of the IEEE/CVF conference on computer vision and pattern recognition (pp. 5291\u20135300). Li et al., 2017 Li Z. Peng C. Yu G. Zhang X. Deng Y. Sun J. Light-head R-CNN: In defense of two-stage object detector 2017 arXiv preprint arXiv:1711.07264 Li, Z., Peng, C., Yu, G., Zhang, X., Deng, Y., & Sun, J. (2017). Light-head r-cnn: In defense of two-stage object detector. arXiv preprint arXiv:1711.07264, . Li et al., 2023 Li, J., Xu, R., Ma, J., Zou, Q., Ma, J., & Yu, H. (2023). Domain adaptive object detection for autonomous driving under foggy weather. In Proceedings of the IEEE/CVF winter conference on applications of computer vision (pp. 612\u2013622). Li et al., 2024 Li H. Zhuang X. Bao S. Chen J. Yang C. SCD-YOLO: A lightweight vehicle target detection method based on improved YOLOv5n Journal of Electronic Imaging 33 2024 023041 Li, H., Zhuang, X., Bao, S., Chen, J., & Yang, C. (2024). Scd-yolo: a lightweight vehicle target detection method based on improved yolov5n. Journal of Electronic Imaging, 33, 023041\u2013023041. Liao et al., 2023 Liao W.-H. Wang C.-C. Lin W.-C. GNN-based point cloud maps feature extraction and residual feature fusion for 3D object detection 2023 IEEE international conference on robotics and automation 2023 IEEE 7010 7016 Liao, W.-H., Wang, C.-C., & Lin, W.-C. (2023). Gnn-based point cloud maps feature extraction and residual feature fusion for 3d object detection. In 2023 IEEE International Conference on Robotics and Automation (ICRA) (pp. 7010\u20137016). IEEE. Liu et al., 2016 Liu W. Anguelov D. Erhan D. Szegedy C. Reed S. Fu C.-Y. SSD: Single shot multibox detector Computer vision\u2013ECCV 2016: 14th European conference, amsterdam, the netherlands, October 11\u201314, 2016, proceedings, part I 14 2016 Springer 21 37 Liu, W., Anguelov, D., Erhan, D., Szegedy, C., Reed, S., Fu, C.-Y., & Berg, A. C. (2016). Ssd: Single shot multibox detector. In Computer Vision\u2013ECCV 2016: 14th European Conference, Amsterdam, The Netherlands, October 11\u201314, 2016, Proceedings, Part I 14 (pp. 21\u201337). Springer. Liu et al., 2021 Liu Z. Cai Y. Wang H. Chen L. Gao H. Jia Y. Robust target recognition and tracking of self-driving cars with radar and camera information fusion under severe weather conditions IEEE Transactions on Intelligent Transportation Systems 23 2021 6640 6653 Liu, Z., Cai, Y., Wang, H., Chen, L., Gao, H., Jia, Y., & Li, Y. (2021). Robust target recognition and tracking of self-driving cars with radar and camera information fusion under severe weather conditions. IEEE Transactions on Intelligent Transportation Systems, 23, 6640\u20136653. Liu et al., 2023 Liu G. Hu Y. Chen Z. Guo J. Ni P. Lightweight object detection algorithm for robots with improved YOLOv5 Engineering Applications of Artificial Intelligence 123 2023 106217 Liu, G., Hu, Y., Chen, Z., Guo, J., & Ni, P. (2023). Lightweight object detection algorithm for robots with improved yolov5. Engineering Applications of Artificial Intelligence, 123, 106217. Liu et al., 2019 Liu, X., Ma, Y., Shi, Z., & Chen, J. (2019). GridDehazeNet: Attention-based multi-scale network for image dehazing. In Proceedings of the IEEE/CVF international conference on computer vision (pp. 7314\u20137323). Liu et al., 2018 Liu, S., Qi, L., Qin, H., Shi, J., & Jia, J. (2018). Path aggregation network for instance segmentation. In Proceedings of the IEEE conference on computer vision and pattern recognition (pp. 8759\u20138768). Liu et al., 2022 Liu W. Ren G. Yu R. Guo S. Zhu J. Zhang L. Image-adaptive YOLO for object detection in adverse weather conditions Proceedings of the AAAI conference on artificial intelligence vol. 36 2022 1792 1800 Liu, W., Ren, G., Yu, R., Guo, S., Zhu, J., & Zhang, L. (2022). Image-adaptive yolo for object detection in adverse weather conditions. In Proceedings of the AAAI Conference on Artificial Intelligence (pp. 1792\u20131800). volume 36. Mahaur et al., 2023 Mahaur B. Mishra K. Kumar A. An improved lightweight small object detection framework applied to real-time autonomous driving Expert Systems with Applications 234 2023 121036 Mahaur, B., Mishra, K., & Kumar, A. (2023). An improved lightweight small object detection framework applied to real-time autonomous driving. Expert Systems with Applications, 234, 121036. Michaelis et al., 2019 Michaelis C. Mitzkus B. Geirhos R. Rusak E. Bringmann O. Ecker A.S. Benchmarking robustness in object detection: Autonomous driving when winter is coming 2019 arXiv preprint arXiv:1907.07484 Michaelis, C., Mitzkus, B., Geirhos, R., Rusak, E., Bringmann, O., Ecker, A. S., Bethge, M., & Brendel, W. (2019). Benchmarking robustness in object detection: Autonomous driving when winter is coming. arXiv preprint arXiv:1907.07484, . Ouyang et al., 2015 Ouyang, W., Wang, X., Zeng, X., Qiu, S., Luo, P., Tian, Y., et al. (2015). DeepID-Net: Deformable deep convolutional neural networks for object detection. In Proceedings of the IEEE conference on computer vision and pattern recognition (pp. 2403\u20132412). Paz et al., 2020 Paz D. Zhang H. Li Q. Xiang H. Christensen H.I. Probabilistic semantic mapping for urban autonomous driving applications 2020 IEEE/RSJ international conference on intelligent robots and systems 2020 IEEE 2059 2064 Paz, D., Zhang, H., Li, Q., Xiang, H., & Christensen, H. I. (2020). Probabilistic semantic mapping for urban autonomous driving applications. In 2020 IEEE/RSJ International Conference on Intelligent Robots and Systems (IROS) (pp. 2059\u20132064). IEEE. Pitropov et al., 2021 Pitropov M. Garcia D.E. Rebello J. Smart M. Wang C. Czarnecki K. Canadian adverse driving conditions dataset The International Journal of Robotics Research 40 2021 681 690 Pitropov, M., Garcia, D. E., Rebello, J., Smart, M., Wang, C., Czarnecki, K., & Waslander, S. (2021). Canadian adverse driving conditions dataset. The International Journal of Robotics Research, 40, 681\u2013690. Ramachandran et al., 2017 Ramachandran P. Zoph B. Le Q.V. Searching for activation functions 2017 arXiv preprint arXiv:1710.05941 Ramachandran, P., Zoph, B., & Le, Q. V. (2017). Searching for activation functions. arXiv preprint arXiv:1710.05941, . Redmon et al., 2016 Redmon, J., Divvala, S., Girshick, R., & Farhadi, A. (2016). You only look once: Unified, real-time object detection. In Proceedings of the IEEE conference on computer vision and pattern recognition (pp. 779\u2013788). Rezaei et al., 2023 Rezaei M. Azarmi M. Mir F.M.P. 3D-Net: Monocular 3D object recognition for traffic monitoring Expert Systems with Applications 227 2023 120253 Rezaei, M., Azarmi, M., & Mir, F. M. P. (2023). 3d-net: Monocular 3d object recognition for traffic monitoring. Expert Systems with Applications, 227, 120253. Sakaridis et al., 2018 Sakaridis C. Dai D. Van Gool L. Semantic foggy scene understanding with synthetic data International Journal of Computer Vision 126 2018 973 992 Sakaridis, C., Dai, D., & Van Gool, L. (2018). Semantic foggy scene understanding with synthetic data. International Journal of Computer Vision, 126, 973\u2013992. Shi and Rajkumar, 2020 Shi, W., & Rajkumar, R. (2020). Point-GNN: Graph neural network for 3D object detection in a point cloud. In Proceedings of the IEEE/CVF conference on computer vision and pattern recognition (pp. 1711\u20131719). Simhambhatla et al., 2019 Simhambhatla R. Okiah K. Kuchkula S. Slater R. Self-driving cars: Evaluation of deep learning techniques for object detection in different driving conditions SMU Data Science Review 2 2019 23 Simhambhatla, R., Okiah, K., Kuchkula, S., & Slater, R. (2019). Self-driving cars: Evaluation of deep learning techniques for object detection in different driving conditions. SMU Data Science Review, 2, 23. Sindagi et al., 2020 Sindagi V.A. Oza P. Yasarla R. Patel V.M. Prior-based domain adaptive object detection for hazy and rainy conditions Computer vision\u2013ECCV 2020: 16th European conference, Glasgow, UK, August 23\u201328, 2020, proceedings, part XIV 16 2020 Springer 763 780 Sindagi, V. A., Oza, P., Yasarla, R., & Patel, V. M. (2020). Prior-based domain adaptive object detection for hazy and rainy conditions. In Computer Vision\u2013ECCV 2020: 16th European Conference, Glasgow, UK, August 23\u201328, 2020, Proceedings, Part XIV 16 (pp. 763\u2013780). Springer. Sun et al., 2020 Sun W. Zhang X. He X. Lightweight image classifier using dilated and depthwise separable convolutions Journal of Cloud Computing 9 2020 55 Sun, W., Zhang, X., & He, X. (2020). Lightweight image classifier using dilated and depthwise separable convolutions. Journal of Cloud Computing, 9, 55. Tabata et al., 2023 Tabata A.N. Zimmer A. dos Santos Coelho L. Mariani V.C. Analyzing CARLA\u2019s performance for 2D object detection and monocular depth estimation based on deep learning approaches Expert Systems with Applications 227 2023 120200 Tabata, A. N., Zimmer, A., dos Santos Coelho, L., & Mariani, V. C. (2023). Analyzing carla\u2019s performance for 2d object detection and monocular depth estimation based on deep learning approaches. Expert Systems with Applications, 227, 120200. Tan et al., 2020 Tan, M., Pang, R., & Le, Q. V. (2020). Efficientdet: Scalable and efficient object detection. In Proceedings of the IEEE/CVF conference on computer vision and pattern recognition (pp. 10781\u201310790). Tian, Gelernter, Wang, Li and Yu, 2019 Tian Y. Gelernter J. Wang X. Li J. Yu Y. Traffic sign detection using a multi-scale recurrent attention network IEEE Transactions on Intelligent Transportation Systems 20 2019 4466 4475 Tian, Y., Gelernter, J., Wang, X., Li, J., & Yu, Y. (2019a). Traffic sign detection using a multi-scale recurrent attention network. IEEE transactions on intelligent transportation systems, 20, 4466\u20134475. Tian et al., 2024 Tian D. Han Y. Wang S. Object feedback and feature information retention for small object detection in intelligent transportation scenes Expert Systems with Applications 238 2024 121811 Tian, D., Han, Y., & Wang, S. (2024). Object feedback and feature information retention for small object detection in intelligent transportation scenes. Expert Systems with Applications, 238, 121811. Tian, Shen, Chen and He, 2019 Tian, Z., Shen, C., Chen, H., & He, T. (2019). FCOS: Fully convolutional one-stage object detection. In Proceedings of the IEEE/CVF international conference on computer vision (pp. 9627\u20139636). Vats and Anastasiu, 2023 Vats, A., & Anastasiu, D. C. (2023). Enhancing retail checkout through video inpainting, YOLOv8 detection, and deepsort tracking. In Proceedings of the IEEE/CVF conference on computer vision and pattern recognition (pp. 5529\u20135536). Wang et al., 2021 Wang, C.-Y., Bochkovskiy, A., & Liao, H.-Y. M. (2021). Scaled-YOLOv4: Scaling cross stage partial network. In Proceedings of the IEEE/cvf conference on computer vision and pattern recognition (pp. 13029\u201313038). Wang, Bochkovskiy and Liao, 2023 Wang, C.-Y., Bochkovskiy, A., & Liao, H.-Y. M. (2023). YOLOv7: Trainable bag-of-freebies sets new state-of-the-art for real-time object detectors. In Proceedings of the IEEE/CVF conference on computer vision and pattern recognition (pp. 7464\u20137475). Wang et al., 2024 Wang Z. Li Y. Liu Y. Meng F. Improved object detection via large kernel attention Expert Systems with Applications 240 2024 122507 Wang, Z., Li, Y., Liu, Y., & Meng, F. (2024). Improved object detection via large kernel attention. Expert Systems with Applications, 240, 122507. Wang et al., 2019 Wang D. Wen J. Wang Y. Huang X. Pei F. End-to-end self-driving using deep neural networks with multi-auxiliary tasks Automotive Innovation 2 2019 127 136 Wang, D., Wen, J., Wang, Y., Huang, X., & Pei, F. (2019). End-to-end self-driving using deep neural networks with multi-auxiliary tasks. Automotive Innovation, 2, 127\u2013136. Wang et al., 2022 Wang H. Xu Y. He Y. Cai Y. Chen L. Li Y. YOLOv5-Fog: A multiobjective visual detection algorithm for fog driving scenes based on improved YOLOv5 IEEE Transactions on Instrumentation and Measurement 71 2022 1 12 Wang, H., Xu, Y., He, Y., Cai, Y., Chen, L., Li, Y., Sotelo, M. A., & Li, Z. (2022). Yolov5-fog: A multiobjective visual detection algorithm for fog driving scenes based on improved yolov5. IEEE Transactions on Instrumentation and Measurement, 71, 1\u201312. Wang, Xu, et al., 2023 Wang H. Xu Y. Wang Z. Cai Y. Chen L. Li Y. Centernet-auto: A multi-object visual detection algorithm for autonomous driving scenes based on improved centernet IEEE Transactions on Emerging Topics in Computational Intelligence 2023 Wang, H., Xu, Y., Wang, Z., Cai, Y., Chen, L., & Li, Y. (2023b). Centernet-auto: A multi-object visual detection algorithm for autonomous driving scenes based on improved centernet. IEEE Transactions on Emerging Topics in Computational Intelligence, . Wei et al., 2017 Wei Y. Yuan Q. Shen H. Zhang L. Boosting the accuracy of multispectral image pansharpening by learning a deep residual network IEEE Geoscience and Remote Sensing Letters 14 2017 1795 1799 Wei, Y., Yuan, Q., Shen, H., & Zhang, L. (2017). Boosting the accuracy of multispectral image pansharpening by learning a deep residual network. IEEE Geoscience and Remote Sensing Letters, 14, 1795\u20131799. Xuan et al., 2022 Xuan W. Jian-She G. Bo-Jie H. Zong-Shan W. Hong-Wei D. Jie W. A lightweight modified YOLOX network using coordinate attention mechanism for PCB surface defect detection IEEE Sensors Journal 22 2022 20910 20920 Xuan, W., Jian-She, G., Bo-Jie, H., Zong-Shan, W., Hong-Wei, D., & Jie, W. (2022). A lightweight modified yolox network using coordinate attention mechanism for pcb surface defect detection. IEEE sensors journal, 22, 20910\u201320920. Yang and Fan, 2024 Yang M. Fan X. YOLOv8-Lite: A lightweight object detection model for real-time autonomous driving systems IECE Transactions on Emerging Topics in Artificial Intelligence 1 2024 1 16 Yang, M., & Fan, X. (2024). Yolov8-lite: A lightweight object detection model for real-time autonomous driving systems. IECE Transactions on Emerging Topics in Artificial Intelligence, 1, 1\u201316. Yu et al., 2020 Yu, F., Chen, H., Wang, X., Xian, W., Chen, Y., Liu, F., et al. (2020). BDD100k: A diverse driving dataset for heterogeneous multitask learning. In Proceedings of the IEEE/CVF conference on computer vision and pattern recognition (pp. 2636\u20132645). Yu and Koltun, 2015 Yu F. Koltun V. Multi-scale context aggregation by dilated convolutions 2015 arXiv preprint arXiv:1511.07122 Yu, F., & Koltun, V. (2015). Multi-scale context aggregation by dilated convolutions. arXiv preprint arXiv:1511.07122, . Zhang et al., 2021 Zhang C. Li Z. Liu J. Peng P. Ye Q. Lu S. Self-guided adaptation: Progressive representation alignment for domain adaptive object detection IEEE Transactions on Multimedia 24 2021 2246 2258 Zhang, C., Li, Z., Liu, J., Peng, P., Ye, Q., Lu, S., Huang, T., & Tian, Y. (2021). Self-guided adaptation: Progressive representation alignment for domain adaptive object detection. IEEE Transactions on Multimedia, 24, 2246\u20132258. Zhang et al., 2022 Zhang Y.-F. Ren W. Zhang Z. Jia Z. Wang L. Tan T. Focal and efficient IOU loss for accurate bounding box regression Neurocomputing 506 2022 146 157 Zhang, Y.-F., Ren, W., Zhang, Z., Jia, Z., Wang, L., & Tan, T. (2022). Focal and efficient iou loss for accurate bounding box regression. Neurocomputing, 506, 146\u2013157. Zhang and Xian, 2021 Zhang Z. Xian C. Consistent depth prediction under various illuminations using dilated cross attention 2021 arXiv preprint arXiv:2112.08006 Zhang, Z., & Xian, C. (2021). Consistent depth prediction under various illuminations using dilated cross attention. arXiv preprint arXiv:2112.08006, . Zhang et al., 2024 Zhang Y. Zhang H. Huang Q. Han Y. Zhao M. DSP-YOLO: An anchor-free network with DsPAN for small object detection of multiscale defects Expert Systems with Applications 241 2024 122669 Zhang, Y., Zhang, H., Huang, Q., Han, Y., & Zhao, M. (2024). Dsp-yolo: An anchor-free network with dspan for small object detection of multiscale defects. Expert Systems with Applications, 241, 122669.",
    "scopus-id": "85200551348",
    "coredata": {
        "eid": "1-s2.0-S0957417424018098",
        "dc:description": "Several deep learning algorithms are currently focused on object detection in adverse weather scenarios for autonomous driving systems. However, these algorithms face challenges in real-time scenarios, leading to a reduction in detection accuracy. To tackle these issues, this paper introduces a lightweight object detection model named Self Driving Cars You Only Look Once Adverse Weather Detection Network (SD-YOLO-AWDNet), derived from enhancements to the YOLOv5 algorithm. The model incorporates four progressive improvement levels within the YOLOv5 framework. This includes integrating C3Ghost and GhostConv modules in the backbone to enhance detection speed by reducing computational overhead during feature extraction. To address potential accuracy issues arising from these modules, Depthwise-Separable Dilated Convolutions (DSDC) are introduced, striking a balance between accuracy and parameter reduction. The model further incorporates a Coordinate Attention (CA) module in the GhostBottleneck to enhance feature extraction and eliminate unnecessary features, improving precision in object detection. Additionally, a novel \u201cFocal Distribution Loss\u201d replaces CIoU Loss, accelerating bounding box regression and loss reduction. Test dataset experiments demonstrate that SD-YOLO-AWDNet outperforms YOLOv5 with a 54% decrease in FLOPs, a 52.53% decrease in model parameters, a 2.24% increase in mAP, and a threefold improvement in detection speed.",
        "openArchiveArticle": "false",
        "prism:coverDate": "2024-12-05",
        "openaccessUserLicense": null,
        "prism:aggregationType": "Journal",
        "prism:url": "https://api.elsevier.com/content/article/pii/S0957417424018098",
        "dc:creator": [
            {
                "@_fa": "true",
                "$": "Rashmi,"
            },
            {
                "@_fa": "true",
                "$": "Chaudhry, Rashmi"
            }
        ],
        "link": [
            {
                "@_fa": "true",
                "@rel": "self",
                "@href": "https://api.elsevier.com/content/article/pii/S0957417424018098"
            },
            {
                "@_fa": "true",
                "@rel": "scidir",
                "@href": "https://www.sciencedirect.com/science/article/pii/S0957417424018098"
            }
        ],
        "dc:format": "application/json",
        "openaccessType": null,
        "pii": "S0957-4174(24)01809-8",
        "prism:volume": "256",
        "articleNumber": "124942",
        "prism:publisher": "Elsevier Ltd. All rights are reserved, including those for text and data mining, AI training, and similar technologies.",
        "dc:title": "SD-YOLO-AWDNet: A hybrid approach for smart object detection in challenging weather for self-driving cars",
        "prism:copyright": "© 2024 Elsevier Ltd. All rights are reserved, including those for text and data mining, AI training, and similar technologies.",
        "openaccess": "0",
        "prism:issn": "09574174",
        "dcterms:subject": [
            {
                "@_fa": "true",
                "$": "Object detection"
            },
            {
                "@_fa": "true",
                "$": "Self driving cars"
            },
            {
                "@_fa": "true",
                "$": "Deep neural network"
            },
            {
                "@_fa": "true",
                "$": "YOLO"
            }
        ],
        "openaccessArticle": "false",
        "prism:publicationName": "Expert Systems with Applications",
        "openaccessSponsorType": null,
        "prism:pageRange": "124942",
        "pubType": "fla",
        "prism:coverDisplayDate": "5 December 2024",
        "prism:doi": "10.1016/j.eswa.2024.124942",
        "prism:startingPage": "124942",
        "dc:identifier": "doi:10.1016/j.eswa.2024.124942",
        "openaccessSponsorName": null
    },
    "objects": {"object": [
        {
            "@category": "standard",
            "@height": "107",
            "@width": "213",
            "@_fa": "true",
            "$": "https://api.elsevier.com/content/object/eid/1-s2.0-S0957417424018098-fx12.jpg?httpAccept=%2A%2F%2A",
            "@multimediatype": "JPEG image file",
            "@type": "IMAGE-DOWNSAMPLED",
            "@size": "21355",
            "@ref": "fx12",
            "@mimetype": "image/jpeg"
        },
        {
            "@category": "standard",
            "@height": "132",
            "@width": "192",
            "@_fa": "true",
            "$": "https://api.elsevier.com/content/object/eid/1-s2.0-S0957417424018098-fx56.jpg?httpAccept=%2A%2F%2A",
            "@multimediatype": "JPEG image file",
            "@type": "IMAGE-DOWNSAMPLED",
            "@size": "27527",
            "@ref": "fx56",
            "@mimetype": "image/jpeg"
        },
        {
            "@category": "standard",
            "@height": "107",
            "@width": "213",
            "@_fa": "true",
            "$": "https://api.elsevier.com/content/object/eid/1-s2.0-S0957417424018098-fx11.jpg?httpAccept=%2A%2F%2A",
            "@multimediatype": "JPEG image file",
            "@type": "IMAGE-DOWNSAMPLED",
            "@size": "19163",
            "@ref": "fx11",
            "@mimetype": "image/jpeg"
        },
        {
            "@category": "standard",
            "@height": "132",
            "@width": "192",
            "@_fa": "true",
            "$": "https://api.elsevier.com/content/object/eid/1-s2.0-S0957417424018098-fx55.jpg?httpAccept=%2A%2F%2A",
            "@multimediatype": "JPEG image file",
            "@type": "IMAGE-DOWNSAMPLED",
            "@size": "25566",
            "@ref": "fx55",
            "@mimetype": "image/jpeg"
        },
        {
            "@category": "standard",
            "@height": "124",
            "@width": "213",
            "@_fa": "true",
            "$": "https://api.elsevier.com/content/object/eid/1-s2.0-S0957417424018098-fx10.jpg?httpAccept=%2A%2F%2A",
            "@multimediatype": "JPEG image file",
            "@type": "IMAGE-DOWNSAMPLED",
            "@size": "27329",
            "@ref": "fx10",
            "@mimetype": "image/jpeg"
        },
        {
            "@category": "standard",
            "@height": "132",
            "@width": "192",
            "@_fa": "true",
            "$": "https://api.elsevier.com/content/object/eid/1-s2.0-S0957417424018098-fx54.jpg?httpAccept=%2A%2F%2A",
            "@multimediatype": "JPEG image file",
            "@type": "IMAGE-DOWNSAMPLED",
            "@size": "28734",
            "@ref": "fx54",
            "@mimetype": "image/jpeg"
        },
        {
            "@category": "standard",
            "@height": "132",
            "@width": "192",
            "@_fa": "true",
            "$": "https://api.elsevier.com/content/object/eid/1-s2.0-S0957417424018098-fx53.jpg?httpAccept=%2A%2F%2A",
            "@multimediatype": "JPEG image file",
            "@type": "IMAGE-DOWNSAMPLED",
            "@size": "27527",
            "@ref": "fx53",
            "@mimetype": "image/jpeg"
        },
        {
            "@category": "standard",
            "@height": "133",
            "@width": "192",
            "@_fa": "true",
            "$": "https://api.elsevier.com/content/object/eid/1-s2.0-S0957417424018098-fx16.jpg?httpAccept=%2A%2F%2A",
            "@multimediatype": "JPEG image file",
            "@type": "IMAGE-DOWNSAMPLED",
            "@size": "25317",
            "@ref": "fx16",
            "@mimetype": "image/jpeg"
        },
        {
            "@category": "standard",
            "@height": "133",
            "@width": "192",
            "@_fa": "true",
            "$": "https://api.elsevier.com/content/object/eid/1-s2.0-S0957417424018098-fx15.jpg?httpAccept=%2A%2F%2A",
            "@multimediatype": "JPEG image file",
            "@type": "IMAGE-DOWNSAMPLED",
            "@size": "25655",
            "@ref": "fx15",
            "@mimetype": "image/jpeg"
        },
        {
            "@category": "standard",
            "@height": "132",
            "@width": "192",
            "@_fa": "true",
            "$": "https://api.elsevier.com/content/object/eid/1-s2.0-S0957417424018098-fx59.jpg?httpAccept=%2A%2F%2A",
            "@multimediatype": "JPEG image file",
            "@type": "IMAGE-DOWNSAMPLED",
            "@size": "27580",
            "@ref": "fx59",
            "@mimetype": "image/jpeg"
        },
        {
            "@category": "standard",
            "@height": "133",
            "@width": "192",
            "@_fa": "true",
            "$": "https://api.elsevier.com/content/object/eid/1-s2.0-S0957417424018098-fx14.jpg?httpAccept=%2A%2F%2A",
            "@multimediatype": "JPEG image file",
            "@type": "IMAGE-DOWNSAMPLED",
            "@size": "15731",
            "@ref": "fx14",
            "@mimetype": "image/jpeg"
        },
        {
            "@category": "standard",
            "@height": "132",
            "@width": "192",
            "@_fa": "true",
            "$": "https://api.elsevier.com/content/object/eid/1-s2.0-S0957417424018098-fx58.jpg?httpAccept=%2A%2F%2A",
            "@multimediatype": "JPEG image file",
            "@type": "IMAGE-DOWNSAMPLED",
            "@size": "25935",
            "@ref": "fx58",
            "@mimetype": "image/jpeg"
        },
        {
            "@category": "standard",
            "@height": "133",
            "@width": "192",
            "@_fa": "true",
            "$": "https://api.elsevier.com/content/object/eid/1-s2.0-S0957417424018098-fx13.jpg?httpAccept=%2A%2F%2A",
            "@multimediatype": "JPEG image file",
            "@type": "IMAGE-DOWNSAMPLED",
            "@size": "25392",
            "@ref": "fx13",
            "@mimetype": "image/jpeg"
        },
        {
            "@category": "standard",
            "@height": "132",
            "@width": "192",
            "@_fa": "true",
            "$": "https://api.elsevier.com/content/object/eid/1-s2.0-S0957417424018098-fx57.jpg?httpAccept=%2A%2F%2A",
            "@multimediatype": "JPEG image file",
            "@type": "IMAGE-DOWNSAMPLED",
            "@size": "28725",
            "@ref": "fx57",
            "@mimetype": "image/jpeg"
        },
        {
            "@category": "standard",
            "@height": "132",
            "@width": "192",
            "@_fa": "true",
            "$": "https://api.elsevier.com/content/object/eid/1-s2.0-S0957417424018098-fx52.jpg?httpAccept=%2A%2F%2A",
            "@multimediatype": "JPEG image file",
            "@type": "IMAGE-DOWNSAMPLED",
            "@size": "25566",
            "@ref": "fx52",
            "@mimetype": "image/jpeg"
        },
        {
            "@category": "standard",
            "@height": "132",
            "@width": "192",
            "@_fa": "true",
            "$": "https://api.elsevier.com/content/object/eid/1-s2.0-S0957417424018098-fx51.jpg?httpAccept=%2A%2F%2A",
            "@multimediatype": "JPEG image file",
            "@type": "IMAGE-DOWNSAMPLED",
            "@size": "28650",
            "@ref": "fx51",
            "@mimetype": "image/jpeg"
        },
        {
            "@category": "standard",
            "@height": "132",
            "@width": "192",
            "@_fa": "true",
            "$": "https://api.elsevier.com/content/object/eid/1-s2.0-S0957417424018098-fx50.jpg?httpAccept=%2A%2F%2A",
            "@multimediatype": "JPEG image file",
            "@type": "IMAGE-DOWNSAMPLED",
            "@size": "27588",
            "@ref": "fx50",
            "@mimetype": "image/jpeg"
        },
        {
            "@category": "standard",
            "@height": "133",
            "@width": "192",
            "@_fa": "true",
            "$": "https://api.elsevier.com/content/object/eid/1-s2.0-S0957417424018098-fx19.jpg?httpAccept=%2A%2F%2A",
            "@multimediatype": "JPEG image file",
            "@type": "IMAGE-DOWNSAMPLED",
            "@size": "25385",
            "@ref": "fx19",
            "@mimetype": "image/jpeg"
        },
        {
            "@category": "standard",
            "@height": "133",
            "@width": "192",
            "@_fa": "true",
            "$": "https://api.elsevier.com/content/object/eid/1-s2.0-S0957417424018098-fx18.jpg?httpAccept=%2A%2F%2A",
            "@multimediatype": "JPEG image file",
            "@type": "IMAGE-DOWNSAMPLED",
            "@size": "24668",
            "@ref": "fx18",
            "@mimetype": "image/jpeg"
        },
        {
            "@category": "standard",
            "@height": "133",
            "@width": "192",
            "@_fa": "true",
            "$": "https://api.elsevier.com/content/object/eid/1-s2.0-S0957417424018098-fx17.jpg?httpAccept=%2A%2F%2A",
            "@multimediatype": "JPEG image file",
            "@type": "IMAGE-DOWNSAMPLED",
            "@size": "15467",
            "@ref": "fx17",
            "@mimetype": "image/jpeg"
        },
        {
            "@category": "standard",
            "@height": "133",
            "@width": "192",
            "@_fa": "true",
            "$": "https://api.elsevier.com/content/object/eid/1-s2.0-S0957417424018098-fx45.jpg?httpAccept=%2A%2F%2A",
            "@multimediatype": "JPEG image file",
            "@type": "IMAGE-DOWNSAMPLED",
            "@size": "27011",
            "@ref": "fx45",
            "@mimetype": "image/jpeg"
        },
        {
            "@category": "standard",
            "@height": "133",
            "@width": "192",
            "@_fa": "true",
            "$": "https://api.elsevier.com/content/object/eid/1-s2.0-S0957417424018098-fx44.jpg?httpAccept=%2A%2F%2A",
            "@multimediatype": "JPEG image file",
            "@type": "IMAGE-DOWNSAMPLED",
            "@size": "27068",
            "@ref": "fx44",
            "@mimetype": "image/jpeg"
        },
        {
            "@category": "standard",
            "@height": "133",
            "@width": "192",
            "@_fa": "true",
            "$": "https://api.elsevier.com/content/object/eid/1-s2.0-S0957417424018098-fx43.jpg?httpAccept=%2A%2F%2A",
            "@multimediatype": "JPEG image file",
            "@type": "IMAGE-DOWNSAMPLED",
            "@size": "24930",
            "@ref": "fx43",
            "@mimetype": "image/jpeg"
        },
        {
            "@category": "standard",
            "@height": "133",
            "@width": "192",
            "@_fa": "true",
            "$": "https://api.elsevier.com/content/object/eid/1-s2.0-S0957417424018098-fx42.jpg?httpAccept=%2A%2F%2A",
            "@multimediatype": "JPEG image file",
            "@type": "IMAGE-DOWNSAMPLED",
            "@size": "26996",
            "@ref": "fx42",
            "@mimetype": "image/jpeg"
        },
        {
            "@category": "standard",
            "@height": "351",
            "@width": "725",
            "@_fa": "true",
            "$": "https://api.elsevier.com/content/object/eid/1-s2.0-S0957417424018098-gr16.jpg?httpAccept=%2A%2F%2A",
            "@multimediatype": "JPEG image file",
            "@type": "IMAGE-DOWNSAMPLED",
            "@size": "105740",
            "@ref": "gr16",
            "@mimetype": "image/jpeg"
        },
        {
            "@category": "standard",
            "@height": "132",
            "@width": "192",
            "@_fa": "true",
            "$": "https://api.elsevier.com/content/object/eid/1-s2.0-S0957417424018098-fx49.jpg?httpAccept=%2A%2F%2A",
            "@multimediatype": "JPEG image file",
            "@type": "IMAGE-DOWNSAMPLED",
            "@size": "25927",
            "@ref": "fx49",
            "@mimetype": "image/jpeg"
        },
        {
            "@category": "standard",
            "@height": "571",
            "@width": "731",
            "@_fa": "true",
            "$": "https://api.elsevier.com/content/object/eid/1-s2.0-S0957417424018098-gr17.jpg?httpAccept=%2A%2F%2A",
            "@multimediatype": "JPEG image file",
            "@type": "IMAGE-DOWNSAMPLED",
            "@size": "293234",
            "@ref": "gr17",
            "@mimetype": "image/jpeg"
        },
        {
            "@category": "standard",
            "@height": "133",
            "@width": "192",
            "@_fa": "true",
            "$": "https://api.elsevier.com/content/object/eid/1-s2.0-S0957417424018098-fx48.jpg?httpAccept=%2A%2F%2A",
            "@multimediatype": "JPEG image file",
            "@type": "IMAGE-DOWNSAMPLED",
            "@size": "27004",
            "@ref": "fx48",
            "@mimetype": "image/jpeg"
        },
        {
            "@category": "standard",
            "@height": "133",
            "@width": "192",
            "@_fa": "true",
            "$": "https://api.elsevier.com/content/object/eid/1-s2.0-S0957417424018098-fx47.jpg?httpAccept=%2A%2F%2A",
            "@multimediatype": "JPEG image file",
            "@type": "IMAGE-DOWNSAMPLED",
            "@size": "26971",
            "@ref": "fx47",
            "@mimetype": "image/jpeg"
        },
        {
            "@category": "standard",
            "@height": "133",
            "@width": "192",
            "@_fa": "true",
            "$": "https://api.elsevier.com/content/object/eid/1-s2.0-S0957417424018098-fx46.jpg?httpAccept=%2A%2F%2A",
            "@multimediatype": "JPEG image file",
            "@type": "IMAGE-DOWNSAMPLED",
            "@size": "24895",
            "@ref": "fx46",
            "@mimetype": "image/jpeg"
        },
        {
            "@category": "standard",
            "@height": "327",
            "@width": "609",
            "@_fa": "true",
            "$": "https://api.elsevier.com/content/object/eid/1-s2.0-S0957417424018098-gr7.jpg?httpAccept=%2A%2F%2A",
            "@multimediatype": "JPEG image file",
            "@type": "IMAGE-DOWNSAMPLED",
            "@size": "110436",
            "@ref": "gr7",
            "@mimetype": "image/jpeg"
        },
        {
            "@category": "standard",
            "@height": "286",
            "@width": "385",
            "@_fa": "true",
            "$": "https://api.elsevier.com/content/object/eid/1-s2.0-S0957417424018098-gr12.jpg?httpAccept=%2A%2F%2A",
            "@multimediatype": "JPEG image file",
            "@type": "IMAGE-DOWNSAMPLED",
            "@size": "95687",
            "@ref": "gr12",
            "@mimetype": "image/jpeg"
        },
        {
            "@category": "standard",
            "@height": "158",
            "@width": "654",
            "@_fa": "true",
            "$": "https://api.elsevier.com/content/object/eid/1-s2.0-S0957417424018098-gr8.jpg?httpAccept=%2A%2F%2A",
            "@multimediatype": "JPEG image file",
            "@type": "IMAGE-DOWNSAMPLED",
            "@size": "86233",
            "@ref": "gr8",
            "@mimetype": "image/jpeg"
        },
        {
            "@category": "standard",
            "@height": "290",
            "@width": "383",
            "@_fa": "true",
            "$": "https://api.elsevier.com/content/object/eid/1-s2.0-S0957417424018098-gr13.jpg?httpAccept=%2A%2F%2A",
            "@multimediatype": "JPEG image file",
            "@type": "IMAGE-DOWNSAMPLED",
            "@size": "96051",
            "@ref": "gr13",
            "@mimetype": "image/jpeg"
        },
        {
            "@category": "standard",
            "@height": "98",
            "@width": "668",
            "@_fa": "true",
            "$": "https://api.elsevier.com/content/object/eid/1-s2.0-S0957417424018098-gr9.jpg?httpAccept=%2A%2F%2A",
            "@multimediatype": "JPEG image file",
            "@type": "IMAGE-DOWNSAMPLED",
            "@size": "81865",
            "@ref": "gr9",
            "@mimetype": "image/jpeg"
        },
        {
            "@category": "standard",
            "@height": "251",
            "@width": "384",
            "@_fa": "true",
            "$": "https://api.elsevier.com/content/object/eid/1-s2.0-S0957417424018098-gr14.jpg?httpAccept=%2A%2F%2A",
            "@multimediatype": "JPEG image file",
            "@type": "IMAGE-DOWNSAMPLED",
            "@size": "99563",
            "@ref": "gr14",
            "@mimetype": "image/jpeg"
        },
        {
            "@category": "standard",
            "@height": "250",
            "@width": "384",
            "@_fa": "true",
            "$": "https://api.elsevier.com/content/object/eid/1-s2.0-S0957417424018098-gr15.jpg?httpAccept=%2A%2F%2A",
            "@multimediatype": "JPEG image file",
            "@type": "IMAGE-DOWNSAMPLED",
            "@size": "100042",
            "@ref": "gr15",
            "@mimetype": "image/jpeg"
        },
        {
            "@category": "standard",
            "@height": "323",
            "@width": "294",
            "@_fa": "true",
            "$": "https://api.elsevier.com/content/object/eid/1-s2.0-S0957417424018098-gr3.jpg?httpAccept=%2A%2F%2A",
            "@multimediatype": "JPEG image file",
            "@type": "IMAGE-DOWNSAMPLED",
            "@size": "113797",
            "@ref": "gr3",
            "@mimetype": "image/jpeg"
        },
        {
            "@category": "standard",
            "@height": "133",
            "@width": "192",
            "@_fa": "true",
            "$": "https://api.elsevier.com/content/object/eid/1-s2.0-S0957417424018098-fx41.jpg?httpAccept=%2A%2F%2A",
            "@multimediatype": "JPEG image file",
            "@type": "IMAGE-DOWNSAMPLED",
            "@size": "26828",
            "@ref": "fx41",
            "@mimetype": "image/jpeg"
        },
        {
            "@category": "standard",
            "@height": "737",
            "@width": "735",
            "@_fa": "true",
            "$": "https://api.elsevier.com/content/object/eid/1-s2.0-S0957417424018098-gr4.jpg?httpAccept=%2A%2F%2A",
            "@multimediatype": "JPEG image file",
            "@type": "IMAGE-DOWNSAMPLED",
            "@size": "203543",
            "@ref": "gr4",
            "@mimetype": "image/jpeg"
        },
        {
            "@category": "standard",
            "@height": "133",
            "@width": "192",
            "@_fa": "true",
            "$": "https://api.elsevier.com/content/object/eid/1-s2.0-S0957417424018098-fx40.jpg?httpAccept=%2A%2F%2A",
            "@multimediatype": "JPEG image file",
            "@type": "IMAGE-DOWNSAMPLED",
            "@size": "24642",
            "@ref": "fx40",
            "@mimetype": "image/jpeg"
        },
        {
            "@category": "standard",
            "@height": "357",
            "@width": "527",
            "@_fa": "true",
            "$": "https://api.elsevier.com/content/object/eid/1-s2.0-S0957417424018098-gr5.jpg?httpAccept=%2A%2F%2A",
            "@multimediatype": "JPEG image file",
            "@type": "IMAGE-DOWNSAMPLED",
            "@size": "102184",
            "@ref": "gr5",
            "@mimetype": "image/jpeg"
        },
        {
            "@category": "standard",
            "@height": "241",
            "@width": "386",
            "@_fa": "true",
            "$": "https://api.elsevier.com/content/object/eid/1-s2.0-S0957417424018098-gr10.jpg?httpAccept=%2A%2F%2A",
            "@multimediatype": "JPEG image file",
            "@type": "IMAGE-DOWNSAMPLED",
            "@size": "99425",
            "@ref": "gr10",
            "@mimetype": "image/jpeg"
        },
        {
            "@category": "standard",
            "@height": "326",
            "@width": "373",
            "@_fa": "true",
            "$": "https://api.elsevier.com/content/object/eid/1-s2.0-S0957417424018098-gr6.jpg?httpAccept=%2A%2F%2A",
            "@multimediatype": "JPEG image file",
            "@type": "IMAGE-DOWNSAMPLED",
            "@size": "99227",
            "@ref": "gr6",
            "@mimetype": "image/jpeg"
        },
        {
            "@category": "standard",
            "@height": "465",
            "@width": "731",
            "@_fa": "true",
            "$": "https://api.elsevier.com/content/object/eid/1-s2.0-S0957417424018098-gr11.jpg?httpAccept=%2A%2F%2A",
            "@multimediatype": "JPEG image file",
            "@type": "IMAGE-DOWNSAMPLED",
            "@size": "190201",
            "@ref": "gr11",
            "@mimetype": "image/jpeg"
        },
        {
            "@category": "standard",
            "@height": "107",
            "@width": "213",
            "@_fa": "true",
            "$": "https://api.elsevier.com/content/object/eid/1-s2.0-S0957417424018098-fx6.jpg?httpAccept=%2A%2F%2A",
            "@multimediatype": "JPEG image file",
            "@type": "IMAGE-DOWNSAMPLED",
            "@size": "21770",
            "@ref": "fx6",
            "@mimetype": "image/jpeg"
        },
        {
            "@category": "standard",
            "@height": "107",
            "@width": "213",
            "@_fa": "true",
            "$": "https://api.elsevier.com/content/object/eid/1-s2.0-S0957417424018098-fx7.jpg?httpAccept=%2A%2F%2A",
            "@multimediatype": "JPEG image file",
            "@type": "IMAGE-DOWNSAMPLED",
            "@size": "22016",
            "@ref": "fx7",
            "@mimetype": "image/jpeg"
        },
        {
            "@category": "standard",
            "@height": "101",
            "@width": "386",
            "@_fa": "true",
            "$": "https://api.elsevier.com/content/object/eid/1-s2.0-S0957417424018098-gr1.jpg?httpAccept=%2A%2F%2A",
            "@multimediatype": "JPEG image file",
            "@type": "IMAGE-DOWNSAMPLED",
            "@size": "77399",
            "@ref": "gr1",
            "@mimetype": "image/jpeg"
        },
        {
            "@category": "standard",
            "@height": "107",
            "@width": "213",
            "@_fa": "true",
            "$": "https://api.elsevier.com/content/object/eid/1-s2.0-S0957417424018098-fx8.jpg?httpAccept=%2A%2F%2A",
            "@multimediatype": "JPEG image file",
            "@type": "IMAGE-DOWNSAMPLED",
            "@size": "23615",
            "@ref": "fx8",
            "@mimetype": "image/jpeg"
        },
        {
            "@category": "standard",
            "@height": "218",
            "@width": "713",
            "@_fa": "true",
            "$": "https://api.elsevier.com/content/object/eid/1-s2.0-S0957417424018098-gr2.jpg?httpAccept=%2A%2F%2A",
            "@multimediatype": "JPEG image file",
            "@type": "IMAGE-DOWNSAMPLED",
            "@size": "143895",
            "@ref": "gr2",
            "@mimetype": "image/jpeg"
        },
        {
            "@category": "standard",
            "@height": "124",
            "@width": "213",
            "@_fa": "true",
            "$": "https://api.elsevier.com/content/object/eid/1-s2.0-S0957417424018098-fx9.jpg?httpAccept=%2A%2F%2A",
            "@multimediatype": "JPEG image file",
            "@type": "IMAGE-DOWNSAMPLED",
            "@size": "25377",
            "@ref": "fx9",
            "@mimetype": "image/jpeg"
        },
        {
            "@category": "standard",
            "@height": "107",
            "@width": "213",
            "@_fa": "true",
            "$": "https://api.elsevier.com/content/object/eid/1-s2.0-S0957417424018098-fx2.jpg?httpAccept=%2A%2F%2A",
            "@multimediatype": "JPEG image file",
            "@type": "IMAGE-DOWNSAMPLED",
            "@size": "26087",
            "@ref": "fx2",
            "@mimetype": "image/jpeg"
        },
        {
            "@category": "standard",
            "@height": "107",
            "@width": "213",
            "@_fa": "true",
            "$": "https://api.elsevier.com/content/object/eid/1-s2.0-S0957417424018098-fx3.jpg?httpAccept=%2A%2F%2A",
            "@multimediatype": "JPEG image file",
            "@type": "IMAGE-DOWNSAMPLED",
            "@size": "18394",
            "@ref": "fx3",
            "@mimetype": "image/jpeg"
        },
        {
            "@category": "standard",
            "@height": "107",
            "@width": "213",
            "@_fa": "true",
            "$": "https://api.elsevier.com/content/object/eid/1-s2.0-S0957417424018098-fx4.jpg?httpAccept=%2A%2F%2A",
            "@multimediatype": "JPEG image file",
            "@type": "IMAGE-DOWNSAMPLED",
            "@size": "19850",
            "@ref": "fx4",
            "@mimetype": "image/jpeg"
        },
        {
            "@category": "standard",
            "@height": "107",
            "@width": "213",
            "@_fa": "true",
            "$": "https://api.elsevier.com/content/object/eid/1-s2.0-S0957417424018098-fx5.jpg?httpAccept=%2A%2F%2A",
            "@multimediatype": "JPEG image file",
            "@type": "IMAGE-DOWNSAMPLED",
            "@size": "20335",
            "@ref": "fx5",
            "@mimetype": "image/jpeg"
        },
        {
            "@category": "standard",
            "@height": "107",
            "@width": "213",
            "@_fa": "true",
            "$": "https://api.elsevier.com/content/object/eid/1-s2.0-S0957417424018098-fx1.jpg?httpAccept=%2A%2F%2A",
            "@multimediatype": "JPEG image file",
            "@type": "IMAGE-DOWNSAMPLED",
            "@size": "25180",
            "@ref": "fx1",
            "@mimetype": "image/jpeg"
        },
        {
            "@category": "standard",
            "@height": "132",
            "@width": "192",
            "@_fa": "true",
            "$": "https://api.elsevier.com/content/object/eid/1-s2.0-S0957417424018098-fx34.jpg?httpAccept=%2A%2F%2A",
            "@multimediatype": "JPEG image file",
            "@type": "IMAGE-DOWNSAMPLED",
            "@size": "25798",
            "@ref": "fx34",
            "@mimetype": "image/jpeg"
        },
        {
            "@category": "standard",
            "@height": "132",
            "@width": "192",
            "@_fa": "true",
            "$": "https://api.elsevier.com/content/object/eid/1-s2.0-S0957417424018098-fx33.jpg?httpAccept=%2A%2F%2A",
            "@multimediatype": "JPEG image file",
            "@type": "IMAGE-DOWNSAMPLED",
            "@size": "25489",
            "@ref": "fx33",
            "@mimetype": "image/jpeg"
        },
        {
            "@category": "standard",
            "@height": "132",
            "@width": "192",
            "@_fa": "true",
            "$": "https://api.elsevier.com/content/object/eid/1-s2.0-S0957417424018098-fx32.jpg?httpAccept=%2A%2F%2A",
            "@multimediatype": "JPEG image file",
            "@type": "IMAGE-DOWNSAMPLED",
            "@size": "17413",
            "@ref": "fx32",
            "@mimetype": "image/jpeg"
        },
        {
            "@category": "standard",
            "@height": "132",
            "@width": "192",
            "@_fa": "true",
            "$": "https://api.elsevier.com/content/object/eid/1-s2.0-S0957417424018098-fx31.jpg?httpAccept=%2A%2F%2A",
            "@multimediatype": "JPEG image file",
            "@type": "IMAGE-DOWNSAMPLED",
            "@size": "25927",
            "@ref": "fx31",
            "@mimetype": "image/jpeg"
        },
        {
            "@category": "standard",
            "@height": "132",
            "@width": "192",
            "@_fa": "true",
            "$": "https://api.elsevier.com/content/object/eid/1-s2.0-S0957417424018098-fx38.jpg?httpAccept=%2A%2F%2A",
            "@multimediatype": "JPEG image file",
            "@type": "IMAGE-DOWNSAMPLED",
            "@size": "17957",
            "@ref": "fx38",
            "@mimetype": "image/jpeg"
        },
        {
            "@category": "standard",
            "@height": "132",
            "@width": "192",
            "@_fa": "true",
            "$": "https://api.elsevier.com/content/object/eid/1-s2.0-S0957417424018098-fx37.jpg?httpAccept=%2A%2F%2A",
            "@multimediatype": "JPEG image file",
            "@type": "IMAGE-DOWNSAMPLED",
            "@size": "25850",
            "@ref": "fx37",
            "@mimetype": "image/jpeg"
        },
        {
            "@category": "standard",
            "@height": "132",
            "@width": "192",
            "@_fa": "true",
            "$": "https://api.elsevier.com/content/object/eid/1-s2.0-S0957417424018098-fx36.jpg?httpAccept=%2A%2F%2A",
            "@multimediatype": "JPEG image file",
            "@type": "IMAGE-DOWNSAMPLED",
            "@size": "25460",
            "@ref": "fx36",
            "@mimetype": "image/jpeg"
        },
        {
            "@category": "standard",
            "@height": "132",
            "@width": "192",
            "@_fa": "true",
            "$": "https://api.elsevier.com/content/object/eid/1-s2.0-S0957417424018098-fx35.jpg?httpAccept=%2A%2F%2A",
            "@multimediatype": "JPEG image file",
            "@type": "IMAGE-DOWNSAMPLED",
            "@size": "17443",
            "@ref": "fx35",
            "@mimetype": "image/jpeg"
        },
        {
            "@category": "standard",
            "@height": "132",
            "@width": "192",
            "@_fa": "true",
            "$": "https://api.elsevier.com/content/object/eid/1-s2.0-S0957417424018098-fx30.jpg?httpAccept=%2A%2F%2A",
            "@multimediatype": "JPEG image file",
            "@type": "IMAGE-DOWNSAMPLED",
            "@size": "25480",
            "@ref": "fx30",
            "@mimetype": "image/jpeg"
        },
        {
            "@category": "standard",
            "@height": "132",
            "@width": "192",
            "@_fa": "true",
            "$": "https://api.elsevier.com/content/object/eid/1-s2.0-S0957417424018098-fx39.jpg?httpAccept=%2A%2F%2A",
            "@multimediatype": "JPEG image file",
            "@type": "IMAGE-DOWNSAMPLED",
            "@size": "25748",
            "@ref": "fx39",
            "@mimetype": "image/jpeg"
        },
        {
            "@category": "standard",
            "@height": "132",
            "@width": "192",
            "@_fa": "true",
            "$": "https://api.elsevier.com/content/object/eid/1-s2.0-S0957417424018098-fx23.jpg?httpAccept=%2A%2F%2A",
            "@multimediatype": "JPEG image file",
            "@type": "IMAGE-DOWNSAMPLED",
            "@size": "17457",
            "@ref": "fx23",
            "@mimetype": "image/jpeg"
        },
        {
            "@category": "standard",
            "@height": "132",
            "@width": "192",
            "@_fa": "true",
            "$": "https://api.elsevier.com/content/object/eid/1-s2.0-S0957417424018098-fx22.jpg?httpAccept=%2A%2F%2A",
            "@multimediatype": "JPEG image file",
            "@type": "IMAGE-DOWNSAMPLED",
            "@size": "25551",
            "@ref": "fx22",
            "@mimetype": "image/jpeg"
        },
        {
            "@category": "standard",
            "@height": "132",
            "@width": "192",
            "@_fa": "true",
            "$": "https://api.elsevier.com/content/object/eid/1-s2.0-S0957417424018098-fx66.jpg?httpAccept=%2A%2F%2A",
            "@multimediatype": "JPEG image file",
            "@type": "IMAGE-DOWNSAMPLED",
            "@size": "28650",
            "@ref": "fx66",
            "@mimetype": "image/jpeg"
        },
        {
            "@category": "standard",
            "@height": "133",
            "@width": "192",
            "@_fa": "true",
            "$": "https://api.elsevier.com/content/object/eid/1-s2.0-S0957417424018098-fx21.jpg?httpAccept=%2A%2F%2A",
            "@multimediatype": "JPEG image file",
            "@type": "IMAGE-DOWNSAMPLED",
            "@size": "24833",
            "@ref": "fx21",
            "@mimetype": "image/jpeg"
        },
        {
            "@category": "standard",
            "@height": "132",
            "@width": "192",
            "@_fa": "true",
            "$": "https://api.elsevier.com/content/object/eid/1-s2.0-S0957417424018098-fx65.jpg?httpAccept=%2A%2F%2A",
            "@multimediatype": "JPEG image file",
            "@type": "IMAGE-DOWNSAMPLED",
            "@size": "27588",
            "@ref": "fx65",
            "@mimetype": "image/jpeg"
        },
        {
            "@category": "standard",
            "@height": "133",
            "@width": "192",
            "@_fa": "true",
            "$": "https://api.elsevier.com/content/object/eid/1-s2.0-S0957417424018098-fx20.jpg?httpAccept=%2A%2F%2A",
            "@multimediatype": "JPEG image file",
            "@type": "IMAGE-DOWNSAMPLED",
            "@size": "15285",
            "@ref": "fx20",
            "@mimetype": "image/jpeg"
        },
        {
            "@category": "standard",
            "@height": "132",
            "@width": "192",
            "@_fa": "true",
            "$": "https://api.elsevier.com/content/object/eid/1-s2.0-S0957417424018098-fx64.jpg?httpAccept=%2A%2F%2A",
            "@multimediatype": "JPEG image file",
            "@type": "IMAGE-DOWNSAMPLED",
            "@size": "25935",
            "@ref": "fx64",
            "@mimetype": "image/jpeg"
        },
        {
            "@category": "standard",
            "@height": "132",
            "@width": "192",
            "@_fa": "true",
            "$": "https://api.elsevier.com/content/object/eid/1-s2.0-S0957417424018098-fx27.jpg?httpAccept=%2A%2F%2A",
            "@multimediatype": "JPEG image file",
            "@type": "IMAGE-DOWNSAMPLED",
            "@size": "25496",
            "@ref": "fx27",
            "@mimetype": "image/jpeg"
        },
        {
            "@category": "standard",
            "@height": "132",
            "@width": "192",
            "@_fa": "true",
            "$": "https://api.elsevier.com/content/object/eid/1-s2.0-S0957417424018098-fx26.jpg?httpAccept=%2A%2F%2A",
            "@multimediatype": "JPEG image file",
            "@type": "IMAGE-DOWNSAMPLED",
            "@size": "17290",
            "@ref": "fx26",
            "@mimetype": "image/jpeg"
        },
        {
            "@category": "standard",
            "@height": "132",
            "@width": "192",
            "@_fa": "true",
            "$": "https://api.elsevier.com/content/object/eid/1-s2.0-S0957417424018098-fx25.jpg?httpAccept=%2A%2F%2A",
            "@multimediatype": "JPEG image file",
            "@type": "IMAGE-DOWNSAMPLED",
            "@size": "25823",
            "@ref": "fx25",
            "@mimetype": "image/jpeg"
        },
        {
            "@category": "standard",
            "@height": "132",
            "@width": "192",
            "@_fa": "true",
            "$": "https://api.elsevier.com/content/object/eid/1-s2.0-S0957417424018098-fx24.jpg?httpAccept=%2A%2F%2A",
            "@multimediatype": "JPEG image file",
            "@type": "IMAGE-DOWNSAMPLED",
            "@size": "25748",
            "@ref": "fx24",
            "@mimetype": "image/jpeg"
        },
        {
            "@category": "standard",
            "@height": "132",
            "@width": "192",
            "@_fa": "true",
            "$": "https://api.elsevier.com/content/object/eid/1-s2.0-S0957417424018098-fx63.jpg?httpAccept=%2A%2F%2A",
            "@multimediatype": "JPEG image file",
            "@type": "IMAGE-DOWNSAMPLED",
            "@size": "28701",
            "@ref": "fx63",
            "@mimetype": "image/jpeg"
        },
        {
            "@category": "standard",
            "@height": "132",
            "@width": "192",
            "@_fa": "true",
            "$": "https://api.elsevier.com/content/object/eid/1-s2.0-S0957417424018098-fx62.jpg?httpAccept=%2A%2F%2A",
            "@multimediatype": "JPEG image file",
            "@type": "IMAGE-DOWNSAMPLED",
            "@size": "27588",
            "@ref": "fx62",
            "@mimetype": "image/jpeg"
        },
        {
            "@category": "standard",
            "@height": "132",
            "@width": "192",
            "@_fa": "true",
            "$": "https://api.elsevier.com/content/object/eid/1-s2.0-S0957417424018098-fx61.jpg?httpAccept=%2A%2F%2A",
            "@multimediatype": "JPEG image file",
            "@type": "IMAGE-DOWNSAMPLED",
            "@size": "25927",
            "@ref": "fx61",
            "@mimetype": "image/jpeg"
        },
        {
            "@category": "standard",
            "@height": "132",
            "@width": "192",
            "@_fa": "true",
            "$": "https://api.elsevier.com/content/object/eid/1-s2.0-S0957417424018098-fx60.jpg?httpAccept=%2A%2F%2A",
            "@multimediatype": "JPEG image file",
            "@type": "IMAGE-DOWNSAMPLED",
            "@size": "28731",
            "@ref": "fx60",
            "@mimetype": "image/jpeg"
        },
        {
            "@category": "standard",
            "@height": "132",
            "@width": "192",
            "@_fa": "true",
            "$": "https://api.elsevier.com/content/object/eid/1-s2.0-S0957417424018098-fx29.jpg?httpAccept=%2A%2F%2A",
            "@multimediatype": "JPEG image file",
            "@type": "IMAGE-DOWNSAMPLED",
            "@size": "17322",
            "@ref": "fx29",
            "@mimetype": "image/jpeg"
        },
        {
            "@category": "standard",
            "@height": "132",
            "@width": "192",
            "@_fa": "true",
            "$": "https://api.elsevier.com/content/object/eid/1-s2.0-S0957417424018098-fx28.jpg?httpAccept=%2A%2F%2A",
            "@multimediatype": "JPEG image file",
            "@type": "IMAGE-DOWNSAMPLED",
            "@size": "25826",
            "@ref": "fx28",
            "@mimetype": "image/jpeg"
        },
        {
            "@category": "thumbnail",
            "@height": "110",
            "@width": "219",
            "@_fa": "true",
            "$": "https://api.elsevier.com/content/object/eid/1-s2.0-S0957417424018098-fx12.sml?httpAccept=%2A%2F%2A",
            "@multimediatype": "GIF image file",
            "@type": "IMAGE-THUMBNAIL",
            "@size": "27530",
            "@ref": "fx12",
            "@mimetype": "image/gif"
        },
        {
            "@category": "thumbnail",
            "@height": "151",
            "@width": "219",
            "@_fa": "true",
            "$": "https://api.elsevier.com/content/object/eid/1-s2.0-S0957417424018098-fx56.sml?httpAccept=%2A%2F%2A",
            "@multimediatype": "GIF image file",
            "@type": "IMAGE-THUMBNAIL",
            "@size": "39097",
            "@ref": "fx56",
            "@mimetype": "image/gif"
        },
        {
            "@category": "thumbnail",
            "@height": "110",
            "@width": "219",
            "@_fa": "true",
            "$": "https://api.elsevier.com/content/object/eid/1-s2.0-S0957417424018098-fx11.sml?httpAccept=%2A%2F%2A",
            "@multimediatype": "GIF image file",
            "@type": "IMAGE-THUMBNAIL",
            "@size": "27420",
            "@ref": "fx11",
            "@mimetype": "image/gif"
        },
        {
            "@category": "thumbnail",
            "@height": "151",
            "@width": "219",
            "@_fa": "true",
            "$": "https://api.elsevier.com/content/object/eid/1-s2.0-S0957417424018098-fx55.sml?httpAccept=%2A%2F%2A",
            "@multimediatype": "GIF image file",
            "@type": "IMAGE-THUMBNAIL",
            "@size": "35496",
            "@ref": "fx55",
            "@mimetype": "image/gif"
        },
        {
            "@category": "thumbnail",
            "@height": "128",
            "@width": "219",
            "@_fa": "true",
            "$": "https://api.elsevier.com/content/object/eid/1-s2.0-S0957417424018098-fx10.sml?httpAccept=%2A%2F%2A",
            "@multimediatype": "GIF image file",
            "@type": "IMAGE-THUMBNAIL",
            "@size": "33104",
            "@ref": "fx10",
            "@mimetype": "image/gif"
        },
        {
            "@category": "thumbnail",
            "@height": "151",
            "@width": "219",
            "@_fa": "true",
            "$": "https://api.elsevier.com/content/object/eid/1-s2.0-S0957417424018098-fx54.sml?httpAccept=%2A%2F%2A",
            "@multimediatype": "GIF image file",
            "@type": "IMAGE-THUMBNAIL",
            "@size": "37780",
            "@ref": "fx54",
            "@mimetype": "image/gif"
        },
        {
            "@category": "thumbnail",
            "@height": "151",
            "@width": "219",
            "@_fa": "true",
            "$": "https://api.elsevier.com/content/object/eid/1-s2.0-S0957417424018098-fx53.sml?httpAccept=%2A%2F%2A",
            "@multimediatype": "GIF image file",
            "@type": "IMAGE-THUMBNAIL",
            "@size": "39097",
            "@ref": "fx53",
            "@mimetype": "image/gif"
        },
        {
            "@category": "thumbnail",
            "@height": "152",
            "@width": "219",
            "@_fa": "true",
            "$": "https://api.elsevier.com/content/object/eid/1-s2.0-S0957417424018098-fx16.sml?httpAccept=%2A%2F%2A",
            "@multimediatype": "GIF image file",
            "@type": "IMAGE-THUMBNAIL",
            "@size": "32270",
            "@ref": "fx16",
            "@mimetype": "image/gif"
        },
        {
            "@category": "thumbnail",
            "@height": "152",
            "@width": "219",
            "@_fa": "true",
            "$": "https://api.elsevier.com/content/object/eid/1-s2.0-S0957417424018098-fx15.sml?httpAccept=%2A%2F%2A",
            "@multimediatype": "GIF image file",
            "@type": "IMAGE-THUMBNAIL",
            "@size": "35824",
            "@ref": "fx15",
            "@mimetype": "image/gif"
        },
        {
            "@category": "thumbnail",
            "@height": "151",
            "@width": "219",
            "@_fa": "true",
            "$": "https://api.elsevier.com/content/object/eid/1-s2.0-S0957417424018098-fx59.sml?httpAccept=%2A%2F%2A",
            "@multimediatype": "GIF image file",
            "@type": "IMAGE-THUMBNAIL",
            "@size": "39103",
            "@ref": "fx59",
            "@mimetype": "image/gif"
        },
        {
            "@category": "thumbnail",
            "@height": "152",
            "@width": "219",
            "@_fa": "true",
            "$": "https://api.elsevier.com/content/object/eid/1-s2.0-S0957417424018098-fx14.sml?httpAccept=%2A%2F%2A",
            "@multimediatype": "GIF image file",
            "@type": "IMAGE-THUMBNAIL",
            "@size": "28162",
            "@ref": "fx14",
            "@mimetype": "image/gif"
        },
        {
            "@category": "thumbnail",
            "@height": "151",
            "@width": "219",
            "@_fa": "true",
            "$": "https://api.elsevier.com/content/object/eid/1-s2.0-S0957417424018098-fx58.sml?httpAccept=%2A%2F%2A",
            "@multimediatype": "GIF image file",
            "@type": "IMAGE-THUMBNAIL",
            "@size": "35589",
            "@ref": "fx58",
            "@mimetype": "image/gif"
        },
        {
            "@category": "thumbnail",
            "@height": "152",
            "@width": "219",
            "@_fa": "true",
            "$": "https://api.elsevier.com/content/object/eid/1-s2.0-S0957417424018098-fx13.sml?httpAccept=%2A%2F%2A",
            "@multimediatype": "GIF image file",
            "@type": "IMAGE-THUMBNAIL",
            "@size": "32375",
            "@ref": "fx13",
            "@mimetype": "image/gif"
        },
        {
            "@category": "thumbnail",
            "@height": "151",
            "@width": "219",
            "@_fa": "true",
            "$": "https://api.elsevier.com/content/object/eid/1-s2.0-S0957417424018098-fx57.sml?httpAccept=%2A%2F%2A",
            "@multimediatype": "GIF image file",
            "@type": "IMAGE-THUMBNAIL",
            "@size": "37921",
            "@ref": "fx57",
            "@mimetype": "image/gif"
        },
        {
            "@category": "thumbnail",
            "@height": "151",
            "@width": "219",
            "@_fa": "true",
            "$": "https://api.elsevier.com/content/object/eid/1-s2.0-S0957417424018098-fx52.sml?httpAccept=%2A%2F%2A",
            "@multimediatype": "GIF image file",
            "@type": "IMAGE-THUMBNAIL",
            "@size": "35496",
            "@ref": "fx52",
            "@mimetype": "image/gif"
        },
        {
            "@category": "thumbnail",
            "@height": "151",
            "@width": "219",
            "@_fa": "true",
            "$": "https://api.elsevier.com/content/object/eid/1-s2.0-S0957417424018098-fx51.sml?httpAccept=%2A%2F%2A",
            "@multimediatype": "GIF image file",
            "@type": "IMAGE-THUMBNAIL",
            "@size": "37595",
            "@ref": "fx51",
            "@mimetype": "image/gif"
        },
        {
            "@category": "thumbnail",
            "@height": "151",
            "@width": "219",
            "@_fa": "true",
            "$": "https://api.elsevier.com/content/object/eid/1-s2.0-S0957417424018098-fx50.sml?httpAccept=%2A%2F%2A",
            "@multimediatype": "GIF image file",
            "@type": "IMAGE-THUMBNAIL",
            "@size": "39119",
            "@ref": "fx50",
            "@mimetype": "image/gif"
        },
        {
            "@category": "thumbnail",
            "@height": "152",
            "@width": "219",
            "@_fa": "true",
            "$": "https://api.elsevier.com/content/object/eid/1-s2.0-S0957417424018098-fx19.sml?httpAccept=%2A%2F%2A",
            "@multimediatype": "GIF image file",
            "@type": "IMAGE-THUMBNAIL",
            "@size": "32395",
            "@ref": "fx19",
            "@mimetype": "image/gif"
        },
        {
            "@category": "thumbnail",
            "@height": "152",
            "@width": "219",
            "@_fa": "true",
            "$": "https://api.elsevier.com/content/object/eid/1-s2.0-S0957417424018098-fx18.sml?httpAccept=%2A%2F%2A",
            "@multimediatype": "GIF image file",
            "@type": "IMAGE-THUMBNAIL",
            "@size": "35572",
            "@ref": "fx18",
            "@mimetype": "image/gif"
        },
        {
            "@category": "thumbnail",
            "@height": "152",
            "@width": "219",
            "@_fa": "true",
            "$": "https://api.elsevier.com/content/object/eid/1-s2.0-S0957417424018098-fx17.sml?httpAccept=%2A%2F%2A",
            "@multimediatype": "GIF image file",
            "@type": "IMAGE-THUMBNAIL",
            "@size": "27978",
            "@ref": "fx17",
            "@mimetype": "image/gif"
        },
        {
            "@category": "thumbnail",
            "@height": "152",
            "@width": "219",
            "@_fa": "true",
            "$": "https://api.elsevier.com/content/object/eid/1-s2.0-S0957417424018098-fx45.sml?httpAccept=%2A%2F%2A",
            "@multimediatype": "GIF image file",
            "@type": "IMAGE-THUMBNAIL",
            "@size": "38369",
            "@ref": "fx45",
            "@mimetype": "image/gif"
        },
        {
            "@category": "thumbnail",
            "@height": "152",
            "@width": "219",
            "@_fa": "true",
            "$": "https://api.elsevier.com/content/object/eid/1-s2.0-S0957417424018098-fx44.sml?httpAccept=%2A%2F%2A",
            "@multimediatype": "GIF image file",
            "@type": "IMAGE-THUMBNAIL",
            "@size": "39600",
            "@ref": "fx44",
            "@mimetype": "image/gif"
        },
        {
            "@category": "thumbnail",
            "@height": "152",
            "@width": "219",
            "@_fa": "true",
            "$": "https://api.elsevier.com/content/object/eid/1-s2.0-S0957417424018098-fx43.sml?httpAccept=%2A%2F%2A",
            "@multimediatype": "GIF image file",
            "@type": "IMAGE-THUMBNAIL",
            "@size": "35777",
            "@ref": "fx43",
            "@mimetype": "image/gif"
        },
        {
            "@category": "thumbnail",
            "@height": "151",
            "@width": "219",
            "@_fa": "true",
            "$": "https://api.elsevier.com/content/object/eid/1-s2.0-S0957417424018098-fx42.sml?httpAccept=%2A%2F%2A",
            "@multimediatype": "GIF image file",
            "@type": "IMAGE-THUMBNAIL",
            "@size": "38246",
            "@ref": "fx42",
            "@mimetype": "image/gif"
        },
        {
            "@category": "thumbnail",
            "@height": "106",
            "@width": "219",
            "@_fa": "true",
            "$": "https://api.elsevier.com/content/object/eid/1-s2.0-S0957417424018098-gr16.sml?httpAccept=%2A%2F%2A",
            "@multimediatype": "GIF image file",
            "@type": "IMAGE-THUMBNAIL",
            "@size": "73533",
            "@ref": "gr16",
            "@mimetype": "image/gif"
        },
        {
            "@category": "thumbnail",
            "@height": "151",
            "@width": "219",
            "@_fa": "true",
            "$": "https://api.elsevier.com/content/object/eid/1-s2.0-S0957417424018098-fx49.sml?httpAccept=%2A%2F%2A",
            "@multimediatype": "GIF image file",
            "@type": "IMAGE-THUMBNAIL",
            "@size": "35573",
            "@ref": "fx49",
            "@mimetype": "image/gif"
        },
        {
            "@category": "thumbnail",
            "@height": "164",
            "@width": "210",
            "@_fa": "true",
            "$": "https://api.elsevier.com/content/object/eid/1-s2.0-S0957417424018098-gr17.sml?httpAccept=%2A%2F%2A",
            "@multimediatype": "GIF image file",
            "@type": "IMAGE-THUMBNAIL",
            "@size": "103642",
            "@ref": "gr17",
            "@mimetype": "image/gif"
        },
        {
            "@category": "thumbnail",
            "@height": "151",
            "@width": "219",
            "@_fa": "true",
            "$": "https://api.elsevier.com/content/object/eid/1-s2.0-S0957417424018098-fx48.sml?httpAccept=%2A%2F%2A",
            "@multimediatype": "GIF image file",
            "@type": "IMAGE-THUMBNAIL",
            "@size": "38262",
            "@ref": "fx48",
            "@mimetype": "image/gif"
        },
        {
            "@category": "thumbnail",
            "@height": "152",
            "@width": "219",
            "@_fa": "true",
            "$": "https://api.elsevier.com/content/object/eid/1-s2.0-S0957417424018098-fx47.sml?httpAccept=%2A%2F%2A",
            "@multimediatype": "GIF image file",
            "@type": "IMAGE-THUMBNAIL",
            "@size": "39486",
            "@ref": "fx47",
            "@mimetype": "image/gif"
        },
        {
            "@category": "thumbnail",
            "@height": "152",
            "@width": "219",
            "@_fa": "true",
            "$": "https://api.elsevier.com/content/object/eid/1-s2.0-S0957417424018098-fx46.sml?httpAccept=%2A%2F%2A",
            "@multimediatype": "GIF image file",
            "@type": "IMAGE-THUMBNAIL",
            "@size": "35840",
            "@ref": "fx46",
            "@mimetype": "image/gif"
        },
        {
            "@category": "thumbnail",
            "@height": "118",
            "@width": "219",
            "@_fa": "true",
            "$": "https://api.elsevier.com/content/object/eid/1-s2.0-S0957417424018098-gr7.sml?httpAccept=%2A%2F%2A",
            "@multimediatype": "GIF image file",
            "@type": "IMAGE-THUMBNAIL",
            "@size": "73848",
            "@ref": "gr7",
            "@mimetype": "image/gif"
        },
        {
            "@category": "thumbnail",
            "@height": "163",
            "@width": "219",
            "@_fa": "true",
            "$": "https://api.elsevier.com/content/object/eid/1-s2.0-S0957417424018098-gr12.sml?httpAccept=%2A%2F%2A",
            "@multimediatype": "GIF image file",
            "@type": "IMAGE-THUMBNAIL",
            "@size": "73272",
            "@ref": "gr12",
            "@mimetype": "image/gif"
        },
        {
            "@category": "thumbnail",
            "@height": "53",
            "@width": "219",
            "@_fa": "true",
            "$": "https://api.elsevier.com/content/object/eid/1-s2.0-S0957417424018098-gr8.sml?httpAccept=%2A%2F%2A",
            "@multimediatype": "GIF image file",
            "@type": "IMAGE-THUMBNAIL",
            "@size": "68373",
            "@ref": "gr8",
            "@mimetype": "image/gif"
        },
        {
            "@category": "thumbnail",
            "@height": "164",
            "@width": "217",
            "@_fa": "true",
            "$": "https://api.elsevier.com/content/object/eid/1-s2.0-S0957417424018098-gr13.sml?httpAccept=%2A%2F%2A",
            "@multimediatype": "GIF image file",
            "@type": "IMAGE-THUMBNAIL",
            "@size": "73705",
            "@ref": "gr13",
            "@mimetype": "image/gif"
        },
        {
            "@category": "thumbnail",
            "@height": "32",
            "@width": "219",
            "@_fa": "true",
            "$": "https://api.elsevier.com/content/object/eid/1-s2.0-S0957417424018098-gr9.sml?httpAccept=%2A%2F%2A",
            "@multimediatype": "GIF image file",
            "@type": "IMAGE-THUMBNAIL",
            "@size": "67653",
            "@ref": "gr9",
            "@mimetype": "image/gif"
        },
        {
            "@category": "thumbnail",
            "@height": "143",
            "@width": "219",
            "@_fa": "true",
            "$": "https://api.elsevier.com/content/object/eid/1-s2.0-S0957417424018098-gr14.sml?httpAccept=%2A%2F%2A",
            "@multimediatype": "GIF image file",
            "@type": "IMAGE-THUMBNAIL",
            "@size": "75822",
            "@ref": "gr14",
            "@mimetype": "image/gif"
        },
        {
            "@category": "thumbnail",
            "@height": "143",
            "@width": "219",
            "@_fa": "true",
            "$": "https://api.elsevier.com/content/object/eid/1-s2.0-S0957417424018098-gr15.sml?httpAccept=%2A%2F%2A",
            "@multimediatype": "GIF image file",
            "@type": "IMAGE-THUMBNAIL",
            "@size": "75951",
            "@ref": "gr15",
            "@mimetype": "image/gif"
        },
        {
            "@category": "thumbnail",
            "@height": "164",
            "@width": "149",
            "@_fa": "true",
            "$": "https://api.elsevier.com/content/object/eid/1-s2.0-S0957417424018098-gr3.sml?httpAccept=%2A%2F%2A",
            "@multimediatype": "GIF image file",
            "@type": "IMAGE-THUMBNAIL",
            "@size": "84324",
            "@ref": "gr3",
            "@mimetype": "image/gif"
        },
        {
            "@category": "thumbnail",
            "@height": "152",
            "@width": "219",
            "@_fa": "true",
            "$": "https://api.elsevier.com/content/object/eid/1-s2.0-S0957417424018098-fx41.sml?httpAccept=%2A%2F%2A",
            "@multimediatype": "GIF image file",
            "@type": "IMAGE-THUMBNAIL",
            "@size": "39746",
            "@ref": "fx41",
            "@mimetype": "image/gif"
        },
        {
            "@category": "thumbnail",
            "@height": "163",
            "@width": "163",
            "@_fa": "true",
            "$": "https://api.elsevier.com/content/object/eid/1-s2.0-S0957417424018098-gr4.sml?httpAccept=%2A%2F%2A",
            "@multimediatype": "GIF image file",
            "@type": "IMAGE-THUMBNAIL",
            "@size": "80365",
            "@ref": "gr4",
            "@mimetype": "image/gif"
        },
        {
            "@category": "thumbnail",
            "@height": "152",
            "@width": "219",
            "@_fa": "true",
            "$": "https://api.elsevier.com/content/object/eid/1-s2.0-S0957417424018098-fx40.sml?httpAccept=%2A%2F%2A",
            "@multimediatype": "GIF image file",
            "@type": "IMAGE-THUMBNAIL",
            "@size": "35986",
            "@ref": "fx40",
            "@mimetype": "image/gif"
        },
        {
            "@category": "thumbnail",
            "@height": "148",
            "@width": "219",
            "@_fa": "true",
            "$": "https://api.elsevier.com/content/object/eid/1-s2.0-S0957417424018098-gr5.sml?httpAccept=%2A%2F%2A",
            "@multimediatype": "GIF image file",
            "@type": "IMAGE-THUMBNAIL",
            "@size": "73193",
            "@ref": "gr5",
            "@mimetype": "image/gif"
        },
        {
            "@category": "thumbnail",
            "@height": "137",
            "@width": "219",
            "@_fa": "true",
            "$": "https://api.elsevier.com/content/object/eid/1-s2.0-S0957417424018098-gr10.sml?httpAccept=%2A%2F%2A",
            "@multimediatype": "GIF image file",
            "@type": "IMAGE-THUMBNAIL",
            "@size": "75073",
            "@ref": "gr10",
            "@mimetype": "image/gif"
        },
        {
            "@category": "thumbnail",
            "@height": "163",
            "@width": "187",
            "@_fa": "true",
            "$": "https://api.elsevier.com/content/object/eid/1-s2.0-S0957417424018098-gr6.sml?httpAccept=%2A%2F%2A",
            "@multimediatype": "GIF image file",
            "@type": "IMAGE-THUMBNAIL",
            "@size": "76293",
            "@ref": "gr6",
            "@mimetype": "image/gif"
        },
        {
            "@category": "thumbnail",
            "@height": "139",
            "@width": "219",
            "@_fa": "true",
            "$": "https://api.elsevier.com/content/object/eid/1-s2.0-S0957417424018098-gr11.sml?httpAccept=%2A%2F%2A",
            "@multimediatype": "GIF image file",
            "@type": "IMAGE-THUMBNAIL",
            "@size": "86742",
            "@ref": "gr11",
            "@mimetype": "image/gif"
        },
        {
            "@category": "thumbnail",
            "@height": "110",
            "@width": "219",
            "@_fa": "true",
            "$": "https://api.elsevier.com/content/object/eid/1-s2.0-S0957417424018098-fx6.sml?httpAccept=%2A%2F%2A",
            "@multimediatype": "GIF image file",
            "@type": "IMAGE-THUMBNAIL",
            "@size": "26148",
            "@ref": "fx6",
            "@mimetype": "image/gif"
        },
        {
            "@category": "thumbnail",
            "@height": "110",
            "@width": "219",
            "@_fa": "true",
            "$": "https://api.elsevier.com/content/object/eid/1-s2.0-S0957417424018098-fx7.sml?httpAccept=%2A%2F%2A",
            "@multimediatype": "GIF image file",
            "@type": "IMAGE-THUMBNAIL",
            "@size": "27970",
            "@ref": "fx7",
            "@mimetype": "image/gif"
        },
        {
            "@category": "thumbnail",
            "@height": "57",
            "@width": "219",
            "@_fa": "true",
            "$": "https://api.elsevier.com/content/object/eid/1-s2.0-S0957417424018098-gr1.sml?httpAccept=%2A%2F%2A",
            "@multimediatype": "GIF image file",
            "@type": "IMAGE-THUMBNAIL",
            "@size": "68890",
            "@ref": "gr1",
            "@mimetype": "image/gif"
        },
        {
            "@category": "thumbnail",
            "@height": "110",
            "@width": "219",
            "@_fa": "true",
            "$": "https://api.elsevier.com/content/object/eid/1-s2.0-S0957417424018098-fx8.sml?httpAccept=%2A%2F%2A",
            "@multimediatype": "GIF image file",
            "@type": "IMAGE-THUMBNAIL",
            "@size": "27995",
            "@ref": "fx8",
            "@mimetype": "image/gif"
        },
        {
            "@category": "thumbnail",
            "@height": "67",
            "@width": "219",
            "@_fa": "true",
            "$": "https://api.elsevier.com/content/object/eid/1-s2.0-S0957417424018098-gr2.sml?httpAccept=%2A%2F%2A",
            "@multimediatype": "GIF image file",
            "@type": "IMAGE-THUMBNAIL",
            "@size": "80840",
            "@ref": "gr2",
            "@mimetype": "image/gif"
        },
        {
            "@category": "thumbnail",
            "@height": "128",
            "@width": "219",
            "@_fa": "true",
            "$": "https://api.elsevier.com/content/object/eid/1-s2.0-S0957417424018098-fx9.sml?httpAccept=%2A%2F%2A",
            "@multimediatype": "GIF image file",
            "@type": "IMAGE-THUMBNAIL",
            "@size": "33338",
            "@ref": "fx9",
            "@mimetype": "image/gif"
        },
        {
            "@category": "thumbnail",
            "@height": "110",
            "@width": "219",
            "@_fa": "true",
            "$": "https://api.elsevier.com/content/object/eid/1-s2.0-S0957417424018098-fx2.sml?httpAccept=%2A%2F%2A",
            "@multimediatype": "GIF image file",
            "@type": "IMAGE-THUMBNAIL",
            "@size": "30367",
            "@ref": "fx2",
            "@mimetype": "image/gif"
        },
        {
            "@category": "thumbnail",
            "@height": "110",
            "@width": "219",
            "@_fa": "true",
            "$": "https://api.elsevier.com/content/object/eid/1-s2.0-S0957417424018098-fx3.sml?httpAccept=%2A%2F%2A",
            "@multimediatype": "GIF image file",
            "@type": "IMAGE-THUMBNAIL",
            "@size": "27184",
            "@ref": "fx3",
            "@mimetype": "image/gif"
        },
        {
            "@category": "thumbnail",
            "@height": "110",
            "@width": "219",
            "@_fa": "true",
            "$": "https://api.elsevier.com/content/object/eid/1-s2.0-S0957417424018098-fx4.sml?httpAccept=%2A%2F%2A",
            "@multimediatype": "GIF image file",
            "@type": "IMAGE-THUMBNAIL",
            "@size": "27159",
            "@ref": "fx4",
            "@mimetype": "image/gif"
        },
        {
            "@category": "thumbnail",
            "@height": "110",
            "@width": "219",
            "@_fa": "true",
            "$": "https://api.elsevier.com/content/object/eid/1-s2.0-S0957417424018098-fx5.sml?httpAccept=%2A%2F%2A",
            "@multimediatype": "GIF image file",
            "@type": "IMAGE-THUMBNAIL",
            "@size": "25959",
            "@ref": "fx5",
            "@mimetype": "image/gif"
        },
        {
            "@category": "thumbnail",
            "@height": "110",
            "@width": "219",
            "@_fa": "true",
            "$": "https://api.elsevier.com/content/object/eid/1-s2.0-S0957417424018098-fx1.sml?httpAccept=%2A%2F%2A",
            "@multimediatype": "GIF image file",
            "@type": "IMAGE-THUMBNAIL",
            "@size": "30423",
            "@ref": "fx1",
            "@mimetype": "image/gif"
        },
        {
            "@category": "thumbnail",
            "@height": "151",
            "@width": "219",
            "@_fa": "true",
            "$": "https://api.elsevier.com/content/object/eid/1-s2.0-S0957417424018098-fx34.sml?httpAccept=%2A%2F%2A",
            "@multimediatype": "GIF image file",
            "@type": "IMAGE-THUMBNAIL",
            "@size": "32626",
            "@ref": "fx34",
            "@mimetype": "image/gif"
        },
        {
            "@category": "thumbnail",
            "@height": "151",
            "@width": "219",
            "@_fa": "true",
            "$": "https://api.elsevier.com/content/object/eid/1-s2.0-S0957417424018098-fx33.sml?httpAccept=%2A%2F%2A",
            "@multimediatype": "GIF image file",
            "@type": "IMAGE-THUMBNAIL",
            "@size": "35224",
            "@ref": "fx33",
            "@mimetype": "image/gif"
        },
        {
            "@category": "thumbnail",
            "@height": "151",
            "@width": "219",
            "@_fa": "true",
            "$": "https://api.elsevier.com/content/object/eid/1-s2.0-S0957417424018098-fx32.sml?httpAccept=%2A%2F%2A",
            "@multimediatype": "GIF image file",
            "@type": "IMAGE-THUMBNAIL",
            "@size": "28666",
            "@ref": "fx32",
            "@mimetype": "image/gif"
        },
        {
            "@category": "thumbnail",
            "@height": "151",
            "@width": "219",
            "@_fa": "true",
            "$": "https://api.elsevier.com/content/object/eid/1-s2.0-S0957417424018098-fx31.sml?httpAccept=%2A%2F%2A",
            "@multimediatype": "GIF image file",
            "@type": "IMAGE-THUMBNAIL",
            "@size": "35573",
            "@ref": "fx31",
            "@mimetype": "image/gif"
        },
        {
            "@category": "thumbnail",
            "@height": "151",
            "@width": "219",
            "@_fa": "true",
            "$": "https://api.elsevier.com/content/object/eid/1-s2.0-S0957417424018098-fx38.sml?httpAccept=%2A%2F%2A",
            "@multimediatype": "GIF image file",
            "@type": "IMAGE-THUMBNAIL",
            "@size": "28899",
            "@ref": "fx38",
            "@mimetype": "image/gif"
        },
        {
            "@category": "thumbnail",
            "@height": "151",
            "@width": "219",
            "@_fa": "true",
            "$": "https://api.elsevier.com/content/object/eid/1-s2.0-S0957417424018098-fx37.sml?httpAccept=%2A%2F%2A",
            "@multimediatype": "GIF image file",
            "@type": "IMAGE-THUMBNAIL",
            "@size": "32258",
            "@ref": "fx37",
            "@mimetype": "image/gif"
        },
        {
            "@category": "thumbnail",
            "@height": "151",
            "@width": "219",
            "@_fa": "true",
            "$": "https://api.elsevier.com/content/object/eid/1-s2.0-S0957417424018098-fx36.sml?httpAccept=%2A%2F%2A",
            "@multimediatype": "GIF image file",
            "@type": "IMAGE-THUMBNAIL",
            "@size": "35361",
            "@ref": "fx36",
            "@mimetype": "image/gif"
        },
        {
            "@category": "thumbnail",
            "@height": "151",
            "@width": "219",
            "@_fa": "true",
            "$": "https://api.elsevier.com/content/object/eid/1-s2.0-S0957417424018098-fx35.sml?httpAccept=%2A%2F%2A",
            "@multimediatype": "GIF image file",
            "@type": "IMAGE-THUMBNAIL",
            "@size": "28735",
            "@ref": "fx35",
            "@mimetype": "image/gif"
        },
        {
            "@category": "thumbnail",
            "@height": "151",
            "@width": "219",
            "@_fa": "true",
            "$": "https://api.elsevier.com/content/object/eid/1-s2.0-S0957417424018098-fx30.sml?httpAccept=%2A%2F%2A",
            "@multimediatype": "GIF image file",
            "@type": "IMAGE-THUMBNAIL",
            "@size": "35379",
            "@ref": "fx30",
            "@mimetype": "image/gif"
        },
        {
            "@category": "thumbnail",
            "@height": "151",
            "@width": "219",
            "@_fa": "true",
            "$": "https://api.elsevier.com/content/object/eid/1-s2.0-S0957417424018098-fx39.sml?httpAccept=%2A%2F%2A",
            "@multimediatype": "GIF image file",
            "@type": "IMAGE-THUMBNAIL",
            "@size": "35395",
            "@ref": "fx39",
            "@mimetype": "image/gif"
        },
        {
            "@category": "thumbnail",
            "@height": "151",
            "@width": "219",
            "@_fa": "true",
            "$": "https://api.elsevier.com/content/object/eid/1-s2.0-S0957417424018098-fx23.sml?httpAccept=%2A%2F%2A",
            "@multimediatype": "GIF image file",
            "@type": "IMAGE-THUMBNAIL",
            "@size": "28440",
            "@ref": "fx23",
            "@mimetype": "image/gif"
        },
        {
            "@category": "thumbnail",
            "@height": "151",
            "@width": "219",
            "@_fa": "true",
            "$": "https://api.elsevier.com/content/object/eid/1-s2.0-S0957417424018098-fx22.sml?httpAccept=%2A%2F%2A",
            "@multimediatype": "GIF image file",
            "@type": "IMAGE-THUMBNAIL",
            "@size": "32039",
            "@ref": "fx22",
            "@mimetype": "image/gif"
        },
        {
            "@category": "thumbnail",
            "@height": "151",
            "@width": "219",
            "@_fa": "true",
            "$": "https://api.elsevier.com/content/object/eid/1-s2.0-S0957417424018098-fx66.sml?httpAccept=%2A%2F%2A",
            "@multimediatype": "GIF image file",
            "@type": "IMAGE-THUMBNAIL",
            "@size": "37595",
            "@ref": "fx66",
            "@mimetype": "image/gif"
        },
        {
            "@category": "thumbnail",
            "@height": "152",
            "@width": "219",
            "@_fa": "true",
            "$": "https://api.elsevier.com/content/object/eid/1-s2.0-S0957417424018098-fx21.sml?httpAccept=%2A%2F%2A",
            "@multimediatype": "GIF image file",
            "@type": "IMAGE-THUMBNAIL",
            "@size": "35620",
            "@ref": "fx21",
            "@mimetype": "image/gif"
        },
        {
            "@category": "thumbnail",
            "@height": "151",
            "@width": "219",
            "@_fa": "true",
            "$": "https://api.elsevier.com/content/object/eid/1-s2.0-S0957417424018098-fx65.sml?httpAccept=%2A%2F%2A",
            "@multimediatype": "GIF image file",
            "@type": "IMAGE-THUMBNAIL",
            "@size": "39119",
            "@ref": "fx65",
            "@mimetype": "image/gif"
        },
        {
            "@category": "thumbnail",
            "@height": "152",
            "@width": "219",
            "@_fa": "true",
            "$": "https://api.elsevier.com/content/object/eid/1-s2.0-S0957417424018098-fx20.sml?httpAccept=%2A%2F%2A",
            "@multimediatype": "GIF image file",
            "@type": "IMAGE-THUMBNAIL",
            "@size": "27841",
            "@ref": "fx20",
            "@mimetype": "image/gif"
        },
        {
            "@category": "thumbnail",
            "@height": "151",
            "@width": "219",
            "@_fa": "true",
            "$": "https://api.elsevier.com/content/object/eid/1-s2.0-S0957417424018098-fx64.sml?httpAccept=%2A%2F%2A",
            "@multimediatype": "GIF image file",
            "@type": "IMAGE-THUMBNAIL",
            "@size": "35589",
            "@ref": "fx64",
            "@mimetype": "image/gif"
        },
        {
            "@category": "thumbnail",
            "@height": "151",
            "@width": "219",
            "@_fa": "true",
            "$": "https://api.elsevier.com/content/object/eid/1-s2.0-S0957417424018098-fx27.sml?httpAccept=%2A%2F%2A",
            "@multimediatype": "GIF image file",
            "@type": "IMAGE-THUMBNAIL",
            "@size": "35422",
            "@ref": "fx27",
            "@mimetype": "image/gif"
        },
        {
            "@category": "thumbnail",
            "@height": "151",
            "@width": "219",
            "@_fa": "true",
            "$": "https://api.elsevier.com/content/object/eid/1-s2.0-S0957417424018098-fx26.sml?httpAccept=%2A%2F%2A",
            "@multimediatype": "GIF image file",
            "@type": "IMAGE-THUMBNAIL",
            "@size": "28643",
            "@ref": "fx26",
            "@mimetype": "image/gif"
        },
        {
            "@category": "thumbnail",
            "@height": "151",
            "@width": "219",
            "@_fa": "true",
            "$": "https://api.elsevier.com/content/object/eid/1-s2.0-S0957417424018098-fx25.sml?httpAccept=%2A%2F%2A",
            "@multimediatype": "GIF image file",
            "@type": "IMAGE-THUMBNAIL",
            "@size": "32574",
            "@ref": "fx25",
            "@mimetype": "image/gif"
        },
        {
            "@category": "thumbnail",
            "@height": "151",
            "@width": "219",
            "@_fa": "true",
            "$": "https://api.elsevier.com/content/object/eid/1-s2.0-S0957417424018098-fx24.sml?httpAccept=%2A%2F%2A",
            "@multimediatype": "GIF image file",
            "@type": "IMAGE-THUMBNAIL",
            "@size": "35395",
            "@ref": "fx24",
            "@mimetype": "image/gif"
        },
        {
            "@category": "thumbnail",
            "@height": "151",
            "@width": "219",
            "@_fa": "true",
            "$": "https://api.elsevier.com/content/object/eid/1-s2.0-S0957417424018098-fx63.sml?httpAccept=%2A%2F%2A",
            "@multimediatype": "GIF image file",
            "@type": "IMAGE-THUMBNAIL",
            "@size": "37949",
            "@ref": "fx63",
            "@mimetype": "image/gif"
        },
        {
            "@category": "thumbnail",
            "@height": "151",
            "@width": "219",
            "@_fa": "true",
            "$": "https://api.elsevier.com/content/object/eid/1-s2.0-S0957417424018098-fx62.sml?httpAccept=%2A%2F%2A",
            "@multimediatype": "GIF image file",
            "@type": "IMAGE-THUMBNAIL",
            "@size": "39119",
            "@ref": "fx62",
            "@mimetype": "image/gif"
        },
        {
            "@category": "thumbnail",
            "@height": "151",
            "@width": "219",
            "@_fa": "true",
            "$": "https://api.elsevier.com/content/object/eid/1-s2.0-S0957417424018098-fx61.sml?httpAccept=%2A%2F%2A",
            "@multimediatype": "GIF image file",
            "@type": "IMAGE-THUMBNAIL",
            "@size": "35573",
            "@ref": "fx61",
            "@mimetype": "image/gif"
        },
        {
            "@category": "thumbnail",
            "@height": "151",
            "@width": "219",
            "@_fa": "true",
            "$": "https://api.elsevier.com/content/object/eid/1-s2.0-S0957417424018098-fx60.sml?httpAccept=%2A%2F%2A",
            "@multimediatype": "GIF image file",
            "@type": "IMAGE-THUMBNAIL",
            "@size": "37862",
            "@ref": "fx60",
            "@mimetype": "image/gif"
        },
        {
            "@category": "thumbnail",
            "@height": "151",
            "@width": "219",
            "@_fa": "true",
            "$": "https://api.elsevier.com/content/object/eid/1-s2.0-S0957417424018098-fx29.sml?httpAccept=%2A%2F%2A",
            "@multimediatype": "GIF image file",
            "@type": "IMAGE-THUMBNAIL",
            "@size": "28563",
            "@ref": "fx29",
            "@mimetype": "image/gif"
        },
        {
            "@category": "thumbnail",
            "@height": "151",
            "@width": "219",
            "@_fa": "true",
            "$": "https://api.elsevier.com/content/object/eid/1-s2.0-S0957417424018098-fx28.sml?httpAccept=%2A%2F%2A",
            "@multimediatype": "GIF image file",
            "@type": "IMAGE-THUMBNAIL",
            "@size": "32663",
            "@ref": "fx28",
            "@mimetype": "image/gif"
        },
        {
            "@category": "high",
            "@height": "473",
            "@width": "945",
            "@_fa": "true",
            "$": "https://api.elsevier.com/content/object/eid/1-s2.0-S0957417424018098-fx12_lrg.jpg?httpAccept=%2A%2F%2A",
            "@multimediatype": "JPEG image file",
            "@type": "IMAGE-HIGH-RES",
            "@size": "117653",
            "@ref": "fx12",
            "@mimetype": "image/jpeg"
        },
        {
            "@category": "high",
            "@height": "587",
            "@width": "851",
            "@_fa": "true",
            "$": "https://api.elsevier.com/content/object/eid/1-s2.0-S0957417424018098-fx56_lrg.jpg?httpAccept=%2A%2F%2A",
            "@multimediatype": "JPEG image file",
            "@type": "IMAGE-HIGH-RES",
            "@size": "137968",
            "@ref": "fx56",
            "@mimetype": "image/jpeg"
        },
        {
            "@category": "high",
            "@height": "473",
            "@width": "945",
            "@_fa": "true",
            "$": "https://api.elsevier.com/content/object/eid/1-s2.0-S0957417424018098-fx11_lrg.jpg?httpAccept=%2A%2F%2A",
            "@multimediatype": "JPEG image file",
            "@type": "IMAGE-HIGH-RES",
            "@size": "106284",
            "@ref": "fx11",
            "@mimetype": "image/jpeg"
        },
        {
            "@category": "high",
            "@height": "587",
            "@width": "851",
            "@_fa": "true",
            "$": "https://api.elsevier.com/content/object/eid/1-s2.0-S0957417424018098-fx55_lrg.jpg?httpAccept=%2A%2F%2A",
            "@multimediatype": "JPEG image file",
            "@type": "IMAGE-HIGH-RES",
            "@size": "143626",
            "@ref": "fx55",
            "@mimetype": "image/jpeg"
        },
        {
            "@category": "high",
            "@height": "552",
            "@width": "945",
            "@_fa": "true",
            "$": "https://api.elsevier.com/content/object/eid/1-s2.0-S0957417424018098-fx10_lrg.jpg?httpAccept=%2A%2F%2A",
            "@multimediatype": "JPEG image file",
            "@type": "IMAGE-HIGH-RES",
            "@size": "147485",
            "@ref": "fx10",
            "@mimetype": "image/jpeg"
        },
        {
            "@category": "high",
            "@height": "586",
            "@width": "851",
            "@_fa": "true",
            "$": "https://api.elsevier.com/content/object/eid/1-s2.0-S0957417424018098-fx54_lrg.jpg?httpAccept=%2A%2F%2A",
            "@multimediatype": "JPEG image file",
            "@type": "IMAGE-HIGH-RES",
            "@size": "157839",
            "@ref": "fx54",
            "@mimetype": "image/jpeg"
        },
        {
            "@category": "high",
            "@height": "587",
            "@width": "851",
            "@_fa": "true",
            "$": "https://api.elsevier.com/content/object/eid/1-s2.0-S0957417424018098-fx53_lrg.jpg?httpAccept=%2A%2F%2A",
            "@multimediatype": "JPEG image file",
            "@type": "IMAGE-HIGH-RES",
            "@size": "137968",
            "@ref": "fx53",
            "@mimetype": "image/jpeg"
        },
        {
            "@category": "high",
            "@height": "589",
            "@width": "851",
            "@_fa": "true",
            "$": "https://api.elsevier.com/content/object/eid/1-s2.0-S0957417424018098-fx16_lrg.jpg?httpAccept=%2A%2F%2A",
            "@multimediatype": "JPEG image file",
            "@type": "IMAGE-HIGH-RES",
            "@size": "121260",
            "@ref": "fx16",
            "@mimetype": "image/jpeg"
        },
        {
            "@category": "high",
            "@height": "591",
            "@width": "851",
            "@_fa": "true",
            "$": "https://api.elsevier.com/content/object/eid/1-s2.0-S0957417424018098-fx15_lrg.jpg?httpAccept=%2A%2F%2A",
            "@multimediatype": "JPEG image file",
            "@type": "IMAGE-HIGH-RES",
            "@size": "117469",
            "@ref": "fx15",
            "@mimetype": "image/jpeg"
        },
        {
            "@category": "high",
            "@height": "587",
            "@width": "851",
            "@_fa": "true",
            "$": "https://api.elsevier.com/content/object/eid/1-s2.0-S0957417424018098-fx59_lrg.jpg?httpAccept=%2A%2F%2A",
            "@multimediatype": "JPEG image file",
            "@type": "IMAGE-HIGH-RES",
            "@size": "139480",
            "@ref": "fx59",
            "@mimetype": "image/jpeg"
        },
        {
            "@category": "high",
            "@height": "589",
            "@width": "851",
            "@_fa": "true",
            "$": "https://api.elsevier.com/content/object/eid/1-s2.0-S0957417424018098-fx14_lrg.jpg?httpAccept=%2A%2F%2A",
            "@multimediatype": "JPEG image file",
            "@type": "IMAGE-HIGH-RES",
            "@size": "65143",
            "@ref": "fx14",
            "@mimetype": "image/jpeg"
        },
        {
            "@category": "high",
            "@height": "587",
            "@width": "851",
            "@_fa": "true",
            "$": "https://api.elsevier.com/content/object/eid/1-s2.0-S0957417424018098-fx58_lrg.jpg?httpAccept=%2A%2F%2A",
            "@multimediatype": "JPEG image file",
            "@type": "IMAGE-HIGH-RES",
            "@size": "145012",
            "@ref": "fx58",
            "@mimetype": "image/jpeg"
        },
        {
            "@category": "high",
            "@height": "589",
            "@width": "851",
            "@_fa": "true",
            "$": "https://api.elsevier.com/content/object/eid/1-s2.0-S0957417424018098-fx13_lrg.jpg?httpAccept=%2A%2F%2A",
            "@multimediatype": "JPEG image file",
            "@type": "IMAGE-HIGH-RES",
            "@size": "121380",
            "@ref": "fx13",
            "@mimetype": "image/jpeg"
        },
        {
            "@category": "high",
            "@height": "586",
            "@width": "851",
            "@_fa": "true",
            "$": "https://api.elsevier.com/content/object/eid/1-s2.0-S0957417424018098-fx57_lrg.jpg?httpAccept=%2A%2F%2A",
            "@multimediatype": "JPEG image file",
            "@type": "IMAGE-HIGH-RES",
            "@size": "157838",
            "@ref": "fx57",
            "@mimetype": "image/jpeg"
        },
        {
            "@category": "high",
            "@height": "587",
            "@width": "851",
            "@_fa": "true",
            "$": "https://api.elsevier.com/content/object/eid/1-s2.0-S0957417424018098-fx52_lrg.jpg?httpAccept=%2A%2F%2A",
            "@multimediatype": "JPEG image file",
            "@type": "IMAGE-HIGH-RES",
            "@size": "143626",
            "@ref": "fx52",
            "@mimetype": "image/jpeg"
        },
        {
            "@category": "high",
            "@height": "587",
            "@width": "851",
            "@_fa": "true",
            "$": "https://api.elsevier.com/content/object/eid/1-s2.0-S0957417424018098-fx51_lrg.jpg?httpAccept=%2A%2F%2A",
            "@multimediatype": "JPEG image file",
            "@type": "IMAGE-HIGH-RES",
            "@size": "159542",
            "@ref": "fx51",
            "@mimetype": "image/jpeg"
        },
        {
            "@category": "high",
            "@height": "587",
            "@width": "851",
            "@_fa": "true",
            "$": "https://api.elsevier.com/content/object/eid/1-s2.0-S0957417424018098-fx50_lrg.jpg?httpAccept=%2A%2F%2A",
            "@multimediatype": "JPEG image file",
            "@type": "IMAGE-HIGH-RES",
            "@size": "139488",
            "@ref": "fx50",
            "@mimetype": "image/jpeg"
        },
        {
            "@category": "high",
            "@height": "589",
            "@width": "851",
            "@_fa": "true",
            "$": "https://api.elsevier.com/content/object/eid/1-s2.0-S0957417424018098-fx19_lrg.jpg?httpAccept=%2A%2F%2A",
            "@multimediatype": "JPEG image file",
            "@type": "IMAGE-HIGH-RES",
            "@size": "121988",
            "@ref": "fx19",
            "@mimetype": "image/jpeg"
        },
        {
            "@category": "high",
            "@height": "589",
            "@width": "851",
            "@_fa": "true",
            "$": "https://api.elsevier.com/content/object/eid/1-s2.0-S0957417424018098-fx18_lrg.jpg?httpAccept=%2A%2F%2A",
            "@multimediatype": "JPEG image file",
            "@type": "IMAGE-HIGH-RES",
            "@size": "111967",
            "@ref": "fx18",
            "@mimetype": "image/jpeg"
        },
        {
            "@category": "high",
            "@height": "589",
            "@width": "851",
            "@_fa": "true",
            "$": "https://api.elsevier.com/content/object/eid/1-s2.0-S0957417424018098-fx17_lrg.jpg?httpAccept=%2A%2F%2A",
            "@multimediatype": "JPEG image file",
            "@type": "IMAGE-HIGH-RES",
            "@size": "64014",
            "@ref": "fx17",
            "@mimetype": "image/jpeg"
        },
        {
            "@category": "high",
            "@height": "589",
            "@width": "851",
            "@_fa": "true",
            "$": "https://api.elsevier.com/content/object/eid/1-s2.0-S0957417424018098-fx45_lrg.jpg?httpAccept=%2A%2F%2A",
            "@multimediatype": "JPEG image file",
            "@type": "IMAGE-HIGH-RES",
            "@size": "133616",
            "@ref": "fx45",
            "@mimetype": "image/jpeg"
        },
        {
            "@category": "high",
            "@height": "589",
            "@width": "851",
            "@_fa": "true",
            "$": "https://api.elsevier.com/content/object/eid/1-s2.0-S0957417424018098-fx44_lrg.jpg?httpAccept=%2A%2F%2A",
            "@multimediatype": "JPEG image file",
            "@type": "IMAGE-HIGH-RES",
            "@size": "125920",
            "@ref": "fx44",
            "@mimetype": "image/jpeg"
        },
        {
            "@category": "high",
            "@height": "589",
            "@width": "851",
            "@_fa": "true",
            "$": "https://api.elsevier.com/content/object/eid/1-s2.0-S0957417424018098-fx43_lrg.jpg?httpAccept=%2A%2F%2A",
            "@multimediatype": "JPEG image file",
            "@type": "IMAGE-HIGH-RES",
            "@size": "129984",
            "@ref": "fx43",
            "@mimetype": "image/jpeg"
        },
        {
            "@category": "high",
            "@height": "588",
            "@width": "851",
            "@_fa": "true",
            "$": "https://api.elsevier.com/content/object/eid/1-s2.0-S0957417424018098-fx42_lrg.jpg?httpAccept=%2A%2F%2A",
            "@multimediatype": "JPEG image file",
            "@type": "IMAGE-HIGH-RES",
            "@size": "131297",
            "@ref": "fx42",
            "@mimetype": "image/jpeg"
        },
        {
            "@category": "high",
            "@height": "1552",
            "@width": "3208",
            "@_fa": "true",
            "$": "https://api.elsevier.com/content/object/eid/1-s2.0-S0957417424018098-gr16_lrg.jpg?httpAccept=%2A%2F%2A",
            "@multimediatype": "JPEG image file",
            "@type": "IMAGE-HIGH-RES",
            "@size": "286341",
            "@ref": "gr16",
            "@mimetype": "image/jpeg"
        },
        {
            "@category": "high",
            "@height": "587",
            "@width": "851",
            "@_fa": "true",
            "$": "https://api.elsevier.com/content/object/eid/1-s2.0-S0957417424018098-fx49_lrg.jpg?httpAccept=%2A%2F%2A",
            "@multimediatype": "JPEG image file",
            "@type": "IMAGE-HIGH-RES",
            "@size": "145004",
            "@ref": "fx49",
            "@mimetype": "image/jpeg"
        },
        {
            "@category": "high",
            "@height": "2531",
            "@width": "3238",
            "@_fa": "true",
            "$": "https://api.elsevier.com/content/object/eid/1-s2.0-S0957417424018098-gr17_lrg.jpg?httpAccept=%2A%2F%2A",
            "@multimediatype": "JPEG image file",
            "@type": "IMAGE-HIGH-RES",
            "@size": "2431335",
            "@ref": "gr17",
            "@mimetype": "image/jpeg"
        },
        {
            "@category": "high",
            "@height": "588",
            "@width": "851",
            "@_fa": "true",
            "$": "https://api.elsevier.com/content/object/eid/1-s2.0-S0957417424018098-fx48_lrg.jpg?httpAccept=%2A%2F%2A",
            "@multimediatype": "JPEG image file",
            "@type": "IMAGE-HIGH-RES",
            "@size": "131305",
            "@ref": "fx48",
            "@mimetype": "image/jpeg"
        },
        {
            "@category": "high",
            "@height": "589",
            "@width": "851",
            "@_fa": "true",
            "$": "https://api.elsevier.com/content/object/eid/1-s2.0-S0957417424018098-fx47_lrg.jpg?httpAccept=%2A%2F%2A",
            "@multimediatype": "JPEG image file",
            "@type": "IMAGE-HIGH-RES",
            "@size": "126702",
            "@ref": "fx47",
            "@mimetype": "image/jpeg"
        },
        {
            "@category": "high",
            "@height": "589",
            "@width": "851",
            "@_fa": "true",
            "$": "https://api.elsevier.com/content/object/eid/1-s2.0-S0957417424018098-fx46_lrg.jpg?httpAccept=%2A%2F%2A",
            "@multimediatype": "JPEG image file",
            "@type": "IMAGE-HIGH-RES",
            "@size": "129795",
            "@ref": "fx46",
            "@mimetype": "image/jpeg"
        },
        {
            "@category": "high",
            "@height": "1449",
            "@width": "2697",
            "@_fa": "true",
            "$": "https://api.elsevier.com/content/object/eid/1-s2.0-S0957417424018098-gr7_lrg.jpg?httpAccept=%2A%2F%2A",
            "@multimediatype": "JPEG image file",
            "@type": "IMAGE-HIGH-RES",
            "@size": "352596",
            "@ref": "gr7",
            "@mimetype": "image/jpeg"
        },
        {
            "@category": "high",
            "@height": "1267",
            "@width": "1704",
            "@_fa": "true",
            "$": "https://api.elsevier.com/content/object/eid/1-s2.0-S0957417424018098-gr12_lrg.jpg?httpAccept=%2A%2F%2A",
            "@multimediatype": "JPEG image file",
            "@type": "IMAGE-HIGH-RES",
            "@size": "250808",
            "@ref": "gr12",
            "@mimetype": "image/jpeg"
        },
        {
            "@category": "high",
            "@height": "699",
            "@width": "2898",
            "@_fa": "true",
            "$": "https://api.elsevier.com/content/object/eid/1-s2.0-S0957417424018098-gr8_lrg.jpg?httpAccept=%2A%2F%2A",
            "@multimediatype": "JPEG image file",
            "@type": "IMAGE-HIGH-RES",
            "@size": "202327",
            "@ref": "gr8",
            "@mimetype": "image/jpeg"
        },
        {
            "@category": "high",
            "@height": "1282",
            "@width": "1695",
            "@_fa": "true",
            "$": "https://api.elsevier.com/content/object/eid/1-s2.0-S0957417424018098-gr13_lrg.jpg?httpAccept=%2A%2F%2A",
            "@multimediatype": "JPEG image file",
            "@type": "IMAGE-HIGH-RES",
            "@size": "257299",
            "@ref": "gr13",
            "@mimetype": "image/jpeg"
        },
        {
            "@category": "high",
            "@height": "433",
            "@width": "2956",
            "@_fa": "true",
            "$": "https://api.elsevier.com/content/object/eid/1-s2.0-S0957417424018098-gr9_lrg.jpg?httpAccept=%2A%2F%2A",
            "@multimediatype": "JPEG image file",
            "@type": "IMAGE-HIGH-RES",
            "@size": "162753",
            "@ref": "gr9",
            "@mimetype": "image/jpeg"
        },
        {
            "@category": "high",
            "@height": "1112",
            "@width": "1703",
            "@_fa": "true",
            "$": "https://api.elsevier.com/content/object/eid/1-s2.0-S0957417424018098-gr14_lrg.jpg?httpAccept=%2A%2F%2A",
            "@multimediatype": "JPEG image file",
            "@type": "IMAGE-HIGH-RES",
            "@size": "276985",
            "@ref": "gr14",
            "@mimetype": "image/jpeg"
        },
        {
            "@category": "high",
            "@height": "1109",
            "@width": "1703",
            "@_fa": "true",
            "$": "https://api.elsevier.com/content/object/eid/1-s2.0-S0957417424018098-gr15_lrg.jpg?httpAccept=%2A%2F%2A",
            "@multimediatype": "JPEG image file",
            "@type": "IMAGE-HIGH-RES",
            "@size": "283952",
            "@ref": "gr15",
            "@mimetype": "image/jpeg"
        },
        {
            "@category": "high",
            "@height": "1434",
            "@width": "1305",
            "@_fa": "true",
            "$": "https://api.elsevier.com/content/object/eid/1-s2.0-S0957417424018098-gr3_lrg.jpg?httpAccept=%2A%2F%2A",
            "@multimediatype": "JPEG image file",
            "@type": "IMAGE-HIGH-RES",
            "@size": "426673",
            "@ref": "gr3",
            "@mimetype": "image/jpeg"
        },
        {
            "@category": "high",
            "@height": "589",
            "@width": "851",
            "@_fa": "true",
            "$": "https://api.elsevier.com/content/object/eid/1-s2.0-S0957417424018098-fx41_lrg.jpg?httpAccept=%2A%2F%2A",
            "@multimediatype": "JPEG image file",
            "@type": "IMAGE-HIGH-RES",
            "@size": "125426",
            "@ref": "fx41",
            "@mimetype": "image/jpeg"
        },
        {
            "@category": "high",
            "@height": "3260",
            "@width": "3253",
            "@_fa": "true",
            "$": "https://api.elsevier.com/content/object/eid/1-s2.0-S0957417424018098-gr4_lrg.jpg?httpAccept=%2A%2F%2A",
            "@multimediatype": "JPEG image file",
            "@type": "IMAGE-HIGH-RES",
            "@size": "965120",
            "@ref": "gr4",
            "@mimetype": "image/jpeg"
        },
        {
            "@category": "high",
            "@height": "589",
            "@width": "851",
            "@_fa": "true",
            "$": "https://api.elsevier.com/content/object/eid/1-s2.0-S0957417424018098-fx40_lrg.jpg?httpAccept=%2A%2F%2A",
            "@multimediatype": "JPEG image file",
            "@type": "IMAGE-HIGH-RES",
            "@size": "129548",
            "@ref": "fx40",
            "@mimetype": "image/jpeg"
        },
        {
            "@category": "high",
            "@height": "1583",
            "@width": "2335",
            "@_fa": "true",
            "$": "https://api.elsevier.com/content/object/eid/1-s2.0-S0957417424018098-gr5_lrg.jpg?httpAccept=%2A%2F%2A",
            "@multimediatype": "JPEG image file",
            "@type": "IMAGE-HIGH-RES",
            "@size": "297813",
            "@ref": "gr5",
            "@mimetype": "image/jpeg"
        },
        {
            "@category": "high",
            "@height": "1066",
            "@width": "1708",
            "@_fa": "true",
            "$": "https://api.elsevier.com/content/object/eid/1-s2.0-S0957417424018098-gr10_lrg.jpg?httpAccept=%2A%2F%2A",
            "@multimediatype": "JPEG image file",
            "@type": "IMAGE-HIGH-RES",
            "@size": "248725",
            "@ref": "gr10",
            "@mimetype": "image/jpeg"
        },
        {
            "@category": "high",
            "@height": "1444",
            "@width": "1652",
            "@_fa": "true",
            "$": "https://api.elsevier.com/content/object/eid/1-s2.0-S0957417424018098-gr6_lrg.jpg?httpAccept=%2A%2F%2A",
            "@multimediatype": "JPEG image file",
            "@type": "IMAGE-HIGH-RES",
            "@size": "279615",
            "@ref": "gr6",
            "@mimetype": "image/jpeg"
        },
        {
            "@category": "high",
            "@height": "2060",
            "@width": "3238",
            "@_fa": "true",
            "$": "https://api.elsevier.com/content/object/eid/1-s2.0-S0957417424018098-gr11_lrg.jpg?httpAccept=%2A%2F%2A",
            "@multimediatype": "JPEG image file",
            "@type": "IMAGE-HIGH-RES",
            "@size": "1214178",
            "@ref": "gr11",
            "@mimetype": "image/jpeg"
        },
        {
            "@category": "high",
            "@height": "473",
            "@width": "945",
            "@_fa": "true",
            "$": "https://api.elsevier.com/content/object/eid/1-s2.0-S0957417424018098-fx6_lrg.jpg?httpAccept=%2A%2F%2A",
            "@multimediatype": "JPEG image file",
            "@type": "IMAGE-HIGH-RES",
            "@size": "106384",
            "@ref": "fx6",
            "@mimetype": "image/jpeg"
        },
        {
            "@category": "high",
            "@height": "473",
            "@width": "945",
            "@_fa": "true",
            "$": "https://api.elsevier.com/content/object/eid/1-s2.0-S0957417424018098-fx7_lrg.jpg?httpAccept=%2A%2F%2A",
            "@multimediatype": "JPEG image file",
            "@type": "IMAGE-HIGH-RES",
            "@size": "107125",
            "@ref": "fx7",
            "@mimetype": "image/jpeg"
        },
        {
            "@category": "high",
            "@height": "447",
            "@width": "1712",
            "@_fa": "true",
            "$": "https://api.elsevier.com/content/object/eid/1-s2.0-S0957417424018098-gr1_lrg.jpg?httpAccept=%2A%2F%2A",
            "@multimediatype": "JPEG image file",
            "@type": "IMAGE-HIGH-RES",
            "@size": "151300",
            "@ref": "gr1",
            "@mimetype": "image/jpeg"
        },
        {
            "@category": "high",
            "@height": "473",
            "@width": "945",
            "@_fa": "true",
            "$": "https://api.elsevier.com/content/object/eid/1-s2.0-S0957417424018098-fx8_lrg.jpg?httpAccept=%2A%2F%2A",
            "@multimediatype": "JPEG image file",
            "@type": "IMAGE-HIGH-RES",
            "@size": "119564",
            "@ref": "fx8",
            "@mimetype": "image/jpeg"
        },
        {
            "@category": "high",
            "@height": "965",
            "@width": "3157",
            "@_fa": "true",
            "$": "https://api.elsevier.com/content/object/eid/1-s2.0-S0957417424018098-gr2_lrg.jpg?httpAccept=%2A%2F%2A",
            "@multimediatype": "JPEG image file",
            "@type": "IMAGE-HIGH-RES",
            "@size": "830181",
            "@ref": "gr2",
            "@mimetype": "image/jpeg"
        },
        {
            "@category": "high",
            "@height": "552",
            "@width": "945",
            "@_fa": "true",
            "$": "https://api.elsevier.com/content/object/eid/1-s2.0-S0957417424018098-fx9_lrg.jpg?httpAccept=%2A%2F%2A",
            "@multimediatype": "JPEG image file",
            "@type": "IMAGE-HIGH-RES",
            "@size": "134610",
            "@ref": "fx9",
            "@mimetype": "image/jpeg"
        },
        {
            "@category": "high",
            "@height": "473",
            "@width": "945",
            "@_fa": "true",
            "$": "https://api.elsevier.com/content/object/eid/1-s2.0-S0957417424018098-fx2_lrg.jpg?httpAccept=%2A%2F%2A",
            "@multimediatype": "JPEG image file",
            "@type": "IMAGE-HIGH-RES",
            "@size": "135279",
            "@ref": "fx2",
            "@mimetype": "image/jpeg"
        },
        {
            "@category": "high",
            "@height": "473",
            "@width": "945",
            "@_fa": "true",
            "$": "https://api.elsevier.com/content/object/eid/1-s2.0-S0957417424018098-fx3_lrg.jpg?httpAccept=%2A%2F%2A",
            "@multimediatype": "JPEG image file",
            "@type": "IMAGE-HIGH-RES",
            "@size": "110098",
            "@ref": "fx3",
            "@mimetype": "image/jpeg"
        },
        {
            "@category": "high",
            "@height": "473",
            "@width": "945",
            "@_fa": "true",
            "$": "https://api.elsevier.com/content/object/eid/1-s2.0-S0957417424018098-fx4_lrg.jpg?httpAccept=%2A%2F%2A",
            "@multimediatype": "JPEG image file",
            "@type": "IMAGE-HIGH-RES",
            "@size": "119407",
            "@ref": "fx4",
            "@mimetype": "image/jpeg"
        },
        {
            "@category": "high",
            "@height": "473",
            "@width": "945",
            "@_fa": "true",
            "$": "https://api.elsevier.com/content/object/eid/1-s2.0-S0957417424018098-fx5_lrg.jpg?httpAccept=%2A%2F%2A",
            "@multimediatype": "JPEG image file",
            "@type": "IMAGE-HIGH-RES",
            "@size": "96507",
            "@ref": "fx5",
            "@mimetype": "image/jpeg"
        },
        {
            "@category": "high",
            "@height": "473",
            "@width": "945",
            "@_fa": "true",
            "$": "https://api.elsevier.com/content/object/eid/1-s2.0-S0957417424018098-fx1_lrg.jpg?httpAccept=%2A%2F%2A",
            "@multimediatype": "JPEG image file",
            "@type": "IMAGE-HIGH-RES",
            "@size": "129192",
            "@ref": "fx1",
            "@mimetype": "image/jpeg"
        },
        {
            "@category": "high",
            "@height": "587",
            "@width": "851",
            "@_fa": "true",
            "$": "https://api.elsevier.com/content/object/eid/1-s2.0-S0957417424018098-fx34_lrg.jpg?httpAccept=%2A%2F%2A",
            "@multimediatype": "JPEG image file",
            "@type": "IMAGE-HIGH-RES",
            "@size": "136591",
            "@ref": "fx34",
            "@mimetype": "image/jpeg"
        },
        {
            "@category": "high",
            "@height": "586",
            "@width": "851",
            "@_fa": "true",
            "$": "https://api.elsevier.com/content/object/eid/1-s2.0-S0957417424018098-fx33_lrg.jpg?httpAccept=%2A%2F%2A",
            "@multimediatype": "JPEG image file",
            "@type": "IMAGE-HIGH-RES",
            "@size": "128855",
            "@ref": "fx33",
            "@mimetype": "image/jpeg"
        },
        {
            "@category": "high",
            "@height": "587",
            "@width": "851",
            "@_fa": "true",
            "$": "https://api.elsevier.com/content/object/eid/1-s2.0-S0957417424018098-fx32_lrg.jpg?httpAccept=%2A%2F%2A",
            "@multimediatype": "JPEG image file",
            "@type": "IMAGE-HIGH-RES",
            "@size": "80687",
            "@ref": "fx32",
            "@mimetype": "image/jpeg"
        },
        {
            "@category": "high",
            "@height": "587",
            "@width": "851",
            "@_fa": "true",
            "$": "https://api.elsevier.com/content/object/eid/1-s2.0-S0957417424018098-fx31_lrg.jpg?httpAccept=%2A%2F%2A",
            "@multimediatype": "JPEG image file",
            "@type": "IMAGE-HIGH-RES",
            "@size": "145004",
            "@ref": "fx31",
            "@mimetype": "image/jpeg"
        },
        {
            "@category": "high",
            "@height": "587",
            "@width": "851",
            "@_fa": "true",
            "$": "https://api.elsevier.com/content/object/eid/1-s2.0-S0957417424018098-fx38_lrg.jpg?httpAccept=%2A%2F%2A",
            "@multimediatype": "JPEG image file",
            "@type": "IMAGE-HIGH-RES",
            "@size": "83589",
            "@ref": "fx38",
            "@mimetype": "image/jpeg"
        },
        {
            "@category": "high",
            "@height": "587",
            "@width": "851",
            "@_fa": "true",
            "$": "https://api.elsevier.com/content/object/eid/1-s2.0-S0957417424018098-fx37_lrg.jpg?httpAccept=%2A%2F%2A",
            "@multimediatype": "JPEG image file",
            "@type": "IMAGE-HIGH-RES",
            "@size": "135732",
            "@ref": "fx37",
            "@mimetype": "image/jpeg"
        },
        {
            "@category": "high",
            "@height": "586",
            "@width": "851",
            "@_fa": "true",
            "$": "https://api.elsevier.com/content/object/eid/1-s2.0-S0957417424018098-fx36_lrg.jpg?httpAccept=%2A%2F%2A",
            "@multimediatype": "JPEG image file",
            "@type": "IMAGE-HIGH-RES",
            "@size": "130295",
            "@ref": "fx36",
            "@mimetype": "image/jpeg"
        },
        {
            "@category": "high",
            "@height": "587",
            "@width": "851",
            "@_fa": "true",
            "$": "https://api.elsevier.com/content/object/eid/1-s2.0-S0957417424018098-fx35_lrg.jpg?httpAccept=%2A%2F%2A",
            "@multimediatype": "JPEG image file",
            "@type": "IMAGE-HIGH-RES",
            "@size": "80708",
            "@ref": "fx35",
            "@mimetype": "image/jpeg"
        },
        {
            "@category": "high",
            "@height": "586",
            "@width": "851",
            "@_fa": "true",
            "$": "https://api.elsevier.com/content/object/eid/1-s2.0-S0957417424018098-fx30_lrg.jpg?httpAccept=%2A%2F%2A",
            "@multimediatype": "JPEG image file",
            "@type": "IMAGE-HIGH-RES",
            "@size": "128832",
            "@ref": "fx30",
            "@mimetype": "image/jpeg"
        },
        {
            "@category": "high",
            "@height": "587",
            "@width": "851",
            "@_fa": "true",
            "$": "https://api.elsevier.com/content/object/eid/1-s2.0-S0957417424018098-fx39_lrg.jpg?httpAccept=%2A%2F%2A",
            "@multimediatype": "JPEG image file",
            "@type": "IMAGE-HIGH-RES",
            "@size": "129581",
            "@ref": "fx39",
            "@mimetype": "image/jpeg"
        },
        {
            "@category": "high",
            "@height": "587",
            "@width": "851",
            "@_fa": "true",
            "$": "https://api.elsevier.com/content/object/eid/1-s2.0-S0957417424018098-fx23_lrg.jpg?httpAccept=%2A%2F%2A",
            "@multimediatype": "JPEG image file",
            "@type": "IMAGE-HIGH-RES",
            "@size": "80309",
            "@ref": "fx23",
            "@mimetype": "image/jpeg"
        },
        {
            "@category": "high",
            "@height": "586",
            "@width": "851",
            "@_fa": "true",
            "$": "https://api.elsevier.com/content/object/eid/1-s2.0-S0957417424018098-fx22_lrg.jpg?httpAccept=%2A%2F%2A",
            "@multimediatype": "JPEG image file",
            "@type": "IMAGE-HIGH-RES",
            "@size": "128420",
            "@ref": "fx22",
            "@mimetype": "image/jpeg"
        },
        {
            "@category": "high",
            "@height": "587",
            "@width": "851",
            "@_fa": "true",
            "$": "https://api.elsevier.com/content/object/eid/1-s2.0-S0957417424018098-fx66_lrg.jpg?httpAccept=%2A%2F%2A",
            "@multimediatype": "JPEG image file",
            "@type": "IMAGE-HIGH-RES",
            "@size": "159542",
            "@ref": "fx66",
            "@mimetype": "image/jpeg"
        },
        {
            "@category": "high",
            "@height": "589",
            "@width": "851",
            "@_fa": "true",
            "$": "https://api.elsevier.com/content/object/eid/1-s2.0-S0957417424018098-fx21_lrg.jpg?httpAccept=%2A%2F%2A",
            "@multimediatype": "JPEG image file",
            "@type": "IMAGE-HIGH-RES",
            "@size": "112798",
            "@ref": "fx21",
            "@mimetype": "image/jpeg"
        },
        {
            "@category": "high",
            "@height": "587",
            "@width": "851",
            "@_fa": "true",
            "$": "https://api.elsevier.com/content/object/eid/1-s2.0-S0957417424018098-fx65_lrg.jpg?httpAccept=%2A%2F%2A",
            "@multimediatype": "JPEG image file",
            "@type": "IMAGE-HIGH-RES",
            "@size": "139488",
            "@ref": "fx65",
            "@mimetype": "image/jpeg"
        },
        {
            "@category": "high",
            "@height": "590",
            "@width": "851",
            "@_fa": "true",
            "$": "https://api.elsevier.com/content/object/eid/1-s2.0-S0957417424018098-fx20_lrg.jpg?httpAccept=%2A%2F%2A",
            "@multimediatype": "JPEG image file",
            "@type": "IMAGE-HIGH-RES",
            "@size": "63407",
            "@ref": "fx20",
            "@mimetype": "image/jpeg"
        },
        {
            "@category": "high",
            "@height": "587",
            "@width": "851",
            "@_fa": "true",
            "$": "https://api.elsevier.com/content/object/eid/1-s2.0-S0957417424018098-fx64_lrg.jpg?httpAccept=%2A%2F%2A",
            "@multimediatype": "JPEG image file",
            "@type": "IMAGE-HIGH-RES",
            "@size": "145012",
            "@ref": "fx64",
            "@mimetype": "image/jpeg"
        },
        {
            "@category": "high",
            "@height": "586",
            "@width": "851",
            "@_fa": "true",
            "$": "https://api.elsevier.com/content/object/eid/1-s2.0-S0957417424018098-fx27_lrg.jpg?httpAccept=%2A%2F%2A",
            "@multimediatype": "JPEG image file",
            "@type": "IMAGE-HIGH-RES",
            "@size": "130292",
            "@ref": "fx27",
            "@mimetype": "image/jpeg"
        },
        {
            "@category": "high",
            "@height": "587",
            "@width": "851",
            "@_fa": "true",
            "$": "https://api.elsevier.com/content/object/eid/1-s2.0-S0957417424018098-fx26_lrg.jpg?httpAccept=%2A%2F%2A",
            "@multimediatype": "JPEG image file",
            "@type": "IMAGE-HIGH-RES",
            "@size": "81134",
            "@ref": "fx26",
            "@mimetype": "image/jpeg"
        },
        {
            "@category": "high",
            "@height": "587",
            "@width": "851",
            "@_fa": "true",
            "$": "https://api.elsevier.com/content/object/eid/1-s2.0-S0957417424018098-fx25_lrg.jpg?httpAccept=%2A%2F%2A",
            "@multimediatype": "JPEG image file",
            "@type": "IMAGE-HIGH-RES",
            "@size": "137172",
            "@ref": "fx25",
            "@mimetype": "image/jpeg"
        },
        {
            "@category": "high",
            "@height": "587",
            "@width": "851",
            "@_fa": "true",
            "$": "https://api.elsevier.com/content/object/eid/1-s2.0-S0957417424018098-fx24_lrg.jpg?httpAccept=%2A%2F%2A",
            "@multimediatype": "JPEG image file",
            "@type": "IMAGE-HIGH-RES",
            "@size": "129581",
            "@ref": "fx24",
            "@mimetype": "image/jpeg"
        },
        {
            "@category": "high",
            "@height": "586",
            "@width": "851",
            "@_fa": "true",
            "$": "https://api.elsevier.com/content/object/eid/1-s2.0-S0957417424018098-fx63_lrg.jpg?httpAccept=%2A%2F%2A",
            "@multimediatype": "JPEG image file",
            "@type": "IMAGE-HIGH-RES",
            "@size": "157937",
            "@ref": "fx63",
            "@mimetype": "image/jpeg"
        },
        {
            "@category": "high",
            "@height": "587",
            "@width": "851",
            "@_fa": "true",
            "$": "https://api.elsevier.com/content/object/eid/1-s2.0-S0957417424018098-fx62_lrg.jpg?httpAccept=%2A%2F%2A",
            "@multimediatype": "JPEG image file",
            "@type": "IMAGE-HIGH-RES",
            "@size": "139488",
            "@ref": "fx62",
            "@mimetype": "image/jpeg"
        },
        {
            "@category": "high",
            "@height": "587",
            "@width": "851",
            "@_fa": "true",
            "$": "https://api.elsevier.com/content/object/eid/1-s2.0-S0957417424018098-fx61_lrg.jpg?httpAccept=%2A%2F%2A",
            "@multimediatype": "JPEG image file",
            "@type": "IMAGE-HIGH-RES",
            "@size": "145004",
            "@ref": "fx61",
            "@mimetype": "image/jpeg"
        },
        {
            "@category": "high",
            "@height": "586",
            "@width": "851",
            "@_fa": "true",
            "$": "https://api.elsevier.com/content/object/eid/1-s2.0-S0957417424018098-fx60_lrg.jpg?httpAccept=%2A%2F%2A",
            "@multimediatype": "JPEG image file",
            "@type": "IMAGE-HIGH-RES",
            "@size": "157768",
            "@ref": "fx60",
            "@mimetype": "image/jpeg"
        },
        {
            "@category": "high",
            "@height": "587",
            "@width": "851",
            "@_fa": "true",
            "$": "https://api.elsevier.com/content/object/eid/1-s2.0-S0957417424018098-fx29_lrg.jpg?httpAccept=%2A%2F%2A",
            "@multimediatype": "JPEG image file",
            "@type": "IMAGE-HIGH-RES",
            "@size": "79930",
            "@ref": "fx29",
            "@mimetype": "image/jpeg"
        },
        {
            "@category": "high",
            "@height": "587",
            "@width": "851",
            "@_fa": "true",
            "$": "https://api.elsevier.com/content/object/eid/1-s2.0-S0957417424018098-fx28_lrg.jpg?httpAccept=%2A%2F%2A",
            "@multimediatype": "JPEG image file",
            "@type": "IMAGE-HIGH-RES",
            "@size": "137300",
            "@ref": "fx28",
            "@mimetype": "image/jpeg"
        },
        {
            "@category": "thumbnail",
            "@_fa": "true",
            "$": "https://api.elsevier.com/content/object/eid/1-s2.0-S0957417424018098-si1.svg?httpAccept=%2A%2F%2A",
            "@multimediatype": "Scalable Vector Graphics file",
            "@type": "ALTIMG",
            "@size": "2845",
            "@ref": "si1",
            "@mimetype": "image/svg+xml"
        },
        {
            "@category": "thumbnail",
            "@_fa": "true",
            "$": "https://api.elsevier.com/content/object/eid/1-s2.0-S0957417424018098-si10.svg?httpAccept=%2A%2F%2A",
            "@multimediatype": "Scalable Vector Graphics file",
            "@type": "ALTIMG",
            "@size": "8970",
            "@ref": "si10",
            "@mimetype": "image/svg+xml"
        },
        {
            "@category": "thumbnail",
            "@_fa": "true",
            "$": "https://api.elsevier.com/content/object/eid/1-s2.0-S0957417424018098-si11.svg?httpAccept=%2A%2F%2A",
            "@multimediatype": "Scalable Vector Graphics file",
            "@type": "ALTIMG",
            "@size": "1446",
            "@ref": "si11",
            "@mimetype": "image/svg+xml"
        },
        {
            "@category": "thumbnail",
            "@_fa": "true",
            "$": "https://api.elsevier.com/content/object/eid/1-s2.0-S0957417424018098-si12.svg?httpAccept=%2A%2F%2A",
            "@multimediatype": "Scalable Vector Graphics file",
            "@type": "ALTIMG",
            "@size": "2665",
            "@ref": "si12",
            "@mimetype": "image/svg+xml"
        },
        {
            "@category": "thumbnail",
            "@_fa": "true",
            "$": "https://api.elsevier.com/content/object/eid/1-s2.0-S0957417424018098-si13.svg?httpAccept=%2A%2F%2A",
            "@multimediatype": "Scalable Vector Graphics file",
            "@type": "ALTIMG",
            "@size": "14871",
            "@ref": "si13",
            "@mimetype": "image/svg+xml"
        },
        {
            "@category": "thumbnail",
            "@_fa": "true",
            "$": "https://api.elsevier.com/content/object/eid/1-s2.0-S0957417424018098-si14.svg?httpAccept=%2A%2F%2A",
            "@multimediatype": "Scalable Vector Graphics file",
            "@type": "ALTIMG",
            "@size": "19104",
            "@ref": "si14",
            "@mimetype": "image/svg+xml"
        },
        {
            "@category": "thumbnail",
            "@_fa": "true",
            "$": "https://api.elsevier.com/content/object/eid/1-s2.0-S0957417424018098-si15.svg?httpAccept=%2A%2F%2A",
            "@multimediatype": "Scalable Vector Graphics file",
            "@type": "ALTIMG",
            "@size": "1099",
            "@ref": "si15",
            "@mimetype": "image/svg+xml"
        },
        {
            "@category": "thumbnail",
            "@_fa": "true",
            "$": "https://api.elsevier.com/content/object/eid/1-s2.0-S0957417424018098-si16.svg?httpAccept=%2A%2F%2A",
            "@multimediatype": "Scalable Vector Graphics file",
            "@type": "ALTIMG",
            "@size": "24531",
            "@ref": "si16",
            "@mimetype": "image/svg+xml"
        },
        {
            "@category": "thumbnail",
            "@_fa": "true",
            "$": "https://api.elsevier.com/content/object/eid/1-s2.0-S0957417424018098-si17.svg?httpAccept=%2A%2F%2A",
            "@multimediatype": "Scalable Vector Graphics file",
            "@type": "ALTIMG",
            "@size": "13037",
            "@ref": "si17",
            "@mimetype": "image/svg+xml"
        },
        {
            "@category": "thumbnail",
            "@_fa": "true",
            "$": "https://api.elsevier.com/content/object/eid/1-s2.0-S0957417424018098-si19.svg?httpAccept=%2A%2F%2A",
            "@multimediatype": "Scalable Vector Graphics file",
            "@type": "ALTIMG",
            "@size": "37336",
            "@ref": "si19",
            "@mimetype": "image/svg+xml"
        },
        {
            "@category": "thumbnail",
            "@_fa": "true",
            "$": "https://api.elsevier.com/content/object/eid/1-s2.0-S0957417424018098-si21.svg?httpAccept=%2A%2F%2A",
            "@multimediatype": "Scalable Vector Graphics file",
            "@type": "ALTIMG",
            "@size": "10907",
            "@ref": "si21",
            "@mimetype": "image/svg+xml"
        },
        {
            "@category": "thumbnail",
            "@_fa": "true",
            "$": "https://api.elsevier.com/content/object/eid/1-s2.0-S0957417424018098-si22.svg?httpAccept=%2A%2F%2A",
            "@multimediatype": "Scalable Vector Graphics file",
            "@type": "ALTIMG",
            "@size": "12981",
            "@ref": "si22",
            "@mimetype": "image/svg+xml"
        },
        {
            "@category": "thumbnail",
            "@_fa": "true",
            "$": "https://api.elsevier.com/content/object/eid/1-s2.0-S0957417424018098-si23.svg?httpAccept=%2A%2F%2A",
            "@multimediatype": "Scalable Vector Graphics file",
            "@type": "ALTIMG",
            "@size": "12660",
            "@ref": "si23",
            "@mimetype": "image/svg+xml"
        },
        {
            "@category": "thumbnail",
            "@_fa": "true",
            "$": "https://api.elsevier.com/content/object/eid/1-s2.0-S0957417424018098-si24.svg?httpAccept=%2A%2F%2A",
            "@multimediatype": "Scalable Vector Graphics file",
            "@type": "ALTIMG",
            "@size": "9095",
            "@ref": "si24",
            "@mimetype": "image/svg+xml"
        },
        {
            "@category": "thumbnail",
            "@_fa": "true",
            "$": "https://api.elsevier.com/content/object/eid/1-s2.0-S0957417424018098-si25.svg?httpAccept=%2A%2F%2A",
            "@multimediatype": "Scalable Vector Graphics file",
            "@type": "ALTIMG",
            "@size": "2855",
            "@ref": "si25",
            "@mimetype": "image/svg+xml"
        },
        {
            "@category": "thumbnail",
            "@_fa": "true",
            "$": "https://api.elsevier.com/content/object/eid/1-s2.0-S0957417424018098-si26.svg?httpAccept=%2A%2F%2A",
            "@multimediatype": "Scalable Vector Graphics file",
            "@type": "ALTIMG",
            "@size": "1136",
            "@ref": "si26",
            "@mimetype": "image/svg+xml"
        },
        {
            "@category": "thumbnail",
            "@_fa": "true",
            "$": "https://api.elsevier.com/content/object/eid/1-s2.0-S0957417424018098-si28.svg?httpAccept=%2A%2F%2A",
            "@multimediatype": "Scalable Vector Graphics file",
            "@type": "ALTIMG",
            "@size": "1389",
            "@ref": "si28",
            "@mimetype": "image/svg+xml"
        },
        {
            "@category": "thumbnail",
            "@_fa": "true",
            "$": "https://api.elsevier.com/content/object/eid/1-s2.0-S0957417424018098-si29.svg?httpAccept=%2A%2F%2A",
            "@multimediatype": "Scalable Vector Graphics file",
            "@type": "ALTIMG",
            "@size": "1671",
            "@ref": "si29",
            "@mimetype": "image/svg+xml"
        },
        {
            "@category": "thumbnail",
            "@_fa": "true",
            "$": "https://api.elsevier.com/content/object/eid/1-s2.0-S0957417424018098-si3.svg?httpAccept=%2A%2F%2A",
            "@multimediatype": "Scalable Vector Graphics file",
            "@type": "ALTIMG",
            "@size": "15222",
            "@ref": "si3",
            "@mimetype": "image/svg+xml"
        },
        {
            "@category": "thumbnail",
            "@_fa": "true",
            "$": "https://api.elsevier.com/content/object/eid/1-s2.0-S0957417424018098-si30.svg?httpAccept=%2A%2F%2A",
            "@multimediatype": "Scalable Vector Graphics file",
            "@type": "ALTIMG",
            "@size": "1142",
            "@ref": "si30",
            "@mimetype": "image/svg+xml"
        },
        {
            "@category": "thumbnail",
            "@_fa": "true",
            "$": "https://api.elsevier.com/content/object/eid/1-s2.0-S0957417424018098-si31.svg?httpAccept=%2A%2F%2A",
            "@multimediatype": "Scalable Vector Graphics file",
            "@type": "ALTIMG",
            "@size": "2611",
            "@ref": "si31",
            "@mimetype": "image/svg+xml"
        },
        {
            "@category": "thumbnail",
            "@_fa": "true",
            "$": "https://api.elsevier.com/content/object/eid/1-s2.0-S0957417424018098-si32.svg?httpAccept=%2A%2F%2A",
            "@multimediatype": "Scalable Vector Graphics file",
            "@type": "ALTIMG",
            "@size": "2413",
            "@ref": "si32",
            "@mimetype": "image/svg+xml"
        },
        {
            "@category": "thumbnail",
            "@_fa": "true",
            "$": "https://api.elsevier.com/content/object/eid/1-s2.0-S0957417424018098-si34.svg?httpAccept=%2A%2F%2A",
            "@multimediatype": "Scalable Vector Graphics file",
            "@type": "ALTIMG",
            "@size": "702",
            "@ref": "si34",
            "@mimetype": "image/svg+xml"
        },
        {
            "@category": "thumbnail",
            "@_fa": "true",
            "$": "https://api.elsevier.com/content/object/eid/1-s2.0-S0957417424018098-si39.svg?httpAccept=%2A%2F%2A",
            "@multimediatype": "Scalable Vector Graphics file",
            "@type": "ALTIMG",
            "@size": "1627",
            "@ref": "si39",
            "@mimetype": "image/svg+xml"
        },
        {
            "@category": "thumbnail",
            "@_fa": "true",
            "$": "https://api.elsevier.com/content/object/eid/1-s2.0-S0957417424018098-si4.svg?httpAccept=%2A%2F%2A",
            "@multimediatype": "Scalable Vector Graphics file",
            "@type": "ALTIMG",
            "@size": "752",
            "@ref": "si4",
            "@mimetype": "image/svg+xml"
        },
        {
            "@category": "thumbnail",
            "@_fa": "true",
            "$": "https://api.elsevier.com/content/object/eid/1-s2.0-S0957417424018098-si40.svg?httpAccept=%2A%2F%2A",
            "@multimediatype": "Scalable Vector Graphics file",
            "@type": "ALTIMG",
            "@size": "1330",
            "@ref": "si40",
            "@mimetype": "image/svg+xml"
        },
        {
            "@category": "thumbnail",
            "@_fa": "true",
            "$": "https://api.elsevier.com/content/object/eid/1-s2.0-S0957417424018098-si41.svg?httpAccept=%2A%2F%2A",
            "@multimediatype": "Scalable Vector Graphics file",
            "@type": "ALTIMG",
            "@size": "11778",
            "@ref": "si41",
            "@mimetype": "image/svg+xml"
        },
        {
            "@category": "thumbnail",
            "@_fa": "true",
            "$": "https://api.elsevier.com/content/object/eid/1-s2.0-S0957417424018098-si42.svg?httpAccept=%2A%2F%2A",
            "@multimediatype": "Scalable Vector Graphics file",
            "@type": "ALTIMG",
            "@size": "13791",
            "@ref": "si42",
            "@mimetype": "image/svg+xml"
        },
        {
            "@category": "thumbnail",
            "@_fa": "true",
            "$": "https://api.elsevier.com/content/object/eid/1-s2.0-S0957417424018098-si43.svg?httpAccept=%2A%2F%2A",
            "@multimediatype": "Scalable Vector Graphics file",
            "@type": "ALTIMG",
            "@size": "8507",
            "@ref": "si43",
            "@mimetype": "image/svg+xml"
        },
        {
            "@category": "thumbnail",
            "@_fa": "true",
            "$": "https://api.elsevier.com/content/object/eid/1-s2.0-S0957417424018098-si44.svg?httpAccept=%2A%2F%2A",
            "@multimediatype": "Scalable Vector Graphics file",
            "@type": "ALTIMG",
            "@size": "8210",
            "@ref": "si44",
            "@mimetype": "image/svg+xml"
        },
        {
            "@category": "thumbnail",
            "@_fa": "true",
            "$": "https://api.elsevier.com/content/object/eid/1-s2.0-S0957417424018098-si45.svg?httpAccept=%2A%2F%2A",
            "@multimediatype": "Scalable Vector Graphics file",
            "@type": "ALTIMG",
            "@size": "8404",
            "@ref": "si45",
            "@mimetype": "image/svg+xml"
        },
        {
            "@category": "thumbnail",
            "@_fa": "true",
            "$": "https://api.elsevier.com/content/object/eid/1-s2.0-S0957417424018098-si46.svg?httpAccept=%2A%2F%2A",
            "@multimediatype": "Scalable Vector Graphics file",
            "@type": "ALTIMG",
            "@size": "3788",
            "@ref": "si46",
            "@mimetype": "image/svg+xml"
        },
        {
            "@category": "thumbnail",
            "@_fa": "true",
            "$": "https://api.elsevier.com/content/object/eid/1-s2.0-S0957417424018098-si48.svg?httpAccept=%2A%2F%2A",
            "@multimediatype": "Scalable Vector Graphics file",
            "@type": "ALTIMG",
            "@size": "12995",
            "@ref": "si48",
            "@mimetype": "image/svg+xml"
        },
        {
            "@category": "thumbnail",
            "@_fa": "true",
            "$": "https://api.elsevier.com/content/object/eid/1-s2.0-S0957417424018098-si49.svg?httpAccept=%2A%2F%2A",
            "@multimediatype": "Scalable Vector Graphics file",
            "@type": "ALTIMG",
            "@size": "1351",
            "@ref": "si49",
            "@mimetype": "image/svg+xml"
        },
        {
            "@category": "thumbnail",
            "@_fa": "true",
            "$": "https://api.elsevier.com/content/object/eid/1-s2.0-S0957417424018098-si5.svg?httpAccept=%2A%2F%2A",
            "@multimediatype": "Scalable Vector Graphics file",
            "@type": "ALTIMG",
            "@size": "18229",
            "@ref": "si5",
            "@mimetype": "image/svg+xml"
        },
        {
            "@category": "thumbnail",
            "@_fa": "true",
            "$": "https://api.elsevier.com/content/object/eid/1-s2.0-S0957417424018098-si50.svg?httpAccept=%2A%2F%2A",
            "@multimediatype": "Scalable Vector Graphics file",
            "@type": "ALTIMG",
            "@size": "3361",
            "@ref": "si50",
            "@mimetype": "image/svg+xml"
        },
        {
            "@category": "thumbnail",
            "@_fa": "true",
            "$": "https://api.elsevier.com/content/object/eid/1-s2.0-S0957417424018098-si51.svg?httpAccept=%2A%2F%2A",
            "@multimediatype": "Scalable Vector Graphics file",
            "@type": "ALTIMG",
            "@size": "22575",
            "@ref": "si51",
            "@mimetype": "image/svg+xml"
        },
        {
            "@category": "thumbnail",
            "@_fa": "true",
            "$": "https://api.elsevier.com/content/object/eid/1-s2.0-S0957417424018098-si52.svg?httpAccept=%2A%2F%2A",
            "@multimediatype": "Scalable Vector Graphics file",
            "@type": "ALTIMG",
            "@size": "2639",
            "@ref": "si52",
            "@mimetype": "image/svg+xml"
        },
        {
            "@category": "thumbnail",
            "@_fa": "true",
            "$": "https://api.elsevier.com/content/object/eid/1-s2.0-S0957417424018098-si53.svg?httpAccept=%2A%2F%2A",
            "@multimediatype": "Scalable Vector Graphics file",
            "@type": "ALTIMG",
            "@size": "3485",
            "@ref": "si53",
            "@mimetype": "image/svg+xml"
        },
        {
            "@category": "thumbnail",
            "@_fa": "true",
            "$": "https://api.elsevier.com/content/object/eid/1-s2.0-S0957417424018098-si54.svg?httpAccept=%2A%2F%2A",
            "@multimediatype": "Scalable Vector Graphics file",
            "@type": "ALTIMG",
            "@size": "1352",
            "@ref": "si54",
            "@mimetype": "image/svg+xml"
        },
        {
            "@category": "thumbnail",
            "@_fa": "true",
            "$": "https://api.elsevier.com/content/object/eid/1-s2.0-S0957417424018098-si55.svg?httpAccept=%2A%2F%2A",
            "@multimediatype": "Scalable Vector Graphics file",
            "@type": "ALTIMG",
            "@size": "8673",
            "@ref": "si55",
            "@mimetype": "image/svg+xml"
        },
        {
            "@category": "thumbnail",
            "@_fa": "true",
            "$": "https://api.elsevier.com/content/object/eid/1-s2.0-S0957417424018098-si6.svg?httpAccept=%2A%2F%2A",
            "@multimediatype": "Scalable Vector Graphics file",
            "@type": "ALTIMG",
            "@size": "20085",
            "@ref": "si6",
            "@mimetype": "image/svg+xml"
        },
        {
            "@category": "thumbnail",
            "@_fa": "true",
            "$": "https://api.elsevier.com/content/object/eid/1-s2.0-S0957417424018098-si7.svg?httpAccept=%2A%2F%2A",
            "@multimediatype": "Scalable Vector Graphics file",
            "@type": "ALTIMG",
            "@size": "19651",
            "@ref": "si7",
            "@mimetype": "image/svg+xml"
        },
        {
            "@category": "thumbnail",
            "@_fa": "true",
            "$": "https://api.elsevier.com/content/object/eid/1-s2.0-S0957417424018098-si8.svg?httpAccept=%2A%2F%2A",
            "@multimediatype": "Scalable Vector Graphics file",
            "@type": "ALTIMG",
            "@size": "2237",
            "@ref": "si8",
            "@mimetype": "image/svg+xml"
        },
        {
            "@category": "thumbnail",
            "@_fa": "true",
            "$": "https://api.elsevier.com/content/object/eid/1-s2.0-S0957417424018098-si9.svg?httpAccept=%2A%2F%2A",
            "@multimediatype": "Scalable Vector Graphics file",
            "@type": "ALTIMG",
            "@size": "19537",
            "@ref": "si9",
            "@mimetype": "image/svg+xml"
        }
    ]},
    "link": {
        "@rel": "abstract",
        "@href": "https://api.elsevier.com/content/abstract/scopus_id/85200551348"
    }
}}