{"full-text-retrieval-response": {
    "scopus-eid": "2-s2.0-85201507381",
    "originalText": "serial JL 306208 291210 291682 291735 291848 291889 291929 31 90 MethodsX METHODSX 2024-08-16 2024-08-16 2024-08-20 2024-08-20 2024-08-27T12:27:32 1-s2.0-S2215016124003662 S2215-0161(24)00366-2 S2215016124003662 10.1016/j.mex.2024.102915 S250 S250.1 FULL-TEXT 1-s2.0-S2215016124X00023 2024-08-27T13:20:11.407989Z 0 0 20241201 20241231 2024 2024-08-16T23:04:43.299373Z absattachment articleinfo articlenumber articletitlenorm authfirstinitialnorm authfirstsurnamenorm cid cids contenttype copyright crossmark dateloaded dateloadedtxt datesearch datesort dateupdated dco docsubtype doctype doi eid ewtransactionid fundingbodyid hubeid indexeddate issn issnnorm itemstage itemtransactionid itemweight oauserlicense openaccess openarchive pg pgfirst pii piinorm pubdateend pubdatestart pubdatetxt pubyr sectiontitle sortorder sponsoredaccesstype srctitle srctitlenorm srctype ssids alllist content oa subj subheadings suppl tomb volfirst volissue volumelist webpdf webpdfpagecount yearnav figure table body mmlmath acknowledge affil articletitle auth authfirstini authfull authkeywords authlast orcid otherkwds primabst ref specialabst 2215-0161 22150161 UNLIMITED NONE true 13 13 C Volume 13 66 102915 102915 102915 202412 December 2024 2024-12-01 2024-12-31 2024 Environmental Science article mic © 2024 The Author(s). Published by Elsevier B.V. MODELINGSPATIALLYVARYINGEFFECTSBIOPHYSICALFACTORSLANDSURFACETEMPERATURE DEBELE G Method details Extraction of biophysical factors Retrieval of LST Spatial association of LST Ethics statements CRediT authorship contribution statement Acknowledgments References LIN 2023 110732 Z LIU 2019 243 255 H DEBELE 2023 e02052 G ROY 2016 57 70 D TUCKER 1979 127 150 C XU 2024 112198 Z XU 2006 3025 3033 H ZHA 2003 583 594 Y CHEN 2006 133 146 X LIANG 2001 213 238 S HUETE 1997 440 451 A IHLEN 2019 114 V ABIR 2021 e08012 F LI 2013 14 37 Z SOBRINO 2004 434 440 J CARLSON 1997 241 252 T ANSELIN 2010 L HANDBOOKAPPLIEDSPATIALANALYSIS GEODAINTRODUCTIONSPATIALDATAANALYSIS GUO 2020 102443 A DAS 2020 100322 S ZHAO 2018 1428 C GAO 2022 103431 Y DEBELEX2024X102915 DEBELEX2024X102915XG Full 2024-08-14T14:17:05Z Author http://creativecommons.org/licenses/by-nc/4.0/ This is an open access article under the CC BY-NC license. © 2024 The Author(s). Published by Elsevier B.V. item S2215-0161(24)00366-2 S2215016124003662 1-s2.0-S2215016124003662 10.1016/j.mex.2024.102915 306208 2024-08-27T13:20:11.407989Z 2024-12-01 2024-12-31 UNLIMITED NONE 1-s2.0-S2215016124003662-main.pdf https://s3-eu-west-1.amazonaws.com/prod-ucs-content-store-eu-west/content/pii:S2215016124003662/MAIN/application/pdf/ffdca0a7633f21277524cddd598c38ea/main.pdf main.pdf pdf true 359824 MAIN 5 1-s2.0-S2215016124003662-main_1.png https://s3-eu-west-1.amazonaws.com/prod-ucs-content-store-eu-west/content/pii:S2215016124003662/PREVIEW/image/png/6976bfefa06746e4abd10fc7b2148a34/main_1.png main_1.png png 44603 849 656 IMAGE-WEB-PDF 1 1-s2.0-S2215016124003662-ga1.jpg https://s3-eu-west-1.amazonaws.com/prod-ucs-content-store-eu-west/content/pii:S2215016124003662/ga1/DOWNSAMPLED200/image/jpeg/baa187e613e640feda9e3a551d9feda3/ga1.jpg ga1 true ga1.jpg jpg 30087 200 430 IMAGE-DOWNSAMPLED 1-s2.0-S2215016124003662-ga1.sml https://s3-eu-west-1.amazonaws.com/prod-ucs-content-store-eu-west/content/pii:S2215016124003662/ga1/THUMBNAIL/image/gif/26c9f7b96cb2af916337f53bb10cdfde/ga1.sml ga1 true ga1.sml sml 8149 102 219 IMAGE-THUMBNAIL 1-s2.0-S2215016124003662-ga1_lrg.jpg https://s3-eu-west-1.amazonaws.com/prod-ucs-content-store-eu-west/content/pii:S2215016124003662/HIGHRES/image/jpeg/b7fca89588535432c6db4a81e3755162/ga1_lrg.jpg ga1 true ga1_lrg.jpg jpg 248303 886 1906 IMAGE-HIGH-RES 1-s2.0-S2215016124003662-si14.svg https://s3-eu-west-1.amazonaws.com/prod-ucs-content-store-eu-west/content/pii:S2215016124003662/STRIPIN/image/svg+xml/773260886f5f424ebf391984575d2714/si14.svg si14 si14.svg svg 1982 ALTIMG 1-s2.0-S2215016124003662-si6.svg https://s3-eu-west-1.amazonaws.com/prod-ucs-content-store-eu-west/content/pii:S2215016124003662/STRIPIN/image/svg+xml/fea28b27de1e064f976026c255fb0fe4/si6.svg si6 si6.svg svg 4312 ALTIMG 1-s2.0-S2215016124003662-si20.svg https://s3-eu-west-1.amazonaws.com/prod-ucs-content-store-eu-west/content/pii:S2215016124003662/STRIPIN/image/svg+xml/5616679febcedaf3ebc28c39f3c859d5/si20.svg si20 si20.svg svg 1735 ALTIMG 1-s2.0-S2215016124003662-si41.svg https://s3-eu-west-1.amazonaws.com/prod-ucs-content-store-eu-west/content/pii:S2215016124003662/STRIPIN/image/svg+xml/462d690546f608fb47308e9d4eac76df/si41.svg si41 si41.svg svg 5924 ALTIMG 1-s2.0-S2215016124003662-si19.svg https://s3-eu-west-1.amazonaws.com/prod-ucs-content-store-eu-west/content/pii:S2215016124003662/STRIPIN/image/svg+xml/e71954e939b88c3666b54a4435b3632d/si19.svg si19 si19.svg svg 1925 ALTIMG 1-s2.0-S2215016124003662-si18.svg https://s3-eu-west-1.amazonaws.com/prod-ucs-content-store-eu-west/content/pii:S2215016124003662/STRIPIN/image/svg+xml/9ddb4f4a35f419e2ffee358fce53bc8e/si18.svg si18 si18.svg svg 2239 ALTIMG 1-s2.0-S2215016124003662-si30.svg https://s3-eu-west-1.amazonaws.com/prod-ucs-content-store-eu-west/content/pii:S2215016124003662/STRIPIN/image/svg+xml/2e130eeda3cb5ed8334ab9277d9751dc/si30.svg si30 si30.svg svg 1924 ALTIMG 1-s2.0-S2215016124003662-si36.svg https://s3-eu-west-1.amazonaws.com/prod-ucs-content-store-eu-west/content/pii:S2215016124003662/STRIPIN/image/svg+xml/6aa59221f032c0b9a29a270c2c853df5/si36.svg si36 si36.svg svg 1402 ALTIMG 1-s2.0-S2215016124003662-si17.svg https://s3-eu-west-1.amazonaws.com/prod-ucs-content-store-eu-west/content/pii:S2215016124003662/STRIPIN/image/svg+xml/8cd85cdcfa2a7efa8352ec7a85bb7968/si17.svg si17 si17.svg svg 7949 ALTIMG 1-s2.0-S2215016124003662-si52.svg https://s3-eu-west-1.amazonaws.com/prod-ucs-content-store-eu-west/content/pii:S2215016124003662/STRIPIN/image/svg+xml/c73e95cf3e700a2422749efb4e2ff671/si52.svg si52 si52.svg svg 2421 ALTIMG 1-s2.0-S2215016124003662-si53.svg https://s3-eu-west-1.amazonaws.com/prod-ucs-content-store-eu-west/content/pii:S2215016124003662/STRIPIN/image/svg+xml/8d2e397d295c6c91f3cbf7bf8421ea35/si53.svg si53 si53.svg svg 2167 ALTIMG 1-s2.0-S2215016124003662-si29.svg https://s3-eu-west-1.amazonaws.com/prod-ucs-content-store-eu-west/content/pii:S2215016124003662/STRIPIN/image/svg+xml/7da452840ef6c5da4e5fb6d6844b577b/si29.svg si29 si29.svg svg 8606 ALTIMG 1-s2.0-S2215016124003662-si10.svg https://s3-eu-west-1.amazonaws.com/prod-ucs-content-store-eu-west/content/pii:S2215016124003662/STRIPIN/image/svg+xml/fd30bc6135f778516ec5b84fd8708721/si10.svg si10 si10.svg svg 4044 ALTIMG 1-s2.0-S2215016124003662-si39.svg https://s3-eu-west-1.amazonaws.com/prod-ucs-content-store-eu-west/content/pii:S2215016124003662/STRIPIN/image/svg+xml/7281e716058724a1573b6d7e7404c2a2/si39.svg si39 si39.svg svg 6414 ALTIMG 1-s2.0-S2215016124003662-si42.svg https://s3-eu-west-1.amazonaws.com/prod-ucs-content-store-eu-west/content/pii:S2215016124003662/STRIPIN/image/svg+xml/679c3d581feb3003f6873a7507974f90/si42.svg si42 si42.svg svg 14427 ALTIMG 1-s2.0-S2215016124003662-si60.svg https://s3-eu-west-1.amazonaws.com/prod-ucs-content-store-eu-west/content/pii:S2215016124003662/STRIPIN/image/svg+xml/b7ad8635d0b6a0f102a59e03a67aa775/si60.svg si60 si60.svg svg 3205 ALTIMG 1-s2.0-S2215016124003662-si49.svg https://s3-eu-west-1.amazonaws.com/prod-ucs-content-store-eu-west/content/pii:S2215016124003662/STRIPIN/image/svg+xml/6e9c05fe0407da4c8f20e58dfc201bb6/si49.svg si49 si49.svg svg 3016 ALTIMG 1-s2.0-S2215016124003662-si7.svg https://s3-eu-west-1.amazonaws.com/prod-ucs-content-store-eu-west/content/pii:S2215016124003662/STRIPIN/image/svg+xml/ce66e2f8bf76a6fe842e7906f93f3817/si7.svg si7 si7.svg svg 4712 ALTIMG 1-s2.0-S2215016124003662-si21.svg https://s3-eu-west-1.amazonaws.com/prod-ucs-content-store-eu-west/content/pii:S2215016124003662/STRIPIN/image/svg+xml/d371ee38e859d7691be69d1e46fcea9a/si21.svg si21 si21.svg svg 11109 ALTIMG 1-s2.0-S2215016124003662-si15.svg https://s3-eu-west-1.amazonaws.com/prod-ucs-content-store-eu-west/content/pii:S2215016124003662/STRIPIN/image/svg+xml/07891f8d3a1c62d1927f100a1a534461/si15.svg si15 si15.svg svg 1566 ALTIMG 1-s2.0-S2215016124003662-si1.svg https://s3-eu-west-1.amazonaws.com/prod-ucs-content-store-eu-west/content/pii:S2215016124003662/STRIPIN/image/svg+xml/7cbb0a54f76cda035f9d754c2f7ff4f4/si1.svg si1 si1.svg svg 14441 ALTIMG 1-s2.0-S2215016124003662-si56.svg https://s3-eu-west-1.amazonaws.com/prod-ucs-content-store-eu-west/content/pii:S2215016124003662/STRIPIN/image/svg+xml/5bd5db733f5ab0fb090c7e25dfbc082c/si56.svg si56 si56.svg svg 2402 ALTIMG 1-s2.0-S2215016124003662-si3.svg https://s3-eu-west-1.amazonaws.com/prod-ucs-content-store-eu-west/content/pii:S2215016124003662/STRIPIN/image/svg+xml/baee291063726d72de28bd0fe026db33/si3.svg si3 si3.svg svg 3639 ALTIMG 1-s2.0-S2215016124003662-si2.svg https://s3-eu-west-1.amazonaws.com/prod-ucs-content-store-eu-west/content/pii:S2215016124003662/STRIPIN/image/svg+xml/40834e3ac8029d714c438ef47e8ca28f/si2.svg si2 si2.svg svg 3145 ALTIMG 1-s2.0-S2215016124003662-si37.svg https://s3-eu-west-1.amazonaws.com/prod-ucs-content-store-eu-west/content/pii:S2215016124003662/STRIPIN/image/svg+xml/ecea528157c6cf4ec6cc23b13f29d998/si37.svg si37 si37.svg svg 1709 ALTIMG 1-s2.0-S2215016124003662-si51.svg https://s3-eu-west-1.amazonaws.com/prod-ucs-content-store-eu-west/content/pii:S2215016124003662/STRIPIN/image/svg+xml/e17d693b2f44e69f3cb6692420e75a6c/si51.svg si51 si51.svg svg 3166 ALTIMG 1-s2.0-S2215016124003662-si38.svg https://s3-eu-west-1.amazonaws.com/prod-ucs-content-store-eu-west/content/pii:S2215016124003662/STRIPIN/image/svg+xml/aebd3f62f225715fbc1e271dbe760856/si38.svg si38 si38.svg svg 11476 ALTIMG 1-s2.0-S2215016124003662-si5.svg https://s3-eu-west-1.amazonaws.com/prod-ucs-content-store-eu-west/content/pii:S2215016124003662/STRIPIN/image/svg+xml/93a87062d479ee96a0f26b208bd0d597/si5.svg si5 si5.svg svg 11960 ALTIMG 1-s2.0-S2215016124003662-si58.svg https://s3-eu-west-1.amazonaws.com/prod-ucs-content-store-eu-west/content/pii:S2215016124003662/STRIPIN/image/svg+xml/b87d1730f9298299bcefb9f111692028/si58.svg si58 si58.svg svg 1068 ALTIMG 1-s2.0-S2215016124003662-si63.svg https://s3-eu-west-1.amazonaws.com/prod-ucs-content-store-eu-west/content/pii:S2215016124003662/STRIPIN/image/svg+xml/52f955880e9608ced6ba4cf4d4c90267/si63.svg si63 si63.svg svg 3632 ALTIMG 1-s2.0-S2215016124003662-si65.svg https://s3-eu-west-1.amazonaws.com/prod-ucs-content-store-eu-west/content/pii:S2215016124003662/STRIPIN/image/svg+xml/f59f936e5b0108ececec7f4f7499a9c2/si65.svg si65 si65.svg svg 6435 ALTIMG 1-s2.0-S2215016124003662-si47.svg https://s3-eu-west-1.amazonaws.com/prod-ucs-content-store-eu-west/content/pii:S2215016124003662/STRIPIN/image/svg+xml/2d1cfefcae4a57530aea413ad4442a71/si47.svg si47 si47.svg svg 9502 ALTIMG 1-s2.0-S2215016124003662-si28.svg https://s3-eu-west-1.amazonaws.com/prod-ucs-content-store-eu-west/content/pii:S2215016124003662/STRIPIN/image/svg+xml/47e7e63026d66676332f44f7e8296d0d/si28.svg si28 si28.svg svg 1684 ALTIMG 1-s2.0-S2215016124003662-si64.svg https://s3-eu-west-1.amazonaws.com/prod-ucs-content-store-eu-west/content/pii:S2215016124003662/STRIPIN/image/svg+xml/344bf6e5db5775a672e6e5cde8551acf/si64.svg si64 si64.svg svg 6110 ALTIMG 1-s2.0-S2215016124003662-si57.svg https://s3-eu-west-1.amazonaws.com/prod-ucs-content-store-eu-west/content/pii:S2215016124003662/STRIPIN/image/svg+xml/b65a85c71f446dd629495febd16ee10d/si57.svg si57 si57.svg svg 2553 ALTIMG 1-s2.0-S2215016124003662-si9.svg https://s3-eu-west-1.amazonaws.com/prod-ucs-content-store-eu-west/content/pii:S2215016124003662/STRIPIN/image/svg+xml/bbe437746b1ad7b49090eed64bf68226/si9.svg si9 si9.svg svg 10523 ALTIMG 1-s2.0-S2215016124003662-si24.svg https://s3-eu-west-1.amazonaws.com/prod-ucs-content-store-eu-west/content/pii:S2215016124003662/STRIPIN/image/svg+xml/3cdeda4a74835970f2213e7d948ebb3c/si24.svg si24 si24.svg svg 2438 ALTIMG 1-s2.0-S2215016124003662-si26.svg https://s3-eu-west-1.amazonaws.com/prod-ucs-content-store-eu-west/content/pii:S2215016124003662/STRIPIN/image/svg+xml/c5b55bbcd8b1333f53fc3a62d9a9aaf3/si26.svg si26 si26.svg svg 1675 ALTIMG 1-s2.0-S2215016124003662-si62.svg https://s3-eu-west-1.amazonaws.com/prod-ucs-content-store-eu-west/content/pii:S2215016124003662/STRIPIN/image/svg+xml/fc5268476fb81c914106b969f28b5404/si62.svg si62 si62.svg svg 13205 ALTIMG 1-s2.0-S2215016124003662-si43.svg https://s3-eu-west-1.amazonaws.com/prod-ucs-content-store-eu-west/content/pii:S2215016124003662/STRIPIN/image/svg+xml/d6167bc6c887b532aac7286624059142/si43.svg si43 si43.svg svg 1086 ALTIMG 1-s2.0-S2215016124003662-si23.svg https://s3-eu-west-1.amazonaws.com/prod-ucs-content-store-eu-west/content/pii:S2215016124003662/STRIPIN/image/svg+xml/ff38cf17494eaf173eac781d2d8e01a3/si23.svg si23 si23.svg svg 3037 ALTIMG 1-s2.0-S2215016124003662-si4.svg https://s3-eu-west-1.amazonaws.com/prod-ucs-content-store-eu-west/content/pii:S2215016124003662/STRIPIN/image/svg+xml/6bd60eb6194367142b856565b15aaad0/si4.svg si4 si4.svg svg 4396 ALTIMG 1-s2.0-S2215016124003662-si34.svg https://s3-eu-west-1.amazonaws.com/prod-ucs-content-store-eu-west/content/pii:S2215016124003662/STRIPIN/image/svg+xml/a1b6d9dbd1d6f8ce3d72a0ddba743697/si34.svg si34 si34.svg svg 1760 ALTIMG 1-s2.0-S2215016124003662-si44.svg https://s3-eu-west-1.amazonaws.com/prod-ucs-content-store-eu-west/content/pii:S2215016124003662/STRIPIN/image/svg+xml/c2d6d52a823194d669cffceb4d00fe07/si44.svg si44 si44.svg svg 1049 ALTIMG 1-s2.0-S2215016124003662-si54.svg https://s3-eu-west-1.amazonaws.com/prod-ucs-content-store-eu-west/content/pii:S2215016124003662/STRIPIN/image/svg+xml/fa1d6dffb785056c5819b54f9c675aaa/si54.svg si54 si54.svg svg 14399 ALTIMG 1-s2.0-S2215016124003662-si8.svg https://s3-eu-west-1.amazonaws.com/prod-ucs-content-store-eu-west/content/pii:S2215016124003662/STRIPIN/image/svg+xml/219b88b475aad2120fdf48e341f336d4/si8.svg si8 si8.svg svg 8878 ALTIMG 1-s2.0-S2215016124003662-si50.svg https://s3-eu-west-1.amazonaws.com/prod-ucs-content-store-eu-west/content/pii:S2215016124003662/STRIPIN/image/svg+xml/021da238d68ed98d8ef21d60d1104d67/si50.svg si50 si50.svg svg 3357 ALTIMG 1-s2.0-S2215016124003662-si16.svg https://s3-eu-west-1.amazonaws.com/prod-ucs-content-store-eu-west/content/pii:S2215016124003662/STRIPIN/image/svg+xml/be702877efbf3c631826903fa206837c/si16.svg si16 si16.svg svg 3542 ALTIMG 1-s2.0-S2215016124003662-si59.svg https://s3-eu-west-1.amazonaws.com/prod-ucs-content-store-eu-west/content/pii:S2215016124003662/STRIPIN/image/svg+xml/c8cc455d73ae2cf5cf1d871733203f69/si59.svg si59 si59.svg svg 1225 ALTIMG 1-s2.0-S2215016124003662-si32.svg https://s3-eu-west-1.amazonaws.com/prod-ucs-content-store-eu-west/content/pii:S2215016124003662/STRIPIN/image/svg+xml/67e2f63fe14000233b4785c42d4875c3/si32.svg si32 si32.svg svg 1824 ALTIMG 1-s2.0-S2215016124003662-si12.svg https://s3-eu-west-1.amazonaws.com/prod-ucs-content-store-eu-west/content/pii:S2215016124003662/STRIPIN/image/svg+xml/b8304e894c95709324e224f84a8911d8/si12.svg si12 si12.svg svg 7354 ALTIMG 1-s2.0-S2215016124003662-si61.svg https://s3-eu-west-1.amazonaws.com/prod-ucs-content-store-eu-west/content/pii:S2215016124003662/STRIPIN/image/svg+xml/b5ccb4f90be3ca19357176af4e7851c3/si61.svg si61 si61.svg svg 1674 ALTIMG 1-s2.0-S2215016124003662-si48.svg https://s3-eu-west-1.amazonaws.com/prod-ucs-content-store-eu-west/content/pii:S2215016124003662/STRIPIN/image/svg+xml/36d14fd03e1b0cd09376f2c33d0c8315/si48.svg si48 si48.svg svg 2067 ALTIMG 1-s2.0-S2215016124003662-si40.svg https://s3-eu-west-1.amazonaws.com/prod-ucs-content-store-eu-west/content/pii:S2215016124003662/STRIPIN/image/svg+xml/ab39cc988f16842d7994b1b5a5dc016e/si40.svg si40 si40.svg svg 2631 ALTIMG 1-s2.0-S2215016124003662-si31.svg https://s3-eu-west-1.amazonaws.com/prod-ucs-content-store-eu-west/content/pii:S2215016124003662/STRIPIN/image/svg+xml/40ad1e998468d661e2d7bdedac8695a7/si31.svg si31 si31.svg svg 1637 ALTIMG 1-s2.0-S2215016124003662-si45.svg https://s3-eu-west-1.amazonaws.com/prod-ucs-content-store-eu-west/content/pii:S2215016124003662/STRIPIN/image/svg+xml/424a0b129e1c681c00209e5953a1fd0a/si45.svg si45 si45.svg svg 4047 ALTIMG 1-s2.0-S2215016124003662-si25.svg https://s3-eu-west-1.amazonaws.com/prod-ucs-content-store-eu-west/content/pii:S2215016124003662/STRIPIN/image/svg+xml/e56238b340129984cc03d89e539c7a56/si25.svg si25 si25.svg svg 8867 ALTIMG 1-s2.0-S2215016124003662-si11.svg https://s3-eu-west-1.amazonaws.com/prod-ucs-content-store-eu-west/content/pii:S2215016124003662/STRIPIN/image/svg+xml/cb146d0714d1ed3b2c10309ccffd5b52/si11.svg si11 si11.svg svg 15699 ALTIMG 1-s2.0-S2215016124003662-si33.svg https://s3-eu-west-1.amazonaws.com/prod-ucs-content-store-eu-west/content/pii:S2215016124003662/STRIPIN/image/svg+xml/50b22d2af392600477c9e84b210bb9ca/si33.svg si33 si33.svg svg 1894 ALTIMG 1-s2.0-S2215016124003662-si35.svg https://s3-eu-west-1.amazonaws.com/prod-ucs-content-store-eu-west/content/pii:S2215016124003662/STRIPIN/image/svg+xml/82faa639d53d77c74adfa66cdef1580e/si35.svg si35 si35.svg svg 6904 ALTIMG 1-s2.0-S2215016124003662-si13.svg https://s3-eu-west-1.amazonaws.com/prod-ucs-content-store-eu-west/content/pii:S2215016124003662/STRIPIN/image/svg+xml/ef9b516e4be9701e02add0b75d1c4b25/si13.svg si13 si13.svg svg 1763 ALTIMG 1-s2.0-S2215016124003662-si46.svg https://s3-eu-west-1.amazonaws.com/prod-ucs-content-store-eu-west/content/pii:S2215016124003662/STRIPIN/image/svg+xml/e888bde2dc5290f3cdf1d9a7f81bd38f/si46.svg si46 si46.svg svg 1289 ALTIMG 1-s2.0-S2215016124003662-si22.svg https://s3-eu-west-1.amazonaws.com/prod-ucs-content-store-eu-west/content/pii:S2215016124003662/STRIPIN/image/svg+xml/e60103a5364f47ed5cac7938d2b6903c/si22.svg si22 si22.svg svg 1931 ALTIMG 1-s2.0-S2215016124003662-si55.svg https://s3-eu-west-1.amazonaws.com/prod-ucs-content-store-eu-west/content/pii:S2215016124003662/STRIPIN/image/svg+xml/09ee42b59195b66c76f8d60fef8e2859/si55.svg si55 si55.svg svg 16220 ALTIMG 1-s2.0-S2215016124003662-si27.svg https://s3-eu-west-1.amazonaws.com/prod-ucs-content-store-eu-west/content/pii:S2215016124003662/STRIPIN/image/svg+xml/b8dc60b91f3e4af36ea63435e9d1399b/si27.svg si27 si27.svg svg 1496 ALTIMG MEX 102915 102915 S2215-0161(24)00366-2 10.1016/j.mex.2024.102915 The Author(s) Table 1 Equation for Surface biophysical parameter calculations. Table 1: Biophysical parameters Equation Description EVI * E V I = G * ρ N I R − ρ R E D ρ N I R + ( C 1 * ρ R E D − C 2 * ρ B L U E ) + L ρ N I R , ρ R E D , ρ B L U E represent reflectance values of Bands 2, 4, and 5 of the Landsat-8 OLI/TIRS MNDWI M N D W I = ρ G r e e n − ρ S W I R 1 ρ G r e e n + ρ S W I R 1 ρ G r e e n , ρ S W I R 1 represent reflectance values of Bands 3 and 6 of the Landsat-8 OLI/TIRS NDBI N D B I = ρ S W I R 1 − ρ N I R ρ S W I R 1 + ρ N I R ρ S W I R 1 , ρ N I R represent reflectance values of Bands 5 and 6 of the Landsat-8 OLI/TIRS NDBaI N D B a I = ρ S W I R 1 − ρ T I R S ρ S W I R 1 + ρ T I R S ρ S W I R 1 , ρ T I R S represent reflectance values of Bands 5 and 10 of the Landsat-8 OLI/TIRS Albedo A l b e d o = 0.356 α 2 + 0.130 α 4 + 0.373 α 5 + 0.085 α 6 + 0.072 α 7 − 0.0018 0.356 + 0.130 + 0.373 + 0.085 + 0.072 α represent reflectance values of Bands 2,4,5,6 and 7 \u204e L is a soil adjustment factor, and C1 and C2 are coefficients used to correct aerosol scattering in the red band by the use of the blue band. In general, G = 2.5, C1=6.0, C2=7.5, and L = 1 [11]. Modeling the spatially varying effects of biophysical factors on land surface temperature Getahun Bekele Debele Conceptualization Methodology Data curation Software Validation Writing \u2013 original draft a b \u204e Kassahun Ture Beketie Conceptualization Methodology Data curation Supervision Writing \u2013 review & editing a a Center for Environmental Sciences, College of Natural and Computational Sciences, Addis Ababa University, PO Box 1176, Addis Ababa, Ethiopia Center for Environmental Sciences College of Natural and Computational Sciences Addis Ababa University PO Box 1176 Addis Ababa Ethiopia aCenter for Environmental Sciences, College of Natural and Computational Sciences, Addis Ababa University, PO Box 1176, Addis Ababa, Ethiopia b Department of Geography and Environment, Debark University, PO Box 90, Debark, Ethiopia Department of Geography and Environment Debark University PO Box 90 Debark Ethiopia bDepartment of Geography and Environment, Debark University, PO Box 90, Debark, Ethiopia \u204e Corresponding author. A growing number of studies have investigated how land surface temperature (LST) is influenced by a variety of driving factors; however, little effort has been made to identify the dominant ones. The suggested method used the Upper Awash Basin (UAB), Ethiopia, as an example to explore the spatial heterogeneity and factors affecting LST, which is critical for selecting effective mitigation strategies to manage the thermal environment. The study employed two models: ordinary least squares (OLS) and geographically weighted regression (GWR). The OLS model was first used to capture the overall relationship between LST and some biophysical factors. The GWR was then utilized to investigate the spatial non-stationary relationships between LST and its influencing biophysical factors. Although the method was tested in UAB, Ethiopia, it can be applied in similar agroecosystems, to identify the dominant factors that influence LST and develop site-specific LST mitigation strategies. \u2022 The OLS and GWR models investigated the spatial heterogeneities of the influencing factors and LST. \u2022 Biophysical parameters such as enhanced vegetation index (EVI), modified normalized difference water index (MNDWI), normalized difference built-up index (NDBI), normalized difference bareness index (NDBaI), albedo and elevation were used as potential driving environmental factors of LST \u2022 The models performance was computed using the adjusted coefficient of determination (adj. R2), Akaike Information Criterion (AICc), and residual sum of squares (RSS). Graphical abstract Image, graphical abstract Keywords Spatial non-stationarity Land surface temperature Biophysical factors Ordinary least squares Geographically weighted regression Method name Geospatial modeling Data availability Raw data is deposited in the Mendeley dataset repository available at: https://data.mendeley.com/datasets/ydspw5pxtd/1. Specifications table Subject area: Environmental Science More specific subject area: Land surface temperature Name of your method: Geospatial modeling Name and reference of original method: Debele, G.B. and Beketie, K.T., 2023. Studying the spatial non-stationary relationships of some physical parameters on the Earth's surface temperature using GWR in Upper Awash basin, Ethiopia. Scientific African, 23(2024), p.e02052, https://doi.org/10.1016/j.sciaf.2023.e02052 Resource availability: Landsat 8 OLI/TIRS and Shuttle Radar Topography Mission (SRTM) datasets were freely accessed from the United States Geological Survey (USGS) portal https://earthexplorer.usgs.gov/ Method details LST is a crucial parameter that reflects land\u2013atmosphere interaction, and its intensity and spatial pattern are mostly influenced by the biophysical composition of the land surface. Understanding the intensity and the spatio-temporal variations of LST is vital to derive appropriate mitigation strategies to regulate the thermal environment [1]. LST derived from satellite remotely sensed thermal infrared (TIR) imagery has become an indispensable data source to study the spatial non-stationary relationships between LST and its influencing biophysical factors. This method offers several advantages, including cost-effectiveness, wide temporal and spatial coverage, and data characterized by reputable accuracy, surpassing the limitations of in-situ data sources, such as traditional weather stations [2]. The spatial variation of LST is complex and nonlinear. Thus, specific methods are required for evaluating this phenomenon. This phenomenon has been evaluated using a variety of statistical approaches, including global regression models such as ordinary least squares (OLS), spatial error model (SEM), and spatial lag model (SLM), which often overlook the issue of spatial heterogeneity. Recently, various studies have employed a strong statistical approach called Geographically Weighted Regression (GWR), which adds geographical distribution information to the regression parameters to examine spatial changes. Therefore, this article describes the methodology used to investigate the spatial non-stationary relationships between LST and its influencing environmental factors. Landsat 8 OLI/TIRS images (168/54 and 169/54) collected in January 2021 were utilized to extract LST and its influencing environmental factors, while elevation was computed using SRTM DEM data [3]. Before analysis, satellite images must be radiometrically corrected to remove noise from the sensor and atmosphere, which is done by converting digital numbers (DN) to radiance and reflectance using a spectral radiance model [4]. First, the Landsat-8 OLI imagery was converted to top-of-atmosphere (TOA) spectral radiance using the radiance rescaling factors provided in the metadata file using the equation given in Eq. (1). (1) L λ = M L × Q c a l + A L where L λ is TOA spectral radiance in W/(m2 × sr × µm), M P is the band-specific multiplicative scaling factor from the metadata, A L is the band-specific additive scaling factor from the metadata, and Q c a l is Level 1 pixel value in DN. Landsat-8 OLI band data can also be converted to TOA planetary reflectance using the reflectance rescaling coefficients provided in the product metadata file, as shown in Eq. (2). (2) ρ λ \u2032 = M ρ × Q c a l + A ρ where ρ λ \u2032 is TOA planetary reflectance in W/(m2 × sr × µm), M ρ is the band-specific multiplicative scaling factor from the metadata, A ρ is the band-specific additive scaling factor from the metadata, and Q c a l is Level 1 pixel value in DN. The derived TOA reflectance is not true reflectance; solar elevation angle correction is required to obtain true TOA reflectance is as follows Eq. (3). (3) ρ λ = ρ λ \u2032 c o s ( θ S Z ) = ρ λ \u2032 s i n ( θ S E ) where ρ λ is the true planetary reflectance and θ S E is local sun elevation angle, θ S Z is local solar zenith angle. Extraction of biophysical factors The biophysical properties of the earth's surface often considered as influencing factors in LST studies, which contain a large amount of spectral information and are easy to obtain from remoting sensing images. EVI, a modified version of the NDVI, was first introduced by Tucker [5] and has become one of the most widely used indexes for characterizing vegetation greenness. EVI was shown to have a negative relationship with LST [6], indicating that vegetation has a greater cooling capability and plays an important role in lowering the LST of its surrounding neighbors. Xu [7] introduced a modified normalized difference water index (MNDWI) to improve the features of open water bodies, which is now frequently used to evaluate the impact of water bodies on LST. The NDBI, NDBaI, and albedo are important biophysical factors that exacerbate the thermal environment. NDBI, initially developed by Zha et al. [8], is the most extensively used indices for characterizing and identifying the built-up area. NDBaI is also a well-known LULC indices for estimating the extent of barren lands in the region of study, and it is commonly used to evaluate the impact of bare soil on LST [9]. Albedo, a measure of the fraction of solar radiation reflected from the earth's surface, is one of the environmental factors influencing LST and is calculated as described by Liang [10]. The radiometrically corrected reflectance bands of Landsat-8 were used to calculate the selected five surface biophysical features (Table 1 ). Retrieval of LST The retrieval of LST using the mono-window algorithm involves the following steps. In the first step, the digital number (DN) of Landsat 8 OLI/TIRS band 10 images was converted to spectral radiance using Eq. (4) given by Ihlen & Zanter, [12]. (4) L λ = M L × Q c a l + A L − O i where, L λ is the Top-of-Atmosphere (TOA) spectral radiance in W/(m2 × sr × µm), M L is the band-specific multiplicative scaling factor from the metadata, A L is the band-specific additive scaling factor from the metadata, Q c a l is Level 1 pixel value in DN and O i is the correction of the thermal band. Secondly, using Eq. (5), sensor spectral radiance is converted into sensor brightness (5) T B = K 2 l n ( K 1 P λ + 1 ) where, T B is effective at-sensor brightness temperature in Kelvin (K), and K 1 and K 2 are band-specific thermal conversion constants from the metadata. For Landsat-8 TIRS band 10, K 1 was 774.8853 and K 2 was 1321.0789, P λ is sensor spectral radiance and l n is the natural logarithm. The land surface is composed of different objects that have different emissivities. Since the land surface emissivity (ε) varies greatly with surface features, it is vital to determine it before computing LST [13]. The NDVI threshold approach is one of the most popular emissivity extraction techniques currently in use due to its simplicity of application [14]. Thus, ε is calculated as given in Eq. (6) given by Sobrino et al. [15]. (6) E = 0.004 P V + 0.986 where, E is emissivity and P V is the proportion of the vegetation, which may be estimated using the formula provided by Carlson and Ripley [16] and stated in Eq. (7). (7) P V = ( N D V I − N D V I m i n N D V I m a x − N D V I m i n ) 2 where, N D V I m a x is a fully vegetated land-covers N D V I value 0.5; N D V I m i n is a non-vegetated land-covers N D V I value 0.2 [14]. Finally, Eq. (8) was applied to correct the computed radiant surface temperature for emissivity . (8) L S T = T B { 1 + [ ( λ T B ρ ) l n ε λ ] } − 273.15 where, LST is land surface temperature (in degree Celsius); T B is the radiant surface temperature (in kelvin); λ is emitted radiance wavelength (10.8 µm); ρ is calculated as ρ = h c σ =1.438 × 10\u20132 mK, ρ is the Boltzmann constant (1.38 × 10\u201323 J/K), h is Planck's constant (6.62 × 10\u201334 J/s), and c is velocity of light (2.998 × 108 m s-1); and ε is land surface emissivity. Spatial association of LST To evaluate the relationships between LST and selected biophysical factors, 5446 sample points in the study area were randomly generated using 'create random points' tool in ArcGIS 10.8. The values of each parameter were then extracted for each point using the 'extract multi values to points' tools, and exported to the OLS and GWR models. Initially, using GeoDa 1.20.0 software, the OLS model was used to examine the relationships between LST and its influencing factors [17]. The expression for this global OLS model is Eq. (9). (9) y i = β 0 + ∑ j = 1 k β j x i j + ε i where, y i is the i t h observation of dependent variable, x i j is the i t h observation of the j t h independent variable, β j is the regression coefficient of the j t h variable, and ε i is the error term. However, the OLS regression could be biased whether spatial autocorrelation and spatial heterogeneity are present. Therefore, the Global Moran's I test was applied to assess whether there is spatial autocorrelation in the LST and the residual term. The global Moran's I Index is calculated using the following formula [18]. (10) M o r a n \u2032 s I = n ∑ ∑ w i j ( x i − x ¯ ) ( x j − x ¯ ) w ∑ ( x i − x ¯ ) 2 (11) L o c a l M o r a n \u2032 s I = n ( x i − x ¯ ) ∑ j = 1 n w i j ( x j − x ¯ ) ∑ i = 1 n ( x i − x ¯ ) where, n is number of points; x i and x j are the LST values of sample i and j , respectively; w i j is the spatial weight describing the distance between i and j ; and x ¯ is the average LST value. The local spatial autocorrelation index is often measured by the local Moran' I statistic in Eq. (11), used to explore the geographic location of such clustered/dispersed patterns of LST [19]. The local patterns of the relationship between LST and explanatory variables are better characterized by the GWR model than by the global OLS model [20]. The GWR model was developed using the GWR4 software [21]. The GWR model can be expressed mathematically as follows: (12) y i = β 0 ( u i , v i ) + ∑ k = 1 n β k ( u i , v i ) x i k + ε i where, ( u i , v i ) is the geographic coordinate of the i t h location; β 0 ( u i , v i ) is a constant term, β k ( u i , v i ) is the regression coefficient of each variable at point i and ε i is the random error term at point i . In this study, to evaluate the performance of the OLS and GWR model, three parameters including adj. R2, and the RSS were chosen, and higher adjust R2 and lower AICc and RSS values indicate better model performance [22]. Ethics statements This declaration is not applicable. CRediT authorship contribution statement Getahun Bekele Debele: Conceptualization, Methodology, Data curation, Software, Validation, Writing \u2013 original draft. Kassahun Ture Beketie: Conceptualization, Methodology, Data curation, Supervision, Writing \u2013 review & editing. Declaration of competing interest The authors declare that they have no known competing financial interests or personal relationships that could have appeared to influence the work reported in this paper. Acknowledgments We thank the United States Geological Survey (USGS) for providing the Landsat 8 OLI/TIRS and SRTM DEM data publicly available and accessible. References [1] Z. Lin H. Xu X. Yao C. Yang L. Yang Exploring the relationship between thermal environmental factors and land surface temperature of a \u201cfurnace city\u201d based on local climate zones Build. Environ. 243 2023 110732 10.1016/j.buildenv.2023.110732 Lin, Z., Xu, H., Yao, X., Yang, C. and Yang, L., 2023. Exploring the relationship between thermal environmental factors and land surface temperature of a \u201cfurnace city\u201d based on local climate zones. Build. Environ., 243, p. 110732, https://doi.org/10.1016/j.buildenv.2023.110732 [2] H. Liu Q. Zhan C. Yang J. Wang The multi-timescale temporal patterns and dynamics of land surface temperature using Ensemble Empirical Mode Decomposition Sci. Total Environ. 652 2019 243 255 10.1016/j.scitotenv.2018.10.252 Liu, H., Zhan, Q., Yang, C. and Wang, J., 2019. The multi-timescale temporal patterns and dynamics of land surface temperature using Ensemble Empirical Mode Decomposition. Sci. Total Environ., 652, pp.243\u2013255, https://doi.org/10.1016/j.scitotenv.2018.10.252 [3] G.B. Debele K.T. Beketie Studying the spatial non-stationary relationships of some physical parameters on the Earth's surface temperature using GWR in Upper Awash basin Ethiopia. Scientific African 23 2024 2023 e02052 10.1016/j.sciaf.2023.e02052 Debele, G.B. and Beketie, K.T., 2023. Studying the spatial non-stationary relationships of some physical parameters on the Earth's surface temperature using GWR in Upper Awash basin, Ethiopia. Scientific African, 23(2024), p. e02052, https://doi.org/10.1016/j.sciaf.2023.e02052 [4] D.P. Roy V. Kovalskyy H.K. Zhang E.F. Vermote L. Yan S.S. Kumar A. Egorov Characterization of Landsat-7 to Landsat-8 reflective wavelength and normalized difference vegetation index continuity Remote Sens. Environ. 185 2016 57 70 10.1016/j.rse.2015.12.024 Roy, D.P., Kovalskyy, V., Zhang, H.K., Vermote, E.F., Yan, L., Kumar, S.S. and Egorov, A., 2016. Characterization of Landsat-7 to Landsat-8 reflective wavelength and normalized difference vegetation index continuity. Remote Sens. Environ., 185, pp. 57\u201370, doi: 10.1016/j.rse.2015.12.024 [5] C.J. Tucker Red and photographic infrared linear combinations for monitoring vegetation Remote Sens. Environ. 8 2 1979 127 150 10.1016/0034-4257(79)90013-0 Tucker, C.J., 1979. Red and photographic infrared linear combinations for monitoring vegetation. Remote Sens. Environ., 8(2), pp.127\u2013150, doi: 10.1016/0034-4257(79)90013-0 [6] Z. Xu Y. Li Y. Qin E. Bach A global assessment of the effects of solar farms on albedo, vegetation, and land surface temperature using remote sensing Sol. Energy 268 2024 112198 10.1016/j.solener.2023.112198 Xu, Z., Li, Y., Qin, Y. and Bach, E., 2024. A global assessment of the effects of solar farms on albedo, vegetation, and land surface temperature using remote sensing. Sol. Energy, 268, p. 112198, https://doi.org/10.1016/j.solener.2023.112198 [7] H. Xu Modification of normalised difference water index (NDWI) to enhance open water features in remotely sensed imagery Int. J. Remote Sens. 27 14 2006 3025 3033 10.1080/01431160600589179 Xu, H., 2006. Modification of normalised difference water index (NDWI) to enhance open water features in remotely sensed imagery. Int. J. Remote Sens., 27(14), pp. 3025\u20133033, doi: 10.1080/01431160600589179 [8] Y. Zha J. Gao S. Ni Use of normalized difference built-up index in automatically mapping urban areas from TM imagery Int. J. Remote Sens. 24 3 2003 583 594 10.1080/01431160304987 Zha, Y., Gao, J. and Ni, S., 2003. Use of normalized difference built-up index in automatically mapping urban areas from TM imagery. Int. J. Remote Sens., 24(3), pp. 583\u2013594, doi: 10.1080/01431160304987 [9] X.L. Chen H.M. Zhao P.X. Li Z.Y. Yin Remote sensing image-based analysis of the relationship between urban heat island and land use/cover changes Remote Sens. Environ. 104 2 2006 133 146 10.1016/j.rse.2005.11.016 Chen, X.L., Zhao, H.M., Li, P.X. and Yin, Z.Y., 2006. Remote sensing image-based analysis of the relationship between urban heat island and land use/cover changes. Remote Sens. Environ., 104(2), pp. 133\u2013146, doi: 10.1016/j.rse.2005.11.016 [10] S. Liang Narrowband to broadband conversions of land surface albedo I: algorithms Remote Sens. Environ. 76 2 2001 213 238 10.1016/S0034-4257(00)00205-4 Liang, S., 2001. Narrowband to broadband conversions of land surface albedo I: algorithms. Remote Sens. Environ., 76(2), pp.213\u2013238, https://doi.org/10.1016/S0034-4257(00)00205-4 [11] A.R. Huete H.Q. Liu K.V. Batchily W.J.D.A. Van Leeuwen A comparison of vegetation indices over a global set of TM images for EOS-MODIS Remote Sens. Environ. 59 3 1997 440 451 10.1016/S0034-4257(96)00112-5 Huete, A.R., Liu, H.Q., Batchily, K.V. and Van Leeuwen, W.J.D.A., 1997. A comparison of vegetation indices over a global set of TM images for EOS-MODIS. Remote Sens. Environ., 59(3), pp.440\u2013451, https://doi.org/10.1016/S0034-4257(96)00112-5 [12] V. Ihlen K. Zanter Landsat 8 Data Users Handbook US Geological Survey 8 2019 114 https://landsat.usgs.gov/documents/Landsat8DataUsersHandbook.pdf Ihlen, V., & Zanter, K. (2019). Landsat 8 Data Users Handbook. US Geological Survey, 8, p. 114. https://landsat.usgs.gov/documents/Landsat8DataUsersHandbook.pdf [13] F.A. Abir S. Ahmmed S.H. Sarker A.U. Fahim Thermal and ecological assessment based on land surface temperature and quantifying multivariate controlling factors in Bogura Bangladesh. Heliyon 7 9 2021 e08012 10.1016/j.heliyon.2021.e08012 Abir, F.A., Ahmmed, S., Sarker, S.H. and Fahim, A.U., 2021. Thermal and ecological assessment based on land surface temperature and quantifying multivariate controlling factors in Bogura, Bangladesh. Heliyon, 7(9), p. e08012, doi: 10.1016/j.heliyon.2021.e08012 [14] Z.L. Li B.H. Tang H. Wu H. Ren G. Yan Z. Wan I.F. Trigo J.A. Sobrino Satellite-derived land surface temperature: current status and perspectives Remote Sens. Environ. 131 2013 14 37 10.1016/j.rse.2012.12.008 Li, Z.L., Tang, B.H., Wu, H., Ren, H., Yan, G., Wan, Z., Trigo, I.F. and Sobrino, J.A., 2013. Satellite-derived land surface temperature: current status and perspectives. Remote Sens. Environ., 131, pp. 14\u201337, doi: 10.1016/j.rse.2012.12.008 [15] J.A. Sobrino J.C. Jiménez-Muñoz L. Paolini Land surface temperature retrieval from LANDSAT TM 5 Remote Sens. Environ. 90 4 2004 434 440 10.1016/j.rse.2004.02.003 Sobrino, J.A., Jiménez-Muñoz, J.C. and Paolini, L., 2004. Land surface temperature retrieval from LANDSAT TM 5. Remote Sens. Environ., 90(4), pp. 434\u2013440, doi: 10.1016/j.rse.2004.02.003 [16] T.N. Carlson D.A. Ripley On the relation between NDVI, fractional vegetation cover, and leaf area index Remote Sens. Environ. 62 3 1997 241 252 10.1016/S0034-4257(97)00104-1 Carlson, T.N. and Ripley, D.A., 1997. On the relation between NDVI, fractional vegetation cover, and leaf area index. Remote Sens. Environ., 62(3), pp. 241\u2013252, doi: 10.1016/S0034-4257(97)00104-1 [17] L. Anselin I. Syabri Y. Kho GeoDa: an introduction to spatial data analysis M. Fischer A. Getis Handbook of Applied Spatial Analysis 2010 Springer Berlin, Heidelberg 10.1007/978-3-642-03647-7_5 Anselin, L., Syabri, I., Kho, Y., 2010. GeoDa: an introduction to spatial data analysis. In: Fischer, M., Getis, A. (eds) Handbook of Applied Spatial Analysis. Springer, Berlin, Heidelberg. https://doi.org/10.1007/978-3-642-03647-7_5 [18] A. Guo J. Yang W. Sun X. Xiao J.X. Cecilia C. Jin X. Li Impact of urban morphology and landscape characteristics on spatiotemporal heterogeneity of land surface temperature Sustainable Cities and Society 63 2020 102443 10.1016/j.scs.2020.102443 Guo, A., Yang, J., Sun, W., Xiao, X., Cecilia, J.X., Jin, C. and Li, X., 2020. Impact of urban morphology and landscape characteristics on spatiotemporal heterogeneity of land surface temperature. Sustainable Cities and Society, 63, p. 102443, doi: 10.1016/j.scs.2020.102443 [19] S. Das D.P. Angadi Land use-land cover (LULC) transformation and its relation with land surface temperature changes: a case study of Barrackpore Subdivision, West Bengal, India Remote Sens. Applicat.: Society and Environ. 19 2020 100322 10.1016/j.rsase.2020.100322 Das, S. and Angadi, D.P., 2020. Land use-land cover (LULC) transformation and its relation with land surface temperature changes: a case study of Barrackpore Subdivision, West Bengal, India. Remote Sens. Applicat.: Society and Environ., 19, p. 100322, doi: 10.1016/j.rsase.2020.100322 [20] C. Zhao J. Jensen Q. Weng R. Weaver A geographically weighted regression analysis of the underlying factors related to the surface urban heat island phenomenon Remote Sens (Basel) 10 9 2018 1428 10.3390/rs10091428 Zhao, C., Jensen, J., Weng, Q. and Weaver, R., 2018. A geographically weighted regression analysis of the underlying factors related to the surface urban heat island phenomenon. Remote Sens (Basel), 10(9), p. 1428, doi: 10.3390/rs10091428 [21] Nakaya, T., Fotheringham, S., Charlton, M. and Brunsdon, C., 2009. Semiparametric geographically weighted generalised linear modelling in GWR 4.0. [22] Y. Gao J. Zhao L. Han Exploring the spatial heterogeneity of urban heat island effect and its relationship to block morphology with the geographically weighted regression model Sustainable Cities and Society 76 2022 103431 10.1016/j.scs.2021.103431 Gao, Y., Zhao, J. and Han, L., 2022. Exploring the spatial heterogeneity of urban heat island effect and its relationship to block morphology with the geographically weighted regression model. Sustainable Cities and Society, 76, p. 103431, https://doi.org/10.1016/j.scs.2021.103431",
    "scopus-id": "85201507381",
    "coredata": {
        "eid": "1-s2.0-S2215016124003662",
        "dc:description": "A growing number of studies have investigated how land surface temperature (LST) is influenced by a variety of driving factors; however, little effort has been made to identify the dominant ones. The suggested method used the Upper Awash Basin (UAB), Ethiopia, as an example to explore the spatial heterogeneity and factors affecting LST, which is critical for selecting effective mitigation strategies to manage the thermal environment. The study employed two models: ordinary least squares (OLS) and geographically weighted regression (GWR). The OLS model was first used to capture the overall relationship between LST and some biophysical factors. The GWR was then utilized to investigate the spatial non-stationary relationships between LST and its influencing biophysical factors. Although the method was tested in UAB, Ethiopia, it can be applied in similar agroecosystems, to identify the dominant factors that influence LST and develop site-specific LST mitigation strategies. \u2022 The OLS and GWR models investigated the spatial heterogeneities of the influencing factors and LST. \u2022 Biophysical parameters such as enhanced vegetation index (EVI), modified normalized difference water index (MNDWI), normalized difference built-up index (NDBI), normalized difference bareness index (NDBaI), albedo and elevation were used as potential driving environmental factors of LST \u2022 The models performance was computed using the adjusted coefficient of determination (adj. R2), Akaike Information Criterion (AICc), and residual sum of squares (RSS).",
        "openArchiveArticle": "false",
        "prism:coverDate": "2024-12-31",
        "openaccessUserLicense": "http://creativecommons.org/licenses/by-nc/4.0/",
        "prism:aggregationType": "Journal",
        "prism:url": "https://api.elsevier.com/content/article/pii/S2215016124003662",
        "dc:creator": [
            {
                "@_fa": "true",
                "$": "Debele, Getahun Bekele"
            },
            {
                "@_fa": "true",
                "$": "Beketie, Kassahun Ture"
            }
        ],
        "link": [
            {
                "@_fa": "true",
                "@rel": "self",
                "@href": "https://api.elsevier.com/content/article/pii/S2215016124003662"
            },
            {
                "@_fa": "true",
                "@rel": "scidir",
                "@href": "https://www.sciencedirect.com/science/article/pii/S2215016124003662"
            }
        ],
        "dc:format": "application/json",
        "openaccessType": "Full",
        "pii": "S2215-0161(24)00366-2",
        "prism:volume": "13",
        "articleNumber": "102915",
        "prism:publisher": "The Author(s). Published by Elsevier B.V.",
        "dc:title": "Modeling the spatially varying effects of biophysical factors on land surface temperature",
        "prism:copyright": "© 2024 The Author(s). Published by Elsevier B.V.",
        "openaccess": "1",
        "prism:issn": "22150161",
        "dcterms:subject": [
            {
                "@_fa": "true",
                "$": "Spatial non-stationarity"
            },
            {
                "@_fa": "true",
                "$": "Land surface temperature"
            },
            {
                "@_fa": "true",
                "$": "Biophysical factors"
            },
            {
                "@_fa": "true",
                "$": "Ordinary least squares"
            },
            {
                "@_fa": "true",
                "$": "Geographically weighted regression"
            }
        ],
        "openaccessArticle": "true",
        "prism:publicationName": "MethodsX",
        "openaccessSponsorType": "Author",
        "prism:pageRange": "102915",
        "pubType": "mic",
        "prism:coverDisplayDate": "December 2024",
        "prism:doi": "10.1016/j.mex.2024.102915",
        "prism:startingPage": "102915",
        "dc:identifier": "doi:10.1016/j.mex.2024.102915",
        "openaccessSponsorName": null
    },
    "objects": {"object": [
        {
            "@category": "standard",
            "@height": "200",
            "@width": "430",
            "@_fa": "true",
            "$": "https://api.elsevier.com/content/object/eid/1-s2.0-S2215016124003662-ga1.jpg?httpAccept=%2A%2F%2A",
            "@multimediatype": "JPEG image file",
            "@type": "IMAGE-DOWNSAMPLED",
            "@size": "30087",
            "@ref": "ga1",
            "@mimetype": "image/jpeg"
        },
        {
            "@category": "thumbnail",
            "@height": "102",
            "@width": "219",
            "@_fa": "true",
            "$": "https://api.elsevier.com/content/object/eid/1-s2.0-S2215016124003662-ga1.sml?httpAccept=%2A%2F%2A",
            "@multimediatype": "GIF image file",
            "@type": "IMAGE-THUMBNAIL",
            "@size": "8149",
            "@ref": "ga1",
            "@mimetype": "image/gif"
        },
        {
            "@category": "high",
            "@height": "886",
            "@width": "1906",
            "@_fa": "true",
            "$": "https://api.elsevier.com/content/object/eid/1-s2.0-S2215016124003662-ga1_lrg.jpg?httpAccept=%2A%2F%2A",
            "@multimediatype": "JPEG image file",
            "@type": "IMAGE-HIGH-RES",
            "@size": "248303",
            "@ref": "ga1",
            "@mimetype": "image/jpeg"
        },
        {
            "@category": "thumbnail",
            "@_fa": "true",
            "$": "https://api.elsevier.com/content/object/eid/1-s2.0-S2215016124003662-si14.svg?httpAccept=%2A%2F%2A",
            "@multimediatype": "Scalable Vector Graphics file",
            "@type": "ALTIMG",
            "@size": "1982",
            "@ref": "si14",
            "@mimetype": "image/svg+xml"
        },
        {
            "@category": "thumbnail",
            "@_fa": "true",
            "$": "https://api.elsevier.com/content/object/eid/1-s2.0-S2215016124003662-si6.svg?httpAccept=%2A%2F%2A",
            "@multimediatype": "Scalable Vector Graphics file",
            "@type": "ALTIMG",
            "@size": "4312",
            "@ref": "si6",
            "@mimetype": "image/svg+xml"
        },
        {
            "@category": "thumbnail",
            "@_fa": "true",
            "$": "https://api.elsevier.com/content/object/eid/1-s2.0-S2215016124003662-si20.svg?httpAccept=%2A%2F%2A",
            "@multimediatype": "Scalable Vector Graphics file",
            "@type": "ALTIMG",
            "@size": "1735",
            "@ref": "si20",
            "@mimetype": "image/svg+xml"
        },
        {
            "@category": "thumbnail",
            "@_fa": "true",
            "$": "https://api.elsevier.com/content/object/eid/1-s2.0-S2215016124003662-si41.svg?httpAccept=%2A%2F%2A",
            "@multimediatype": "Scalable Vector Graphics file",
            "@type": "ALTIMG",
            "@size": "5924",
            "@ref": "si41",
            "@mimetype": "image/svg+xml"
        },
        {
            "@category": "thumbnail",
            "@_fa": "true",
            "$": "https://api.elsevier.com/content/object/eid/1-s2.0-S2215016124003662-si19.svg?httpAccept=%2A%2F%2A",
            "@multimediatype": "Scalable Vector Graphics file",
            "@type": "ALTIMG",
            "@size": "1925",
            "@ref": "si19",
            "@mimetype": "image/svg+xml"
        },
        {
            "@category": "thumbnail",
            "@_fa": "true",
            "$": "https://api.elsevier.com/content/object/eid/1-s2.0-S2215016124003662-si18.svg?httpAccept=%2A%2F%2A",
            "@multimediatype": "Scalable Vector Graphics file",
            "@type": "ALTIMG",
            "@size": "2239",
            "@ref": "si18",
            "@mimetype": "image/svg+xml"
        },
        {
            "@category": "thumbnail",
            "@_fa": "true",
            "$": "https://api.elsevier.com/content/object/eid/1-s2.0-S2215016124003662-si30.svg?httpAccept=%2A%2F%2A",
            "@multimediatype": "Scalable Vector Graphics file",
            "@type": "ALTIMG",
            "@size": "1924",
            "@ref": "si30",
            "@mimetype": "image/svg+xml"
        },
        {
            "@category": "thumbnail",
            "@_fa": "true",
            "$": "https://api.elsevier.com/content/object/eid/1-s2.0-S2215016124003662-si36.svg?httpAccept=%2A%2F%2A",
            "@multimediatype": "Scalable Vector Graphics file",
            "@type": "ALTIMG",
            "@size": "1402",
            "@ref": "si36",
            "@mimetype": "image/svg+xml"
        },
        {
            "@category": "thumbnail",
            "@_fa": "true",
            "$": "https://api.elsevier.com/content/object/eid/1-s2.0-S2215016124003662-si17.svg?httpAccept=%2A%2F%2A",
            "@multimediatype": "Scalable Vector Graphics file",
            "@type": "ALTIMG",
            "@size": "7949",
            "@ref": "si17",
            "@mimetype": "image/svg+xml"
        },
        {
            "@category": "thumbnail",
            "@_fa": "true",
            "$": "https://api.elsevier.com/content/object/eid/1-s2.0-S2215016124003662-si52.svg?httpAccept=%2A%2F%2A",
            "@multimediatype": "Scalable Vector Graphics file",
            "@type": "ALTIMG",
            "@size": "2421",
            "@ref": "si52",
            "@mimetype": "image/svg+xml"
        },
        {
            "@category": "thumbnail",
            "@_fa": "true",
            "$": "https://api.elsevier.com/content/object/eid/1-s2.0-S2215016124003662-si53.svg?httpAccept=%2A%2F%2A",
            "@multimediatype": "Scalable Vector Graphics file",
            "@type": "ALTIMG",
            "@size": "2167",
            "@ref": "si53",
            "@mimetype": "image/svg+xml"
        },
        {
            "@category": "thumbnail",
            "@_fa": "true",
            "$": "https://api.elsevier.com/content/object/eid/1-s2.0-S2215016124003662-si29.svg?httpAccept=%2A%2F%2A",
            "@multimediatype": "Scalable Vector Graphics file",
            "@type": "ALTIMG",
            "@size": "8606",
            "@ref": "si29",
            "@mimetype": "image/svg+xml"
        },
        {
            "@category": "thumbnail",
            "@_fa": "true",
            "$": "https://api.elsevier.com/content/object/eid/1-s2.0-S2215016124003662-si10.svg?httpAccept=%2A%2F%2A",
            "@multimediatype": "Scalable Vector Graphics file",
            "@type": "ALTIMG",
            "@size": "4044",
            "@ref": "si10",
            "@mimetype": "image/svg+xml"
        },
        {
            "@category": "thumbnail",
            "@_fa": "true",
            "$": "https://api.elsevier.com/content/object/eid/1-s2.0-S2215016124003662-si39.svg?httpAccept=%2A%2F%2A",
            "@multimediatype": "Scalable Vector Graphics file",
            "@type": "ALTIMG",
            "@size": "6414",
            "@ref": "si39",
            "@mimetype": "image/svg+xml"
        },
        {
            "@category": "thumbnail",
            "@_fa": "true",
            "$": "https://api.elsevier.com/content/object/eid/1-s2.0-S2215016124003662-si42.svg?httpAccept=%2A%2F%2A",
            "@multimediatype": "Scalable Vector Graphics file",
            "@type": "ALTIMG",
            "@size": "14427",
            "@ref": "si42",
            "@mimetype": "image/svg+xml"
        },
        {
            "@category": "thumbnail",
            "@_fa": "true",
            "$": "https://api.elsevier.com/content/object/eid/1-s2.0-S2215016124003662-si60.svg?httpAccept=%2A%2F%2A",
            "@multimediatype": "Scalable Vector Graphics file",
            "@type": "ALTIMG",
            "@size": "3205",
            "@ref": "si60",
            "@mimetype": "image/svg+xml"
        },
        {
            "@category": "thumbnail",
            "@_fa": "true",
            "$": "https://api.elsevier.com/content/object/eid/1-s2.0-S2215016124003662-si49.svg?httpAccept=%2A%2F%2A",
            "@multimediatype": "Scalable Vector Graphics file",
            "@type": "ALTIMG",
            "@size": "3016",
            "@ref": "si49",
            "@mimetype": "image/svg+xml"
        },
        {
            "@category": "thumbnail",
            "@_fa": "true",
            "$": "https://api.elsevier.com/content/object/eid/1-s2.0-S2215016124003662-si7.svg?httpAccept=%2A%2F%2A",
            "@multimediatype": "Scalable Vector Graphics file",
            "@type": "ALTIMG",
            "@size": "4712",
            "@ref": "si7",
            "@mimetype": "image/svg+xml"
        },
        {
            "@category": "thumbnail",
            "@_fa": "true",
            "$": "https://api.elsevier.com/content/object/eid/1-s2.0-S2215016124003662-si21.svg?httpAccept=%2A%2F%2A",
            "@multimediatype": "Scalable Vector Graphics file",
            "@type": "ALTIMG",
            "@size": "11109",
            "@ref": "si21",
            "@mimetype": "image/svg+xml"
        },
        {
            "@category": "thumbnail",
            "@_fa": "true",
            "$": "https://api.elsevier.com/content/object/eid/1-s2.0-S2215016124003662-si15.svg?httpAccept=%2A%2F%2A",
            "@multimediatype": "Scalable Vector Graphics file",
            "@type": "ALTIMG",
            "@size": "1566",
            "@ref": "si15",
            "@mimetype": "image/svg+xml"
        },
        {
            "@category": "thumbnail",
            "@_fa": "true",
            "$": "https://api.elsevier.com/content/object/eid/1-s2.0-S2215016124003662-si1.svg?httpAccept=%2A%2F%2A",
            "@multimediatype": "Scalable Vector Graphics file",
            "@type": "ALTIMG",
            "@size": "14441",
            "@ref": "si1",
            "@mimetype": "image/svg+xml"
        },
        {
            "@category": "thumbnail",
            "@_fa": "true",
            "$": "https://api.elsevier.com/content/object/eid/1-s2.0-S2215016124003662-si56.svg?httpAccept=%2A%2F%2A",
            "@multimediatype": "Scalable Vector Graphics file",
            "@type": "ALTIMG",
            "@size": "2402",
            "@ref": "si56",
            "@mimetype": "image/svg+xml"
        },
        {
            "@category": "thumbnail",
            "@_fa": "true",
            "$": "https://api.elsevier.com/content/object/eid/1-s2.0-S2215016124003662-si3.svg?httpAccept=%2A%2F%2A",
            "@multimediatype": "Scalable Vector Graphics file",
            "@type": "ALTIMG",
            "@size": "3639",
            "@ref": "si3",
            "@mimetype": "image/svg+xml"
        },
        {
            "@category": "thumbnail",
            "@_fa": "true",
            "$": "https://api.elsevier.com/content/object/eid/1-s2.0-S2215016124003662-si2.svg?httpAccept=%2A%2F%2A",
            "@multimediatype": "Scalable Vector Graphics file",
            "@type": "ALTIMG",
            "@size": "3145",
            "@ref": "si2",
            "@mimetype": "image/svg+xml"
        },
        {
            "@category": "thumbnail",
            "@_fa": "true",
            "$": "https://api.elsevier.com/content/object/eid/1-s2.0-S2215016124003662-si37.svg?httpAccept=%2A%2F%2A",
            "@multimediatype": "Scalable Vector Graphics file",
            "@type": "ALTIMG",
            "@size": "1709",
            "@ref": "si37",
            "@mimetype": "image/svg+xml"
        },
        {
            "@category": "thumbnail",
            "@_fa": "true",
            "$": "https://api.elsevier.com/content/object/eid/1-s2.0-S2215016124003662-si51.svg?httpAccept=%2A%2F%2A",
            "@multimediatype": "Scalable Vector Graphics file",
            "@type": "ALTIMG",
            "@size": "3166",
            "@ref": "si51",
            "@mimetype": "image/svg+xml"
        },
        {
            "@category": "thumbnail",
            "@_fa": "true",
            "$": "https://api.elsevier.com/content/object/eid/1-s2.0-S2215016124003662-si38.svg?httpAccept=%2A%2F%2A",
            "@multimediatype": "Scalable Vector Graphics file",
            "@type": "ALTIMG",
            "@size": "11476",
            "@ref": "si38",
            "@mimetype": "image/svg+xml"
        },
        {
            "@category": "thumbnail",
            "@_fa": "true",
            "$": "https://api.elsevier.com/content/object/eid/1-s2.0-S2215016124003662-si5.svg?httpAccept=%2A%2F%2A",
            "@multimediatype": "Scalable Vector Graphics file",
            "@type": "ALTIMG",
            "@size": "11960",
            "@ref": "si5",
            "@mimetype": "image/svg+xml"
        },
        {
            "@category": "thumbnail",
            "@_fa": "true",
            "$": "https://api.elsevier.com/content/object/eid/1-s2.0-S2215016124003662-si58.svg?httpAccept=%2A%2F%2A",
            "@multimediatype": "Scalable Vector Graphics file",
            "@type": "ALTIMG",
            "@size": "1068",
            "@ref": "si58",
            "@mimetype": "image/svg+xml"
        },
        {
            "@category": "thumbnail",
            "@_fa": "true",
            "$": "https://api.elsevier.com/content/object/eid/1-s2.0-S2215016124003662-si63.svg?httpAccept=%2A%2F%2A",
            "@multimediatype": "Scalable Vector Graphics file",
            "@type": "ALTIMG",
            "@size": "3632",
            "@ref": "si63",
            "@mimetype": "image/svg+xml"
        },
        {
            "@category": "thumbnail",
            "@_fa": "true",
            "$": "https://api.elsevier.com/content/object/eid/1-s2.0-S2215016124003662-si65.svg?httpAccept=%2A%2F%2A",
            "@multimediatype": "Scalable Vector Graphics file",
            "@type": "ALTIMG",
            "@size": "6435",
            "@ref": "si65",
            "@mimetype": "image/svg+xml"
        },
        {
            "@category": "thumbnail",
            "@_fa": "true",
            "$": "https://api.elsevier.com/content/object/eid/1-s2.0-S2215016124003662-si47.svg?httpAccept=%2A%2F%2A",
            "@multimediatype": "Scalable Vector Graphics file",
            "@type": "ALTIMG",
            "@size": "9502",
            "@ref": "si47",
            "@mimetype": "image/svg+xml"
        },
        {
            "@category": "thumbnail",
            "@_fa": "true",
            "$": "https://api.elsevier.com/content/object/eid/1-s2.0-S2215016124003662-si28.svg?httpAccept=%2A%2F%2A",
            "@multimediatype": "Scalable Vector Graphics file",
            "@type": "ALTIMG",
            "@size": "1684",
            "@ref": "si28",
            "@mimetype": "image/svg+xml"
        },
        {
            "@category": "thumbnail",
            "@_fa": "true",
            "$": "https://api.elsevier.com/content/object/eid/1-s2.0-S2215016124003662-si64.svg?httpAccept=%2A%2F%2A",
            "@multimediatype": "Scalable Vector Graphics file",
            "@type": "ALTIMG",
            "@size": "6110",
            "@ref": "si64",
            "@mimetype": "image/svg+xml"
        },
        {
            "@category": "thumbnail",
            "@_fa": "true",
            "$": "https://api.elsevier.com/content/object/eid/1-s2.0-S2215016124003662-si57.svg?httpAccept=%2A%2F%2A",
            "@multimediatype": "Scalable Vector Graphics file",
            "@type": "ALTIMG",
            "@size": "2553",
            "@ref": "si57",
            "@mimetype": "image/svg+xml"
        },
        {
            "@category": "thumbnail",
            "@_fa": "true",
            "$": "https://api.elsevier.com/content/object/eid/1-s2.0-S2215016124003662-si9.svg?httpAccept=%2A%2F%2A",
            "@multimediatype": "Scalable Vector Graphics file",
            "@type": "ALTIMG",
            "@size": "10523",
            "@ref": "si9",
            "@mimetype": "image/svg+xml"
        },
        {
            "@category": "thumbnail",
            "@_fa": "true",
            "$": "https://api.elsevier.com/content/object/eid/1-s2.0-S2215016124003662-si24.svg?httpAccept=%2A%2F%2A",
            "@multimediatype": "Scalable Vector Graphics file",
            "@type": "ALTIMG",
            "@size": "2438",
            "@ref": "si24",
            "@mimetype": "image/svg+xml"
        },
        {
            "@category": "thumbnail",
            "@_fa": "true",
            "$": "https://api.elsevier.com/content/object/eid/1-s2.0-S2215016124003662-si26.svg?httpAccept=%2A%2F%2A",
            "@multimediatype": "Scalable Vector Graphics file",
            "@type": "ALTIMG",
            "@size": "1675",
            "@ref": "si26",
            "@mimetype": "image/svg+xml"
        },
        {
            "@category": "thumbnail",
            "@_fa": "true",
            "$": "https://api.elsevier.com/content/object/eid/1-s2.0-S2215016124003662-si62.svg?httpAccept=%2A%2F%2A",
            "@multimediatype": "Scalable Vector Graphics file",
            "@type": "ALTIMG",
            "@size": "13205",
            "@ref": "si62",
            "@mimetype": "image/svg+xml"
        },
        {
            "@category": "thumbnail",
            "@_fa": "true",
            "$": "https://api.elsevier.com/content/object/eid/1-s2.0-S2215016124003662-si43.svg?httpAccept=%2A%2F%2A",
            "@multimediatype": "Scalable Vector Graphics file",
            "@type": "ALTIMG",
            "@size": "1086",
            "@ref": "si43",
            "@mimetype": "image/svg+xml"
        },
        {
            "@category": "thumbnail",
            "@_fa": "true",
            "$": "https://api.elsevier.com/content/object/eid/1-s2.0-S2215016124003662-si23.svg?httpAccept=%2A%2F%2A",
            "@multimediatype": "Scalable Vector Graphics file",
            "@type": "ALTIMG",
            "@size": "3037",
            "@ref": "si23",
            "@mimetype": "image/svg+xml"
        },
        {
            "@category": "thumbnail",
            "@_fa": "true",
            "$": "https://api.elsevier.com/content/object/eid/1-s2.0-S2215016124003662-si4.svg?httpAccept=%2A%2F%2A",
            "@multimediatype": "Scalable Vector Graphics file",
            "@type": "ALTIMG",
            "@size": "4396",
            "@ref": "si4",
            "@mimetype": "image/svg+xml"
        },
        {
            "@category": "thumbnail",
            "@_fa": "true",
            "$": "https://api.elsevier.com/content/object/eid/1-s2.0-S2215016124003662-si34.svg?httpAccept=%2A%2F%2A",
            "@multimediatype": "Scalable Vector Graphics file",
            "@type": "ALTIMG",
            "@size": "1760",
            "@ref": "si34",
            "@mimetype": "image/svg+xml"
        },
        {
            "@category": "thumbnail",
            "@_fa": "true",
            "$": "https://api.elsevier.com/content/object/eid/1-s2.0-S2215016124003662-si44.svg?httpAccept=%2A%2F%2A",
            "@multimediatype": "Scalable Vector Graphics file",
            "@type": "ALTIMG",
            "@size": "1049",
            "@ref": "si44",
            "@mimetype": "image/svg+xml"
        },
        {
            "@category": "thumbnail",
            "@_fa": "true",
            "$": "https://api.elsevier.com/content/object/eid/1-s2.0-S2215016124003662-si54.svg?httpAccept=%2A%2F%2A",
            "@multimediatype": "Scalable Vector Graphics file",
            "@type": "ALTIMG",
            "@size": "14399",
            "@ref": "si54",
            "@mimetype": "image/svg+xml"
        },
        {
            "@category": "thumbnail",
            "@_fa": "true",
            "$": "https://api.elsevier.com/content/object/eid/1-s2.0-S2215016124003662-si8.svg?httpAccept=%2A%2F%2A",
            "@multimediatype": "Scalable Vector Graphics file",
            "@type": "ALTIMG",
            "@size": "8878",
            "@ref": "si8",
            "@mimetype": "image/svg+xml"
        },
        {
            "@category": "thumbnail",
            "@_fa": "true",
            "$": "https://api.elsevier.com/content/object/eid/1-s2.0-S2215016124003662-si50.svg?httpAccept=%2A%2F%2A",
            "@multimediatype": "Scalable Vector Graphics file",
            "@type": "ALTIMG",
            "@size": "3357",
            "@ref": "si50",
            "@mimetype": "image/svg+xml"
        },
        {
            "@category": "thumbnail",
            "@_fa": "true",
            "$": "https://api.elsevier.com/content/object/eid/1-s2.0-S2215016124003662-si16.svg?httpAccept=%2A%2F%2A",
            "@multimediatype": "Scalable Vector Graphics file",
            "@type": "ALTIMG",
            "@size": "3542",
            "@ref": "si16",
            "@mimetype": "image/svg+xml"
        },
        {
            "@category": "thumbnail",
            "@_fa": "true",
            "$": "https://api.elsevier.com/content/object/eid/1-s2.0-S2215016124003662-si59.svg?httpAccept=%2A%2F%2A",
            "@multimediatype": "Scalable Vector Graphics file",
            "@type": "ALTIMG",
            "@size": "1225",
            "@ref": "si59",
            "@mimetype": "image/svg+xml"
        },
        {
            "@category": "thumbnail",
            "@_fa": "true",
            "$": "https://api.elsevier.com/content/object/eid/1-s2.0-S2215016124003662-si32.svg?httpAccept=%2A%2F%2A",
            "@multimediatype": "Scalable Vector Graphics file",
            "@type": "ALTIMG",
            "@size": "1824",
            "@ref": "si32",
            "@mimetype": "image/svg+xml"
        },
        {
            "@category": "thumbnail",
            "@_fa": "true",
            "$": "https://api.elsevier.com/content/object/eid/1-s2.0-S2215016124003662-si12.svg?httpAccept=%2A%2F%2A",
            "@multimediatype": "Scalable Vector Graphics file",
            "@type": "ALTIMG",
            "@size": "7354",
            "@ref": "si12",
            "@mimetype": "image/svg+xml"
        },
        {
            "@category": "thumbnail",
            "@_fa": "true",
            "$": "https://api.elsevier.com/content/object/eid/1-s2.0-S2215016124003662-si61.svg?httpAccept=%2A%2F%2A",
            "@multimediatype": "Scalable Vector Graphics file",
            "@type": "ALTIMG",
            "@size": "1674",
            "@ref": "si61",
            "@mimetype": "image/svg+xml"
        },
        {
            "@category": "thumbnail",
            "@_fa": "true",
            "$": "https://api.elsevier.com/content/object/eid/1-s2.0-S2215016124003662-si48.svg?httpAccept=%2A%2F%2A",
            "@multimediatype": "Scalable Vector Graphics file",
            "@type": "ALTIMG",
            "@size": "2067",
            "@ref": "si48",
            "@mimetype": "image/svg+xml"
        },
        {
            "@category": "thumbnail",
            "@_fa": "true",
            "$": "https://api.elsevier.com/content/object/eid/1-s2.0-S2215016124003662-si40.svg?httpAccept=%2A%2F%2A",
            "@multimediatype": "Scalable Vector Graphics file",
            "@type": "ALTIMG",
            "@size": "2631",
            "@ref": "si40",
            "@mimetype": "image/svg+xml"
        },
        {
            "@category": "thumbnail",
            "@_fa": "true",
            "$": "https://api.elsevier.com/content/object/eid/1-s2.0-S2215016124003662-si31.svg?httpAccept=%2A%2F%2A",
            "@multimediatype": "Scalable Vector Graphics file",
            "@type": "ALTIMG",
            "@size": "1637",
            "@ref": "si31",
            "@mimetype": "image/svg+xml"
        },
        {
            "@category": "thumbnail",
            "@_fa": "true",
            "$": "https://api.elsevier.com/content/object/eid/1-s2.0-S2215016124003662-si45.svg?httpAccept=%2A%2F%2A",
            "@multimediatype": "Scalable Vector Graphics file",
            "@type": "ALTIMG",
            "@size": "4047",
            "@ref": "si45",
            "@mimetype": "image/svg+xml"
        },
        {
            "@category": "thumbnail",
            "@_fa": "true",
            "$": "https://api.elsevier.com/content/object/eid/1-s2.0-S2215016124003662-si25.svg?httpAccept=%2A%2F%2A",
            "@multimediatype": "Scalable Vector Graphics file",
            "@type": "ALTIMG",
            "@size": "8867",
            "@ref": "si25",
            "@mimetype": "image/svg+xml"
        },
        {
            "@category": "thumbnail",
            "@_fa": "true",
            "$": "https://api.elsevier.com/content/object/eid/1-s2.0-S2215016124003662-si11.svg?httpAccept=%2A%2F%2A",
            "@multimediatype": "Scalable Vector Graphics file",
            "@type": "ALTIMG",
            "@size": "15699",
            "@ref": "si11",
            "@mimetype": "image/svg+xml"
        },
        {
            "@category": "thumbnail",
            "@_fa": "true",
            "$": "https://api.elsevier.com/content/object/eid/1-s2.0-S2215016124003662-si33.svg?httpAccept=%2A%2F%2A",
            "@multimediatype": "Scalable Vector Graphics file",
            "@type": "ALTIMG",
            "@size": "1894",
            "@ref": "si33",
            "@mimetype": "image/svg+xml"
        },
        {
            "@category": "thumbnail",
            "@_fa": "true",
            "$": "https://api.elsevier.com/content/object/eid/1-s2.0-S2215016124003662-si35.svg?httpAccept=%2A%2F%2A",
            "@multimediatype": "Scalable Vector Graphics file",
            "@type": "ALTIMG",
            "@size": "6904",
            "@ref": "si35",
            "@mimetype": "image/svg+xml"
        },
        {
            "@category": "thumbnail",
            "@_fa": "true",
            "$": "https://api.elsevier.com/content/object/eid/1-s2.0-S2215016124003662-si13.svg?httpAccept=%2A%2F%2A",
            "@multimediatype": "Scalable Vector Graphics file",
            "@type": "ALTIMG",
            "@size": "1763",
            "@ref": "si13",
            "@mimetype": "image/svg+xml"
        },
        {
            "@category": "thumbnail",
            "@_fa": "true",
            "$": "https://api.elsevier.com/content/object/eid/1-s2.0-S2215016124003662-si46.svg?httpAccept=%2A%2F%2A",
            "@multimediatype": "Scalable Vector Graphics file",
            "@type": "ALTIMG",
            "@size": "1289",
            "@ref": "si46",
            "@mimetype": "image/svg+xml"
        },
        {
            "@category": "thumbnail",
            "@_fa": "true",
            "$": "https://api.elsevier.com/content/object/eid/1-s2.0-S2215016124003662-si22.svg?httpAccept=%2A%2F%2A",
            "@multimediatype": "Scalable Vector Graphics file",
            "@type": "ALTIMG",
            "@size": "1931",
            "@ref": "si22",
            "@mimetype": "image/svg+xml"
        },
        {
            "@category": "thumbnail",
            "@_fa": "true",
            "$": "https://api.elsevier.com/content/object/eid/1-s2.0-S2215016124003662-si55.svg?httpAccept=%2A%2F%2A",
            "@multimediatype": "Scalable Vector Graphics file",
            "@type": "ALTIMG",
            "@size": "16220",
            "@ref": "si55",
            "@mimetype": "image/svg+xml"
        },
        {
            "@category": "thumbnail",
            "@_fa": "true",
            "$": "https://api.elsevier.com/content/object/eid/1-s2.0-S2215016124003662-si27.svg?httpAccept=%2A%2F%2A",
            "@multimediatype": "Scalable Vector Graphics file",
            "@type": "ALTIMG",
            "@size": "1496",
            "@ref": "si27",
            "@mimetype": "image/svg+xml"
        }
    ]},
    "link": {
        "@rel": "abstract",
        "@href": "https://api.elsevier.com/content/abstract/scopus_id/85201507381"
    }
}}